question,answer,context,source,subdomain
What role do faculty play in the educational experience within the department?,Faculty are expert and contribute to innovative teaching and research.,"Chemical Engineering World renowned faculty, state-of-the-art facilities, innovative teaching and research prepare students to solve problems and positively impact the world.",http://cpe.engr.ku.edu/research-centers,cpe.engr.ku.edu
In which fields does Michael Branicky apply his research on cyber-physical systems?,"Michael Branicky applies his research in fields such as agriculture, energy, health care, manufacturing, and transportation.","These systems are applied to a wide range of areas such as agriculture, energy, health care, manufacturing and transportation.",https://engr.ku.edu/news/article/engineering-professor-named-aaas-fellow,engr.ku.edu
What aspects of signal processing are included in the Signals and Systems topic of the Ph.D. Qualifying Exams?,"Aspects include design and implementation of digital filtering, estimation and detection theory, communication theory, information theory, and optimization theory for signals.","Signals and Systems includes signal processing, design and implementation of digital filtering, estimation and detection theory, communication theory, information theory, and optimization theory for the transmission, reception, and extraction of information-bearing signals from noise and interference.",https://eecs.ku.edu/phd-qualifying-exam-topics,eecs.ku.edu
What kind of communication role does Cody Howard fulfill for the School of Engineering?,"He communicates news of School of Engineering achievements, research and events.","Communicates news of School of Engineering achievements, research and events",https://engr.ku.edu/people/cody-howard,engr.ku.edu
What specific classes are allowed to have alternate examination times during the final exam period?,"Alternate examination times for MATH 2 and MATH 101 are available on Monday, Tuesday, and Wednesday.","Alternate examination times for MATH 2 and MATH 101 will be available on Monday, Tuesday, and Wednesday. These alternate times and information on how to register will be announced by the Kansas Algebra Program.",https://registrar.ku.edu/fall-2025-final-exam-schedule,registrar.ku.edu
How much total scholarship money is awarded to the winning teams in the High School Design event?,"$12,000 in scholarships will be awarded to the winning teams across the six engineering disciplines.","A total of $12,000 in scholarships will be awarded to the winning teams across the six engineering disciplines.",https://engr.ku.edu/high-school-design-competition,engr.ku.edu
What is the main reason the University of Kansas does not provide invitation letters for family members applying for a B-2 tourist visa?,The University of Kansas does not write an invitation letter for your family to visit you in the United States.,The University of Kansas will not write an invitation letter for your family to visit you in the United States.,https://iss.ku.edu/invitation-letter-family,iss.ku.edu
What focus areas were covered during the Information Technology Workshop attended by Kansas City public school students?,"The workshop covered web-design, cyber security, and system-administration, along with college and career planning sessions geared toward the IT industry.","About 80 students from the Kansas City, Kansas Public Schools attended the Information Technology Workshop at the KU Edwards Campus on Oct. 24. BSIT faculty ran the event that covered web-design, cyber security and system-administration, along with college and career planning sessions geared toward the IT industry.",https://eecs.ku.edu/news?page=4,eecs.ku.edu
What additional funding sources are available for graduate students outside of university offerings?,Students are encouraged to seek private or outside funding and utilize the Pivot database for finding funding specific to their field.,"External Funding Students may seek private or outside funding. We encourage students to use the Pivot database, as well as speak to their advisors, departmental contacts, or graduate mentors for guidance...",https://engr.ku.edu/grad-funding,engr.ku.edu
"What role does Jeffrey Burns, M.D., M.S. hold at the University of Kansas Health System?",He is the Director of the Clinical And Translational Science Unit and the Director of the Memory Care Clinic.,"Jeffrey Burns, M.D., M.S. -Professor, Neurology -Director, Clinical And Translational Science Unit -Director, Memory Care Clinic, University of Kansas Health System",http://bioengr.ku.edu/clinical-affiliates,bioengr.ku.edu
In which building is Rachel Jarvis's office located?,Eaton Hall.,3042 Eaton Hall,https://eecs.ku.edu/people/rachel-jarvis,eecs.ku.edu
What is the role of Sam Klecan at the university?,Sam Klecan is the Program Coordinator.,People Staff Sam Klecan -Program Coordinator,http://bio.engr.ku.edu/staff,bio.engr.ku.edu
What specific documents must dependents present when applying for a visa?,"Dependents should present a passport, DS-160 confirmation page, Dependent I-20/DS-2019.",Dependents should have these documents ready as well. Passport (valid for at least six months beyond the date of travel to the U.S.) DS-160 confirmation page Dependent I-20/DS-2019.,https://iss.ku.edu/apply-visa,iss.ku.edu
What document must F-1 students obtain for travel abroad?,An F-1 student should get a travel signature on the I-20 form and speak with an international advisor if desired before traveling.,An F-1 student should get a travel signature on I-20 form and speak with an international advisor if desired before traveling.,https://iss.ku.edu/F-1-staying-legal,iss.ku.edu
Is it possible for students to select the credit/no credit option for a course that is required for their major or minor?,"No, the course selected for CR/NC cannot be used to fulfill major or minor requirements for undergraduate students.",The course you select for CR/NC cannot be used to fulfill your major or minor requirement (undergraduate students) or cannot be used to fulfill any degree or certificate requirements (graduate students).,https://registrar.ku.edu/request-other-record,registrar.ku.edu
When do applications for the accelerated Master’s program open and close?,Graduate applications to start the following summer would open on January 1 and close on March 15.,Graduate applications to start the following summer would open on January 1 and close March 15.,https://bioengr.ku.edu/accelerated-ms,bioengr.ku.edu
What steps must a J-1 exchange visitor take if they experience a delay in their arrival to the U.S.?,"If the exchange visitor is unable to arrive within 15 days of the start date on the DS-2019, they must submit a Late Arrival form in iHawk to request an amended start date.","If the exchange visitor is unable to arrive and report to ISS within 15 days of the start date on the DS-2019, the exchange visitor must submit a Late Arrival form in iHawk, so that a request for an amended start date can be submitted.",https://iss.ku.edu/j-1-scholar-visa-sponsorship,iss.ku.edu
What role do Resident Assistants (RAs) play in the first-year engineering experience?,Many Resident Assistants (RA's) on these floors are upper level engineering students trained to support freshmen through the adjustments and rigors they experience during their first year of college.,Many Resident Assistants (RA's) on these floors are upper level engineering students trained to support freshmen through the adjustments and rigors they experience during their first year of college.,https://engr.ku.edu/after-admission,engr.ku.edu
What distinguishes BIOE 890 Special Topics from other courses in the bioengineering program?,BIOE 890 Special Topics features advanced courses on current topics of interest in bioengineering and is offered as the need arises.,"BIOE 890 Special Topics: _____. 1-5 Credits. Advanced courses on special topics of current interest in bioengineering, given as the need arises.",http://bio.engr.ku.edu/bioengineering-courses,bio.engr.ku.edu
What is the typical GPA requirement for applicants to the Ph.D. program in Electrical Engineering?,"Applicants for the Ph.D. program in Electrical Engineering must have a GPA at or above 3.5 on a 4 point scale, with the mean GPA being 3.6.",GPA: at or above 3.5 on a 4 point scale (mean GPA: 3.6).,https://eecs.ku.edu/phd-program,eecs.ku.edu
"What fellowship did Amanda Hertel, a 2022 KU graduate, receive?","Amanda Hertel was awarded the $35,000 Phi Kappa Phi fellowship.","Amanda Hertel, a 2022 University of Kansas graduate in chemical engineering from Shawnee, is the recipient of the 1897 Fellowship by the honor society of Phi Kappa Phi.",https://engr.ku.edu/news?page=3,engr.ku.edu
Since when has Mona been a member of the Jayhawk community?,Mona has been a Jayhawk since 2020.,Mona has been a Jayhawk since 2020.,https://engr.ku.edu/people/mona-shaheen,engr.ku.edu
Which professor specializes in data mining and machine learning among the EECS faculty?,"Jerzy W Grzymala-Busse specializes in data mining, knowledge discovery, machine learning, and reasoning under uncertainty.",Jerzy W Grzymala-Busse Professor Emeritus jerzygb@ku.edu 785-864-4488 Primary Research Interests Data mining Knowledge discovery Machine learning Expert systems Reasoning under uncertainty Rough set theory,https://eecs.ku.edu/theory-computing,eecs.ku.edu
How has Brian McClendon contributed to the field of geographic information and technology?,"McClendon co-created Google Earth and played a pivotal role in developing Google Maps and Street View, significantly transforming our interaction with geospatial data.","As co-creator of Google Earth, he made Lawrence the literal center of the digital globe. ... McClendon led Google’s geospatial division for 10 years, driving the development of Google Maps, Street View, Google Earth and Google Earth Engine.",https://engr.ku.edu/news/article/ku-engineering-to-honor-2-alumni-with-distinguished-engineering-service-award,engr.ku.edu
What distinguishes Anthony Fehr and Gibum Kwon's recent awards from past recipients at KU?,Fehr and Kwon are the first two researchers to receive the prestigious Presidential Early Career Awards for Scientists and Engineers as KU faculty members since 2008.,"Fehr and Kwon are the first two researchers to receive the prestigious award as KU faculty members since 2008, when then-KU faculty member Joy Ward received it.",https://engr.ku.edu/news/article/engineering-faculty-member-wins-prestigious-early-career-presidential-award,engr.ku.edu
What are the requirements for engineering student organizations to be eligible for FAC funding in the 2024-2025 school year?,"Organizations must re-register in the Engineering Connector and Rock Chalk Central by September 13, 2024, participate in specific recruiting events, attend 2/3 of ESC Meetings, and participate in the Engineering EXPO.","For FAC eligibility in the 2024-2025 school year, each engineering student organization is required to commit to the following: Re-register your organization in the Engineering Connector and Rock Chalk Central by September 13, 2024... Participate in at least one of the following Fall Welcome Back Recruiting Events...",https://engr.ku.edu/student-organization-funding,engr.ku.edu
What is the e-Learning fee for undergraduate students per credit hour?,$80.00,Mandatory Fees Medical Center Campus Click to expand Program Fee e-Learning Fee - Undergraduates $80.00,https://registrar.ku.edu/fy-2024-online-tuition-fees,registrar.ku.edu
What options do students have if their GPA drops below 3.00?,Students may be placed on academic probation or dismissed if their GPA goes below 3.0 and should contact their departmental programs advisor or director to discuss options.,Students are placed on academic probation or dismissed if their cumulative GPA goes below 3.0. Students who are in danger of probation or dismissal should contact their departmental programs advisor or director to discuss options.,https://engr.ku.edu/current-graduate-students,engr.ku.edu
What motivated Gideon to join the University of Kansas (KU)?,"He is passionate about finding sustainable solutions in the energy sector, which motivated him to join KU.","He is passionate about finding sustainable solutions in the energy sector, hence joining KU.",https://engr.ku.edu/people/gideon-gyamfi,engr.ku.edu
What happens if students do not check the box for the Bioengineering Certificate when applying for their degree?,"If students do not check the box for the Bioengineering Certificate, it will be assumed that they do not want to receive it.","When you apply for your degree, make sure to CHECK the BOX for the Bioengineering Certificate! Otherwise, we assume you don't want it.",http://bio.engr.ku.edu/undergraduate-certificate,bio.engr.ku.edu
What are some areas of research that graduate students can work on in the Petroleum Engineering program?,"Graduate students can work on areas including bioengineering, catalysis, renewable energy, sustainability, separations, enhanced oil and gas recovery, unconventional reservoirs, data mining and reservoir characterization, flow in porous media, and reservoir simulation.","Work on cutting-edge research with nationally and internationally recognized faculty in areas including bioengineering, catalysis, renewable energy, sustainability, separations, enhanced oil and gas recovery, unconventional reservoirs, data mining and reservoir characterization, flow in porous media, and reservoir simulation.",http://cpe.engr.ku.edu/degrees-curriculum,cpe.engr.ku.edu
What unique program does the University of Kansas offer in the field of Petroleum Engineering?,The University of Kansas hosts the only petroleum engineering program in the State of Kansas.,The University of Kansas hosts the only petroleum engineering program in the State of Kansas and is home to the Tertiary Oil Recovery Program.,http://cpe.engr.ku.edu/news-event-submission,cpe.engr.ku.edu
What other resources are mentioned in the passage besides the Change of School form?,"Diplomas, Grades, Personal Information & Privacy, Transcripts.",Student Records Resources Diplomas Grades Personal Information & Privacy Transcripts.,https://registrar.ku.edu/change-school,registrar.ku.edu
What happens if a student drops courses without prior authorization after deciding to withdraw from KU?,Dropping courses without authorization will result in a loss of legal F-1 status and does not allow for a 15-day grace period.,"Withdrawing from the university and dropping your courses without authorization will result in a loss of legal F-1 status, and does not allow for a 15-day grace period.",https://iss.ku.edu/f-1-leaving-ku,iss.ku.edu
What role did Elizabeth Appel play in her university's competitive design-build competition?,Appel restarted the university’s competitive design-build competition Concrete Canoe and led the team to a third-place finish in the regional competition in 2023.,"""As a KU undergraduate, Appel has pursued research that explores 'ambiguous, social-focused questions' related to civil engineering... restarting Concrete Canoe was a lot of work, but it showed that even a team of novices can outperform established competitors.""",https://engr.ku.edu/news/article/ku-senior-from-kansas-city-awarded-full-ride-to-university-of-cambridge-to-pursue-sustainable-engineering,engr.ku.edu
Who is authorized to access electronic resources at the University of Kansas?,"Access is restricted to employees, students, or other individuals authorized by the University or its affiliates.","Access to electronic resources at the University of Kansas is restricted to employees, students, or other individuals authorized by the University or its affiliates.",https://shopkeeper.eecs.ku.edu/,shopkeeper.eecs.ku.edu
What is the responsibility of students regarding their I-20s according to the passage?,It is the students' responsibility to retain all of their I-20s.,Keep in mind it is your responsibility to retain all of your I-20s and it is not the responsibility of ISS to archive official copies of all documents.,https://iss.ku.edu/i-20-requests-or-copies,iss.ku.edu
What contributions did Kristin Bowman-James make to the field of chemistry that earned her recognition as an AAAS fellow?,Kristin Bowman-James was recognized for her significant contributions to supramolecular anion coordination chemistry and her efforts in advancing diversity and inclusion in the chemical sciences.,"Bowman-James was recognized for significant contributions to supramolecular anion coordination chemistry, advancing diversity and inclusion in the chemical sciences, and service to the research enterprise in Kansas.",https://engr.ku.edu/news/article/three-ku-professors-of-chemistry-economics-and-engineering-named-aaas-fellows,engr.ku.edu
Does the passage provide a personal statement or biography for John Gibbons?,"No, the passage does not include a personal statement or biography, only basic contact and research information.",Show More about Research,https://eecs.ku.edu/people/john-gibbons,eecs.ku.edu
What are the specific safeguards mentioned for ensuring the authenticity of paper transcripts from the University of Kansas?,"The safeguards include a background color with small print of 'The University of Kansas,' 'Copy' appearing in large print when photocopied, a watermark visible at an angle, and 'VOID' appearing in multiple languages if bleach is applied.","The University of Kansas employs a number of safeguards to ensure the authenticity of their transcripts: The background color of the transcript face should have multiple repetitions of the words 'The University of Kansas' in very small print. When the front side is photocopied, the word 'Copy' should appear in very large print across the face. If liquid bleach is applied to the front side, 'VOID' should appear in six different languages.",https://registrar.ku.edu/transcripts,registrar.ku.edu
What specific section of the User guide provides information on creating/editing tables in CourseLeaf?,Information on creating/editing tables is on pages 18-30.,Information on creating/editing tables is on pages 18-30.,https://registrar.ku.edu/courseleaf-faq,registrar.ku.edu
What department does Justin Hutchison belong to?,"Justin Hutchison belongs to the Department of Civil, Environmental, and Architecture Engineering.","Monday: 04/14/2025 Justin Hutchison Associate Professor Department of Civil, Environmental, and Architecture Engineering University of Kansas",http://bioengr.ku.edu/colloquium,bioengr.ku.edu
In which areas can students engage in cutting-edge research as part of the petroleum engineering graduate programs?,"Students can engage in research in bioengineering, catalysis, renewable energy, sustainability, separations, enhanced oil and gas recovery, and more.","Work on cutting-edge research with nationally and internationally recognized faculty in areas including bioengineering, catalysis, renewable energy, sustainability, separations, enhanced oil and gas recovery, unconventional reservoirs, data mining and reservoir characterization, flow in porous media, and reservoir simulation.",http://cpe.engr.ku.edu/enrollment-resources-and-course-listings,cpe.engr.ku.edu
What was the purpose of establishing the KU EECS Distinguished Service Award?,The award was established to recognize distinguished alumni and dedicated associates of the KU EECS department.,The EECS department established the new award... in February 2022 to recognize distinguished alumni and dedicated associates of the department.,https://eecs.ku.edu/node/2489,eecs.ku.edu
What is the role of the Institute for Bioengineering Research (IBER) at KU?,IBER promotes creativity and catalyzes collaborations to enhance societal health and well-being through research and education.,"The Institute for Bioengineering Research on the Lawrence campus provides a research, teaching and scholarly environment that promotes creativity and catalyzes collaborations to enhance societal health and well-being.",http://bio.engr.ku.edu/bioengineering-graduate-programs-2024-25,bio.engr.ku.edu
What kind of career preparation does the computational bioengineering track offer to its students?,"Students are prepared for careers in industry, academia, and public service, with training in computer science, mathematical and statistical methods, biological and life sciences, and physical and chemistry principles.","Students in this track are prepared for careers in industry, academia, and public service. They are trained in computer science, mathematical and statistical methods and principles, biological and life sciences, and physical and chemistry principles.",https://bioengr.ku.edu/computational-bioengineering,bioengr.ku.edu
What is the minimum credit awarded to students for military service after completing basic training?,"KU awards a minimum of four credits of Health, Sport, and Exercise Science for the completion of basic training for the United States Armed Forces.","KU awards a minimum of four credits of Health, Sport, and Exercise Science credits for the completion of basic training for the United States Armed Forces.",https://registrar.ku.edu/credit-prior-learning,registrar.ku.edu
What are the deadlines for submitting the Out of Country Waiver for each semester?,The Out of Country Waiver must be submitted before the first day of class each semester.,This Out of Country Waiver must be submitted before the first day of class.,https://iss.ku.edu/out-country-waiver,iss.ku.edu
What is the purpose of submitting an annual Graduate Student Activity Report?,It ensures students are making satisfactory progress towards their degree to be considered in good standing and eligible for funding as a GTA or GRA.,Graduate Students must make satisfactory progress towards their degree to be considered in good standing and eligible for funding as a GTA or GRA.,https://engr.ku.edu/masters-program-timeline,engr.ku.edu
What opportunities do the facilities offer for hands-on learning in mechanical engineering?,The facilities offer hands-on learning opportunities through access to state-of-the-art labs and equipment for practical engineering applications.,The Mechanical Engineering facilities provide students with hands-on learning opportunities through access to state-of-the-art labs and equipment.,https://engr.ku.edu/mechanical-engineering-facilities,engr.ku.edu
What recognition have KU chemical engineering students received for their innovative efforts?,"They have been awarded prestigious Goldwater Scholarships, graduate fellowships, and prizes for innovative technology commercialization strategies.","KU students consistently receive national and international recognition and have been awarded prestigious Goldwater Scholarships, graduate fellowships, and prizes for innovative technology commercialization strategies.",https://engr.ku.edu/node/2789,engr.ku.edu
"What dates did the competition take place, and what were some of the teams Jayhackers faced?","The competition took place from October 28th to 31st, and they faced teams from the Army, Department of Defense, Partner Nations, and universities worldwide.","Competing virtually from October 28th to 31st, the KU Jayhackers overcame a significant time difference to secure 9th place overall against teams from the Army, Department of Defense, Partner Nations, and universities worldwide.",https://eecs.ku.edu/news/article/ku-jayhackers-triumph-in-international-best-cyber-warrior-competition,eecs.ku.edu
What are the implications for grades of D+ or below in transferable courses?,Grades of D+ or below are transferable but do not apply towards degree requirements.,Grades of D+ or below are transferable but do not apply towards degree requirements.,https://registrar.ku.edu/transfer-credit-codes,registrar.ku.edu
What conditions must a senior citizen student meet to be eligible for the Senior Citizen Rate at KU?,"They must be a Kansas resident for tuition purposes, be at least 60 years of age, and be admitted to KU as a non-degree seeking undergraduate or graduate student.","One of the benefits to taking classes as a senior citizen at KU is they can apply for the Senior Citizen Rate, which is a waiver of tuition and the Lawrence or Medical Center student and wellness fees if they follow the below requirements: They are a Kansas Resident for tuition purposes. They are at least 60 years of age. They are admitted to KU as a non-degree seeking undergraduate or graduate student.",https://registrar.ku.edu/senior-citizen-students,registrar.ku.edu
What types of content can users expect to find on the new EECS social media accounts?,"Users can expect to find news and updates about upcoming events, research highlights, and student and faculty achievements.","Through our social media accounts, we will share news and updates about the department, including: Upcoming events Research highlights Student and faculty achievements Opportunities for students and alumni.",https://eecs.ku.edu/news/article/2023/08/01/eecs-launches-new-social-media-accounts,eecs.ku.edu
What is the research aim of the Tertiary Oil Recovery Program (TORP) at KU?,"TORP aims to evaluate the full potential of oil recovery processes in the region, including tertiary oil recovery and standard technologies like waterflooding.",The aim of TORP research services is to evaluate the full potential of the oil recovery process in the region. This includes tertiary oil recovery as well as more standard technologies such as waterflooding.,https://engr.ku.edu/research-centers,engr.ku.edu
What major change has been announced regarding the technical support system for the School of Engineering?,"R/T will no longer be the EECS Help Ticketing System for EECS, and there is now one centrally supported team for all IT issues.","R/T will no longer be the EECS Help Ticketing System for EECS. Starting immediately, there is one number and one email for all IT support at the School of Engineering.",https://eecs.ku.edu/tech-help,eecs.ku.edu
What type of research areas will benefit from the $14.5 million funding provided to the University of Kansas by Congress?,"The funding will support research in key areas such as fuel cells, road and vehicle materials, aircraft, and air quality.","Congress appropriated $14.5 million on July 29 to the University of Kansas to support and expand ongoing transportation-related research in such key areas as fuel cells, road and vehicle materials, aircraft and air quality.",https://engr.ku.edu/news?page=20,engr.ku.edu
Which specific technologies does Leuschen utilize in his radar system design and development?,"He employs High Resolution Radar and Ultra-Wideband, Microwave Radar systems for various applications including agricultural and polar research.","Research interests: Radar System Design and Development, High Resolution Radar for Agricultural Applications, An Ultra-Wideband, Microwave Radar for Measuring Snow Thickness on Sea Ice.",https://eecs.ku.edu/people/carlton-leuschen,eecs.ku.edu
What happens if a transfer student holds an Associate's degree from a Kansas public institution upon enrolling at the University of Kansas?,They will have completed all general education requirements for the KU Core 34.,"Students entering KU in Fall 2024 who complete an Associate in Arts (AA), Associate in Fine Arts (AFA), or an Associate in Science (AS) from a regionally accredited Kansas public college... will have completed all general education requirements for the KU Core 34.",https://registrar.ku.edu/systemwide-gen-ed,registrar.ku.edu
What professional organization is Swapan Chakrabarti a member of?,He is a member of IEEE SID.,Memberships — IEEE SID,https://eecs.ku.edu/people/swapan-chakrabarti,eecs.ku.edu
"What mathematics course is specifically required only for the Astronomy, Chemistry, and Physics focuses in the Interdisciplinary Computing program?","MATH 220 Applied Differential Equations is required only for the Astronomy, Chemistry, and Physics focuses.","Note: Required only for the Astronomy, Chemistry, and Physics focuses 3",https://eecs.ku.edu/prospective-students/undergraduate/degree-requirements,eecs.ku.edu
What GPA must students maintain in their coursework for the Bioengineering graduate program?,Students are expected to maintain a 3.0 GPA in their coursework.,Students are expected to: Maintain a 3.0 GPA in their coursework,http://bioengr.ku.edu/overview,bioengr.ku.edu
What happens to the KU email upon activation of the KU Online ID?,A KU email with the online ID as the first portion will be automatically generated.,"When you activate your KU online ID, it will automatically generate a KU email with the online ID as the first portion.",https://iss.ku.edu/student-id-number,iss.ku.edu
Who can initiate a request process in iHawk?,"A department or administrative user of iHawk, such as a department administrator, KU faculty member, or member of the Shared Service Center, can initiate a request process.","A department or administrative user of iHawk is normally a department administrator, KU faculty member, or member of the Shared Service Center. This user will very often initiate a request process in iHawk.",https://iss.ku.edu/request-access-ihawk,iss.ku.edu
What specific categories of individuals are eligible for the Kansas Hero’s Scholarship Act?,"Eligible dependents and spouses of certain deceased/disabled public safety officers, military personnel, and prisoners of war qualify for the scholarship.","The Kansas Hero’s Scholarship Act (K.S.A. 75-4364) provides an opportunity for eligible dependents and spouses of certain deceased/disabled public safety officers, military personnel and prisoner of war to attend an eligible Kansas postsecondary educational institution...",https://registrar.ku.edu/kansas-heros-scholarship,registrar.ku.edu
Which academic affiliate has a title that includes 'Chancellors Distinguished Chair in Biomedical Sciences'?,"Andrew Godwin, Ph.D.","-Chancellors Distinguished Chair in Biomedical Sciences and Endowed Professor -Professor and Director of Molecular Oncology, Pathology and Laboratory Medicine -Deputy Director, The University of Kansas Cancer Center -Kansas Bioscience Authority Eminent Scholar",http://bioengr.ku.edu/academic-affiliates,bioengr.ku.edu
What type of support does KU Bioengineering offer for research facilities?,The program boasts state-of-the-art computer labs and research facilities.,State of the Art Computer Labs and Research Facilities.,http://bio.engr.ku.edu/,bio.engr.ku.edu
What are the roles and responsibilities of Self Graduate Fellows at KU?,"Self Graduate Fellows are expected to participate in the Fellow Development Program and demonstrate leadership potential, motivation, and a commitment to lifelong learning.","Self Graduate Fellows also demonstrate initiative, passion for achievement and lifelong learning, and make a commitment to participate in the Fellow Development Program.",https://engr.ku.edu/graduate-scholarships,engr.ku.edu
What information is required when submitting a travel signature request?,"When submitting a travel signature request, scholars need to bring in their DS-2019 form so that an advisor can sign it for travel.",You will get an email asking you to bring in your DS-2019 form so that an advisor can sign your DS-2019 form for travel.,https://iss.ku.edu/travel-signatures-and-ds-2019-reprint-j-scholar,iss.ku.edu
What is the required utilization percentage for auditoriums based on previous use?,Approved utilization for auditoriums is 80% or higher based on previous use during the last like term.,Approved utilization for auditoriums is 80% or higher based on previous use during the last like term.,https://registrar.ku.edu/auditoriums,registrar.ku.edu
What unique research collaborations enhance the learning experience for bioengineering graduate students at KU?,Bioengineering collaborations across KU’s main campus in Lawrence and at the KU Medical Center in Kansas City ensure that graduate students receive a fundamentally strong and comprehensive research and education experience.,"Bioengineering collaborations across KU’s main campus in Lawrence and at the KU Medical Center in Kansas City, Kansas, ensure that graduate students in the bioengineering program receive a fundamentally strong and comprehensive research and education experience.",http://bioengr.ku.edu/bioengineering-graduate-programs-2024-25,bioengr.ku.edu
What type of education approach does the Petroleum Engineering program integrate?,The Petroleum Engineering program emphasizes hands-on education based on industrial problems and real-world examples.,Learn more about how hands-on education based on industrial problems and real-world examples taught by expert faculty can start your path to a successful career.,http://cpe.engr.ku.edu/degrees,cpe.engr.ku.edu
What should you do if you cannot access the E-form due to browser issues?,You can open a new Private Browsing / Incognito window and paste the access link from the email into the address bar to access the form.,You can try one of the following: Open a new Private Browsing / Incognito window in any browser and copy the access link from the E-mail message you received and use it (paste it) into the address bar of the private/incognito window to access the form.,https://iss.ku.edu/troubleshooting-ihawk-technical-issues,iss.ku.edu
What additional coursework may be required for students with deficiencies in the Bioimaging Track?,Students with deficiencies in areas critical to the program may be required to complete additional courses in preparation for the qualifying exam.,Students with deficiencies in areas critical to the program may be required to complete additional courses in preparation for the qualifying exam.,https://bioengr.ku.edu/entrance-requirements-track,bioengr.ku.edu
What resource does the University of Kansas provide to assist students in calculating tuition and fees?,The Tuition and fee tool assists students in calculating an estimate of tuition and fees.,"The Tuition and fee tool assists students in calculating an estimate of tuition and fees, but does not replace the charge information found in the Comprehensive Tuition and Fee Schedule.",https://registrar.ku.edu/tuition-and-fees,registrar.ku.edu
"If a student's visa expires while they are in the U.S., what is the consequence?","Nothing happens because it is a travel document only, as long as they are maintaining status.","Visa Renewal... If your visa expires while you are maintaining status and in the U.S., nothing happens because it is a travel document only.",https://iss.ku.edu/apply-visa-student,iss.ku.edu
What types of GPA are calculated separately for different student careers at the University of Kansas?,"The GPA is calculated separately for each student career, including undergraduate, graduate, medical, and law.","This GPA is calculated separately for each student career (i.e. - undergraduate, graduate, medical, law).",https://registrar.ku.edu/grades,registrar.ku.edu
What steps must non-degree seeking students take to enroll in classes that have prerequisites?,"If a prerequisite is required, submit the test scores or an official academic transcript to the Office of Admissions then email transfercredit@ku.edu to request to have necessary prerequisites placed on your KU student transfer record.",If a prerequisite is required submit the test scores or an official academic transcript to the Office of Admissions then email transfercredit@ku.edu to request to have necessary prerequisites placed on your KU student transfer record.,https://registrar.ku.edu/non-degree-seeking-students,registrar.ku.edu
What documents must F-1 students present upon entry to the U.S.?,"F-1 students must present a valid passport, valid visa, I-20, SEVIS fee receipt, and financial documents used for their I-20 application.",Organize Your Documents Have these documents in your hand (and not packed in a suitcase) for the officer to review: F-1 Students Valid Passport Valid Visa (Canadians are exempt from visa requirement) I-20 SEVIS fee receipt Financial documents (used for your I-20 application),https://iss.ku.edu/entering-us-f-j-students,iss.ku.edu
Where is Samyoga Bhattarai originally from?,"She is originally from Kathmandu, Nepal.","Hometown: Kathmandu, Nepal",https://engr.ku.edu/people/samyoga-bhattarai,engr.ku.edu
What unique features will the VICEROY Virtual Institute offer?,"It will offer an augmented curriculum that includes hands-on training, research-oriented experiential learning, and scholarships.","The institute will offer an augmented curriculum that includes hands-on training, research-oriented experiential learning, and scholarships.",https://eecs.ku.edu/news/article/2023/08/28/eecs-professor-leads-new-15m-virtual-institute-protect-cyberspace,eecs.ku.edu
What roles do Bioengineering graduate students often take on within the program?,"Bioengineering graduate students often play an important role in new course development, grant writing efforts of faculty, and recruitment of new students.",Bioengineering graduate students often play an important role in: New course development Grant writing efforts of faculty Recruitment of new students.,http://bio.engr.ku.edu/overview,bio.engr.ku.edu
What is the required minimum full-time enrollment for undergraduate F-1 students during Fall and Spring semesters?,"For undergraduate students, the required minimum full-time enrollment is 12 credit hours (including any AEC courses).",KU defines full-time enrollment during Fall and Spring semesters: For undergraduate students: 12 credit hours (including any AEC courses),https://iss.ku.edu/F-1-staying-legal,iss.ku.edu
What unique program related to oil recovery is hosted by the University of Kansas?,The University of Kansas hosts the Tertiary Oil Recovery Program.,The University of Kansas hosts the only petroleum engineering program in the State of Kansas and is home to the Tertiary Oil Recovery Program.,http://cpe.engr.ku.edu/degrees-curriculum,cpe.engr.ku.edu
What safety measures are implemented on the SafeBus?,Each bus is equipped with six security cameras for rider safety.,Each bus is equipped with six security cameras for rider safety.,https://iss.ku.edu/saferide-and-safebus,iss.ku.edu
How many patents does Brian McClendon hold?,McClendon holds 40 patents.,McClendon holds 40 patents.,https://engr.ku.edu/news/article/2023/12/12/google-earth-creator-brian-mcclendon-kus-newest-national-academy-inventors-fellow,engr.ku.edu
What aspect of her graduate studies does Jordan emphasize in her current degree program?,Jordan has an emphasis on Structural Engineering.,She is now a dual Masters and PhD student in Civil Engineering with an emphasis on Structural Engineering.,https://engr.ku.edu/people/jordan-nutter,engr.ku.edu
Which course has been approved as a permanent exception for the Bachelor of Science in business degrees related to Microeconomics?,ECON 142: Principles of Microeconomics has been approved as a permanent exception.,Exceptions noted with an asterisk (*) have been approved as permanent exceptions. Major(s) Discipline Bucket Course title that the institution wishes to continue in the GE degree requirements 1 Title of the post requisite course or Accreditation/Licensure issue 2 Bachelor of Science in Business Degree Accounting; Business Administration; Business Analytics; Finance; Information Systems; Marketing; Management & Leadership; Supply Chain Management; Social & Behavioral Sciences ECON 142: Principles of Microeconomics MGMT 310: Principles of Management.,https://registrar.ku.edu/sge-approved-exceptions,registrar.ku.edu
Which faculty member serves as the Director of the Landon Center on Aging?,"Randy Nudo, Ph.D.","Randy Nudo, Ph.D. -Professor & Vice Chair of Research, Department of Rehabilitation Medicine -Director, Landon Center on Aging",http://bio.engr.ku.edu/core-faculty,bio.engr.ku.edu
What historical context does The Wonderful Company have in relation to university research funding?,The Resnicks have a long history of supporting leading research universities with nearly $850 million pledged to universities for sustainability-related research and technologies.,"To date, the Resnicks, along with their foundations and The Wonderful Company, have invested nearly $2.6 billion in philanthropy... with more than $850 million pledged to universities for research and technologies around sustainability.",https://engr.ku.edu/news/article/university-of-kansas-renames-institute-for-sustainable-engineering-after-the-wonderful-company,engr.ku.edu
Who are the faculty mentors for the Jayhackers team?,Professors Alex Bardas and Bo Luo were the team's faculty mentors.,Professors Alex Bardas and Bo Luo were the team's faculty mentors.,https://eecs.ku.edu/news/article/2023/02/16/jayhackers-compete-2023-cyber-defense-competition,eecs.ku.edu
What is the procedure for choosing committee members for an M.S. thesis defense?,"A student must choose a faculty advisor and a thesis committee of at least three members, all of whom must be members of the KU Graduate Faculty, but students may also request members from outside the university.","Choose a faculty advisor and thesis committee of at least three (3) total members. All committee members must be members of the KU Graduate Faculty, but students may request to have committee members from outside the university.",http://bioengr.ku.edu/graduating,bioengr.ku.edu
What should a student do if they believe their education records contain inaccurate information?,"The student may ask KU to amend a record they believe is inaccurate by writing to the KU official responsible for the record, clearly identifying the part of the record they want changed and specifying why it is inaccurate.","Students may ask KU to amend a record that they believe is inaccurate. They should write the KU official responsible for the record (see KU Student Records Policy) clearly identify the part of the record they want changed, and specify why it is inaccurate.",https://registrar.ku.edu/personal-information-and-privacy,registrar.ku.edu
"What event is KU Bioengineering sponsoring, and where will it take place?",KU Bioengineering is sponsoring the Rising BME Scholars Conference at the University of Illinois - Chicago.,"KU Bioengineering was a sponsor for the Rising BME Scholars Conference. June 19-21, 2024 at the University of Illinois - Chicago",http://bioengr.ku.edu/,bioengr.ku.edu
Which program aims to maximize access to research careers for students?,Jayhawk BioResearch Scholars (JABRS),"Jayhawk BioResearch Scholars (JABRS) The University of Kansas, Maximizing Access to Research Careers (MARC) Apply/MoreInfo",https://bioengr.ku.edu/opportunities,bioengr.ku.edu
What is the maximum duration for which J-1 students can receive employment authorization due to economic hardship?,"The authorization can extend through the validity of the DS-2019 or up to 12 months, whichever period is shorter.","The dates will extend through the validity of your DS-2019 or up to 12 months, whichever period is less.",https://iss.ku.edu/j-1-economic-hardship,iss.ku.edu
What specific area of research is Mona Shaheen currently engaged in?,"Mona is focusing on structural vibrations, vibration mitigation, and dynamics.","Currently she is pursuing her Ph.D., and her research is an extension of her master's degree project which focuses on structural vibrations, vibration mitigation, and dynamics.",https://engr.ku.edu/people/mona-shaheen,engr.ku.edu
What unique support structure is emphasized for EECS graduate students at KU to enhance their research experience?,Many EECS students are supported through graduate research or teaching assistantships.,Many EECS students are supported through graduate research or teaching assistantships.,https://eecs.ku.edu/graduate-programs,eecs.ku.edu
What method will be used to collect data for the study?,"The study will utilize surveys, interviews, focus groups, and roundtable discussions to collect data.","'...The study will include data collection via surveys, interviews, focus groups and roundtable discussions, ensuring the work incorporates viewpoints from people involved in the decision-making process at all levels.'",https://engr.ku.edu/news/article/research-will-establish-best-managed-retreat-practices-for-communities-faced-with-climate-change-disaster,engr.ku.edu
How has Valerie Griffin contributed to the mental health advocacy in engineering?,She has been an advocate for mental health in engineering as a GEA Ambassador.,Valerie has enjoyed being a GEA Ambassador since 2019 ... be an advocate for mental health in engineering.,https://engr.ku.edu/people/valerie-griffin,engr.ku.edu
Who funds the Research Experience for Undergraduates (REU) Program at the School of Engineering?,The program is funded by the National Science Foundation (NSF).,The School of Engineering hosts Research Experience for Undergraduate (REU) funded by the National Science Foundation (NSF).,https://engr.ku.edu/reu,engr.ku.edu
Who is the Chief Executive Officer of the Midwest Cancer Alliance?,"Roy Jensen, M.D.","Roy Jensen, M.D. -Director, University of Kansas Cancer Center -Chief Executive Officer, Midwest Cancer Alliance",http://bio.engr.ku.edu/people/search,bio.engr.ku.edu
What action is advised for individuals with disabilities who cannot evacuate with others?,They should include in their personal action plan the specific location of their 'Stay in Place' and remain in a room with an exterior window and telephone.,"Individuals with disabilities or other conditions which do not allow them to evacuate with others, should include in their personal action plan the specific location of their 'Stay in Place'.",https://engr.ku.edu/learned-hall-emergency-evacuation-plan,engr.ku.edu
"What is the h-index of Michael Branicky according to Google Scholar, and what does it signify?","His h-index is 40, which indicates a substantial number of citations and impactful research contributions.","His h-index is 40 with nearly 17,000 total citations, according to Google Scholar.",https://eecs.ku.edu/people/michael-branicky,eecs.ku.edu
What specific skills does the RF Systems Engineering graduate certificate program aim to enhance for industrial practitioners?,The program aims to enhance RF Systems Engineering skills without requiring a Master’s of Electrical Engineering degree.,The certificate program offers an opportunity for industrial practitioners to enhance RF Systems Engineering skills without having to apply for and complete a Master’s of Electrical Engineering degree.,https://eecs.ku.edu/rf-systems-engineering-graduate-certificate,eecs.ku.edu
What is the process for changing employers while on Academic Training?,"You must first receive Academic Training authorization for the new employer from your J-1 program sponsor, which involves obtaining a new recommendation from your academic advisor or dean.",If you wish to change employers you must first receive Academic Training authorization for the new employer from your J-1 program sponsor. This process will involve obtaining a new recommendation from your academic advisor or dean.,https://iss.ku.edu/j-1-academic-training,iss.ku.edu
How many AAAS fellows are there among active faculty members at the University of Kansas after the recent election?,"Including the three new honorees, there are 31 AAAS fellows among active faculty members at the University of Kansas.","Including the three new honorees, KU now has 31 AAAS fellows as active faculty members across all its campuses.",https://engr.ku.edu/news/article/three-ku-professors-of-chemistry-economics-and-engineering-named-aaas-fellows,engr.ku.edu
Why did Soma Pal join the Graduate Engineering Association (GEA)?,To interact with many students who have different areas of interest and to help other students with their mental well-being.,I joined GEA because it will provide me with the opportunity to interact with many students who have different areas of interest. I also want to help other students with their mental well-being.,https://engr.ku.edu/people/soma-pal,engr.ku.edu
What support do after-school programs in Lawrence schools provide?,Many schools offer after-school programs that provide homework assistance and organized activities.,Many schools offer after-school programs that provide homework assistance and organized activities.,https://iss.ku.edu/school-enrollment-children,iss.ku.edu
What advice does Kevin Cunningham offer to current students regarding course load?,"He advises against taking too many hours, suggesting that it can lead to stress.",It’s not a race. Taking too many hours can really stress you out. I wish I would have taken maybe one less class per semester.,https://engr.ku.edu/news/article/2024/04/02/alumni-profile-kevin-cunningham,engr.ku.edu
What distinguishes the Upsilon Pi Epsilon honor society at KU?,"Members are chosen for their scholastic achievement and professionalism in computing science, promoting the disciplines and enhancing knowledge.",Upsilon Pi Epsilon is an honorary society whose membership consists of outstanding undergraduate and graduate students in Computing and Information Disciplines.,https://eecs.ku.edu/undergraduate,eecs.ku.edu
What must information technology professionals communicate to non-technical coworkers?,IT professionals must communicate the impact of technology decisions to non-technical coworkers along with the latest policies and trends in IT.,"In addition to their vast computing knowledge, IT professionals must be able to communicate the impact of technology decisions to non-technical coworkers along with the latest policies and trends in IT.",https://eecs.ku.edu/disciplines,eecs.ku.edu
Who is the Director of Recruitment and Outreach for the School of Engineering?,Meredith Morris Whyte,"Meredith Morris, Whyte Director of Recruitment and Outreach School of Engineering meredith.morriswhyte@ku.edu LEEP2, room 1415",https://engr.ku.edu/people,engr.ku.edu
Which two departments jointly administer the Engineering Physics program at KU?,The program is jointly administered through the School of Engineering and the Department of Physics and Astronomy.,KU's Engineering Physics program is jointly administered through the School of Engineering and the Department of Physics and Astronomy in the College of Liberal Arts and Sciences.,http://ephx.engr.ku.edu/research,ephx.engr.ku.edu
What is the financial support amount provided by the Chancellor's Doctoral Fellowship?,"The Chancellor's Doctoral Fellowship provides $25,000 of support to each fellow.","Chancellor Bernadette Gray-Little created this fellowship, which provides $25,000 of support to each fellow and advanced education in a range of fields.",https://engr.ku.edu/graduate-scholarships,engr.ku.edu
What is necessary for students to access the online Plan of Study system?,Students should use their KU Online ID and password to log in to the online Plan of Study system.,Students should use their KU Online ID and password to log in to the online Plan of Study system.,http://gradplan.engr.ku.edu/,gradplan.engr.ku.edu
How does the tax filing process differ for resident aliens compared to non-resident aliens?,"Resident aliens follow the same guidelines and use the same forms as United States citizens, whereas non-resident aliens have different forms and filing requirements.",Resident aliens for tax purposes follow the same guidelines and use the same forms as United States citizens. Non-residents have different rules for submitting taxes based on their status.,https://iss.ku.edu/taxes,iss.ku.edu
What distinguishes KU's Department of Chemical and Petroleum Engineering in Kansas?,KU is the only institution in Kansas that offers a degree in petroleum engineering.,KU is the only institution in Kansas that offers a degree in petroleum engineering.,https://engr.ku.edu/,engr.ku.edu
Are all class fees eligible for the opt-out process at the University of Kansas?,Not all class fees are eligible; students may only opt-out of fees intended to cover the cost of supplies for a given class.,"Not all class fees are eligible for opt-out. Rather, students may only opt-out of fees intended to cover the cost of supplies for a given class.",https://registrar.ku.edu/class-supply-fee-opt-out-request,registrar.ku.edu
What are the support hours for the School of Engineering?,Support hours are 7:30 a.m. - 4:30 p.m. Monday-Thursday and 7 a.m. - 4 p.m. Friday.,Support Hours: 7:30 a.m. - 4:30 p.m. Monday-Thursday; 7 a.m - 4 p.m. Friday,https://engr.ku.edu/computer-specs,engr.ku.edu
What is the purpose of the Jayhawk Semester Program?,The Jayhawk Semester Program allows visiting students to join KU for a semester or academic year.,Jayhawk Semester Program Visiting students joining KU for a semester or academic year,https://iss.ku.edu/apply,iss.ku.edu
How can graduate scholarships benefit students in the Bioengineering program?,"Graduate Scholarships can be added onto fellowships, assistantships, and help to enhance the basic offer, making the program more attractive to quality students.","Graduate Scholarships: Scholarships can be added onto fellowships, graduate teaching assistantships or graduate research assistantships, but are only offered for one year. These can boost the basic offer to help a bring quality students to KU.",http://bioengr.ku.edu/donate,bioengr.ku.edu
In what scenarios are the Eaton Hall emergency evacuation maps particularly important?,"The maps are especially important in scenarios involving fire, severe weather, or other emergencies that require immediate evacuation.","Emergency evacuation maps are critical for guiding individuals during fire, severe weather, or other emergencies that necessitate immediate evacuation.",https://engr.ku.edu/eaton-hall-emergency-evacuation-maps,engr.ku.edu
Is Lindsey McCaig affiliated with any specific university diversity initiative?,"Yes, Lindsey McCaig is a member of the KU Safe Zone.",KU Safe Zone Member,https://engr.ku.edu/people/lindsey-mccaig,engr.ku.edu
Which commission accredits the bachelor’s degree programs in computer science and information technology at KU School of Engineering?,The Computing Accreditation Commission of ABET accredits the bachelor’s degree programs in computer science and information technology.,The bachelor’s degree programs in computer science and information technology undergraduate programs are accredited by the Computing Accreditation Commission of ABET.,https://engr.ku.edu/academics,engr.ku.edu
What resources are available for first-generation college students at KU?,"TRIO SES provides comprehensive support services, including academic advising, financial aid, and tutoring, specifically for first-generation college students and those with high financial need or disabilities.",TRIO provides comprehensive support services by working with eligible students to identify personal areas of strengths and challenges.,https://engr.ku.edu/engineering-student-resources,engr.ku.edu
How can you determine if an immigration service provider is unauthorized?,Look closely for misspellings and grammatical errors in their communications.,"If the websites, emails or other text provided by an individual asking for money contain misspellings and grammatical errors, this is likely a scam.",https://iss.ku.edu/scams-and-fraud,iss.ku.edu
What hands-on experience is required for students in the Biomedical Product Design and Development Track?,A clinical or industrial preceptorship is required to give students practical exposure to applied biomedical research and development.,A clinical or industrial preceptorship is required to give students practical exposure to applied biomedical research and development.,http://bioengr.ku.edu/biomedical-product-design-development,bioengr.ku.edu
What role does the University of Kansas aim for ONDI to play in relation to national defense?,ONDI is intended to serve as KU’s central hub for DoD engagement to enhance current and future contributions to national defense.,The new office will serve as KU’s central hub for DoD engagement to focus KU capabilities to better serve the state of Kansas and the nation.,https://engr.ku.edu/news/article/ku-strengthening-national-defense-partnership-with-new-office,engr.ku.edu
What is one important step students should take before attending their advising appointment?,Students need to review their degree requirements from the KU Catalog before their appointment.,Students need to review their degree requirements from the KU Catalog before their appointment.,https://engr.ku.edu/advising,engr.ku.edu
What is the Tertiary Oil Recovery Program (TORP) known for?,"TORP is known for providing core lab facilities, tech-transfer services, and being one of the few in the world offering a course and publishing a textbook in unconventional oil and gas production.",The Tertiary Oil Recovery Program (TORP) provides students and faculty with core lab facilities and tech-transfer services. The program is one of the few in the world which offers a course and has a published a textbook in unconventional oil and gas production.,https://engr.ku.edu/petroleum-engineering-brochure-2023,engr.ku.edu
What is the role of the Kansas Board of Regents in terms of tuition rates?,The Kansas Board of Regents sets the tuition rate annually for students.,Students pay a tuition rate set annually by the Kansas Board of Regents.,https://registrar.ku.edu/residency-tuition-and-fees,registrar.ku.edu
Where can students find additional information about undergraduate research?,Students can visit the FAQ page to learn more about undergraduate research.,Visit our FAQ page to learn more about undergraduate research.,https://engr.ku.edu/undergraduate-research,engr.ku.edu
What type of resources does Academic Affairs provide regarding New Academic Program Proposals?,"Academic Affairs provides a full explanation of the process, policies, and procedures for New Academic Program Proposals.","A full explanation of the process, policies and procedures is for New Academic Program Proposals is provided by Academic Affairs.",https://registrar.ku.edu/catalog-production,registrar.ku.edu
What is the phone number listed for Neelofar Ahmad?,The phone number listed for Neelofar Ahmad is 785-864-2068.,Contact Info 785-864-2068,https://engr.ku.edu/people/neelofar-ahmad,engr.ku.edu
What common advising roles does Shannon Blunt hold that relate to spectrum research?,Shannon Blunt is a subject matter expert on spectrum for the White House Office of Science & Technology Policy and for the Office of the Under Secretary of Defense for Research & Engineering.,Subject matter expert on spectrum for the White House Office of Science & Technology Policy on America's Mid-Band Initiative Team (AMBIT) Subject matter expert on spectrum R&D for the Office of the Under Secretary of Defense for Research & Engineering.,https://eecs.ku.edu/radar-systems-and-remote-sensing,eecs.ku.edu
Is the Engineering Physics Bachelor of Science program at KU accredited?,"Yes, it is accredited by the Engineering Accreditation Commission of ABET.",The Engineering Physics Bachelor of Science program is accredited by the Engineering Accreditation Commission of ABET.,http://ephx.engr.ku.edu/courses,ephx.engr.ku.edu
What happens if the recipient does not have Adobe set as the default PDF viewer when opening a transcript?,Issues described as blank pages or failure to open load or reload can occur due to the computer not using Adobe as the default PDF reader/viewer.,Issues described as blank pages or failure to open load or reload is a result of your computer not using Adobe as the default PDF reader/viewer.,https://registrar.ku.edu/electronic-transcript-faq,registrar.ku.edu
How can Jayhawk Semester students ensure they are enrolled in the correct courses?,Students will enroll in courses after arriving on the KU campus and completing international student check-in.,You will enroll in courses with the consultation of the Jayhawk Semester Coordinator. Undergraduate students must enroll in a minimum of 12 credit hours.,https://iss.ku.edu/jayhawk-semester-students,iss.ku.edu
What is the primary role of Erin Otter at the university?,Erin Otter is the Tuition and Fees Coordinator.,Erin Otter Tuition and Fees Coordinator,https://registrar.ku.edu/people/erin-otter,registrar.ku.edu
What specific activities does the Student Development Fund promote?,"The Student Development Fund promotes academic and research activities for undergraduate and graduate students, including travel to competitions and technical conferences.","Our Student Development Fund promotes undergraduate and graduate student academic and research activities, such as travel to student competitions, technical conferences to present their research, and graduate student research.",https://eecs.ku.edu/giving,eecs.ku.edu
Which team from Olathe South High School won first place in Bioengineering?,D.E.C.K. won 1st place in Bioengineering.,"Bioengineering 1st place: D.E.C.K. Olathe South High School Devyn Kingsley, Cole Anderson, Elian Ramirez, Keira Witkowski",https://engr.ku.edu/hsd-2024-winners,engr.ku.edu
What personal goal does Mona have regarding her travels during her PhD?,Her goal is to visit as many national parks in the US as possible before the end of her PhD.,Mona loves traveling and being in nature. Her goal is to visit as many national parks in the US as possible before the end of her PhD.,https://engr.ku.edu/people/mona-shaheen,engr.ku.edu
"What are the specific time requirements for a 50% GTA, GRA, or GA appointment to qualify for the university's insurance premium contribution?","The position must last a minimum of eight consecutive work weeks during the fall or spring semester, or four consecutive work weeks during the summer semester.","If you have a 50% Graduate Teaching Assistant (GTA), Graduate Research Assistant (GRA) or Graduate Assistant (GA) payroll appointment, you qualify for the university’s 75% contribution to your insurance premium if your position lasts a minimum of eight (8) consecutive work weeks during the fall or spring semester, or four (4) consecutive work weeks during the summer semester.",https://iss.ku.edu/health-insurance-gta-gra-ga,iss.ku.edu
What are the components required in the 'Plan of Study' for the M.S. BIOE degree?,"The Plan of Study must consist of CORE, RESEARCH, DEPTH, and BREADTH courses.","The Plan of Study must consist of the following components: CORE, RESEARCH, DEPTH and BREADTH courses.",http://bio.engr.ku.edu/ms,bio.engr.ku.edu
How is the nature of biomechanics research at KU characterized?,"The nature of the research is multidisciplinary, fostering collaborative research among researchers in engineering, mathematics, the sciences, and the KU Medical Center.","While this program is firmly grounded on the techniques in mechanical engineering, the nature of the research is multidisciplinary. Collaborative research is being fostered among researchers in engineering, mathematics, the sciences and the KU Medical Center.",http://bioengr.ku.edu/biomechanics-neural-engineering,bioengr.ku.edu
Which emphases are offered in the chemical engineering program at the University of Kansas?,"The emphases offered include Biomedical, Data Science, Environmental, Material Science, Premedical, and Petroleum Engineering.","Discover chemical engineering and the emphases we offer in Biomedical, Data Science, Environmental, Material Science, Premedical, and Petroleum Engineering.",http://cpe.engr.ku.edu/adjunct-professors-and-lecturers,cpe.engr.ku.edu
"What is the hometown of Aminah Lawrence, an Architectural Engineering student?","Aminah Lawrence is from Crete, IL.","Aminah Lawrence Architectural Engineering, 2027 Hometown: Crete, IL",https://engr.ku.edu/self-architectural,engr.ku.edu
Which areas of research are highlighted for graduate programs in Chemical Engineering at KU?,"Areas of research include bioengineering, catalysis, renewable energy, sustainability, separations, enhanced oil and gas recovery, unconventional reservoirs, data mining and reservoir characterization, flow in porous media, and reservoir simulation.","Work on cutting-edge research with nationally and internationally recognized faculty in areas including bioengineering, catalysis, renewable energy, sustainability, separations, enhanced oil and gas recovery, unconventional reservoirs, data mining and reservoir characterization, flow in porous media, and reservoir simulation.",http://cpe.engr.ku.edu/undergraduate-research,cpe.engr.ku.edu
Where is the Engineering Career Center located?,"1410 LEEP2, 1536 W. 15th Street, Lawrence, KS 66045","Engineering Career Center 1410 LEEP2 1536 W. 15th Street Lawrence, KS 66045",https://engr.ku.edu/contact-ku-school-engineering,engr.ku.edu
What is the maximum number of terms for which a student can request academic forgiveness at the University of Kansas?,A student can request academic forgiveness for a maximum of three terms.,Academic forgiveness can be requested by undergraduate students one time for a maximum of three terms as long as the following apply:,https://registrar.ku.edu/request-other-record,registrar.ku.edu
What is the email address to contact Teresa Fry?,The email address is teresa_fry@ku.edu.,Contact Info teresa_fry@ku.edu,https://engr.ku.edu/people/teresa-fry,engr.ku.edu
What strategies can help find apartment postings in Lawrence?,Looking under the classifieds section for rentals in the Lawrence Journal World newspaper is recommended.,This is Lawrence’s local newspaper. Look under the classifieds->Rentals->unfurnished apartments. This is one of the best sources for off-campus housing.,https://iss.ku.edu/off-campus-housing,iss.ku.edu
What is the price target for the edge devices being developed in the project?,Under $45.,"Hoque's work emphasizes the development of cost-effective edge devices, priced under $45...",https://eecs.ku.edu/news/article/training-the-next-generation-of-ai-and-microelectronics-innovators,eecs.ku.edu
What is one limitation on counting online course credits towards full-time enrollment?,"Generally, only one online class (up to 3 credit hours) can count towards the full-time enrollment requirement.","Generally, only one online class (up to 3 credit hours) can count towards the full-time enrollment requirement.",https://iss.ku.edu/f-1-reduced-course-load,iss.ku.edu
What is the funding range available for proposals under the ASCEND funding program?,$5K to $15K,The total amount of funding to be requested should be in the range of $5K to $15K.,https://engr.ku.edu/ascend-funding-program,engr.ku.edu
What opportunities do students have while participating in the KUEST Bridge program?,"Students will have the opportunity to work with KU Engineering Faculty, Staff, and Graduate Students.","Students will have an opportunity to do work with KU Engineering Faculty, Staff, and Graduate Students.",https://engr.ku.edu/pre-college-programs,engr.ku.edu
What type of regulations does the training cover that pertains to international scholars?,"Student, employee and scholar immigration regulations.","Our staff is well-versed in topics such as student, employee and scholar immigration regulations, employment opportunities for international students, cross-cultural communication and cultural adjustment, student support services, and more.",https://iss.ku.edu/training-ku-departments,iss.ku.edu
In which publication is the concept of nonlinear infrared plasmonic waveguide arrays introduced?,The concept is explored in the paper titled 'Nonlinear infrared plasmonic waveguide arrays' published in Nano Research.,"Salandrino, A., Wang, Y., & Zhang, X. (2016). Nonlinear infrared plasmonic waveguide arrays. Nano Research, 1-6.",https://eecs.ku.edu/people/alessandro-salandrino,eecs.ku.edu
How often do you get a new I-94 when entering the U.S.?,You will get a new I-94 with a new admission number every time you enter the U.S.,You will get a NEW I-94 with a NEW admission number every time you enter the U.S.,https://iss.ku.edu/i94-newly-admitted,iss.ku.edu
Who is the Director of the Landon Center on Aging?,"Randy Nudo, Ph.D.","Randy Nudo, Ph.D. -Professor & Vice Chair of Research, Department of Rehabilitation Medicine -Director, Landon Center on Aging",https://bioengr.ku.edu/core-faculty,bioengr.ku.edu
What is a required component of the track to ensure practical exposure for students?,A clinical or industrial preceptorship is required to give students practical exposure to applied biomedical research and development.,A clinical or industrial preceptorship is required to give students practical exposure to applied biomedical research and development.,http://bio.engr.ku.edu/biomedical-product-design-development,bio.engr.ku.edu
What type of internship experience does the BIOE 802 course involve?,The BIOE 802 course involves an approved bioengineering industrial or clinical internship supervised by a preceptor at the internship site.,An approved bioengineering industrial or clinical internship. The student is supervised by a preceptor at the internship site.,http://bioengr.ku.edu/bioengineering-courses,bioengr.ku.edu
What specific courses are recommended for high school students applying to the EECS Department?,"Students should take a standard college-preparatory curriculum in high school, including courses in chemistry, economics, English, physics, and mathematics (through trigonometry).","Students should take standard college-preparatory curriculum in high school, including courses in chemistry, economics, English, physics, and mathematics (through trigonometry).",https://eecs.ku.edu/admissions-undergraduate,eecs.ku.edu
What position does Aaron McIntyre hold at the university?,Aaron McIntyre is the Front Desk Manager.,Aaron McIntyre Front Desk Manager,https://iss.ku.edu/people/aaron-mcintyre,iss.ku.edu
Who presented the thesis and dissertation workshop at the University of Kansas?,"The workshop was presented by Jim Miller, an associate professor of electrical engineering and computer science.","The University of Kansas School of Engineering and the Graduate Engineering Association (GEA) will play host to a thesis and dissertation workshop, presented by Jim Miller, associate professor of electrical engineering and computer science.",https://engr.ku.edu/news?page=20,engr.ku.edu
What types of projects are involved in KU's Engineers Without Borders?,They have projects in Bolivia and Uganda.,KU’s Engineers Without Borders has projects in Bolivia and Uganda.,https://engr.ku.edu/node/2791,engr.ku.edu
What is Yousif Dafalla's specific area of emphasis in his PhD program?,Cybersecurity,Yousif has been a Jayhawk since 2019 when he came to KU to pursue a P.hD in Computer Science with emphasis on cybersecurity.,https://engr.ku.edu/people/yousif-dafalla,engr.ku.edu
What code and number are necessary when paying the SEVIS fee for F-1 and J-1 students?,"F-1 students need the KU F-1 School Code: KAN 214F 00634000, while J-1 students need the Program Number listed in Section 2 on the DS-2019.",You will need the following code and number when paying the SEVIS fee: KU F-1 (I-20) School Code: KAN 214F 00634000 J-1 (DS-2019) School Code: The 'Program Number' listed in Section 2 on the DS-2019 issued for your attendance at KU.,https://iss.ku.edu/sevis-fee-newly-admitted,iss.ku.edu
What assistance has the University of Kansas provided to help with writing invitation letters?,The University of Kansas has created a template invitation letter that individuals may use to help write their letter.,We have created a template invitation letter below that you may use to help you write your letter.,https://iss.ku.edu/invitation-letter-family,iss.ku.edu
Where is Suzanne Shontz's office located?,"Eaton Hall, room 1C.","Eaton Hall, room 1C",https://engr.ku.edu/people/suzanne-shontz-0,engr.ku.edu
What are the limitations on visitors entering the United States under the Visa Waiver Program?,Visitors admitted in WB/WT status cannot extend their stay beyond 90 days and cannot apply for a change of status.,Visitors admitted in WB/WT status cannot extend their permission to remain in the United States beyond 90 days and they cannot apply for a change of status.,https://iss.ku.edu/visitor-visa,iss.ku.edu
What is the CPU model of the desktop computers used in the School of Engineering?,The desktops use an i7-14700K CPU.,The School of Engineering utilizes desktops with the following specifications: Dell Precision 3680... CPU: i7-14700K,https://engr.ku.edu/computer-specs,engr.ku.edu
What extracurricular activity does João Poli participate in at the University of Kansas?,João Poli is the advisor for the KU Tennis Club.,"While I am not doing research or my activities related to my degree, I like to play tennis. I am the advisor for the KU Tennis Club, a very fun association at KU.",https://engr.ku.edu/people/joao-victor-poli,engr.ku.edu
What fellowship opportunity is provided by the Institute for Broadening Participation?,The Institute for Broadening Participation offers STEM scholarships and fellowships.,STEM scholarships & fellowships The Institute for Broadening Participation (IBP) Apply/MoreInfo,http://bioengr.ku.edu/opportunities,bioengr.ku.edu
What is the contact email for Rémy Lequesne?,His contact email is rlequesne@ku.edu.,Contact Info rlequesne@ku.edu,https://engr.ku.edu/people/remy-lequesne,engr.ku.edu
What role does Jeffrey Burns hold at the University of Kansas Health System?,He is a Professor of Neurology and serves as the Director of the Clinical And Translational Science Unit and the Memory Care Clinic.,"Jeffrey Burns, M.D., M.S. -Professor, Neurology -Director, Clinical And Translational Science Unit -Director, Memory Care Clinic, University of Kansas Health System",http://bio.engr.ku.edu/clinical-affiliates,bio.engr.ku.edu
Which tools are associated with the development of multiagent systems in this department?,"The associated tools for multiagent development include ACCS, C++, CORBA, and Java.","Associated Facilities Multiagent development tools: ACCS, C++, CORBA, Java",https://eecs.ku.edu/data-science-and-engineering,eecs.ku.edu
What time adjustments are made for final examinations on different campuses?,Sixty minutes of time should be added to the beginning and end time of the examinations to accommodate travel time between locations.,"In addition to the standard time of the exam, sixty minutes of time should be added to the beginning and end time of the examinations to accommodate travel time between locations when determining if a conflict exists.",https://registrar.ku.edu/final-exam-policies-guidelines,registrar.ku.edu
What platforms are listed for finding off-campus housing in Lawrence?,Craigslist Apartments and Apartments Lawrence.com are listed as resources for finding off-campus housing.,Craigs List Apartments Craigs List Apartments Apartments Lawrence.com Apartments Lawrence.com,http://bioengr.ku.edu/community,bioengr.ku.edu
What is required for the completion of the M.S. bioengineering degree besides coursework?,A thesis is required which demonstrates the student's ability to conduct independent investigation and present results.,"A thesis is required. The M.S. BIOE is evidence of an ability to work as an engineer and researcher, who is capable of some independent investigation, and who can present the results of that investigation cogently.",https://bioengr.ku.edu/ms,bioengr.ku.edu
What accreditation does the Engineering Physics Bachelor of Science program hold?,The program is accredited by the Engineering Accreditation Commission of ABET.,The Engineering Physics Bachelor of Science program is accredited by the Engineering Accreditation Commission of ABET.,http://ephx.engr.ku.edu/program-statements,ephx.engr.ku.edu
What is the purpose of EECS 101 for new students?,"EECS 101 helps connect freshmen and transfer EECS students to the EECS department, their chosen profession, and each other.","EECS 101 - New Student Seminar This seminar helps connect freshmen and transfer EECS students to the EECS department, their chosen profession, and each other.",https://eecs.ku.edu/new-undergraduate,eecs.ku.edu
Which organization sponsored the 10th Annual Best Scientific Cybersecurity Paper Competition?,The competition was sponsored by the NSA (National Security Agency).,"The 10 th Annual Best Scientific Cybersecurity Paper Competition, sponsored by NSA, recognized the best foundational cybersecurity paper published in 2021.",https://eecs.ku.edu/news/article/2023/01/05/eecs-faculty-research-receives-honorable-mention-nsa,eecs.ku.edu
What entity approves the tuition and fee amounts charged by the University of Kansas?,The Kansas Board of Regents approves the tuition and fee amounts annually.,Tuition and Fee amounts charged by the University of Kansas are approved by the Kansas Board of Regents annually based on a proposal submitted by the Office of Finance.,https://registrar.ku.edu/tuition-and-fees,registrar.ku.edu
What unique opportunity did KU's Aero Students have for testing their design project?,They had the opportunity to test a design project in a weightless environment at NASA's Johnson Space Flight Center.,Students in the University of Kansas School of Engineering will have a rare opportunity to test a design project in a weightless environment this summer at NASA's Johnson Space Flight Center in Houston.,https://engr.ku.edu/news?page=20,engr.ku.edu
"What degree does the Engineering Physics program offer, and what are the design options available?","The program offers a B.S. degree in engineering physics with options in Aerospace Systems, Chemical Systems, Digital Electronic Systems, and Electromechanical Control Systems.","The program offers a B.S. degree in engineering physics with opportunities to pursue one of four design options: Aerospace Systems, Chemical Systems, Digital Electronic Systems, and Electromechanical Control Systems.",http://ephx.engr.ku.edu/digital-electronic-systems,ephx.engr.ku.edu
Which commissions accredit the Engineering Physics Bachelor of Science program at KU?,The program is accredited by the Engineering Accreditation Commission of ABET.,"The Engineering Physics Bachelor of Science program is accredited by the Engineering Accreditation Commission of ABET, under the commission’s General Criteria and Program Criteria for Engineering, General Engineering, Engineering Physics, Engineering Science, and Similarly Named Engineering Programs.",http://ephx.engr.ku.edu/people/list/staff,ephx.engr.ku.edu
How does KU manage tuition and fees to support its students?,KU works to keep costs low for students while providing the highest level of educational experience.,KU works to keep costs low for students while providing the highest level of educational experience.,https://registrar.ku.edu/residency-tuition-and-fees,registrar.ku.edu
What is the minimum high school GPA required for freshman admission to the University of Kansas?,A minimum high school GPA of 3.0 is required.,Have a 3.0+ high school GPA,https://engr.ku.edu/admission-requirements,engr.ku.edu
What are the potential consequences of not adhering to the course enrollment requirement while on CPT?,Failure to enroll in the specific course for which the CPT is approved and to complete the employment during the period of authorization will result in a violation of immigration status.,Both failure to enroll in the specific course for which the CPT is approved and to complete the employment during the period of authorization will result in a violation of immigration status.,https://iss.ku.edu/f-1-cpt-curricular-practical-training,iss.ku.edu
What steps must a J-1 student take to apply for off-campus work authorization due to economic necessity?,"Students must write a letter requesting off-campus work authorization, explain their urgent economic circumstances, gather supporting documents, and meet with an ISS immigration advisor.","Make sure that you are eligible for off-campus employment according to the eligibility criteria above. Write a letter requesting off-campus work authorization due to economic necessity. Explain the serious, urgent and unforeseen circumstances which have arisen since acquiring J-1 status. Gather documents that support your claims (medical bills, loss of scholarship, etc.).",https://iss.ku.edu/j-1-economic-hardship,iss.ku.edu
What types of advisors are available for international students and scholars?,International students and scholars can talk with an ISS Immigration Advisor.,Talk with an ISS Immigration Advisor,https://iss.ku.edu/,iss.ku.edu
When did Penny Thies begin her career in higher education?,Penny began her career in higher education in 2016.,Penny began her career in higher education in 2016.,https://registrar.ku.edu/people/penny-thies,registrar.ku.edu
What is an alternative method for logging into iHawk if a user continues to encounter issues?,They can try opening a new private/incognito window to log in.,"To eliminate the browser history as a factor without clearing it in your settings, you can try opening a new private / incognito window in any browser, then go to the iHawk page, click on the blue LOGIN button...",https://iss.ku.edu/troubleshooting-ihawk-login-issues,iss.ku.edu
What is the significance of the Plan of Study in the Ph.D. graduation process?,The Plan of Study must be filed and approved in the second semester of study and is necessary for clearing the comprehensive exam and scheduling the final oral exam.,"2. Along with your advisor, develop and file your Plan of Study online. This must be completed and approved in the second semester of study. Your Plan of Study is complete when all information is up-to-date, all fields are entered, and all committee members have signed.",http://bio.engr.ku.edu/graduating,bio.engr.ku.edu
What role does KU Innovation Park play in relation to the University of Kansas and economic development?,"KU Innovation Park serves as a nonprofit economic development organization and business incubator that supports building a modern, resilient, and diverse regional economy.","Through its partnership with KU Innovation Park, a nonprofit economic development organization and business incubator that is home to 72 companies employing more than 725 people and supporting an annual payroll of $48 million, the university seeks to drive economic development in the Midwest.",https://engr.ku.edu/news/article/panasonic-energy-and-university-of-kansas-to-collaborate-on-ev-battery-technology-and-talent-development,engr.ku.edu
What leadership role does Samyoga Bhattarai hold in the GEA?,She is the chair of the Public Relations and Marketing team.,"I'm a computer science student, and as a proud member of GEA and the chair of Public Relations and Marketing team...",https://engr.ku.edu/people/samyoga-bhattarai,engr.ku.edu
What is the relevance of biomarkers in bioimaging education?,Students learn biomarkers specific to individual modalities and their utilities for interpreting image contrast.,Students are exposed to in vivo and ex vivo applications and learn biomarkers specific to individual modality and their utilities.,http://bioengr.ku.edu/bioimaging,bioengr.ku.edu
What emphasis do EECS faculty members place on the integration of real-world experiences in their teaching?,EECS faculty members possess industry and research experience that provides real-world examples of fundamental concepts being taught in the classroom.,EECS faculty members possess industry and research experience that provides real-world examples of fundamental concepts being taught in the classroom.,https://eecs.ku.edu/undergraduate-programs,eecs.ku.edu
What is the purpose of the Python to C++ Boot Camp created by Professor Gibbons?,The boot camp is designed to help students transition from Python to C++ for use in some later classes.,"Professor Gibbons has created an online, video-based 'boot camp' to help students make the transition from Python (in EECS 168 and EECS 268) to C++ (used in some later classes).",https://eecs.ku.edu/undergraduate,eecs.ku.edu
What type of reception will follow the International Student Graduation Celebration ceremony?,"A reception will follow the ceremony, including cake and beverages.","A reception will follow the ceremony, including cake and beverages.",https://iss.ku.edu/2025-international-student-graduation-celebration,iss.ku.edu
What action should a student take if their degree has not yet officially posted but they have completed all requirements?,The student should order a Statement of Forthcoming Degree.,"If the student has completed all requirements for a degree during the current semester, but degrees have not officially posted, order a Statement of Forthcoming Degree.",https://registrar.ku.edu/verification-degree,registrar.ku.edu
What is the minimum number of credit hours you need to have completed at Kansas colleges to qualify for Reverse Transfer?,You must have completed 45 credit hours at or more colleges.,You are eligible if you have completed 45 credit hours at or more colleges and if you consent to the release of your academic records.,https://registrar.ku.edu/reverse-transfer-and-articulation,registrar.ku.edu
Which institutions did Matt Skirven work at before joining KU?,"Matt has previously worked at George Washington University, James Madison University, Alexander Hamilton Scholars, City University of Seattle, and the University of Washington.","Matt has previously worked at a number of diverse institutions and organizations on both the east coast (George Washington University & James Madison University), and west coast (Alexander Hamilton Scholars, City University of Seattle, & University of Washington).",https://registrar.ku.edu/people/matt-skirven,registrar.ku.edu
What specific documentation is needed for a Medical Reduced Course Load (RCL)?,Students will need to submit a letter (on letterhead) signed by a physician requiring/recommending an interruption/reduction in studies for the specific semester.,"In some cases, a student will need an RCL due to a medical condition. Students will need to submit a letter (on letterhead) signed by a physician requiring/recommending an interruption/reduction in studies for the specific semester.",https://iss.ku.edu/j-1-reduced-course-load,iss.ku.edu
How does alumni support contribute to the growth of the next generation of engineers at KU?,"Alumni support fosters personal and professional growth in the next generation of engineers and computing professionals through scholarships, professorships, and improvements in laboratories and facilities.","Their professional successes have enabled them to foster personal and professional growth in the next generation of engineers and computing professionals through the school. Alumni support can take the form of scholarships, distinguished or endowed professorships, laboratories and facilities improvements, structures, programs and more.",https://engr.ku.edu/alumni-friends,engr.ku.edu
What title does Jacob Schoonover hold at the university?,Lecturer,Jacob Schoonover Lecturer Contact Info 3038 Eaton Hall,https://eecs.ku.edu/people/jacob-schoonover,eecs.ku.edu
Which laboratory at the University of Kansas is dedicated to studying musculoskeletal biomechanics?,The Musculoskeletal Biomechanics Research Laboratory.,Musculoskeletal Biomechanics Research Laboratory - Fischer...,https://bioengr.ku.edu/research,bioengr.ku.edu
How does the university handle conflicts between special examinations and regular class schedules?,Students are given the opportunity to take the examination at a time that does not conflict with their other regularly scheduled classes.,"If a special examination(s) conflicts with a student’s obligation to other regularly scheduled classes, the student shall be accorded the opportunity to take the examination or test at a time NOT in conflict with other regularly scheduled university classes.",https://registrar.ku.edu/special-exam-policies,registrar.ku.edu
What unique classroom topic did Man C. Kong explore in a publication?,Fun in Teaching Counting using the Powerball Lottery.,"Nancy Kinnersley and Man C. Kong, “Fun in Teaching Counting using the Powerball Lottery,” The 37th ASEE/IEEE Frontiers in Education Conference, F25: 7 – 11, Milwaukee, WI, 2007.",https://eecs.ku.edu/people/man-kong,eecs.ku.edu
What role does faculty mentoring play in KU Engineering's research programs?,Faculty mentoring is a key component that helps embolden student and faculty research development.,"KU Engineering's Research and Graduate Programs emboldens student and faculty research development. Through collaborative research visioning, faculty mentoring, and seed funding programs...",https://engr.ku.edu/news-faculty-leaders-and-research-support,engr.ku.edu
"What is the flat rate charged by 5 Guys Transportation for a one-way trip, and how many people can fit in the vehicle?",5 Guys Transportation charges a $100 one-way flat rate for a van that holds 1-6 people.,5 Guys Transportation A $100 one-way flat rate for a van that holds 1-6 people.,https://iss.ku.edu/airport-lawrence,iss.ku.edu
What information is important to know before calling for an appointment with a primary care provider?,"You should ask if the provider is taking new patients, accepts your insurance, has convenient appointment hours, and what information you need to bring to the appointment.","When you call for an appointment, it’s important to have information such as: Is the provider taking new patients? Does the provider accept your insurance, and is he or she in your plan’s network? ... Does the provider offer services in your preferred language? ... What information will you need to bring with you when you go to your appointment?",https://iss.ku.edu/how-find-doctor,iss.ku.edu
What should you expect to pay in tips when using a taxi in Lawrence?,You are expected to tip drivers around 15% of the fare.,"While they can be convenient, taxis can be pricey. You are also expected to tip drivers around 15% of the fare.",https://iss.ku.edu/taxisuber,iss.ku.edu
"What significant donation did Murli Tolaney make to KU, and what is its intended purpose?","Murli Tolaney donated $50,000 to strengthen the Tolaney Family Scholarship to help KU environmental engineering students.","University of Kansas School of Engineering alumnus Murli Tolaney is donating $50,000 to strengthen the Tolaney Family Scholarship he established 15 years ago. His ongoing goal: help KU environmental engineering students follow in his academic and professional footsteps.",https://engr.ku.edu/news?page=2,engr.ku.edu
What is one of the primary goals of research in electromagnetic communications at KU EECS?,One of the primary goals is to maximize the accuracy of information retrieval on receive.,"For electromagnetic communications and sensing, the problem essentially is one of maximizing the capacity of this information on transmit, and then maximizing the accuracy of information retrieval on receive.",https://eecs.ku.edu/rf-systems-engineering,eecs.ku.edu
What accreditation does the Bachelor of Science in Engineering Physics program hold?,The program is accredited by the Engineering Accreditation Commission of ABET.,The Engineering Physics Bachelor of Science program is accredited by the Engineering Accreditation Commission of ABET.,http://ephx.engr.ku.edu/accreditation,ephx.engr.ku.edu
In which year did Brian McClendon run for Kansas Secretary of State?,He ran for Kansas Secretary of State in 2018.,"In 2018, he ran for Kansas Secretary of State as a Democrat.",https://eecs.ku.edu/people/brian-mcclendon,eecs.ku.edu
What types of applications are associated with modern bioimaging?,"Modern applications include multi-photon imaging, image-guided interventional procedures, surgical planning, oncology treatment planning, endoscopic and laparoscopic surgeries, and virtual telemedicine.","Modern applications of bioimaging include multi-photon imaging, image-guided interventional procedures, surgical planning, oncology treatment planning, endoscopic and laparoscopic surgeries and virtual telemedicine.",http://bioengr.ku.edu/bioimaging,bioengr.ku.edu
Is Tyler Smith's email address publicly available?,"Yes, his email address is publicly available.",Contact Info tyler.smith@ku.edu,https://engr.ku.edu/people/tyler-smith,engr.ku.edu
What are the implications of the credit/no credit option for graduate students regarding course requirements?,Graduate students can take courses graded credit/no credit only if those courses are not needed to fulfill requirements for their degree.,Graduate students: Courses graded credit/no credit may be taken in a graduate program if the course is not needed to fulfill hours toward the satisfaction of requirements.,https://registrar.ku.edu/covid-19-creditno-credit-policy-modification,registrar.ku.edu
What kind of research areas can graduate students in Petroleum Engineering expect to work on?,"Students can work on research areas including bioengineering, catalysis, renewable energy, sustainability, and reservoir simulation.","Work on cutting-edge research with nationally and internationally recognized faculty in areas including bioengineering, catalysis, renewable energy, sustainability, separations, enhanced oil and gas recovery, unconventional reservoirs, data mining and reservoir characterization, flow in porous media, and reservoir simulation.",http://cpe.engr.ku.edu/student-involvement-and-professional-organizations,cpe.engr.ku.edu
When was the information in the document last updated?,"The information was last updated on March 31, 2025.","Last updated on March 31, 2025.",https://registrar.ku.edu/summer-2025-short-courses,registrar.ku.edu
What specific goal does the EECS Department have regarding its research areas?,To be world-class in an increasing number of selected areas of research.,to be world-class in an increasing number of selected areas of research,https://eecs.ku.edu/vision-and-mission,eecs.ku.edu
What dynamic strategy for label assignment was proposed in the dissertation?,"A dynamic paradigm is introduced to define positive and negative samples, allowing for more high-quality samples to be selected as positives.","A dynamic strategy for improving label assignment in modern object detection models is proposed. Rather than relying on fixed or statistics-based adaptive thresholds, a dynamic paradigm is introduced to define positive and negative samples.",https://eecs.ku.edu/efficient-and-effective-object-detection-and-recognition-convolutions-transformers,eecs.ku.edu
What is the email address provided for Owen Kelly?,The email address for Owen Kelly is omkelly@ku.edu.,Contact Info omkelly@ku.edu,https://engr.ku.edu/people/owen-kelly,engr.ku.edu
What should be included in the graphic submitted for digital signage?,"The graphic should include all relevant information about the event, including date, time, and location.","The graphic should include all relevant information about the event including date, time and location.",https://engr.ku.edu/digital-signage-submission,engr.ku.edu
What are some of the innovative startup focuses created by KU chemical engineering students and faculty?,"Startup companies focused on mitigating climate change, improving drug development, feeding a growing planet, and harnessing the power of hydrogen.","KU chemical engineering petroleum students and faculty have created startup companies focused on mitigating climate change, improving drug development, feeding a growing planet, and harnessing the power of hydrogen.",https://engr.ku.edu/chemical-engineering-brochure-2023,engr.ku.edu
What expectations should students have when selecting an advisor?,"Students should discuss expectations, including communication and supervision style, with their advisor before making a decision.","Establish open, effective and straightforward communication with your advisor and other lab personnel. Spend a few weeks in the lab of any prospective advisor before making any decisions.",http://bio.engr.ku.edu/faqs,bio.engr.ku.edu
What interdisciplinary approach does the Sturm Research Group utilize in its research?,"It applies a holistic research approach that includes microbial ecology, bioreactor design, and collaborations with environmental economists.","The Sturm Research Group studies the application of biological processes in environmental engineering toward public health protection and sustainability. The group applies a holistic research approach that includes microbial ecology, bioreactor design and operation, life cycle assessment, geospatial modeling, and collaborations with environmental economists.",https://engr.ku.edu/open-house-engineering-graduate-programs,engr.ku.edu
What types of financial support are available to graduate students at the KU School of Engineering?,"Graduate students can access a variety of scholarships, fellowships, and assistantships.","A variety of scholarships, fellowships and assistantships are available to graduate students through the School of Engineering, KU Graduate Studies and outside sources including federal agencies.",https://engr.ku.edu/graduate-programs,engr.ku.edu
What resource is suggested for finding additional KU scholarships?,Students are encouraged to visit the University of Kansas Scholarship Opportunities Portal for additional KU scholarships.,Students are also encouraged to visit the University of Kansas Scholarship Opportunities Portal for additional KU scholarships.,https://engr.ku.edu/diversity-scholarships,engr.ku.edu
Which schools within the University of Kansas provide faculty for the interdisciplinary approach in bioengineering?,"Faculty from the School of Medicine, School of Pharmacy, School of Business, and College of Liberal Arts & Sciences are involved.","Our world-class affiliate faculty are found in the School of Medicine, School of Pharmacy, School of Business, College of Liberal Arts & Sciences...",https://bioengr.ku.edu/vision-mission,bioengr.ku.edu
Where can Lynne Vanahill's office be found within the university's campus?,In Strong Hall,"Strong Hall 1450 Jayhawk Boulevard, Rm 50",https://iss.ku.edu/people/lynne-vanahill,iss.ku.edu
What is the significance of the findings from Donna Ginther's research on gender and racial disparities in scientific funding?,"Donna Ginther's research highlighted significant racial disparities in funding from the National Institutes of Health, leading to the establishment of a task force and mentoring program to address these issues.","In 2011 and 2018, Ginther published papers showing significant racial disparities in funding from the National Institutes of Health, which later became known as the 'Ginther gap.' This led to the creation of a task force and mentoring program at the agency to address these disparities.",https://engr.ku.edu/news/article/three-ku-professors-of-chemistry-economics-and-engineering-named-aaas-fellows,engr.ku.edu
How can someone contact Palvih Bhana?,Someone can contact Palvih Bhana via email at palvih.bhana@ku.edu or by phone at 785-864-3620.,Contact Info Email: palvih.bhana@ku.edu Phone: 785-864-3620,https://engr.ku.edu/people/palvih-bhana,engr.ku.edu
What is the maximum speed and test section size of the Small Water Tunnel?,"The maximum speed at the experimental section is 3 ft/sec, with a channel that is 6 inches wide, 6 inches deep, and 7 feet long.","The Small Water Tunnel has a 6” wide, 6” deep and 7’ long channel. Water is pumped in a closed loop. The maximum speed at the experimental section is 3ft/sec.",http://ae.engr.ku.edu/facilities,ae.engr.ku.edu
What specific types of academic calendars are mentioned in the passage?,"The passage mentions Spring, Summer, and Fall academic calendars for the years 2025 and also includes archived calendars.",Academic Calendars Spring 2025 Academic Calendar Select to follow link Summer 2025 Academic Calendar Select to follow link Fall 2025 Academic Calendar Select to follow link Academic Calendars in List View & Archived Calendars Select to follow link,https://registrar.ku.edu/calendar,registrar.ku.edu
What documentation is required before a J-1 student can begin on-campus work?,A written authorization letter from ISS is required before a J-1 student can start work.,You must have a written authorization letter before you start work.,https://iss.ku.edu/campus-employment-j-students,iss.ku.edu
"As of the current date, what professional membership does Man C. Kong hold?","ACM IEEE Fellow, Institute of Combinatorics and its Applications.","Memberships — ACM IEEE Fellow, Institute of Combinatorics and its Applications",https://eecs.ku.edu/people/man-kong,eecs.ku.edu
What documentation will J-1 students receive regarding their wages and taxes?,"By January 31 of the following tax year, they will be sent a W-2 form, which reports their annual wages and the amount of taxes withheld.","By January 31 of the following tax year, you will be sent a W-2 form, also known as the Wage and Tax Statement.",https://iss.ku.edu/campus-employment-f-and-j-students,iss.ku.edu
From which university did Mary Rezac earn her bachelor’s degree?,Kansas State University,Rezac earned a doctorate and master’s degree in chemical engineering from the University of Texas at Austin and a bachelor’s degree in chemical engineering from Kansas State.,https://engr.ku.edu/people/mary-rezac-phd,engr.ku.edu
What type of network is mentioned for healthcare providers?,The passage mentions a 'Preferred Provider' Network for healthcare providers.,This is also called a 'Preferred Provider' Network.,https://iss.ku.edu/search-doctor-uhc-network,iss.ku.edu
What is Upsilon Pi Epsilon and what does it recognize?,Upsilon Pi Epsilon is an honorary society that recognizes outstanding undergraduate and graduate students in Computing and Information Disciplines for their academic excellence and professional contributions.,Upsilon Pi Epsilon is an honorary society whose membership consists of outstanding undergraduate and graduate students in Computing and Information Disciplines. It recognizes academic excellence at both the undergraduate and graduate levels in the computing sciences.,https://eecs.ku.edu/academic-experience,eecs.ku.edu
When is the Engineering Expo scheduled to take place?,The Engineering Expo is scheduled for Feb. 23 from noon to 3 p.m.,The public is invited to Expo events from noon-3 p.m. Feb. 23 at the KU Engineering Complex.,https://engr.ku.edu/explore,engr.ku.edu
What is the main objective of the Rising BME Scholars Conference?,The main goal is to encourage and equip students to move forward in an academic career.,The conference goal is to encourage and equip students to move forward in an academic career.,http://bioengr.ku.edu/rising-bme-scholars-conference,bioengr.ku.edu
Are there late enrollment fees and what are their amounts?,"Yes, the late enrollment fee is $150.00 for fall/spring and $75.00 for summer.","Late Enrollment Fee The late enrollment fee is assessed once per semester/term in the following circumstances: - The enrollment is the initial enrollment in the term; and, - The enrollment is initiated at 12:00 a.m. or later of the first published day of the term (fall/spring/summer) or the published start date of the course, whichever is later. Fall/Spring - $150.00 Summer - $75.00",https://registrar.ku.edu/fy-2024-specialized-tuition-fees,registrar.ku.edu
"What is the significance of KU's research in radar systems, especially in relation to climate change?",KU is internationally known for its radar research and development in climate change.,KU is internationally known for its radar research and development in climate change.,https://eecs.ku.edu/radar-systems-and-remote-sensing,eecs.ku.edu
How does the coursework in the Master of Engineering in Bioengineering degree differ from that of the Master of Science in Bioengineering?,"The Master of Engineering degree eliminates the need for research, a thesis, and thesis defense, replacing thesis credit hours with additional coursework.","The primary difference is the elimination of research, the thesis and the thesis defense. The thesis credit hours are replaced with the same credit hours of coursework.",https://bioengr.ku.edu/master-engineering,bioengr.ku.edu
What type of degree must applicants normally possess to be considered for the KU BioE Graduate Program?,"Applicants normally have a Bachelor of Science degree or a Master of Science degree in an engineering discipline, physical sciences, life sciences, or a closely related field.","Applicants normally have a Bachelors of Science degree or a Masters of Science degree in an engineering discipline, physical sciences (e.g. Chemistry, Physics, etc.), the life sciences (e.g. Biology, Biochemistry, etc.), or a closely related field.",http://bio.engr.ku.edu/entrance-requirements-track,bio.engr.ku.edu
In which room can Valentine Baumann be found in the LEEP2 building?,Valentine Baumann can be found in room 1415 of the LEEP2 building.,"Office: 785-864-2945 LEEP2, room 1415",https://engr.ku.edu/people/valentine-baumann,engr.ku.edu
What specific action must users take when they first log into Virtual Lab?,Users need to install the Citrix Receiver when they first log into Virtual Lab.,You will need to install the Citrix Receiver - It should prompt you to install it the first time you login into Virtual Lab.,https://engr.ku.edu/remote-lab-access-instructions,engr.ku.edu
How does the Graduate Student Writing Groups program support students?,"Graduate Student Writing Groups provide environments for students to collaborate on writing projects, enhancing peer support and motivation.",Graduate Student Writing Groups Graduate Research / Write-Ins Graduate Writing Coaching Thesis/Dissertation Accelerator,https://engr.ku.edu/graduate-academic-resources,engr.ku.edu
How should earthquake and hurricane emergencies be approached according to the plan?,"Additional information regarding issues such as weather emergencies, bomb threats, etc., can be found on the KU Lawrence Campus Alerts website.","Examples of such occasions include: smoke/fire, gas leak, bomb threat. Pre-planning and rehearsal are effective ways to ensure that building occupants recognize the evacuation alarm and know how to respond. Additional information regarding issues such as weather emergencies, bomb threats, etc., can be found on the KU Lawrence Campus Alerts website.",https://engr.ku.edu/easton-hall-emergency-evacuation-plan,engr.ku.edu
What types of engineering emphases can students discover within the chemical engineering program?,"Students can discover emphases in Biomedical, Data Science, Environmental, Material Science, Premedical, and Petroleum Engineering.","Discover chemical engineering and the emphases we offer in Biomedical, Data Science, Environmental, Material Science, Premedical, and Petroleum Engineering.",http://cpe.engr.ku.edu/research-areas,cpe.engr.ku.edu
What is the common academic level for Garrett Black and Ashley Bland?,Both Garrett Black and Ashley Bland are in the Masters Program.,"Garrett Black - Masters Program View full profile, Ashley Bland - Masters Program View full profile",https://bioengr.ku.edu/graduate-students,bioengr.ku.edu
What is the difference between a visa and an immigration status?,"Your visa is an entry document, while immigration status is the non-immigrant status you hold when admitted to the U.S. at a port of entry.",One of the most common sources of confusion is the difference between your visa and your status. Your visa is an entry document... This is also referred to as 'immigration status' or 'visa status'.,https://iss.ku.edu/about-your-visa-students,iss.ku.edu
What distinguishes the teaching method in KU’s Chemical & Petroleum Engineering department?,The teaching method emphasizes hands-on education based on industrial problems and real-world examples.,Learn more about how hands-on education based on industrial problems and real-world examples taught by expert faculty can start your path to a successful career.,http://cpe.engr.ku.edu/research-centers,cpe.engr.ku.edu
What should a student do if they cannot find a course on CredTran?,They should send an email to transfercredit@ku.edu to request an evaluation of the course.,"If a course is not found on CredTran, please send an email to transfercredit@ku.edu to request an evaluation.",https://registrar.ku.edu/credittransfer,registrar.ku.edu
Who is the director of the Biomechanics and Neural Engineering track at KU?,"Terence McIff, Ph.D. is the director of the Biomechanics and Neural Engineering track.","Terence McIff, Ph.D. - Track Director, Biomechanics & Neural Eng. - Associate Professor, Orthopedic Surgery and Sports Medicine, KUMC.",https://bioengr.ku.edu/biomechanics-neural-engineering,bioengr.ku.edu
How can students ensure they can enroll in classes after orientation?,Students should ensure they update their information and clear any holds in the system.,Make sure you update your information and clear any holds you might have in the system.,https://eecs.ku.edu/new-graduate,eecs.ku.edu
What is Kabir Panahi's academic department and degree program?,He is in the Electrical Engineering and Computer Science department and is pursuing a PhD.,Department: Electrical Engineering and Computer Science Degree Program: PhD,https://engr.ku.edu/people/kabir-panahi,engr.ku.edu
What is the importance of the I-94 record for international students entering the United States?,"The I-94 record is an electronic admission record given to international students upon entry, important for understanding their immigration status.",When you enter the United States you will get an electronic admission record. This is called your I-94 record.,https://iss.ku.edu/newly-admitted-students,iss.ku.edu
What is the operational schedule for the SafeRide service?,SafeRide operates from 10:30 p.m. to 2:30 a.m. every evening during the academic year when classes are in session.,SafeRide is a free transportation service for KU members that operates from 10:30 p.m. to 2:30 a.m. every evening during the academic year when classes are in session.,https://iss.ku.edu/saferide-and-safebus,iss.ku.edu
What is the recommended method for bringing money into the U.S.?,You should bring your money in the form of U.S. dollar traveler's checks or have it electronically wired to your American bank account.,Bring your money to the United States in these forms: U.S. dollar traveler's checks. Have it electronically wired to your new American bank account.,https://iss.ku.edu/finances-newly-admitted,iss.ku.edu
What are the conditions under which staff member dependents can receive resident fee privileges?,Dependents of employees must hold a regular payroll appointment for at least .4 time and be enrolled in a graduate program to qualify for resident fee privileges.,"The dependent spouse and children of any employee of an institution governed by the state board of regents... shall be accorded the resident fee privilege, provided that the employee holds a regular payroll for 1.0 time... until one of the following criteria is met...",https://registrar.ku.edu/residency-faqs,registrar.ku.edu
What steps must a student take to request an increase in hours for a variable credit course after the add/change deadline?,"A student must obtain instructor approval, and if beyond the add deadline, they must also obtain approval from their school.","Increasing hours: The Schools listed below also require approval from a representative in the School to increase hours. Students may increase hours to a variable credit course thru the last day of finals, however, after the last day to add a course with permission has passed all schools and the College require Dean approval to increase hours.",https://registrar.ku.edu/schedule-changes,registrar.ku.edu
What areas of research can graduate students work on in the Chemical & Petroleum Engineering program?,"Graduate students can work on research areas including bioengineering, catalysis, renewable energy, sustainability, and more.","Work on cutting-edge research with nationally and internationally recognized faculty in areas including bioengineering, catalysis, renewable energy, sustainability, separations, enhanced oil and gas recovery, unconventional reservoirs, data mining and reservoir characterization, flow in porous media, and reservoir simulation.",http://cpe.engr.ku.edu/cpe-newsletters,cpe.engr.ku.edu
What should a student do to prevent duplicate processing of their request?,Do not submit the same form in multiple methods or repeatedly submit the same request.,"Do not submit the same form in multiple methods (i.e. hand deliver and fax the same form), or repeatedly submit the same request; processing and charges will be duplicated.",https://registrar.ku.edu/verification-degree,registrar.ku.edu
What is the purpose of the Undergraduate Pre-Orientation To-Do List?,It helps students prepare to enroll in their classes.,Many items on the undergraduate Pre-Orientation to-do list help you prepare to enroll in your classes.,https://registrar.ku.edu/enrollment-planning,registrar.ku.edu
What additional fee do students have to pay for the administration of the Jayhawk Semester Program?,An additional fee of $285 per semester will be charged for the Jayhawk Semester Program administration and services.,An additional fee of $285 per semester will be charged for the Jayhawk Semester Program administration and services.,https://iss.ku.edu/jayhawk-semester-students,iss.ku.edu
What advisory recommendation is given for completing the application concerning recommenders?,It is helpful to save your application while working on the resume and statement of purpose to give recommenders more time to submit their materials.,It is helpful to advance to the section of the application where you input the names and e-mails of 3 recommenders and save your application while you are working on your Resume and Statement of Purpose.,http://bioengr.ku.edu/application,bioengr.ku.edu
What distinction does the passage make regarding ONLINE and IN-PERSON classes?,"Classes described as 'Hybrid Online' or 'World Wide Web' are considered ONLINE credits, while those labeled 'In Person', 'Hybrid Classroom', or 'Video Conference' are considered IN-PERSON credits.","Definition of ONLINE vs IN-PERSON classes based on mode of instruction shown on course catalogue: Considered In-Person credits: 'In Person', 'Hybrid Classroom', 'Video Conference' Considered Online credits: 'Hybrid Online', 'World Wide Web'.",https://iss.ku.edu/enrollment-f-students,iss.ku.edu
"What mathematical concepts are emphasized in the Languages, Semantics, and Formal Methods topic?","The topic emphasizes understanding mathematical concepts of formal languages and techniques for mathematically specifying, verifying, and synthesizing hardware and software artifacts.","Languages, Semantics, and Formal Methods includes understanding the foundations of high-level programming language design, language type systems, specification and verification of language semantics; understanding mathematical concepts of formal languages; understanding techniques for mathematically specifying, verifying, and synthesizing hardware and software artifacts...",https://eecs.ku.edu/phd-qualifying-exam-topics,eecs.ku.edu
"What is the email address of Katherine Liu, the International Advisor?",The email address of Katherine Liu is qiyu.liu@ku.edu.,Katherine Liu International Advisor Contact Info qiyu.liu@ku.edu 785-864-3617,https://iss.ku.edu/people/katherine-liu,iss.ku.edu
What does Appel believe about the social impacts of infrastructure?,Appel believes infrastructure should be viewed not only as a technical product but also as a social tool that shapes how people interact and perceive their community.,"""I think one major issue is a lack of education on infrastructure not just as a technical product, but also as a social tool... Public services and public spaces have great power to influence peoples’ lives for the better.""",https://engr.ku.edu/news/article/ku-senior-from-kansas-city-awarded-full-ride-to-university-of-cambridge-to-pursue-sustainable-engineering,engr.ku.edu
What is the cost associated with obtaining an Apostille through the Office of the University Registrar?,"The cost of an Apostille is $7.50 per document, and the cost of notarization is $5.00 per document.",The cost of an Apostille is $7.50 per document. A Notary Request Form... The cost of notarization is $5.00 per document and will be billed to your Enroll & Pay portal.,https://registrar.ku.edu/university-seal,registrar.ku.edu
How can one contact Bozenna Pasik-Duncan?,One can contact her via email at bozenna@ku.edu or by phone at 785-864-5162.,Contact Info bozenna@ku.edu 785-864-5162,https://eecs.ku.edu/people/bozenna-pasik-duncan,eecs.ku.edu
What are the processing timelines for F-1 STEM OPT extensions?,"The second EAD card process for F-1 STEM OPT extension will take 3-5 months, but the employee can work with the receipt notice for 180 days.",second EAD will take 3-5 months but employee can work with receipt notice for 180 days,https://iss.ku.edu/hire-foreign-national,iss.ku.edu
What is the purpose of the Versatile Alignment Toolkit (VAT) created in the biological sequence alignment framework?,VAT allows users to switch seamlessly between nearly all major alignment tasks through command-line parameter configuration.,"The resulting software, the Versatile Alignment Toolkit (VAT), allows the users to switch seamlessly between nearly all major alignment tasks through command-line parameter configuration.",https://eecs.ku.edu/defense-notices,eecs.ku.edu
How does Alex Pang approach student success?,Alex Pang is passionate about holistic student success inside and outside the classroom.,Alex is passionate about holistic student success inside and outside the classroom.,https://engr.ku.edu/people/alex-pang,engr.ku.edu
What precautionary practice is recommended to avoid future login issues with iHawk?,Always log out of the iHawk system after you are done submitting your E-form.,"Finally, in order to reduce the likelihood of similar issues affecting you in the future when working with iHawk, we recommend the following practices: Always log out of the iHawk system after you are done submitting your E-form.",https://iss.ku.edu/troubleshooting-ihawk-technical-issues,iss.ku.edu
What are the document submission requirements for proof of insurance for J-2 dependents?,J-1 students must submit documentation including insurance ID card(s) and Certificate(s) of Coverage by uploading them through the iHawk Portal.,J-1 students must submit documentation showing their J-2 dependents have insurance coverage which meets the minimum health insurance coverage requirements listed above by uploading the insurance ID card(s) and Certificate(s) of Coverage.,https://iss.ku.edu/proof-insurance-j-2-dependents,iss.ku.edu
"What specific role does vegetation play in the water quality improvement process in wetlands, according to Amy Hansen's research?",Vegetation plays a crucial role in nitrogen exchange and removal in riparian wetlands.,Amy Hansen is recipient of an NSF Early Career Development (CAREER) award for her work to understand the role of vegetation in nitrogen exchange and removal in riparian wetlands.,https://engr.ku.edu/news/article/2024/02/27/ku-engineering-professor-wins-nsf-career-award-research-wetlands-water-quality-benefits,engr.ku.edu
What is the focus of the required core courses in the Master of Engineering in Bioengineering program?,"The core courses are focused on providing a foundational understanding of biomedical engineering, professional development, and ethical conduct in engineering.","All the tracks have the same required core courses (total 6 credit hours): C&PE 756 Introduction to Biomedical Engineering (3 credit hours), BIOE 800 Colloquium (2 credit hours total), and BIOE 801 Responsible Conduct of Research in Engineering (1 credit hour).",http://bioengr.ku.edu/master-engineering,bioengr.ku.edu
What academic qualifications does Adam hold?,Adam holds a BFA in Painting and Drawing from Wichita State University and an MFA in Visual Art with an emphasis in Painting and Drawing from the University of Kansas.,"Education — BFA in Painting and Drawing, Wichita State University, 2000 Summa cum laude MFA in Visual Art - Emphasis in Painting and Drawing, University of Kansas, 2003",https://registrar.ku.edu/people/adam-tompkins,registrar.ku.edu
What conditions allow for exceptions to the 80% enrollment policy for auditorium use?,Exceptions are allowed when enrollment for a class does not meet the 80% minimum but is too large for the next smaller capacity auditorium.,Exceptions to this policy are allowed when enrollment for a class does not meet the 80% minimum but is too large for the next smaller capacity auditorium.,https://registrar.ku.edu/auditoriums,registrar.ku.edu
What department is Dongjie Wang associated with?,Electrical Engineering and Computer Science,This information can be inferred from the source URL: https://eecs.ku.edu/people/dongjie-wang,https://eecs.ku.edu/people/dongjie-wang,eecs.ku.edu
Which innovative teaching methods are emphasized in the Chemical Engineering program at KU?,Hands-on education based on industrial problems and real-world examples are emphasized.,Learn more about how hands-on education based on industrial problems and real-world examples taught by expert faculty can start your path to a successful career.,http://cpe.engr.ku.edu/news-event-submission,cpe.engr.ku.edu
What unique funding sources support KU Engineering's cybersecurity initiatives?,Initiatives include a National Security Agency-funded lablet to secure the Internet of Things and a National Science Foundation-sponsored project to the CyberCorps Scholarship for Service program.,"Our initiatives include a National Security Agency-funded lablet to secure the Internet of Things and a National Science Foundation-sponsored project to CyberCorps Scholarship for Service program, which offers training and collaboration with the NSA and U.S. Army.",https://engr.ku.edu/research-innovations,engr.ku.edu
What type of events are categorized under Engineering Events on the website?,The events listed are specifically related to engineering.,Upcoming Events Engineering Events See all events,https://engr.ku.edu/events,engr.ku.edu
How can students update their preferred name at the University of Kansas?,Students can update their preferred name through Enroll & Pay by selecting the Personal Details Tile and then the Update Name & Pronouns menu item.,Update Preferred Name: Students and faculty have the option to use a name other than their legal (primary) name to identify themselves. ... Students can update their preferred name through Enroll & Pay by selecting the Personal Details Tile then the Update Name & Pronouns menu item.,https://registrar.ku.edu/update-or-correct-your-information,registrar.ku.edu
What documentation is required from students previously attending Haskell Indian Nations University to establish residency at the University of Kansas?,Students need to submit an official transcript or an enrollment verification form from Haskell to the Office of the University Registrar at KU.,"If you previously attended Haskell, submit an official transcript or an enrollment verification form from Haskell to the Office of the University Registrar at KU.",https://registrar.ku.edu/residency,registrar.ku.edu
What specific graduate certificates does the EECS program offer?,The EECS program offers Graduate Certificates in Data Science and RF Systems Engineering.,Graduate Certificate Data Science Graduate Certificate RF Systems Engineering,https://eecs.ku.edu/navigator,eecs.ku.edu
What is the mission of KU Dining services?,The mission is empowering students by access to healthy food and resources through collaboration among KU departments and community agencies.,"Our mission is empowering students by access to healthy food and resources through collaboration among KU departments and community agencies, exemplifying the Jayhawk Values of Unity, Inclusion, Innovation, and Engagement.",https://engr.ku.edu/campus-student-resources,engr.ku.edu
What are the mathematics prerequisites recommended for the KU BioE Graduate Program?,"The mathematics prerequisites include Calculus I (MATH 121), Calculus II (MATH 126), Applied Differential Equations (MATH 220), and Elementary Linear Algebra (MATH 290).","Mathematics: all courses below must be taken Calculus I, MATH 121 (4 credits) or equivalent AND Calculus II, MATH 126 (4 credits) or equivalent AND Applied Differential Equations, MATH 220 (3 credits) or equivalent AND Elementary Linear Algebra, MATH 290 (2 credits) or equivalent.",http://bio.engr.ku.edu/entrance-requirements-track,bio.engr.ku.edu
What type of degree does the Engineering Physics program at KU offer?,The program offers a B.S. degree in engineering physics.,The program offers a B.S. degree in engineering physics with opportunities to pursue one of four design options.,http://ephx.engr.ku.edu/faqs,ephx.engr.ku.edu
In what way is the High School Design Competition structured regarding participation?,High school students can participate as individuals or in small teams.,"Working as individuals or in small teams, high school students design, build, and test a project that addresses the design criteria.",https://engr.ku.edu/high-school-design-competition,engr.ku.edu
What is the purpose of the LEEP2 facility at the KU School of Engineering?,"LEEP2 is designed to cultivate student success and includes state-of-the-art classrooms, teaching and research laboratories, and collaboration and study spaces.","LEEP2 serves as the front door for the KU School of Engineering and home for student recruitment, retention efforts, such as tutoring, group and individual study space, student organization space, and the Engineering Career Center.",https://bioengr.ku.edu/contact,bioengr.ku.edu
What is the primary objective of the research initiative funded by the NSF?,The primary objective is the development of innovative hardware and software tools tailored for gathering precise cellular network performance data in rural regions.,Its primary objective is the development of innovative hardware and software tools tailored for the purpose of gathering precise cellular network performance data in rural regions.,https://eecs.ku.edu/news/article/2023/08/22/eecs-professor-secures-600k-nsf-award-rural-cellular-network-performance-study,eecs.ku.edu
What is the role of the Jayhawk Academic Advising office for undergraduate students?,All undergraduate students are advised through Jayhawk Academic Advising.,All undergraduate students are advised through Jayhawk Academic Advising.,https://iss.ku.edu/enrollment-tuition,iss.ku.edu
How does the National Science Foundation (NSF) Research Traineeship (NRT) program contribute to graduate education?,The NRT program contributes to graduate education by developing and implementing traineeship models in STEM fields to prepare scientific leaders for complex societal challenges.,"The National Science Foundation (NSF) Research Traineeship (NRT) program is designed to develop and implement graduate education traineeship models in science, technology, engineering and mathematics (STEM) fields.",https://engr.ku.edu/broadening-participation-graduate,engr.ku.edu
What cultural perspective does Yousif enjoy as a GEA Ambassador?,Meeting other engineering graduate students with different cultures and backgrounds,Yousif enjoys being a GEA Ambassador because it allows him to meet other engineering graduate students with different cultures and backgrounds and also help serve other engineering graduate students.,https://engr.ku.edu/people/yousif-dafalla,engr.ku.edu
What type of aid does the Abhay and Mina Bisarya Scholarship provide?,The scholarship supports international students.,Abhay and Mina Bisarya Scholarship to support international students.,https://engr.ku.edu/international-experiences-ku-school-engineering,engr.ku.edu
What unique feature does the PhantomSeal approach provide against identity impersonation in deepfake face-swapping?,"PhantomSeal embeds invisible perturbations to encode a hidden 'cloak' identity, which alters the generated deepfake to resemble the cloak identity when used as a source.","To counter identity impersonation in deepfake face-swapping, where both the source and target can be exploited, we introduce PhantomSeal, which embeds invisible perturbations to encode a hidden 'cloak' identity.",https://eecs.ku.edu/defense-notices?page=%2C80,eecs.ku.edu
What is included in the New Scholar Orientation for visiting scholars?,Visiting scholars will meet with an international advisor to learn about university systems and complete the International Support Service check-in.,When visiting scholars first arrive on campus they will meet with an international advisor. Scholars will learn about university systems/processes that will help them get started in their research agenda.,https://iss.ku.edu/our-services,iss.ku.edu
What additional resources are available for students regarding credit transfer at Kansas community colleges?,"Students have access to links for Credit for Prior Learning, Credit Transferability, CredTran, and Transfer Credit FAQs.",Helpful Links Credit for Prior Learning Select to follow link Credit Transferability Select to follow link CredTran Select to follow link Systemwide General Education Requriements Select to follow link Transfer Credit FAQs Select to follow link.,https://registrar.ku.edu/kansas-community-college-guides,registrar.ku.edu
What unique program does the University of Kansas offer in the field of Petroleum Engineering?,It hosts the only petroleum engineering program in the State of Kansas.,The University of Kansas hosts the only petroleum engineering program in the State of Kansas and is home to the Tertiary Oil Recovery Program.,http://cpe.engr.ku.edu/student-involvement-and-professional-organizations,cpe.engr.ku.edu
"Since when has Valerie Griffin been a GEA Ambassador, and what has this role allowed her to do?","She has been a GEA Ambassador since 2019, which has allowed her to interact with a wide range of engineering disciplines.",Valerie has enjoyed being a GEA Ambassador since 2019 as it has allowed her to interact with a wide range of engineering disciplines.,https://engr.ku.edu/people/valerie-griffin,engr.ku.edu
When was the information about the Spring 2025 short courses last updated?,"The information was last updated on March 31, 2025.","Last updated on March 31, 2025.",https://registrar.ku.edu/spring-2025-short-courses,registrar.ku.edu
What should applicants include if they are applying for a change of status from a B-1 or B-2 visitor?,Applicants must include a personal letter and supportive evidence showing their intent to be a student changed after entering the U.S.,CAUTION: You must maintain your B-1 status until the change of status is approved! You may need to also file an I-539 (with fee) for a B-1/B-2 extension if your current I-94 will expire before your change of status application is processed. Personal letter and supportive evidence The letter and evidence must show your intent to be a student changed after entering the U.S. and that your course of study has not yet begun.,https://iss.ku.edu/inside-united-states,iss.ku.edu
Where is Isabella Bray originally from?,"She is originally from Olathe, KS.","Isabella is originally from Olathe, KS.",https://registrar.ku.edu/people/isabella-bray,registrar.ku.edu
What role does the Convergence Lab play in the bioengineering facilities?,The Convergence Lab is designed for collaborative research that integrates multiple disciplines within bioengineering.,"Designed for collaborative research, the Convergence Lab facilitates interdisciplinary approaches to bioengineering challenges.",https://engr.ku.edu/bioengineering-facilities,engr.ku.edu
What resources are provided under the 'Forms & Documents' section for graduate degree programs in Bioengineering?,The 'Forms & Documents' section includes various resources related to degree requirements for graduate students.,Degree Requirements Forms & Documents,http://bio.engr.ku.edu/navigator,bio.engr.ku.edu
How can someone contact Tracy Rockers?,Tracy Rockers can be contacted via email at tracy.rockers@ku.edu or by phone at 785-864-0853.,Contact Info tracy.rockers@ku.edu 785-864-0853,https://engr.ku.edu/people/tracy-rockers,engr.ku.edu
Which high school had teams represented in both the Mechanical Engineering and Aerospace categories?,Blue Valley West High School.,"Mechanical Engineering Pembroke Hill High School - Pembroke Hill High School (Vikram Nguyen, Nicholas Chao, Nathan Zhao) Red Pandas - Blue Valley West High School (Nischay Rawal, Rishabh Anand) I'm Batman - Blue Valley CAPS (Zoish Bhagwagar, Zareb Rahman, Jordan Tiger, Pablo Davalos)",https://engr.ku.edu/hsd-2023-winners,engr.ku.edu
What significant initiative has Elaina Sutley undertaken in her new role as engineering associate dean?,"She will guide KU Engineering’s Diversity & Women’s Program, which is celebrating its 50th anniversary.","Elaina Sutley named engineering associate dean for diversity, equity, inclusion & belonging...",https://engr.ku.edu/news?page=4,engr.ku.edu
What are the implications of 'porting' a cell phone number in the U.S.?,"Porting allows customers to keep their U.S. cell phone numbers if they decide to change companies, as mandated by U.S. law.",The U.S. has a law that requires cell phone companies to allow customers to keep their U.S. cell phone numbers if you decide to change companies. This is called 'porting'.,https://iss.ku.edu/checklist-new-visiting-scholars,iss.ku.edu
What specific document is required for F-1 students when traveling within the United States?,F-1 students are required to carry the I-20 document.,It is strongly advised that you carry all of your immigration documents: [...] I-20 (F-1) or DS-2019 (J-1) [...],https://iss.ku.edu/travel-within-united-states,iss.ku.edu
What unique aspect of the floor maps is highlighted for Learned Hall?,"The passage includes a map for the Penthouse floor of Learned Hall, which is typically less emphasized in building maps.",Learned Hall Penthouse Floor Map,https://engr.ku.edu/learned-hall-floor-maps,engr.ku.edu
What is the office location of Michael Panethiere at the University of Kansas?,"His office is located in Learned Hall, room 2150F.","Contact Info ... Learned Hall, 2150F",https://eecs.ku.edu/people/michael-panethiere,eecs.ku.edu
Who serves as the Associate Dean for Research and Graduate Programs in the Department of Electrical Engineering and Computer Science?,Suzanne Shontz,"Suzanne Shontz Associate Dean for Research and Graduate Programs Professor, Department of Electrical Engineering and Computer Science shontz@ku.edu Office Phone: 785-864-8816 Department Phone: 785-864-4620 Eaton Hall, room 1C",https://engr.ku.edu/people,engr.ku.edu
What unique aspect does the Small World organization provide for English language learners in terms of enrollment?,"Small World allows women to enroll at any time during the semester, without a set deadline.",Women may enroll at any time during the semester. Tuition of $20.00 per semester or $35.00 per year is due at enrollment.,https://iss.ku.edu/conversational-english-support,iss.ku.edu
Which tools are associated with the development of specification languages and semantics?,"Associated tools include the Rosetta specification language and analysis software like PVS, SPIN, Isabelle, HOL, and SAT.","Associated Facilities ... Rosetta specification language Haskell evaluation environment PVS, SPIN, Isabelle, HOL and SAT analysis software.",https://eecs.ku.edu/language-and-semantics,eecs.ku.edu
What documentation must a J-1 scholar provide for the New Scholar Check-In process?,"J-1 scholars must submit their residential address in Lawrence, emergency contact information, a responsibility statement, and copies of immigration documents including Form DS-2019, visa, passport, and I-94 record.","Every J-1 scholar must complete online check-in through your iHawk account. These forms gather required information for our office that includes your residential address in Lawrence, emergency contact information, a responsibility statement and submitting copies of your immigration documents...",https://iss.ku.edu/j-1-scholars,iss.ku.edu
What advice is given regarding taxi costs from the airport?,"Taxi service from the airport is very expensive, but it may be possible to share the ride with other people to reduce the cost.","Taxi service from the airport is very expensive, but it may be possible to share the ride with other people to reduce the cost.",https://iss.ku.edu/airport-lawrence,iss.ku.edu
What processing options and associated fees are available for enrollment certifications based on urgency?,"Current students can receive certifications at no charge, but priority processing (same day) costs $26, while a charge of $15 applies for non-students.",Certifications are provided at no charge for current students (unless priority processing is requested). There is a $15.00 charge for non-students. Priority (same day) processing is $26 per enrollment certification regardless of enrollment status.,https://registrar.ku.edu/request-enrollment-certification,registrar.ku.edu
What is the expected graduation year for Taylor Slade?,Taylor Slade is expected to graduate in 2025.,"Taylor Slade Applied Computing, 2025 Hometown: St Louis, MO",https://engr.ku.edu/self-applied-computing,engr.ku.edu
What is the deadline for graduating international students to register for the celebration?,"Graduating students must register by Friday, May 9 to participate in the event.","Graduating students must register by Friday, May 9 to participate in the event and receive a certificate.",https://iss.ku.edu/2025-international-student-graduation-celebration,iss.ku.edu
What are the specific health insurance requirements for incoming Jayhawk Semester students?,"All incoming Jayhawk Semester students must have medical insurance for their duration in the United States, which is enforced by automatically enrolling them in KU's international student health insurance plan.",All incoming Jayhawk Semester students must have medical insurance for the duration of their stay in the United States. This requirement is enforced by automatically enrolling students in KU’s international student health insurance plan.,https://iss.ku.edu/jayhawk-semester-students,iss.ku.edu
What kinds of employment options are available for F-1 students?,"F-1 students have several employment options including on-campus employment, Curricular Practical Training (CPT), Optional Practical Training (OPT), and Economic Hardship.",F-1 Students Employment Options F-1 On-Campus Employment F-1 CPT (Curricular Practical Training) F-1 OPT (Optional Practical Training) F-1 Economic Hardship,https://iss.ku.edu/navigator,iss.ku.edu
What types of emphases can students discover within the Chemical Engineering program?,"Students can discover emphases in Biomedical, Data Science, Environmental, Material Science, Premedical, and Petroleum Engineering.","Discover chemical engineering and the emphases we offer in Biomedical, Data Science, Environmental, Material Science, Premedical, and Petroleum Engineering.",http://cpe.engr.ku.edu/enrollment-resources,cpe.engr.ku.edu
What is the goal of the Rising BME Scholars Conference?,The goal is to encourage and equip students to move forward in an academic career.,The conference goal is to encourage and equip students to move forward in an academic career.,https://bioengr.ku.edu/rising-bme-scholars-conference,bioengr.ku.edu
What is the time frame for submitting a fee petition after notification of assessment or refund?,"The request must be submitted within 30 calendar days of notification of assessment, adjustment, or refund.","The request must be submitted to the Office of the University Registrar within 30 calendar days of notification of assessment, adjustment, or refund.",https://registrar.ku.edu/fee-petition,registrar.ku.edu
What document is required for dependents of students applying for a visa?,Dependents should have their own copy of the student’s I-20/DS-2019.,Dependents should have these documents ready as well. ... Copy of student’s I-20/DS-2019.,https://iss.ku.edu/apply-visa-student,iss.ku.edu
What is the phone number for contacting Joy K Grisafe-Gross?,785-864-4487,Joy K Grisafe-Gross Graduate Division Contact Info 785-864-4487,https://eecs.ku.edu/people/joy-k-grisafe-gross,eecs.ku.edu
What role does Dr. Mahta Moghaddam currently hold at the University of Southern California?,Dr. Mahta Moghaddam currently serves as Vice Dean for Research at the Viterbi School of Engineering.,"As the holder of the prestigious Ming Hsieh Chair in Electrical and Computer Engineering, she currently serves as Vice Dean for Research at the Viterbi School of Engineering, as well as co-Chair of the Presidential Working Group on Sustainability at the University of Southern California.",https://eecs.ku.edu/news/article/2023/04/21/2023-ku-eecs-keds-award-presented,eecs.ku.edu
What is the required action if a J-1 student is outside the U.S. and decides not to return?,They must complete and be authorized for a withdrawal for their immigration record to remain in good standing.,"If you are already outside the U.S. and decide not to return to resume your degree/program, you must still complete and be authorized for a withdrawal in order for your immigration record to remain in good standing.",https://iss.ku.edu/j-1-leaving-ku,iss.ku.edu
What types of courses are generally not awarded transfer credit at KU?,"Courses that are typically pre-collegiate, remedial, vocational, internship, graduate, professional, technical, or religious in nature do not qualify for transfer credit.","Transfer courses may not be awarded credit at KU for several reasons. These courses are typically pre-collegiate, remedial, vocational, internship, graduate, professional (e.g. law, medicine, dentistry, nursing), technical or religious in nature and do not fall within the level, scope, content and expected learning outcomes of courses offered at KU.",https://registrar.ku.edu/transfer-credit-faq,registrar.ku.edu
"When was the School of Engineering Advisory Board formed, and what was its purpose?",The Advisory Board was formed in 1978 to help the school develop priorities for the future and ensure students received an education meeting future demands.,"In 1978, the University of Kansas School of Engineering drew upon the wealth of knowledge amassed by its alumni and friends in forming the School of Engineering Advisory Board. Such a board would help the school develop priorities for the future, and would help ensure the school provided students with an education that could meet the demands of the future.",https://engr.ku.edu/alumni-friends,engr.ku.edu
Which individual also serves as the Director of Graduate Studies in their department?,"Prajna Dhar, Ph.D. serves as the Director of Graduate Studies in the Department of Chemical and Petroleum Engineering.","Prajna Dhar, Ph.D. - Track Director, Biomolecular Engineering - Professor, Chemical and Petroleum Engineering - Director of Graduate Studies, Department of Chemical and Petroleum Engineering",http://bioengr.ku.edu/leadership,bioengr.ku.edu
What are the academic requirements for maintaining participation in the SELF Program?,"To maintain participation in the SELF Program, Fellows must make satisfactory progress toward their engineering degree, which includes on-time graduation, a minimum GPA of 3.0, and remaining in good academic standing.",Make satisfactory progress toward an engineering degree (on-time graduation and minimum 3.0 GPA requirements). Remain in good academic standing. Academic misconduct will result in immediate suspension from the SELF Program.,https://engr.ku.edu/self-fellow-responsibilities,engr.ku.edu
What should a J-1 student do if they need assistance with course selection?,J-1 students should reach out to their academic advisor for help in choosing courses.,If you need help in choosing courses for the current or future semester please reach out to your academic advisor.,https://iss.ku.edu/enrollment-j-students,iss.ku.edu
What should be done to the photographs included in the application materials for USCIS?,"The photographs should be placed in a clear plastic 'ziploc' sandwich bag, and the name should be gently printed on the back.",Be careful not to damage photos when writing. The USCIS Service Center recommends placing the photo in a clear plastic ‘ziploc’ sandwich bag. do NOT put a staple through the photos or trim the size of the photos.,https://iss.ku.edu/f-1-internship-international-organization,iss.ku.edu
What are the specific requirements for fellows receiving the Dean's First Year Doctoral Fellowship?,Fellows are required to complete one national/international doctoral fellowship application and participate in professional development organized by Research & Graduate Programs.,The fellowship requires completion of one national/international doctoral fellowship application and participation in professional development organized by Research & Graduate Programs.,https://engr.ku.edu/deans-first-year-doctoral-fellowship,engr.ku.edu
What fee is associated with late enrollment during the first instructional days of the semester?,"A $150 late enrollment fee applies for Fall and Spring semesters, and $75 for the Summer term.",Period 1 (Instructional Days 1-5): A $150 late enrollment fee applies for Fall and Spring semesters; $75 for Summer term.,https://registrar.ku.edu/schedule-changes,registrar.ku.edu
What is unique about the research conducted at the Garrison Flight Test Center/KU Hangar?,"The Center offers design and construction space for student projects, in addition to recently renovated laboratory and office space for aerospace engineering faculty.",The facility... also offers design and construction space for student projects.,https://engr.ku.edu/research-centers,engr.ku.edu
How is the subjectivity of the two-year home residency requirement determined?,"A consular officer makes a preliminary determination during the visa interview, which is then marked on the J-1 visa and DS-2019.",The consular officer makes a preliminary determination at the time of your interview if you will be subject to this requirement upon entering the U.S. in J-1 status. It should be marked on both your J-1 visa and your DS-2019.,https://iss.ku.edu/J-1-two-year-home-residency-requirement,iss.ku.edu
What is the contact email for the undergraduate admissions office?,studyengineering@ku.edu,Undergraduate Admissions 785-864-3881 studyengineering@ku.edu,https://engr.ku.edu/contact-ku-school-engineering,engr.ku.edu
How long has Tim Johnson been involved in industry and university experience?,He has over twenty years of industry and university experience.,Tim has over twenty years of industry and university experience providing executive and technical leadership focused on business strategies and the development of software and information technologies IT.,https://eecs.ku.edu/people/tim-johnson,eecs.ku.edu
What opportunities do students participating in the SELF Program have to develop their skills?,"Students will expand and refine their leadership, managerial, business, interpersonal, entrepreneurial, communication and engineering skills through mentoring, coursework, seminars and leadership opportunities.","By active participation in the program, the students will expand and refine their leadership, managerial, business, interpersonal, entrepreneurial, communication and engineering skills through mentoring, coursework, seminars and leadership opportunities.",https://engr.ku.edu/self-engineering-leadership-fellows-program,engr.ku.edu
What should a student discuss with their professor when considering opting out of a supply fee?,"The student should discuss the potential impact of opting out, their responsibilities, and the specific supplies they will need to acquire.","The professor/instructor will cover the potential impact of opting out, the responsibilities the student assumes, and the specific supplies the student will be required to personally acquire for participation in the course.",https://registrar.ku.edu/class-supply-fee-opt-out-request,registrar.ku.edu
"How many students in the Computer Science program are from Stilwell, KS?","There are four students in the Computer Science program from Stilwell, KS.","Josselyn Bui Computer Science, 2028 Hometown: Stilwell, KS ... Arnav Jain Computer Science, 2026 Hometown: Stilwell, KS ... Srihari Meyoor Computer Science, 2026 Hometown: Stilwell, KS ... Daniel Neugent Computer Science, 2026 Hometown: Stilwell, KS.",https://engr.ku.edu/self-computer-science,engr.ku.edu
What unique educational opportunity is provided by the new virtual institute established at KU's School of Engineering?,The virtual institute will train the next generation of military and civilian leaders to better combat the growing threat of cyberattacks.,A new virtual institute established at the University of Kansas School of Engineering will train the next generation of military and civilian leaders to better combat the growing threat of cyberattacks and protect the electromagnetic spectrum (EMS).,https://engr.ku.edu/news?page=2,engr.ku.edu
What types of support does the TRIO SES & STEM program offer?,"TRIO SES & STEM provides comprehensive support services including academic advising, financial aid, tutoring, and career or graduate school preparation tailored to the individual needs of eligible students.","TRIO provides comprehensive support services by working with eligible students to identify personal areas of strengths and challenges. TRIO's support ranges from academic advising, financial aid, tutoring, career or graduate school preparation, and any needs based on individual circumstances.",https://engr.ku.edu/academic-resources,engr.ku.edu
What is one important step students need to take before completing their research or design project?,Students need to have their planned Research or Design Course/Project Topic pre-approved.,Step 2. Have your planned Research or Design Course/Project Topic Pre-Approved! ...,http://bio.engr.ku.edu/minor-biomedical-engineering,bio.engr.ku.edu
How are applicants for University and School of Engineering scholarships and fellowships nominated?,"Applicants are nominated based on academic merit and other selection criteria, as specified by the fellowship selection committees.","The Bioengineering graduate admissions committee nominates applicants for University and School of Engineering scholarships and fellowships based on academic merit and other selection criteria, as specified by the fellowship selection committees.",https://bioengr.ku.edu/funding,bioengr.ku.edu
What is the scope of research involved in BIOE 899 Independent Investigation?,"BIOE 899 involves an original and independent research or design investigation that applies analytical, experimental, and/or modeling methodologies to solve a bioengineering problem, fulfilling part of the degree requirements for the Master of Science.","BIOE 899 Independent Investigation. 1-6 Hours. An original and independent research or design investigation involving analytical, experimental and/or modeling methodology applied to solve a bioengineering problem as a part of the degree requirements for the Master of Science.",http://bio.engr.ku.edu/bioengineering-courses,bio.engr.ku.edu
What kind of educational approach is emphasized in the Petroleum Engineering program?,Hands-on education based on industrial problems and real-world examples is emphasized.,Learn more about how hands-on education based on industrial problems and real-world examples taught by expert faculty can start your path to a successful career.,http://cpe.engr.ku.edu/undergraduate-research,cpe.engr.ku.edu
What method is employed to shape and enhance the performance of modern object detection models in the proposed research?,"A dynamic strategy that introduces a paradigm to define positive and negative samples is used to improve label assignment, allowing for better selection of high-quality samples.","Rather than relying on fixed or statistics-based adaptive thresholds, a dynamic paradigm is introduced to define positive and negative samples.",https://eecs.ku.edu/defense-notices?page=%2C80,eecs.ku.edu
What coursework areas can students choose to focus on in the Master of Engineering in Bioengineering program?,"Students can choose to focus on areas such as Bioimaging, Computational bioengineering, Biomaterials and tissue engineering, Biomechanics and neural engineering, Biomedical product design and development, and Biomolecular engineering.",Master of Engineering students will choose an area of focus from the Bioengineering track list to determine their coursework requirements.,http://bio.engr.ku.edu/master-engineering,bio.engr.ku.edu
What accreditation does the Engineering Physics Bachelor of Science program at KU hold?,The program is accredited by the Engineering Accreditation Commission of ABET.,The Engineering Physics Bachelor of Science program is accredited by the Engineering Accreditation Commission of ABET.,http://ephx.engr.ku.edu/admissions,ephx.engr.ku.edu
Who coordinates tuition and fees at the university?,Erin Otter is the Tuition and Fees Coordinator.,Erin Otter Tuition and Fees Coordinator View full profile,https://registrar.ku.edu/people,registrar.ku.edu
What is the maximum period a student can take a Leave of Absence without needing to reapply for admission?,You can request a leave of absence for a maximum of 1 year. Additional requests will be considered after the first year.,You can request a leave of absence for a maximum of 1 year. Additional requests will be considered after the first year.,https://engr.ku.edu/graduate-enrollment-info,engr.ku.edu
What is one of the specific focuses of the Center for BioModular Multi-Scale Systems for Precision Medicine?,The center develops tools to analyze circulating biomarkers secured from blood samples that help manage diseases such as cancers and strokes.,"The Center for BioModular Multi-Scale Systems for Precision Medicine develops transformative tools that have significant impact in precision medicine. The unique tools created at the center provide the ability to analyze circulating biomarkers secured from blood samples that help manage a number of diseases, such as cancers, stroke and bacterial infections.",https://bioengr.ku.edu/bioengineering-graduate-programs-2024-25,bioengr.ku.edu
What types of professionals collaborate in the Biomaterials and Tissue Engineering research track?,"Collaborations are among engineers, surgeons, materials scientists, biological scientists, chemists, dentists, and veterinarians.","Research in this inter- and multidisciplinary field involves collaborations among engineers, surgeons, materials scientists, biological scientists, chemists, dentists, and veterinarians in academics, industry, government and the clinic.",http://bio.engr.ku.edu/biomaterials-tissue-engineering,bio.engr.ku.edu
What financial implications are associated with lease agreements in the U.S.?,Lease agreements tend to be for one year and have financial penalties for breaking the lease.,Lease agreements in the U.S. tend to be for one year and have financial penalties for moving out early ('breaking the lease').,https://iss.ku.edu/find-place-live,iss.ku.edu
What unique research designation does the University of Kansas hold among American universities?,The University of Kansas is a Carnegie Doctoral/Research Extensive University.,KU is a Carnegie Doctoral/Research Extensive University and has been a member of the Association of American Universities since 1909.,https://engr.ku.edu/graduate-programs,engr.ku.edu
What is the examination schedule for night classes?,Final examinations for classes that begin at 5 p.m. or later will have examinations from 7:30 - 10 p.m. during the final examination period on the same night of the week that the class regularly met.,Final examinations for classes that begin at 5 p.m. or later will have examinations from 7:30 - 10 p.m. during the final examination period on the same night of the week that the class regularly met.,https://registrar.ku.edu/final-exam-policies-guidelines,registrar.ku.edu
What is the educational background of Esraa Abdelsalam?,Esraa Abdelsalam is a graduate student with a profile available.,People Graduate Students Esraa Abdelsalam View full profile,http://bioengr.ku.edu/graduate-students,bioengr.ku.edu
What should one do to set up a visit to the University of Kansas School of Engineering?,"Register for an event through the Office of Admissions, or email meredith.morriswhyte@ku.edu with further questions.","To set up your visit, please register for an event through the Office of Admissions, or email meredith.morriswhyte@ku.edu with further questions.",https://engr.ku.edu/admission,engr.ku.edu
What designation did the EECS achieve related to information assurance education?,EECS earned a federal National Center of Academic Excellence in Information Assurance Education designation.,Expanding leading-edge cyber security and defense mechanisms earned EECS a federal National Center of Academic Excellence in Information Assurance Education designation.,https://eecs.ku.edu/cybersecurity,eecs.ku.edu
What is included in the graduation services offered by the Office of the University Registrar?,The graduation services include the planning of enrollment and degree requirements.,Enrollment and Degree Planning.,https://registrar.ku.edu/,registrar.ku.edu
What is the last day to add or change class sections without written permission in Spring 2025?,"The last day to add/change sections without written permission is January 27, 2025.","Add/Drop Monday, January 27, 2025 Last day to add/change sections without written permission*",https://registrar.ku.edu/spring-2025-academic-calendar,registrar.ku.edu
What is the name of the event scheduled for November 7th?,The event scheduled for November 7th is the BIOE Network Event - LEEP2 2415.,November 7th BIOE Network Event - LEEP2 2415,http://bioengr.ku.edu/events,bioengr.ku.edu
Which types of laboratories are included in the facilities of the Institute for Information Sciences?,"I2S facilities include laboratories such as the Kansas Applied Research Laboratory, RF Measurement Laboratory, Optical and Photonics Systems Laboratories, Cybersecurity Laboratory, and a Blockchain Laboratory.","I2S facilities include: the Kansas Applied Research Laboratory, RF Measurement Laboratory, Optical and Photonics Systems Laboratories, a High-Performance Computing Cluster & File Storage, the Cyber-physical Laboratory, Cybersecurity Laboratory and the Blockchain Laboratory.",https://eecs.ku.edu/research-clusters-facilities,eecs.ku.edu
"What is the research focus of Terence McIff, Ph.D.?",Biomechanics & Neural Engineering.,"Terence McIff, Ph.D. -Track Director, Biomechanics & Neural Eng. -Associate Professor, Orthopedic Surgery and Sports Medicine, KUMC",http://bio.engr.ku.edu/people/search,bio.engr.ku.edu
How are the evacuation maps designed to assist individuals with mobility challenges?,The maps provide accessible routes that cater specifically to individuals with mobility challenges.,"For individuals with mobility challenges, the evacuation maps provide accessible routes to ensure their safety during an emergency.",https://engr.ku.edu/eaton-hall-emergency-evacuation-maps,engr.ku.edu
What is the primary purpose of degree maps according to the passage?,Degree maps serve as sample four-year academic plans to guide students and advisors in course selection.,"Degree maps are sample four-year academic plans that provide examples of course sequences and degree requirements based on the university catalog. The degree maps are useful tools for advisors, students, and parents...",https://registrar.ku.edu/degree-maps,registrar.ku.edu
What type of courses does the CR/No CR deadline apply to?,The CR/No CR deadline applies to courses that last less than five days.,The CR/No CR deadline of courses that last less than five days is the day before the first day of the class.,https://registrar.ku.edu/summer-2025-short-courses,registrar.ku.edu
What unique program does the University of Kansas offer that is not available elsewhere in the state?,The University of Kansas hosts the only petroleum engineering program in the State of Kansas.,The University of Kansas hosts the only petroleum engineering program in the State of Kansas and is home to the Tertiary Oil Recovery Program.,http://cpe.engr.ku.edu/chairs-welcome,cpe.engr.ku.edu
What is Heather Abernathy's position at the university?,Heather Abernathy is the Business Manager.,Heather Abernathy Business Manager,https://engr.ku.edu/people/heather-abernathy,engr.ku.edu
Who is eligible to apply for the Self Graduate Fellowship?,Eligibility is limited to U.S. citizens who are newly admitted or within their first year of doctoral study within one of the 22 eligible stem disciplines.,"Eligibility is limited to U.S. citizens who are newly admitted or within their first year of doctoral study within one of the 22 eligible stem disciplines, including Bioengineering.",http://bio.engr.ku.edu/funding,bio.engr.ku.edu
How many students listed in the passage will graduate in the year 2028?,Two students listed in the passage will graduate in the year 2028.,"Nathan Phillips Computer Engineering, 2028 Hometown: Shawnee, KS Nischay Rawal Computer Engineering, 2028 Hometown: Overland Park, KS",https://engr.ku.edu/self-computer-engineering,engr.ku.edu
What specific algorithms did the KUARQ research group optimize in their quantum computing research?,The team developed optimized versions of the quantum wavelet transform and Grover’s search algorithm.,"Their research focuses on practical applications such as dimension reduction, pattern recognition, quantum sorting, and quantum communications. The team has developed optimized versions of the quantum wavelet transform and Grover’s search algorithm...",https://eecs.ku.edu/news/article/kuarq-research-group-wins-best-poster-award-at-qcuf-2024,eecs.ku.edu
What types of collaboration does research in the Biomaterials and Tissue Engineering track involve?,"Research involves collaborations among engineers, surgeons, materials scientists, biological scientists, chemists, dentists, and veterinarians.","Research in this inter- and multidisciplinary field involves collaborations among engineers, surgeons, materials scientists, biological scientists, chemists, dentists, and veterinarians in academics, industry, government and the clinic.",http://bioengr.ku.edu/biomaterials-tissue-engineering,bioengr.ku.edu
How does SAILS utilize AI to enhance the learning experience for users?,"SAILS employs a centralized AI model that learns from individual and team data, as well as the collective experience of all users to provide personalized assistance.","The back-end connects to a state-of-the-art architecture simulator and provides personalized assistance to users through a centralized AI model. The model learns from individual and team data, as well as the collective experience of all users.",https://eecs.ku.edu/news/article/2023/07/21/eecs-professors-receive-200000-nsf-award-develop-ai-driven-computer-architecture-learning-tool,eecs.ku.edu
How can someone contact Robert Lee Parsons via email?,He can be contacted via email at rparsons@ku.edu.,Contact Info rparsons@ku.edu,https://engr.ku.edu/people/robert-parsons-phd,engr.ku.edu
What role did Baca and Harders play in Icorium's representation at the competition?,"Kalin Baca served as co-founder and chief operating officer, while Abby Harders was a part-time R&D engineer.","Kalin Baca, Icorium co-founder and chief operating officer, and Abby Harders, part-time Icorium R&D engineer, represented the company at the competition.",https://engr.ku.edu/news/article/icorium-engineering-company-earns-top-5-finish-at-2024-rice-business-plan-competition,engr.ku.edu
Are there any specific facilities dedicated to collaboration and team projects?,"Yes, the university provides collaborative spaces for team projects, enhancing teamwork among students.",The facilities also include collaborative spaces designed to facilitate teamwork on projects.,https://engr.ku.edu/mechanical-engineering-facilities,engr.ku.edu
How does KU Aerospace Engineering rank in international design competitions?,KU students have won more American Institute of Aeronautics and Astronautics international design competitions than students from any other school in the world.,KU students have won more American Institute of Aeronautics and Astronautics international design competitions than students from any other school in the world.,https://engr.ku.edu/aerospace-engineering-brochure-2023,engr.ku.edu
What is the purpose of the Office of National Defense Initiatives at KU?,It combines the expertise of the former Office of Graduate Military Programs with KU's three Reserve Officers' Training Corps (ROTC) programs.,KU strengthening national defense partnership with new office The Office of National Defense Initiatives combines the expertise of the former Office of Graduate Military Programs with KU's three Reserve Officers' Training Corps (ROTC) programs.,https://engr.ku.edu/explore,engr.ku.edu
How do credit/no credit courses affect undergraduate students' major requirements?,Courses taken for credit/no credit that are satisfactorily completed can count toward a student’s undergraduate major requirements.,"Courses taken during the spring and summer 2021 semester for credit/no credit, that are satisfactorily completed, can count toward a student’s undergraduate major requirements.",https://registrar.ku.edu/covid-19-creditno-credit-policy-modification,registrar.ku.edu
Who should be contacted for questions about submissions?,"Lindsey McCaig, the KU Engineering student engagement and outreach coordinator, should be contacted.","Any other questions about submissions can be sent to Lindsey McCaig , KU Engineering student engagement and outreach coordinator.",https://engr.ku.edu/newsletterdigital-signage-submission,engr.ku.edu
What are some specific areas of research available to graduate students in Petroleum Engineering at the University of Kansas?,"Bioengineering, catalysis, renewable energy, sustainability, separations, enhanced oil and gas recovery, unconventional reservoirs, data mining and reservoir characterization, flow in porous media, and reservoir simulation.","Work on cutting-edge research with nationally and internationally recognized faculty in areas including bioengineering, catalysis, renewable energy, sustainability, separations, enhanced oil and gas recovery, unconventional reservoirs, data mining and reservoir characterization, flow in porous media, and reservoir simulation.",http://cpe.engr.ku.edu/petroleum-engineering-graduate-programs-2024-25,cpe.engr.ku.edu
What types of activities can participants expect at the Engineering EXPO?,"Participants can expect a variety of hands-on activities, demonstrations, or competitions set up by different engineering student organizations.","Each engineering student organization has either an activity, demonstration, or competition set up around the KU Engineering Complex that kids can participate in and learn all about engineering in a hands-on way.",https://engr.ku.edu/engineering-expo,engr.ku.edu
What condition must be met before KU will produce an I-20 for a transferring student?,KU cannot produce the I-20 before the release date set by the current school.,"After the release date, KU will produce an I-20 if all e-forms have been completed and approved. KU cannot produce the I-20 before the release date.",https://iss.ku.edu/f-1-transfer,iss.ku.edu
What specific condition must J-1 students meet to work on campus after completing their degree?,On-campus employment is not permitted after completion of a degree or program unless the student has been issued a DS-2019 to begin a new academic program or has been granted Academic Training.,Please note that on-campus employment is not permitted after completion of a degree or program unless the student has been issued a DS-2019 to begin a new academic program or has been granted Academic Training.,https://iss.ku.edu/j-1-employment-options,iss.ku.edu
What should one avoid when handling cash upon arrival in the U.S.?,"You should not carry a large amount of cash with you, as KU cannot accept cash payment for tuition and fees.",DO NOT carry a large amount of cash with you. KU cannot accept cash payment for tuition and fees.,https://iss.ku.edu/finances-newly-admitted,iss.ku.edu
How does the Engineering Student Success Team support students beyond academics?,"The team is committed to providing resources that contribute to overall student well-being and success, which includes various tools and support beyond just academic achievements.","We know success is more than getting good grades, so we've put together a list of resources to help you in the classroom and beyond.",https://engr.ku.edu/academic-resources,engr.ku.edu
What are the deadlines for submitting proof of insurance for the different semesters for J-1 students?,"The deadlines for submitting proof of insurance are August 26, 2024, for Fall 2024; January 21, 2025, for Spring 2025; and June 2, 2025, for Summer 2024.","Submit proof of insurance by Fall 2024 Semester - Deadline is August 26, 2024 Spring 2025 Semester - Deadline is January 21, 2025 Summer 2024 Semester - Deadline is June 2, 2025.",https://iss.ku.edu/proof-insurance-j-1-students-not-enrolled-classes,iss.ku.edu
"What unique characteristics does the Civil, Environmental & Architectural Engineering department at KU highlight?","KU's instructional and laboratory facilities in areas such as environmental engineering, concrete materials, asphalt, and illumination are world-class.","KU’s instructional and laboratory facilities in areas such as environmental engineering, concrete materials, asphalt, and illumination are world-class.",https://engr.ku.edu/,engr.ku.edu
What is Bozenna Pasik-Duncan's role at the university?,She is a Courtesy Professor.,Bozenna Pasik-Duncan Courtesy Professor Contact Info bozenna@ku.edu 785-864-5162 503 Snow Hall,https://eecs.ku.edu/people/bozenna-pasik-duncan,eecs.ku.edu
"What unique role does Sar Wilson, Ph.D., hold in the context of biomedical product design?","Sara Wilson, Ph.D. is the Track Co-Director for Biomedical Product Design & Development.","Sara Wilson, Ph.D. - Track Co-Director, Biomedical Product Design & Dev. - Associate Professor, Mechanical Engineering",http://bioengr.ku.edu/leadership,bioengr.ku.edu
What happens to the second segment of funding if there is no progress reported?,The second segment funding may not be released.,"In case of no progress, second segment funding may not be released.",https://engr.ku.edu/ascend-funding-program,engr.ku.edu
Which universities are partnering with the University of Kansas in the VICEROY Virtual Institute?,The VICEROY Virtual Institute will partner with researchers at Ohio State University and Purdue University Northwest.,It will partner with researchers at Ohio State University and Purdue University Northwest.,https://eecs.ku.edu/news/article/2023/08/28/eecs-professor-leads-new-15m-virtual-institute-protect-cyberspace,eecs.ku.edu
What is the significance of the essay on academic objectives in the application process?,"The statement of academic objectives is critically important as it is used by faculty to evaluate a candidate's academic, research, and leadership potential, and also for selecting graduate teaching and research assistants.","This statement of objectives will be read and used by faculty in the track to evaluate your academic, research and leadership potential as well as to select graduate teaching and/or research assistants.",http://bio.engr.ku.edu/application,bio.engr.ku.edu
What notable memory does Sydney Stone have related to the University of Kansas campus?,Her favorite KU memory is getting married in front of Potter Lake on KU’s campus.,Her favorite KU memory is getting married in front of Potter Lake on KU’s campus.,https://registrar.ku.edu/people/sydney-stone,registrar.ku.edu
What happens to a student's preferred name in academic settings at the University of Kansas?,"The preferred name will be sent to Blackboard and Canvas and will be listed on class and grade rosters, among other processes.","The University of Kansas will use that preferred name wherever possible unless the usage of the legal name is mandated. The preferred name will be sent to Blackboard and Canvas and will be listed on class and grade rosters, among other processes.",https://registrar.ku.edu/update-or-correct-your-information,registrar.ku.edu
"Which student is from Olathe, KS and what is their expected year of graduation?","Paul Wills from Olathe, KS is expected to graduate in 2027.","Paul Wills Civil Engineering, 2027 Hometown: Olathe, KS",https://engr.ku.edu/self-civil,engr.ku.edu
What is the last day for 100% fee refunds for fall 2025?,"The last day for a 100% refund is Friday, August 22, 2025.","Refunds and Adjustments Friday, August 22, 2025 Last day 100% refund *",https://registrar.ku.edu/fall-2025-academic-calendar,registrar.ku.edu
How does image processing and analysis contribute to bioimaging?,"Image processing and analysis allows measurement and quantification of anatomical, physiological and/or clinically meaningful parameters.","Image processing and analysis is an important part of bioimaging and allows measurement and quantification of anatomical, physiological and/or clinically meaningful parameters.",https://bioengr.ku.edu/bioimaging,bioengr.ku.edu
"Can you name a student start-up that focuses on medical technology and is based in Lawrence, KS?","Evoke Medical, based in Lawrence, KS, is a student start-up that focuses on medical technology.","A sampling of our student start-up companies include: ... Evoke Medical, Lawrence, KS ...",https://bioengr.ku.edu/beyond-ku,bioengr.ku.edu
How are the departmental faculty links organized in the passage?,They are organized alphabetically by unit and by department.,Links Alphabetically By Unit By Department,https://engr.ku.edu/departmental-faculty-and-staff,engr.ku.edu
How can individuals participate in the GEA Annual Research Showcase?,Anyone is welcome and encouraged to come and listen to the presentations.,Anyone is welcome and encouraged to come and listen to the presentations.,https://engr.ku.edu/gea-research-showcase,engr.ku.edu
What must employees do to ensure their health insurance coverage starts on their first day of work?,Employees must complete the onboarding process and have a Social Security Number (SSN) to ensure their health insurance coverage starts on their first day of work.,"Your health insurance coverage should begin your first day of work. However, this will require that you complete on-boarding, which requires you to have a SSN.",https://iss.ku.edu/employee-health-insurance,iss.ku.edu
What is the approval time for a correctly submitted access request if the proper training has been attended?,The request for access to iHawk will be approved within 3 days if the proper training has been attended.,"If you have attended the proper training, your request for access to iHawk will be approved within 3 days.",https://iss.ku.edu/request-access-ihawk,iss.ku.edu
How did Mike Shinn contribute to the KU community beyond his academic achievements?,Mike Shinn helped found the KU Alumni Association’s Black Alumni Network and the African-American Leaders and Innovators Project.,He later helped found the KU Alumni Association’s Black Alumni Network as well as the African-American Leaders and Innovators Project.,https://engr.ku.edu/news/article/new-ku-engineering-ihawke-student-lounge-named-for-joyce-and-mike-shinn,engr.ku.edu
What is the mission of the Department of Chemical & Petroleum Engineering at KU?,The mission is to integrate teaching excellence and research innovation to educate students and produce future leaders.,Department Mission KU Chemical & Petroleum Engineering integrates teaching excellence and research innovation to educate students and produce future leaders.,http://cpe.engr.ku.edu/petroleum-engineering,cpe.engr.ku.edu
What must students do before dropping to less than full-time enrollment?,Students must obtain ISS permission first.,Dropping below required full time credits? Obtain ISS permission first!!,https://iss.ku.edu/enrollment-f-students,iss.ku.edu
What attributes characterize the faculty in the graduate programs at KU's Chemical and Petroleum Engineering department?,The faculty are nationally and internationally recognized.,Work on cutting-edge research with nationally and internationally recognized faculty in areas including...,http://cpe.engr.ku.edu/degrees-and-curriculum,cpe.engr.ku.edu
What is the title of Dave Glauner at the Engineering Technology Service Center?,IT Support Technician Senior,"Dave Glauner IT Support Technician Senior, Engineering Technology Service Center",https://engr.ku.edu/people/dave-glauner,engr.ku.edu
What types of research can graduate students conduct in KU's petroleum engineering program?,"Graduate students can conduct research in areas including bioengineering, catalysis, renewable energy, and enhanced oil and gas recovery.","Work on cutting-edge research with nationally and internationally recognized faculty in areas including bioengineering, catalysis, renewable energy, sustainability, separations, enhanced oil and gas recovery, unconventional reservoirs, data mining and reservoir characterization, flow in porous media, and reservoir simulation.",http://cpe.engr.ku.edu/research-and-job-opportunities,cpe.engr.ku.edu
"What recent improvements have been made to Learned Hall, and what departments are housed there?",Recent renovations in Learned Hall have added wireless connectivity and created a more welcoming learning environment; it houses multiple engineering departments.,"Recent renovations and additions have added wireless connectivity and created a more welcoming learning environment in this 1960s-era facility... the home for the Department of Civil, Environmental and Architectural Engineering, the Department of Aerospace Engineering, The Department of Chemical and Petroleum Engineering and the Department of Mechanical Engineering.",http://bio.engr.ku.edu/contact,bio.engr.ku.edu
"What role does Ken Fischer, Ph.D. serve at the University of Kansas in relation to bioengineering?","Ken Fischer, Ph.D. is the Director of Bioengineering and Professor of Mechanical Engineering.","Ken Fischer, Ph.D. -Director, Bioengineering -Professor, Mechanical Engineering -Director, Biomechanical Rehabilitation Engineering Advancement in Kansas Program",http://bioengr.ku.edu/people/search,bioengr.ku.edu
Which faculty member serves as the Graduate Program Director in the Chemical and Petroleum Engineering department?,Prajna Dhar serves as the Graduate Program Director for Chemical and Petroleum Engineering.,Prajna Dhar Graduate Program Director prajnadhar@ku.edu 785-864-4969 4132E Learned Hall,https://engr.ku.edu/graduate-program-staff,engr.ku.edu
What is the location of the International Support Services office?,"The office is located at Strong Hall, Room 50, 1450 Jayhawk Boulevard, Lawrence, Kansas 66045.","International Support Services iss@ku.edu 785-864-3617 Strong Hall, Room 50 1450 Jayhawk Boulevard Lawrence, Kansas 66045",https://iss.ku.edu/hours-operation-location,iss.ku.edu
What is the restriction regarding the progression to a higher degree for J-1 students?,J-1 students can only progress to a higher degree; they cannot move from a PhD to a Masters.,Note: J-1's can only progress to a higher degree (PhD to Masters is not possible).,https://iss.ku.edu/j-1-change-degree-level,iss.ku.edu
What are the operating hours for the EECS administrative staff during the Spring and Fall semesters?,"The EECS administrative staff operates from 8 am to 4:30 pm, Monday through Friday.","Administrative staff can be contacted by email or phone, and can be located in the EECS Office on the second floor of Eaton Hall 8 am-4:30 pm Monday through Friday during the Spring and Fall semesters.",https://eecs.ku.edu/new,eecs.ku.edu
What is the significance of the Garrison Flight Research Center in relation to KU's aerospace engineering program?,The Garrison Flight Research Center is a comprehensive facility that supports the practical application of aerospace engineering through its hangar space for aircraft and various testing capabilities.,"The Garrison Flight Research Center is a 22,000-square-foot facility at the Lawrence Municipal Airport with hangar space for several aircraft, an AST 4000 fixed-base simulator, a machine shop, and electronics shop.",https://engr.ku.edu/aerospace-engineering-brochure-2023,engr.ku.edu
In which department did Isabella work while studying at the University of Kansas?,She worked in the Digital Publishing department at Watson Library.,"While studying at KU, Isabella also worked at Watson Library in the Digital Publishing department.",https://registrar.ku.edu/people/isabella-bray,registrar.ku.edu
Which laboratory specifically focuses on testing materials?,The Materials Testing Laboratories specifically focus on testing materials.,Materials Testing Laboratories,https://engr.ku.edu/civil-environmental-architectural-facilities,engr.ku.edu
When will the Rising BME Scholars Conference take place in 2025?,"The conference is scheduled for June 11-13, 2025.","Rising BME Scholars Conference June 11-13, 2025.",http://bio.engr.ku.edu/rising-bme-scholars-conference,bio.engr.ku.edu
What kind of teaching approach is emphasized in the Petroleum Engineering program?,The program emphasizes hands-on education based on industrial problems and real-world examples.,Learn more about how hands-on education based on industrial problems and real-world examples taught by expert faculty can start your path to a successful career.,http://cpe.engr.ku.edu/student-involvement-and-professional-organizations,cpe.engr.ku.edu
What are the eligibility requirements for an individual in F or J status to take advantage of the automatic visa extension?,"They must not have been absent from the U.S. for more than 30 days, have a valid passport, present a current valid I-94, and not have applied for a new visa while abroad, among other conditions.",An individual in F or J status is eligible for this 'automatic extension of visa' provided the individual: has not been absent from the U.S. for more than 30 days... has not applied for a new visa while abroad...,https://iss.ku.edu/automatic-revalidation-students,iss.ku.edu
What factors influence how many hours a week an undergraduate researcher will work?,The weekly hours will depend on the lab and the project that you are working on.,Your weekly hours will depend on the lab and the project that you are working on.,https://engr.ku.edu/undergraduate-research-faq,engr.ku.edu
What are the hours for the Engineering Technology Service Center during weekdays?,The support hours are 7:30 a.m. - 4:30 p.m. Monday-Thursday and 7 a.m. - 4 p.m. Friday.,Support Hours: 7:30 a.m. - 4:30 p.m. Monday-Thursday; 7 a.m - 4 p.m. Friday,https://engr.ku.edu/technology-service-center,engr.ku.edu
What options are available for students living on-campus at the University of Kansas?,"The available on-campus living options include residence halls, private rooms with baths, suites with semi-private baths, scholarship halls, and on-campus apartments.","The KU Department of Student Housing offers a variety of on-campus living options, including residence halls, private room with bath, suite with semi-private bath, scholarship halls, or on-campus apartments.",https://iss.ku.edu/housing-newly-admitted,iss.ku.edu
What is required for a student to submit a petition to withdraw after the deadline?,"They must provide an explanation of the exceptional circumstances and how it impacted their ability to withdraw, along with supporting documentation.","Students will need to indicate the reason(s) of the withdrawal, provide an explanation of the exceptional circumstances and how it impacted their ability to withdraw during the semester, and include supporting documentation for the exceptional circumstances.",https://registrar.ku.edu/dropping-and-withdrawing,registrar.ku.edu
What form must F-1 students submit to request a Social Security Number Letter for On-Campus jobs?,F-1 students must submit the 'Request SSN Letter for On-Campus Jobs (F-1)'.,"If you do not have a Social Security Number (SSN), you must apply for one before you can finalize your onboarding process at KU. Step 1: Submit 'Request SSN Letter for On-Campus Jobs (F-1)'...",https://iss.ku.edu/3gs,iss.ku.edu
What is the role of Resident Assistants (RAs) in the Self Engineered Learning Community?,"RAs provide guidance to help students navigate university and school resources, develop good study habits, form study groups, and build important peer relationships.","Resident Assistants (RA's) on these floors are upper level engineering students trained to support freshmen through the adjustments and rigors they experience during their first year of college. RA's provide guidance to help students navigate university and school resources, develop good study habits, form study groups, and build those important peer relationships that can be vital to their success.",https://engr.ku.edu/engineering-learning-community,engr.ku.edu
What unique program does the University of Kansas offer that is not available in the rest of the state?,The University of Kansas hosts the only petroleum engineering program in the State of Kansas.,The University of Kansas hosts the only petroleum engineering program in the State of Kansas and is home to the Tertiary Oil Recovery Program.,http://cpe.engr.ku.edu/courtesy-faculty,cpe.engr.ku.edu
How is the health insurance cost for F-1 and J-1 students integrated into their expenses?,The charge for insurance is added to the student tuition and fees bill.,The charge for insurance is added to the student tuition and fees bill.,https://iss.ku.edu/health-care-insurance-newly-admitted,iss.ku.edu
What must a student do to transfer their SEVIS record to another school while maintaining J-1 status?,They must submit a request for an ISS immigration advisor to transfer their SEVIS record electronically to the new program sponsor.,"If you decide to continue your studies in J-1 status at another SEVIS-approved school in the U.S., you must submit a request for an ISS immigration advisor to transfer your SEVIS record electronically to the new program sponsor.",https://iss.ku.edu/j-1-leaving-ku,iss.ku.edu
How does KU Chemical & Petroleum Engineering prepare students for future careers?,By integrating teaching excellence and research innovation to educate students and produce future leaders.,KU Chemical & Petroleum Engineering integrates teaching excellence and research innovation to educate students and produce future leaders.,http://cpe.engr.ku.edu/videos,cpe.engr.ku.edu
Who should J-1 students contact if their DS-2019 is issued by a program sponsor other than KU?,Students with a DS-2019 issued by a program sponsor other than KU should contact their sponsor to request an extension.,"For students with a DS-2019 issued by a program sponsor other than KU (ex. IIE, LASPAU, Fulbright), please contact your sponsor to request your extension.",https://iss.ku.edu/ds-2019-extension,iss.ku.edu
What is unique about Kieran Egan's hometown compared to the others mentioned?,"Kieran Egan's hometown is St. Louis, MO, which is the only one not in Kansas.","Kieran Egan Computer Engineering, 2025 Hometown: St. Louis, MO",https://engr.ku.edu/self-computer-engineering,engr.ku.edu
What significant change has been made regarding the Fall 2025 semester class start date?,The University has decided to start the Fall 2025 semester classes one week earlier than previously published.,A recent decision has been made by the University to start Fall 2025 semester classes one week earlier than previously published.,https://iss.ku.edu/arrival-date-newly-admitted,iss.ku.edu
What distinguishes a Full Media Classroom from a Full Media Room?,"Full Media Classrooms have lecture capture capabilities, while Full Media Rooms do not necessarily have this feature.","Full Media Classroom Video displays or overhead projector and screen Multiple content sources (Computer, laptop connection, document camera, DVD) Microphone Media lectern/podium Lecture capture capabilities.",https://engr.ku.edu/eaton-learned-and-leep2-spaces,engr.ku.edu
What are the application deadlines for the Data Science Graduate Certificate program?,The application deadlines are March 1 for Fall and October 1 for Spring.,Fall Deadline: March 1 Spring Deadline: October 1 Applicants must complete an application to Graduate Studies for admission into the certificate program...,https://eecs.ku.edu/data-science-graduate-certificate,eecs.ku.edu
What is the deadline for submitting requests for the credit/no credit grading option for the spring and summer 2021 terms?,"The deadline for submitting requests for the credit/no credit grading option is 11:59 p.m., December 3, 2021.","All requests for credit/no credit grading option, or to rescind the credit/no credit grading option must be submitted... no later than 11:59 p.m., December 3, 2021.",https://registrar.ku.edu/covid-19-creditno-credit-policy-modification,registrar.ku.edu
What is the composition requirement for the master’s committee?,"The master’s committee generally consists of at least 3 members, including at least 2 tenured/tenured-track faculty from the department and one additional member holding graduate faculty status.",The master’s committee generally consists of at least 3 members. Those members should consist of at least 2 tenured/tenured-track faculty from within the department (including the advisor) and include one additional member who holds any graduate faculty status.,https://engr.ku.edu/masters-program-timeline,engr.ku.edu
When must military-affiliated students provide documentation to qualify for in-state residency?,Documentation must be submitted by the 30th day of the semester being requested.,You must begin this process by the 30th day of the semester being requested. Retroactive requests will not be approved.,https://registrar.ku.edu/armed-forces-residency-benefit-0,registrar.ku.edu
What are the fees associated with the School of Music for recital performances?,"Students performing a recital are required to pay a $100 fee for program design, audio recording, and livestreaming.","Students performing a recital are required to pay a $100 fee to cover the cost of design and printing of programs, costs associated with providing the student a professional quality audio recording and livestreaming the performance through the KU School of Music YouTube channel.",https://registrar.ku.edu/fy-2024-specialized-tuition-fees,registrar.ku.edu
What features are included in the Cognitive Control Systems Laboratory?,"The laboratory features student workstations, 3D printing equipment, and a protected indoor flight range with a 14-camera VICON tracking system.","The Cognitive Control Systems Laboratory is designed as a one-stop research and development facility for small robots and unmanned aircraft. It features student workstations, a 3D printing equipment, and a protected, indoor flight range with a 14-camera VICON tracking system.",http://ae.engr.ku.edu/facilities,ae.engr.ku.edu
Which enrollment planning tool is mentioned in relation to managing class schedules?,The KU Planner is mentioned as a tool for enrollment planning.,Enrollment Planning KU Planner,https://registrar.ku.edu/special-populations,registrar.ku.edu
"Which university did Sydney Stone attend, and what degree did she earn?","Sydney Stone earned a B.A. in Political Science, Spanish, and Global & International Studies from Kansas State University.","Education — B.A. in Political Science, Spanish, and Global & International Studies, Kansas State University, 2008.",https://registrar.ku.edu/people/sydney-stone,registrar.ku.edu
What educational qualifications does Amanda Chesbrough hold?,She has a B.S. in Political Science from Brigham Young University-Idaho and an MBA from Western Governors University.,"Education — B.S. in Political Science, Brigham Young University-Idaho, 2013 MBA, Western Governors University, 2024.",https://registrar.ku.edu/people/amanda-chesbrough,registrar.ku.edu
What should students do if they are called to active military duty and need to withdraw from classes?,They should notify their instructors in writing and fill out and submit the KU Military Drop/Withdraw Form.,Notify your instructors in writing. Provide reasonable notice; don't wait until the last minute. Fill out and submit the KU Military Drop/Withdraw Form.,https://registrar.ku.edu/dropping-and-withdrawing,registrar.ku.edu
What is the purpose of the online pre-arrival component of the International Student Orientation?,It is designed to help new international students prepare for life at KU and in the United States.,"International Student Orientation is a comprehensive program consisting of two parts: an online, pre-arrival component and a multi-day in-person portion. It is designed to help new international students prepare for life at KU and in the United States.",https://iss.ku.edu/international-student-orientation,iss.ku.edu
What is the focus of the Student Center regarding student issues?,The Student Support and Case Management uses a holistic and strengths-based approach to help students overcome barriers to achieve their educational and personal goals.,"Student Support and Case Management uses a holistic and strengths based approach, and in collaboration with campus and community partners, empowers all students to address and overcome barriers to achieve their educational and personal goals.",https://engr.ku.edu/academic-resources,engr.ku.edu
What was the enrollment trend in the Aerospace Engineering Department from 2018-2019 to 2023-2024?,The Aerospace Engineering Department saw an increase in enrollment from 246 in 2018-2019 to 456 in 2023-2024.,BS in Aerospace Engineering School Year Enrolled 2018-2019 246 2023-2024 456,https://engr.ku.edu/enrollment-and-graduation-data,engr.ku.edu
What types of programs are included under the student programs listed at the University of Kansas?,"Programs include Allied Health, Applied English, Architecture & Design, Arts, Business, Education & Human Sciences, Engineering, Journalism & Mass Communications, Law, Liberal Arts & Sciences, Medicine, Music, Nursing, Professional Studies, Pharmacy, Social Welfare, and a Special non-degree-seeking program.","A program is the school in which the student is pursuing a degree. Programs are listed as follows: Allied Health, Applied English*, Architecture & Design, Arts, Business, Education & Human Sciences, Engineering, Journalism & Mass Communications, Law, Liberal Arts & Sciences, Medicine, Music, Nursing, Professional Studies, Pharmacy, Social Welfare, University Special (non-degree seeking at KU).",https://registrar.ku.edu/transcripts,registrar.ku.edu
What kind of program is offered by UCDavis in the context of medical device development?,UCDavis offers a Master of Engineering in Medical Device Development program.,Master of Engineering in Medical Device Development UCDavis Medical Device Development Graduate Program,http://bio.engr.ku.edu/opportunities,bio.engr.ku.edu
What types of facilities are available for EECS students at Eaton Hall?,"Eaton Hall provides superior laboratories, an Engineering Library, and Computing Commons for additional resources and study spots.","The 80,000-square-foot Eaton Hall, which opened in 2003, provides EECS students with superior laboratories. The Engineering Library and Computing Commons offer students additional resources and study spots.",https://eecs.ku.edu/prospective-students,eecs.ku.edu
Which specific emphasis areas in chemical engineering are highlighted at the University of Kansas?,"The emphases offered include Biomedical, Data Science, Environmental, Material Science, Premedical, and Petroleum Engineering.","Discover chemical engineering and the emphases we offer in Biomedical, Data Science, Environmental, Material Science, Premedical, and Petroleum Engineering.",http://cpe.engr.ku.edu/reu,cpe.engr.ku.edu
What happens to the SEVIS fee requirement for students who are already studying in the U.S.?,"Students currently studying in the U.S. usually do not have to pay the SEVIS fee again, as long as they maintain their status.","Students currently studying in the U.S. usually do not have to pay the fee again. The fee is tied to the SEVIS ID number and as long as the student has maintained status, the SEVIS record can be transferred to KU without the student repaying the fee.",https://iss.ku.edu/pay-sevis-fee,iss.ku.edu
What is the maximum enrollment hours for non-degree graduate students in the Business program during the Spring semester?,18 hours.,Graduate (non-degree) 18 18 12,https://registrar.ku.edu/maximum-enrollment-hours,registrar.ku.edu
What are some of Zack Holland's contributions to the University of Kansas outside of engineering?,"Holland has established a scholarship for music students, supported international travel opportunities for KU Music students, and provided a $1 million gift to the KU Alumni Association.","In addition to his aforementioned support of the schools of Engineering and Music, Holland provided a $1 million gift to the KU Alumni Association. ... He established a scholarship to honor the memory of Thomas Stidham, professor emeritus of music, who directed the KU University Band when Holland was a student.",https://engr.ku.edu/news/article/ku-engineering-to-honor-2-alumni-with-distinguished-engineering-service-award,engr.ku.edu
What should F-1 students do if their I-20 or DS-2019 is expiring and they haven't finished their program?,F-1 students should apply for an extension BEFORE the expiration date on their I-20 or DS-2019.,Apply for an extension BEFORE the expiration date on your I-20 or DS-2019 if you have not finished your program.,https://iss.ku.edu/messages-iss,iss.ku.edu
What is the primary basis for awarding Graduate Teaching Assistantships (GTAs)?,Teaching Assistantships are awarded competitively based on academic qualifications.,Teaching Assistantships are available and are awarded competitively based on academic qualifications.,https://bioengr.ku.edu/funding,bioengr.ku.edu
What percentage of EECS graduate students receive financial support through assistantships or fellowships?,More than 75 percent of EECS graduate students are supported by assistantships or fellowships.,"More than 75 percent of EECS graduate students are supported by assistantships or fellowships from within KU or external organizations, such as the National Science Foundation and the Department of Defense.",https://eecs.ku.edu/graduate-programs,eecs.ku.edu
What research opportunity is available through the National Science Foundation for undergraduates?,Research Experiences for Undergraduates (REU),Research Experiences for Undergraduates (REU) National Science Foundation Apply/MoreInfo,https://bioengr.ku.edu/opportunities,bioengr.ku.edu
What is the significance of mentoring in the UGRF program?,"The UGRF program provides a remarkable experience to these fellows due to the mentoring they receive from the Engineering faculty, postdoctoral researchers, and graduate students.","Most of all, the UGRF program provides a remarkable experience to these fellows due to the mentoring they receive from the Engineering faculty, postdoctoral researchers, and graduate students.",https://engr.ku.edu/undergraduate-research-fellows,engr.ku.edu
What kind of skills does the interdisciplinary program in Engineering Physics aim to develop for students?,"The program prepares students for life in the 21st century with a focus on science, math, and engineering.","If you love science, math and engineering, this is the place for you. In our interdisciplinary program students prepare themselves for life in the 21st century.",http://ephx.engr.ku.edu/navigator,ephx.engr.ku.edu
How can students print their Student Health Insurance ID Card?,Students can print their ID Card by logging into 'My Account' on the United Healthcare website after receiving activation notification from ISS Insurance.,Your Student Health Insurance ID Card is available online 24/7 via My Account on United Healthcare website. Please keep in mind insurance ID cards are only available after you have received notification from ISS Insurance that your insurance for the semester has been activated.,https://iss.ku.edu/plan-details-id-cards,iss.ku.edu
When did Willy Lee join the Jayhawk family?,In 2020.,WeiHsien (Willy) has joined the Jayhawk family since 2020 as a PhD student in BioEngineering...,https://engr.ku.edu/people/willy-lee,engr.ku.edu
In which computer lab rooms can you find the Aerospace Engineering department resources?,Aerospace Engineering resources are found in Room G400 (LEEP 2) and Room 1182 (Learned).,Departmental Computer Labs (List) Aerospace Engineering (AE) Room G400 (LEEP 2) Room 1182 (Learned),https://engr.ku.edu/software-request,engr.ku.edu
What resource does the Office of the University Registrar offer for calculating educational costs?,The office provides a comprehensive tuition and fee schedule to help students calculate their costs.,A KU degree is a valuable investment. We’re here to inform and advise you as you prepare for and pursue a successful career as a Jayhawk. Calculate Your Costs Tuition and Fees.,https://registrar.ku.edu/node/66,registrar.ku.edu
When must a waiver be submitted if the student will be out of the country during their enrolled semester?,The Out of Country Waiver must be submitted before the first day of class of each semester.,The Out of the Country Waiver requires you to indicate you will NOT be in the U.S. the entire length of the semester... must be submitted before the first day of class.,https://iss.ku.edu/united-healthcare-waiver,iss.ku.edu
What qualities of the Club members contributed to their success in the competition?,The Club members' commitment to pushing the boundaries of computational performance contributed to their success.,This achievement reflects the Club members' commitment to pushing the boundaries of computational performance.,https://eecs.ku.edu/news/article/2024/04/29/eecs-supercomputing-club-shines-2024-single-board-cluster-competition,eecs.ku.edu
What motivated Afeez Badmus to join the GEA?,He joined GEA in order to contribute to meeting the ends of the engineering graduate students and connect with students from different backgrounds and cultures.,I joined GEA in order to contribute to meeting the ends of the engineering graduate students and connect with students from different backgrounds and cultures.,https://engr.ku.edu/people/afeez-badmus,engr.ku.edu
"What type of awards are linked to the KU EECS Distinguished Service Award, as mentioned in the passage?","The passage mentions the KEDS Award presentations, specifically the inaugural and subsequent awards.",KEDS News Inaugural KU EECS KEDS Award Presented Select to follow link 2023 KU KEDS Awards Presented Select to follow link 2024 KEDS Award Presentation Select to follow link.,https://eecs.ku.edu/ku-eecs-distinguished-service-award,eecs.ku.edu
What is the primary goal of the SELF Program in relation to its students?,The SELF Program is intent on identifying and nurturing engineering and computer science students with strong leadership and achievement qualities who have a desire to orchestrate innovation in business and industry during their careers.,The SELF Program is intent on identifying and nurturing engineering and computer science students with strong leadership and achievement qualities and who have a desire to orchestrate innovation in business and industry during their careers.,https://engr.ku.edu/self-program-apply,engr.ku.edu
Are there additional requirements for international students regarding language proficiency?,"Yes, the TOEFL is required for any international student whose native language is not English, and the Test of Spoken English (TSE) may also be required.","The Test of English as a Foreign Language (TOEFL) is required for any applicant who indicates that English is not their native language. Additionally, the Test of Spoken English (TSE) may be required.",http://bio.engr.ku.edu/faqs,bio.engr.ku.edu
What are the class meeting times effective for the Fall 2025 term?,"The class meeting times are: MWF 8:00-8:50, 9:00-9:50, 10:00-10:50, 11:00-11:50, 12:00-12:50, 1:00-1:50, 2:00-2:50, 3:00-3:50, 4:00-4:50, and 5:00-5:50, as well as various times for Tuesday & Thursday and Monday & Wednesday classes.",The class meeting times below are effective for the Fall 2025 term. Contact scheduling@ku.edu for questions about the class meeting times...,https://registrar.ku.edu/standard-meeting-times,registrar.ku.edu
What significant milestone did Murray Harris achieve in 1873?,He was awarded the first engineering degree in the entire state of Kansas.,The first engineering degree granted in the entire state of Kansas was a degree in civil engineering awarded in 1873 to KU student Murray Harris.,https://engr.ku.edu/history,engr.ku.edu
What specific documentation is required for a medical Reduced Course Load request?,"Students will need to submit a letter on letterhead signed by an appropriate licensed medical doctor, psychiatrist, doctor of osteopathy, licensed psychologist, or clinical psychologist recommending the RCL for the specific semester.","Students will need to submit a letter on letterhead signed by an appropriate licensed medical doctor, psychiatrist, doctor of osteopathy, licensed psychologist, or clinical psychologist recommending the RCL for the specific semester.",https://iss.ku.edu/f-1-reduced-course-load,iss.ku.edu
What is Caleb Regan's role concerning the Dean’s Advisory Board?,He serves as the staff point-of-contact for the Dean’s Advisory Board.,Serves as staff point-of contact for Dean’s Advisory Board and CPE department.,https://engr.ku.edu/people/caleb-regan-0,engr.ku.edu
"During the Fall semester, what is the maximum number of hours that undergraduate students can enroll in the Engineering program?",19 hours.,Engineering Undergraduate (degree) 19 19 9,https://registrar.ku.edu/maximum-enrollment-hours,registrar.ku.edu
What types of financial documentation are acceptable for proving finances as an F-1 student?,"A bank statement, a bank letter, an official loan sanction letter, a scholarship or sponsorship letter, or an official Graduate Assistantship offer letter.","Acceptable Types of Financial Documentation include: A bank statement from checking, savings, stock holding and/or certificates of deposit; Bank letter on letterhead indicating date account opened, average balance and current balance; An official loan sanction letter, indicating unconditional approval for a student education loan; A scholarship or sponsorship letter verifying the amount, source, and dates of the student's award; An official Graduate Assistantship (such as GTA or GRA) offer letter that indicates the benefits and dates of the student’s position.",https://iss.ku.edu/proof-finances,iss.ku.edu
What was the purpose of the Office of National Defense Initiatives at KU?,The Office of National Defense Initiatives combines the expertise of the former Office of Graduate Military Programs with KU's three Reserve Officers' Training Corps (ROTC) programs.,KU strengthening national defense partnership with new office The Office of National Defense Initiatives combines the expertise of the former Office of Graduate Military Programs with KU's three Reserve Officers' Training Corps (ROTC) programs.,https://engr.ku.edu/news,engr.ku.edu
Which faculty member directs the NIH Biotechnology Training Program?,"Teruna Siahaan, Ph.D. is the co-director of the NIH Biotechnology Training Program.","Teruna Siahaan, Ph.D. -Aya and Takeru Higuchi Distinguished Professor, Pharmaceutical Chemistry -Co-Director, NIH Biotechnology Training Program...",http://bio.engr.ku.edu/academic-affiliates,bio.engr.ku.edu
How can someone contact Ryan Siebuhr by email?,Someone can contact Ryan Siebuhr by emailing ryansiebuhr@ku.edu.,Email: ryansiebuhr@ku.edu,https://engr.ku.edu/people/ryan-siebuhr,engr.ku.edu
What steps must a student take to activate their health insurance if they have a qualifying appointment?,"The student must enroll in KU classes, submit an online application to United Healthcare, and ensure their appointment is keyed in the HR Pay system.","All eligible 50% GTA, GRA and/or GA students can apply for health insurance coverage by submitting an online application at United Healthcare Online Enrollment each semester.",https://iss.ku.edu/health-insurance-gta-gra-ga,iss.ku.edu
What is the total amount of credit hours required for the Systemwide General Education framework at Kansas universities?,34-35 hours of credit.,"There are seven discipline areas that students must take a specific amount of hours of coursework within, totaling 34-35 hours of credit.",https://registrar.ku.edu/systemwide-gen-ed,registrar.ku.edu
Identify a student who is pursuing a Master's in Engineering.,Andreas Altingul is pursuing a Master's of Engineering.,Andreas Altingul - Maters of Engineering View full profile,https://bioengr.ku.edu/graduate-students,bioengr.ku.edu
What resource does the university provide to assist individuals in developing their own emergency evacuation plans?,The University of Kansas Public Safety Office provides an online tool to help students and employees develop a Personal Action Plan in the event of an emergency.,The University of Kansas Public Safety Office also provides an online tool to help students and employees - particularly those who may need assistance evacuating - develop a Personal Action Plan in the event of an emergency.,https://engr.ku.edu/safety,engr.ku.edu
What is the significance of enrolling in a course for credit while participating in Curricular Practical Training (CPT)?,"The student must enroll in a class for credit, which must be required for the degree or an elective course required for the student’s degree.","For the employment, the student must enroll in a class for credit and the class MUST either be required for the degree or the class must qualify as an elective course required for the student’s degree.",https://iss.ku.edu/f-1-cpt-curricular-practical-training,iss.ku.edu
What types of records does the Office of the University Registrar maintain?,"The Office of the University Registrar maintains official academic student records which include grades, transcripts, enrollment certifications, degrees and diplomas, as well as personal information.","The Office of the University Registrar maintains official academic student records. This includes grades, transcripts, enrollment certifications, degrees and diplomas, a student’s personal information and more.",https://registrar.ku.edu/,registrar.ku.edu
What motivated Soma Pal to choose the University of Kansas (KU) for her studies?,She was drawn to KU because she got her research subject there and found the professors very helpful.,"I joined KU because I got my research subject here, and all the professors are also very helpful.",https://engr.ku.edu/people/soma-pal,engr.ku.edu
What happens to the health insurance charge for students enrolled in KU classes?,"Students enrolled in KU classes, even online classes, receive the insurance automatically, and the charge will go on their Enroll and Pay account.","If you are F-1, F-2 or J-1, enrolling in KU classes (even online classes), you receive the insurance automatically, and the charge for insurance goes on your Enroll and Pay account.",https://iss.ku.edu/health-insurance-OPT-AT,iss.ku.edu
"In the 2023-2024 academic year, how many students were enrolled in the BS in Cybersecurity program?",5 students were enrolled in the BS in Cybersecurity program in the 2023-2024 academic year.,BS in Cybersecurity School Year Enrolled 2023-2024 5,https://engr.ku.edu/enrollment-and-graduation-data,engr.ku.edu
What unique program does the University of Kansas offer that is not available in other institutions within the state?,The University of Kansas hosts the only petroleum engineering program in the State of Kansas.,The University of Kansas hosts the only petroleum engineering program in the State of Kansas and is home to the Tertiary Oil Recovery Program.,http://cpe.engr.ku.edu/degrees,cpe.engr.ku.edu
What kind of programs does the Applied English Center provide?,The Applied English Center offers Intensive English Programs or TEFL Certificate.,Applied English Center Intensive English Programs or TEFL Certificate Study English at the Applied English Center,https://iss.ku.edu/apply,iss.ku.edu
Which two academic units jointly administer the Engineering Physics program at KU?,The program is jointly administered through the School of Engineering and the Department of Physics and Astronomy.,KU's Engineering Physics program is jointly administered through the School of Engineering and the Department of Physics and Astronomy in the College of Liberal Arts and Sciences.,http://ephx.engr.ku.edu/digital-electronic-systems,ephx.engr.ku.edu
What role does 'Impact and Belonging' play in relation to student organizations?,'Impact and Belonging' helps students connect to various student organizations focused on diversity and inclusion.,Impact and Belonging helps students connect to these student organizations.,https://engr.ku.edu/impact-and-belonging-student-organizations,engr.ku.edu
Which countries' nationals are explicitly not eligible for the Automatic Extension of Visa Validity?,"Nationals from Iran, Sudan, and Syria are not eligible for the automatic extension due to being identified as sponsors of terrorism.","The automatic extension rule does NOT apply to nationals of countries the U.S. has identified as sponsors of terrorism. As of 04/24/2017 the three countries identified as sponsoring terrorism are: Iran, Sudan and Syria.",https://iss.ku.edu/automatic-revalidation-students,iss.ku.edu
What practical guidance does 'Basic Human-Robot Interaction' provide to its readers?,"The book equips readers with practical guidance on conducting HRI experiments, from the initial stages of design and execution to navigating the publication process.","Professor Johnson's book equips readers with practical guidance on conducting HRI experiments, from the initial stages of design and execution to navigating the publication process in scientific journals.",https://eecs.ku.edu/news/article/2024/02/25/professor-david-johnson-publishes-new-book-human-robot-interaction,eecs.ku.edu
What is the function of CourseLeaf as mentioned in the passage?,CourseLeaf is included in the context of course and room scheduling resources.,Course and Room Scheduling Resources CourseLeaf FAQ Definitions for Course Components.,https://registrar.ku.edu/scheduling-officer-resources,registrar.ku.edu
When are the Advanced Auditoria requests due for Spring 2025?,"May 1, 2024.","May 1, 2024 Advanced Auditoria requests due to OUR office",https://registrar.ku.edu/schedule-classes-deadlines,registrar.ku.edu
What components must a student's Plan of Study include?,"It must include CORE, RESEARCH, DEPTH, and BREADTH courses.","The Plan of Study must consist of the following components: CORE, RESEARCH, DEPTH and BREADTH courses.",https://bioengr.ku.edu/ms,bioengr.ku.edu
How often does the KU School of Engineering update the list of Industry Events for the showcase?,The list of events will be updated frequently throughout the 2022-2023 school year.,Please be sure to check back frequently as more events will be added throughout the 2022-2023 school year!,https://engr.ku.edu/engineering-showcase-series-2023,engr.ku.edu
"Who hosts the High School Design event, and who is responsible for planning it?","The event is hosted by the KU School of Engineering, while SELF fellows plan and execute the event.","High School Design is hosted by the KU School of Engineering, while SELF fellows plan and execute the event.",https://engr.ku.edu/high-school-design-competition,engr.ku.edu
How many EECS graduate students at KU are supported by assistantships or fellowships?,More than 75 percent of EECS graduate students are supported by assistantships or fellowships.,"More than 75 percent of EECS graduate students are supported by assistantships or fellowships from within KU or external organizations, such as the National Science Foundation and the Department of Defense.",https://eecs.ku.edu/graduate-funding,eecs.ku.edu
Which company is listed as having a significant presence in Denver and specializes in engineering?,"Burns & McDonnell, located in Denver, CO, is mentioned as one of the influential leaders in the industry.","Our graduates have obtained positions at some of the most powerful and influential leaders in the industry, such as: ... Burns & McDonnell, Denver, CO ...",https://bioengr.ku.edu/beyond-ku,bioengr.ku.edu
Who is the Director of the Hoglund Brain Imaging Center?,"William Brooks, Ph.D.","-Director, Hoglund Brain Imaging Center -Professor, Neurology",http://bioengr.ku.edu/academic-affiliates,bioengr.ku.edu
What is a fun fact about Koyel Pramanick's fandom?,Koyel is a die-hard Potterhead.,She is also a die hard Potterhead.,https://engr.ku.edu/people/koyel-pramanick,engr.ku.edu
What action is necessary before processing a financial update if funding comes from KU?,The verification of KU funding must be submitted by the person who can confirm it.,"*If any portion of your funding comes from KU, the financial update can only be processed once the person who can verify your KU funding submits their portion.",https://iss.ku.edu/i-20-requests-or-copies,iss.ku.edu
What are the specific focus areas for research clusters in the Computer Science Ph.D. program?,"The associated focus areas for Computer Science Ph.D. students include Computational Science and Engineering, Data Science and Engineering, Computer Systems Design, Languages and Semantics, Theory of Computing, and Computing in the Biosciences.","Computer Science Ph.D. students are encouraged to choose a research cluster and dissertation topic as early in the graduate program as possible and identify a faculty adviser who is interested in supervising their work. Associated Focus Areas: Computational Science and Engineering, Data Science and Engineering, Computer Systems Design, Languages and Semantics, Theory of Computing, Computing in the Biosciences.",https://eecs.ku.edu/phd-program,eecs.ku.edu
What specific requests can be reviewed during a Drop-In Advising session?,"During Drop-In Advising, the following iHawk requests can be reviewed and processed if they are completely submitted: Reduced Course Load (F-1 or J-1), Add Dependents (F or J), Financial Update on I-20, among others.","The following iHawk requests can be reviewed and processed during drop-ins/walk-ins if they are completely submitted (AND verified by the second approver such as department contact or academic advisor, if applicable): Reduced Course Load (F-1 or J-1)...",https://iss.ku.edu/advising,iss.ku.edu
What specific programs are offered through KU's CyberCorps Scholarship for Service?,"The CyberCorps Scholarship for Service program, funded by a $4.7 million NSF grant, offers collaborations with the NSA and U.S. Army.","Another key cybersecurity initiative is KU’s $4.7 million NSF grant-funded CyberCorps Scholarship for Service program, which offers collaborations with the NSA and U.S. Army.",https://engr.ku.edu/electrical-engineering-computer-science-brochure-2023,engr.ku.edu
What is the significance of completing additional remedial courses for some students in the graduate program?,Students with deficiencies in areas critical to the program may be required to complete additional courses in preparation for the qualifying exam.,Students with deficiencies in areas critical to the program may be required to complete additional courses in preparation for the qualifying exam.,http://bio.engr.ku.edu/entrance-requirements-track,bio.engr.ku.edu
Which two students have the same hometown and graduation year?,"Rebecca Suku and Vilan Vu both have Olathe, KS as their hometown and are graduating in 2025.","Rebecca Suku Chemical Engineering, 2025 Hometown: Olathe, KS; Vilan Vu Chemical Engineering, 2025 Hometown: Lenexa, KS.",https://engr.ku.edu/self-chemical,engr.ku.edu
What is the mission of the SELF Program?,The mission of the SELF Program is to develop passionate engineering and computer science graduates who are strongly goal-oriented and who bring the business skills and vision needed to guide the technology-based corporations of tomorrow.,The mission of the SELF Program is to develop passionate engineering and computer science graduates who are strongly goal-oriented and who bring the business skills and vision needed to guide the technology-based corporations of tomorrow.,https://engr.ku.edu/self-engineering-leadership-fellows-program,engr.ku.edu
Why is it recommended to schedule a 'well visit' with a new primary care provider?,Having a well visit with a new primary care provider will make it easier to get an appointment with that provider when you are sick.,It is a good idea to make an appointment with your new primary care provider even if you are not sick. This visit is sometimes called a 'well visit.' Having a well visit with a new primary care provider will make it easier to get an appointment with that provider when you are sick.,https://iss.ku.edu/how-find-doctor,iss.ku.edu
When should a Ph.D. student's Plan of Study be developed and filed?,A Ph.D. student's Plan of Study must be completed and approved in the second semester of study.,This must be completed and approved in the second semester of study.,http://bioengr.ku.edu/graduating,bioengr.ku.edu
What are the financial aid options for students pursuing the Master of Engineering in Bioengineering at KU?,Students pursuing the Master of Engineering in Bioengineering will not be considered for Graduate Assistantships within the Bioengineering Program and should plan to fund the degree through their own efforts or external funding.,Students pursuing the Master of Engineering in Bioengineering will not be considered for Graduate Assistantships within the Bioengineering Program and should plan to fund the ME degree through their own efforts or external funding.,http://bio.engr.ku.edu/master-engineering,bio.engr.ku.edu
What must students who plan to reduce their course load do regarding their ISS?,"If KU ISS (or your program sponsor) has not approved the RCL by the deadline or prior to dropping below full time, you will be considered in violation of your legal status.","Important : If KU ISS (or your program sponsor) has not approved the RCL by the deadline or prior to dropping below full time, you will be considered in violation of your legal status.",https://iss.ku.edu/j-1-reduced-course-load,iss.ku.edu
What facets of chemical engineering are highlighted in the University of Kansas curriculum?,"Biomedical, Data Science, Environmental, Material Science, Premedical, and Petroleum Engineering.","Discover chemical engineering and the emphases we offer in Biomedical, Data Science, Environmental, Material Science, Premedical, and Petroleum Engineering.",http://cpe.engr.ku.edu/petroleum-engineering-graduate-programs-2024-25,cpe.engr.ku.edu
Are KU departments required to pay for the premium processing fee for the OPT?,There is no mandate for KU to pay this fee; reimbursement is the recommended method if they choose to do so.,"There is no mandate for KU to pay this fee. If you would like to pay this fee, then reimbursement is the recommended method.",https://iss.ku.edu/f-1-opt-stem-opt,iss.ku.edu
What are the four design options available within the Engineering Physics program?,"The design options are Aerospace Systems, Chemical Systems, Digital Electronic Systems, and Electromechanical Control Systems.","Students work with faculty from both the Department of Physics and Astronomy and the School of Engineering. They can have cutting edge research experiences that run the gamut from A (Automobiles) to Z (Z bosons). The program offers a B.S. degree in engineering physics with opportunities to pursue one of four design options: Aerospace Systems, Chemical Systems, Digital Electronic Systems, and Electromechanical Control Systems.",http://ephx.engr.ku.edu/faqs,ephx.engr.ku.edu
What are some examples of student start-ups initiated by graduates of the program?,"Examples of student start-ups include Dynamic Athletic Research Institute, LLC, Evoke Medical, and Glyscend.","Many of our students have begun their own start-up companies, some even while they were still at KU. A sampling of our student start-up companies include: Click to expand Dynamic Athletic Research Institute, LLC, Lenexa, KS, Evoke Medical, Lawrence, KS, Glyscend, Baltimore, MD.",http://bio.engr.ku.edu/beyond-ku,bio.engr.ku.edu
What steps should F-1s and J-1s take if they want to add their dependents to the KU health insurance?,They must contact the International Insurance Coordinator at issinsurance@ku.edu within 30 days of arriving.,All F-1s and J-1s are allowed to add the KU health insurance for their dependents by contacting the International Insurance Coordinator at issinsurance@ku.edu. Dependents must be added to the insurance within 30 days of arriving.,https://iss.ku.edu/health-care-insurance-newly-admitted,iss.ku.edu
What types of activities and events do Fellows participate in during the SELF Program?,"Fellows coordinate and help with numerous events across campus, including running the Engineering High School Design Competition, the largest outreach event each Fall, and engaging in the Community Service Project in partnership with not-for-profit organizations.","Members of the Madison A. and Lila Self Engineering Leadership Fellows (SELF) Program participate in a wide range of activities and have established themselves as leaders across campus. They run the Engineering High School Design Competition, the School of Engineering's largest on-campus outreach event each Fall. The SELF Community Service Project is an opportunity during sophomore year to partner with not-for-profit organizations in the Greater Lawrence Community.",https://engr.ku.edu/self-fellow-responsibilities,engr.ku.edu
What condition must a student meet regarding enrollment during their graduation semester?,Students must be enrolled in at least one credit hour for the semester that they graduate unless they meet the early graduation deadline.,Please remember that you must be enrolled in at least one (1) credit hour for the semester that you graduate unless you meet the early graduation deadline.,https://bioengr.ku.edu/graduating,bioengr.ku.edu
What specific policy applies to final examinations for classes at the Edwards Campus?,All classes with a location of the Edwards Campus follow the defined KU Edwards Final Examinations Policy.,All classes with a location of the Edwards Campus follow the defined KU Edwards Final Examinations Policy.,https://registrar.ku.edu/exams,registrar.ku.edu
What diverse disciplines contribute to the field of bioimaging?,"Bioimaging science brings together engineers, computer scientists, physicists, biologists, chemists, and clinicians.","This discipline brings together engineers, computer scientists, physicists, biologists, chemists and clinicians engaged in the development of equipment and methodologies...",https://bioengr.ku.edu/bioimaging,bioengr.ku.edu
Which areas of research in petroleum engineering are highlighted in KU's graduate programs?,"Highlighted areas of research include bioengineering, catalysis, renewable energy, sustainability, separations, and enhanced oil and gas recovery.","Work on cutting-edge research with nationally and internationally recognized faculty in areas including bioengineering, catalysis, renewable energy, sustainability, separations, enhanced oil and gas recovery.",http://cpe.engr.ku.edu/about-us,cpe.engr.ku.edu
Which phase includes the School of Pharmacy for access to the KU Planner?,"The School of Pharmacy will be included in Phase 3, which is available on April 28.",Phase 3 (Available April 28) School of Pharmacy...,https://registrar.ku.edu/ku-planner,registrar.ku.edu
What are some of Prasad Kulkarni's research interests?,"His research interests include software security, software performance, compiler optimizations, and virtual machines and runtime systems.",Research — Research interests: Software security Software performance Compiler optimizations Virtual Machines and Runtime Systems,https://eecs.ku.edu/people/prasad-kulkarni,eecs.ku.edu
What opportunities are available for graduates of the Biomaterials and Tissue Engineering program?,"Graduates are prepared to enter into industry, government, or academics and assist in research programs in biomaterials.","Graduates are prepared to enter into industry, government, or academics, where they will be able to assist in research programs in biomaterials.",http://bioengr.ku.edu/biomaterials-tissue-engineering,bioengr.ku.edu
What should be done if access to iHawk is needed sooner than the usual timeframe?,"If access is needed sooner, you should send an email to International Support Services at iss@ku.edu to expedite the approval.","If you need access sooner, please send an email to International Support Services at iss@ku.edu and we will expedite the approval.",https://iss.ku.edu/request-access-ihawk,iss.ku.edu
What is the value and duration of the Self Graduate Fellowship offered at KU?,"The Self Graduate Fellowship is worth over $200,000 and covers a duration of four years.","Self Graduate Fellowship: An elite 4-year fellowship that is exclusive to KU and worth over $200,000.",http://bioengr.ku.edu/funding,bioengr.ku.edu
Who can students expect to learn from in the graduate programs?,Students will learn from nationally and internationally recognized faculty.,"Work on cutting-edge research with nationally and internationally recognized faculty in areas including bioengineering, catalysis, renewable energy, sustainability, separations, enhanced oil and gas recovery, unconventional reservoirs, data mining and reservoir characterization, flow in porous media, and reservoir simulation.",http://cpe.engr.ku.edu/resources-undergraduate,cpe.engr.ku.edu
What types of skills will the SELF Program help students to expand and refine?,"The program helps students expand and refine their leadership, managerial, business, interpersonal, entrepreneurial, communication, and engineering skills.","By active participation in the program, the students will expand and refine their leadership, managerial, business, interpersonal, entrepreneurial, communication and engineering skills through mentoring, coursework, seminars and leadership opportunities.",https://engr.ku.edu/self,engr.ku.edu
What is required of MS students regarding manuscript publication?,MS students should expect to submit at least one published manuscript.,MS students should expect to submit at least one published manuscript and PhD students should submit at least three; though you should discuss individual expectations with your advisor.,http://bio.engr.ku.edu/faqs,bio.engr.ku.edu
What is the seating capacity of the Beren Petroleum Conference Center?,The Beren Petroleum Conference Center can accommodate up to 300 people.,"Most ideal for large gatherings, the auditorium can accommodate up to 300 people with tech support to suit the needs of your event.",https://engr.ku.edu/eaton-learned-and-leep2-spaces,engr.ku.edu
What is the fare policy for shared ride shuttles from the airport to Lawrence?,"For shared ride shuttles, you pay a specified amount to reserve your space, even though the shuttle may also provide transportation to other individuals.",Shared Ride: shared ride means that you pay the specified amount to reserve your space in a shuttle that may also be providing transportation to other individuals.,https://iss.ku.edu/newly-admitted-transportation,iss.ku.edu
What additional calendars are available besides the regular academic calendars?,"The passage includes the Office of Graduate Studies Calendars and Key Dates, as well as the School of Law Calendar.",Office of Graduate Studies Calendars and Key Dates Select to follow link School of Law Calendar Select to follow link,https://registrar.ku.edu/calendar,registrar.ku.edu
What is the role of the Foundation Distinguished Professor Mark Shiflett concerning the new naming of the institute?,He is the founder and director of the institute and expressed gratitude for the partnership with Wonderful.,"said Foundation Distinguished Professor Mark Shiflett, founder and director of the institute... we are honored to name our institute after our partners at Wonderful for their major investment.",https://engr.ku.edu/news/article/university-of-kansas-renames-institute-for-sustainable-engineering-after-the-wonderful-company,engr.ku.edu
Are any Engineering Ambassadors focused on interdisciplinary studies?,"Yes, there is a representative named Abishai Mathai who is in Interdisciplinary Computing.",Engineering Physics Abishai Mathai Interdisciplinary Computing.,https://engr.ku.edu/engineering-ambassadors,engr.ku.edu
What is unique about the Last Day of Finals for the Spring Semester 2025?,"It is projected to be May 16, 2025, which is one day later than the Last Day for the Spring Semester 2024.",Last Day of Finals May 16 F (Spring Semester 2025); Last Day of Finals May 10 F (Spring Semester 2024),https://registrar.ku.edu/kbor-approved-academic-calendars,registrar.ku.edu
What educational qualifications does Derek Zomer hold?,Derek holds a B.S. in Communication Studies and Psychology and an M.A. in Communication Studies.,Derek holds a B.S. in Communication Studies and Psychology and an M.A. in Communication Studies from the University of South Dakota.,https://eecs.ku.edu/people/derek-zomer,eecs.ku.edu
Who is the current Director of the Jayhawk Athletic Performance Laboratory?,"Andrew Fry, Ph.D. holds the position of Director of the Jayhawk Athletic Performance Laboratory.","Andrew Fry, Ph.D. - Director, Jayhawk Athletic Performance Laboratory - Professor, Heath, Sport & Exercise Sciences.",https://bioengr.ku.edu/people,bioengr.ku.edu
"What was Liz Smith's role at Community Action, Inc.?",She served as the executive assistant at the organization.,"Before coming to KU, Liz served as the executive assistant at Community Action, Inc., an anti-poverty organization that provides low-income services to people in the Northeast Kansas area.",https://registrar.ku.edu/people/liz-smith,registrar.ku.edu
What professional role did Renganayagi hold before her current position?,She worked as a quality analyst for a software company from 2015 to 2021.,"Renganayagi moved to Lawrence, Kansas a few years ago after she got married, and worked as a quality analyst for a software company from 2015-2021.",https://registrar.ku.edu/people/renganayagi-shyam,registrar.ku.edu
What type of information can international students find on the page regarding financial aid?,"The page provides general information about how to pay for your degree, understanding financial aid for international students, and lists multiple scholarship search aggregate websites.","This page provides general information about how to pay for your degree, understanding financial aid for international students, and lists multiple scholarship search aggregate websites.",https://iss.ku.edu/scholarship-loan-information,iss.ku.edu
What specific ecological function does Amy Hansen's research focus on with regard to wetlands?,Amy Hansen's research focuses on the ability of wetlands to improve water quality by removing nitrate.,Amy Hansen’s research focuses on the ability of wetlands to improve water quality by removing nitrate.,https://engr.ku.edu/news/article/2024/04/01/two-ku-engineering-professors-recognized-early-career-research-success,engr.ku.edu
What unique hometowns are represented among the Computer Science students?,"Students from Dubai, UAE and Assaria, KS are uniquely represented among the Computer Science students.","Bhavik Goplani Computer Science, 2025 Hometown: Dubai, UAE ... Hart Nurnberg Computer Science, 2026 Hometown: Assaria, KS.",https://engr.ku.edu/self-computer-science,engr.ku.edu
What is Ashish Adhikari's academic department?,He is part of the Electrical Engineering and Computer Science department.,Department: Electrical Engineering and Computer Science,https://engr.ku.edu/people/ashish-adhikari,engr.ku.edu
What is the primary focus of the safety measures outlined by the KU School of Engineering?,"The primary focus is the safety of students, staff and faculty, as well as the surrounding community.","The safety of students, staff and faculty, as well as the surrounding community, is paramount at the KU School of Engineering.",https://engr.ku.edu/safety,engr.ku.edu
How does the bioengineering program at KU contribute to public health?,"The program helps students to find cures, promote well-being, and build healthy communities.","From cancer treatment and tissue engineering to improved drug delivery and concussion testing, KU’s bioengineering program is helping students to find cures, promote well-being, and build healthy communities.",https://engr.ku.edu/departments,engr.ku.edu
"What role does Steven Soper, Ph.D. hold that signifies a prestigious position within the university?",KU Foundation Distinguished Professor,"Steven Soper, Ph.D. -KU Foundation Distinguished Professor, Chemistry, Mechanical Engineering, and Bioengineering",https://bioengr.ku.edu/core-faculty,bioengr.ku.edu
What specific roles does Caleb Regan fulfill in relation to prospective and current leadership donors?,"He directs programs for prospect identification, cultivation, solicitation, and stewardship for prospective and present leadership and major gift donors.","Directs programs for prospect identification, cultivation, solicitation, and stewardship for prospective and present leadership and major gift donors to the School of Engineering and the University of Kansas.",https://engr.ku.edu/people/caleb-regan-0,engr.ku.edu
Where did Renganayagi complete her engineering degree?,She completed her engineering degree at New Prince Shri Bhavani College of Engineering and Technology.,"Education — B.E. In Electronics and Communication Engineering, New Prince Shri Bhavani College of Engineering and Technology, 2015",https://registrar.ku.edu/people/renganayagi-shyam,registrar.ku.edu
What is Liz Smith's educational background?,"She holds a Bachelor of General Studies in Communication Studies with a minor in Women, Gender, and Sexuality Studies.","Liz recently completed her undergraduate in Communication Studies with a minor in Women, Gender, and Sexuality Studies in July of 2022.",https://registrar.ku.edu/people/liz-smith,registrar.ku.edu
What kind of interview process do applicants to the SELF Program undergo?,Applicants must be willing to participate in interviews and other assessment methods employed as part of the selection process.,Applicants must be willing to visit the campus and participate in interviews and other assessment methods employed as part of the selection process.,https://engr.ku.edu/self-program-apply,engr.ku.edu
What is the primary purpose of the Bioengineering Opportunity Fund?,The Bioengineering Opportunity Fund provides unrestricted funds that allow the Director to meet urgent needs and take advantage of opportunities as they arise.,Bioengineering Opportunity Fund: Unrestricted funds that allow the Director to meet urgent needs and take advantage of opportunities as they arise.,http://bioengr.ku.edu/donate,bioengr.ku.edu
What is the purpose of the Paul F. Huebner Memorial Award?,It rewards teaching assistants who best exemplify the role of a teacher and encourages students to consider teaching as a career.,Paul F. Huebner Memorial Award is offered to teaching assistants who best exemplify the role of a teacher. It is intended to reward good teaching and encourage students to consider teaching as a career.,https://eecs.ku.edu/news?page=14,eecs.ku.edu
What happens if a J-1 student fails to maintain health insurance for their dependents?,They shall be subject to termination as a student.,Any J-1 student that willfully fails to maintain health insurance as prescribed below shall be subject to termination as a student.,https://iss.ku.edu/proof-insurance-j-2-dependents,iss.ku.edu
What is the primary focus of the Master of Engineering in Bioengineering program at the University of Kansas?,"The primary focus is to prepare students for careers in medicine, private commercial firms, and entrepreneurship in a start-up company, with an emphasis on coursework rather than research.","This degree will prepare students to be more effective in their careers in medicine, private commercial firms, and with entrepreneurship in a start-up company. The coursework-only Master of Engineering in Bioengineering degree is an efficient way for baccalaureate graduates to get more in-depth background and credentials in bioengineering prior to seeking employment.",https://bioengr.ku.edu/master-engineering,bioengr.ku.edu
What are the main interdisciplinary skills students must demonstrate in the M.S. BIOE program?,"Students must demonstrate an understanding of interdisciplinary concepts, ability to generate testable hypotheses, design experiments, and collect and analyze data in both independent and team settings.","Students must demonstrate that they understand interdisciplinary concepts, are able to generate testable hypotheses, design experiments, and collect and analyze data, both independently and within team and interdisciplinary environments.",http://bioengr.ku.edu/ms,bioengr.ku.edu
What is the purpose of the scholarship impact questionnaire for students receiving scholarships?,The scholarship impact questionnaire allows recipients to express appreciation for the donor's generosity and informs donors how their gifts benefit students.,"As part of a student's scholarship package, they are asked to complete a scholarship impact questionnaire. This questionnaire provides an opportunity for recipients to express appreciation for the donor's generosity, and lets engineering donors know the ways in which their gifts benefit students.",https://engr.ku.edu/undergraduate-scholarships,engr.ku.edu
How does bioimaging support other tracks in the bioengineering program?,Bioimaging supplies critical supportive data for other tracks in the bioengineering program.,This track is closely linked to the other tracks of the bioengineering program because of supplying critical supportive data.,http://bio.engr.ku.edu/bioimaging,bio.engr.ku.edu
What aspects of diversity does the Impact and Belonging Program address?,"It addresses the needs of students regardless of race, ethnicity, gender identity, sexual orientation, disability, national origin, or otherwise.","Impact and Belonging Program addresses the needs of historically underserved students regardless of race, ethnicity, gender identity, sexual orientation, disability, national origin, or otherwise.",https://engr.ku.edu/impact-and-belonging,engr.ku.edu
What is a common misconception about landlord responsibility for a renter's property?,A common misconception is that a landlord is legally responsible for loss or damage to a renter's property.,"Generally, a landlord is not legally responsible for loss or damage to a renter's property.",https://iss.ku.edu/renters-insurance,iss.ku.edu
What options do students have for taking courses without affecting their GPA?,Students may elect to take one course a semester for credit/no credit after the last day to drop.,"After the last day to drop, students may elect to take one course a semester for credit/no credit. Credit/No Credit approvals are subject to the policy of the student’s school/college.",https://registrar.ku.edu/definitions,registrar.ku.edu
What specific actions indicate a student’s intent to remain in Kansas indefinitely for residency purposes?,"Intent is exhibited by actions taken, not by a statement of intent.","Intent to remain in Kansas indefinitely. Intent is exhibited by actions taken, not by a statement of intent.",https://registrar.ku.edu/residency,registrar.ku.edu
What additional courses might allow students from other engineering fields to qualify for the Ph.D. programs?,"Students with good preparation in another engineering field, mathematics, or science may qualify for the program by taking appropriate additional undergraduate courses, which normally do not count toward the graduate degree.","Students with good preparation in another engineering field, mathematics, or science may qualify for the program by taking appropriate additional undergraduate courses. Such courses normally do not count toward the graduate degree.",https://eecs.ku.edu/phd-program,eecs.ku.edu
What specific applications of neural networks and fuzzy systems does Swapan Chakrabarti focus on in his research?,He focuses on their applications in bioinformatics and signal processing.,Research — Applications of Neural Networks and Fuzzy Systems in Bioinformatics and Signal Processing,https://eecs.ku.edu/people/swapan-chakrabarti,eecs.ku.edu
What steps should a student take after obtaining an offer letter for CPT?,The student should talk to their CPT course instructor and academic advisor before submitting the CPT e-forms in iHawk.,Step 2: CPT Course Instructor Click to expand Talk to your CPT course instructor and your academic advisor before submitting the CPT e-forms in iHawk.,https://iss.ku.edu/f-1-cpt-curricular-practical-training,iss.ku.edu
What project secured the 2nd place in the Civil Engineering category?,The project titled 'Inception' secured 2nd place in Civil Engineering.,"Civil Engineering 2nd place: Inception Blue Valley West High School Xueji Zou, Jackson Jordan, Cale Regier",https://engr.ku.edu/hsd-2024-winners,engr.ku.edu
What must a student do to place an information hold on their directory information?,"To place an information hold, a student must complete the Request to Remove Information Hold Form.",To release an information hold complete the Request to Remove Information Hold Form.,https://registrar.ku.edu/personal-information-and-privacy,registrar.ku.edu
What is the process for submitting event announcements for the engineering newsletter?,Events and news items for the engineering newsletter will be submitted through the Engineering Connector.,Events and news items for the engineering newsletter will be submitted through the Engineering Connector. (KU log in required.),https://engr.ku.edu/newsletterdigital-signage-submission,engr.ku.edu
What are the consequences of violating the lab's food and drink rule?,"The first offense will result in a verbal warning, a second offense will result in a suspension of the user's account for a full day, a third offense will result in a suspension for a full week, and any further offenses may lead to account removal.",No food or drink is allowed in the labs at any time. Violation of this rule may result in account suspension and/or suspension from the KU School of Engineering. The first offense will result in a verbal warning. A second offense will result in the suspension of the user's account for a full day. A third offense will result in the suspension of the user's account for a full week. Any further offenses will result in the removal of the user's account.,https://engr.ku.edu/computer-labs,engr.ku.edu
Are degree maps considered a substitute for academic advising?,"No, degree maps are not a substitute for academic advising.","The degree maps are useful tools for advisors, students, and parents to use as a general guideline when building class schedules. They are not a substitution for academic advising.",https://registrar.ku.edu/degree-maps,registrar.ku.edu
What resources are available for students looking into credit for prior learning?,The university provides a specific section for determining transferability related to credit for prior learning.,Credit for Prior Learning CredTran Determining Transferability,https://registrar.ku.edu/navigator,registrar.ku.edu
How did Brian McClendon contribute back to the University of Kansas?,"He has been very generous in giving back in terms of his time, talent, means, and energy.","McClendon has been very generous in giving back to the University of Kansas in terms of his time, talent, means, and energy.",https://eecs.ku.edu/node/2489,eecs.ku.edu
How is the role of visualization characterized in the scientific discovery process?,"Visualization is recognized as an integral part of the scientific discovery process, not just a method for displaying final results.","Visualization which is now widely recognized as an integral part of the scientific discovery process, not just a method for displaying final results.",https://eecs.ku.edu/computational-science-and-engineering,eecs.ku.edu
What brand of insurance companies is explicitly mentioned in the passage for renters' insurance?,Progressive and State Farm are explicitly mentioned as insurance companies for renters' insurance.,"There are many insurance companies, here are two: Progressive» State Farm»",https://iss.ku.edu/renters-insurance,iss.ku.edu
What is the expected outcome of the renovation of the Bioinformatics Computing Facility?,The renovation is expected to increase computing power by 20 fold.,The Bioinformatics Computing Facility is undergoing a major renovation that will increase computing power by 20 fold.,https://eecs.ku.edu/computing-biosciences,eecs.ku.edu
When is the VICEROY Virtual Institute scheduled to launch?,The VICEROY Virtual Institute is scheduled to launch in fall 2023.,The VICEROY Virtual Institute is scheduled to launch in fall 2023.,https://eecs.ku.edu/news/article/2023/08/28/eecs-professor-leads-new-15m-virtual-institute-protect-cyberspace,eecs.ku.edu
What are the different graduate programs available in the Bioengineering department?,"The Bioengineering department offers M.S., Accelerated M.S., M.Eng., and Ph.D. programs.",Graduate Degree Program: M.S. Accelerated M.S. M.Eng. Ph.D.,https://bioengr.ku.edu/navigator,bioengr.ku.edu
What areas of research are emphasized in the graduate programs of the Department of Chemical & Petroleum Engineering?,"Research areas include bioengineering, catalysis, renewable energy, sustainability, separations, enhanced oil and gas recovery, and unconventional reservoirs.","Work on cutting-edge research with nationally and internationally recognized faculty in areas including bioengineering, catalysis, renewable energy, sustainability, separations, enhanced oil and gas recovery, unconventional reservoirs, data mining and reservoir characterization, flow in porous media, and reservoir simulation.",http://cpe.engr.ku.edu/department-news,cpe.engr.ku.edu
Are there funding opportunities available specifically for undergraduate researchers?,"Yes, there are funding opportunities such as the Honors Program or the Center for Undergraduate Research.",There are also other ways to fund your research through places like the Honors Program or Center for Undergraduate Research.,https://engr.ku.edu/undergraduate-research-faq,engr.ku.edu
Where can students find their responsibilities and expectations as advised in their graduate program?,Student Advisor Expectations document.,Documents Click to expand ... Student Advisor Expectations,https://bioengr.ku.edu/forms-documents,bioengr.ku.edu
What was Dr. Phil Anderson's notable contribution to amateur radio?,"He designed products that enable the connection of computers to amateur radios, making the hobby more accessible.","His most notable contribution is his design of products that enable the connection of computers to amateur radios, making the hobby more accessible to a wider range of people and additionally finding use in commercial applications such as telemetry and marine navigation.",https://eecs.ku.edu/node/2555,eecs.ku.edu
What types of systems are under research in the EECS computer systems design program?,The research covers a range from small embedded elements to large distributed computing environments.,"From small embedded elements to large distributed computing environments, the breadth of EECS research addresses all computer systems and aspects of the system lifecycle.",https://eecs.ku.edu/computer-systems-design,eecs.ku.edu
"Is there an option for engineering students to study abroad, and if so, how is it referenced in the passage?","Yes, there is a mention of study abroad opportunities for engineering students.",Study Abroad,https://engr.ku.edu/student-involvement,engr.ku.edu
What distinguishes the Summer Orientation sessions for freshmen in engineering?,All Summer Orientation sessions for freshmen admitted directly to the School of Engineering will be one-day programs.,All Summer Orientation sessions for freshmen admitted directly to the School of Engineering the will be one-day programs.,https://engr.ku.edu/after-admission,engr.ku.edu
What types of professionals collaborate in the Biomaterials and Tissue Engineering research track?,"The research involves collaborations among engineers, surgeons, materials scientists, biological scientists, chemists, dentists, and veterinarians.","Research in this inter- and multidisciplinary field involves collaborations among engineers, surgeons, materials scientists, biological scientists, chemists, dentists, and veterinarians in academics, industry, government and the clinic.",https://bioengr.ku.edu/biomaterials-tissue-engineering,bioengr.ku.edu
"What recognition did EECS Ph.D. student Sumant Pathak receive, and at which event?",He received the 'Best Graduate Student Paper' award at the 2017 International Telemetering Conference.,A paper written by EECS Ph.D. student Sumant Pathak received the 'Best Graduate Student Paper' award at the 2017 International Telemetering Conference (ITC).,https://eecs.ku.edu/news?page=4,eecs.ku.edu
What unique research opportunities are available to students in the Engineering Physics program?,Students can engage in cutting edge research experiences that range from A (Automobiles) to Z (Z bosons).,They can have cutting edge research experiences that run the gamut from A (Automobiles) to Z (Z bosons).,http://ephx.engr.ku.edu/digital-electronic-systems,ephx.engr.ku.edu
Who leads the research efforts at KU School of Engineering?,Research at KU School of Engineering is led by Associate Dean for Research and Graduate Programs Suzanne Shontz.,Research at KU School of Engineering is led by Associate Dean for Research and Graduate Programs Suzanne Shontz.,https://engr.ku.edu/research,engr.ku.edu
What types of living arrangements are available through the KU Department of Student Housing?,"The options include residence halls, private room with bath, suite with semi-private bath, scholarship halls, or on-campus apartments.","The KU Department of Student Housing offers a variety of on-campus living options, including residence halls, private room with bath, suite with semi-private bath, scholarship halls, or on-campus apartments.",https://iss.ku.edu/on-campus-housing,iss.ku.edu
What educational approach does the KU Chemical & Petroleum Engineering Department emphasize?,The department emphasizes hands-on education based on industrial problems and real-world examples.,Learn more about how hands-on education based on industrial problems and real-world examples taught by expert faculty can start your path to a successful career.,http://cpe.engr.ku.edu/research-areas,cpe.engr.ku.edu
What is the minimum GPA required for students to earn the RF Systems Engineering Graduate Certificate?,Students must have a GPA of 3.0 or better on the required courses.,(a) students must have a GPA of 3.0 or better on the required courses;,https://eecs.ku.edu/current/rf-systems-engineering-graduate-certificate,eecs.ku.edu
How can students save their selected transfer courses using CredTran?,Students can save their selected courses by checking the box next to each course they want to save and clicking the 'My Saved' button.,"To create a personalized list of your transfer courses, check the box next to each course you want to save, then click the 'My Saved' button.",https://registrar.ku.edu/credittransfer,registrar.ku.edu
What aspects of student life are covered under the 'Academic Experience' in the passage?,The 'Academic Experience' encompasses admissions requirements for undergraduate degrees as well as academic-related information.,Admissions Requirements - Undergraduate Degree Academic Experience,https://eecs.ku.edu/navigator,eecs.ku.edu
How does the Department of Chemical & Petroleum Engineering approach education?,The department integrates teaching excellence and research innovation to educate students and produce future leaders.,KU Chemical & Petroleum Engineering integrates teaching excellence and research innovation to educate students and produce future leaders.,http://cpe.engr.ku.edu/enrollment-resources,cpe.engr.ku.edu
What is the requirement for committee members for master's and doctoral students when submitting a Plan of Study?,"Master's students are required to enter at least three committee members, while doctoral students must enter at least five committee members, including one outside member.","master's students are required to enter in at least three committee members, and doctoral students are required to enter at least five committee members including one outside member.",https://engr.ku.edu/plan-study,engr.ku.edu
Which techniques are suggested by Andrew Stratmann to enhance user experience in mobile mmWave networks?,Stratmann presents a hybrid multi-user scheduling solution that integrates a blockage-aware scheduling strategy with a mobility-aware geometric model.,Our approach integrates two key components: (i) a blockage-aware scheduling strategy modeled via a Restless Multi-Armed Bandit (RMAB) formulation ... and (ii) a mobility-aware geometric model that estimates beam alignment overhead cost as a function of receiver motion.,https://eecs.ku.edu/defense-notices?page=%2C1,eecs.ku.edu
What is the primary purpose of the Materials Characterization Laboratory mentioned in the passage?,The Materials Characterization Laboratory is primarily used for analyzing materials.,The Materials Characterization Laboratory is utilized for analyzing materials.,https://engr.ku.edu/engineering-physics-facilities,engr.ku.edu
What distinguishes the atmosphere of the KU Bioengineering program as mentioned in the passage?,The program is described as having a great sense of community and work-life balance.,Great sense of community and work-life balance.,https://bioengr.ku.edu/,bioengr.ku.edu
What significant financial commitment did The Wonderful Company make to the newly renamed WISE-KU?,$5 million commitment to promote sustainable engineering initiatives.,Along with the rebranding comes a $5 million commitment to promote sustainable engineering initiatives.,https://engr.ku.edu/news/article/university-of-kansas-renames-institute-for-sustainable-engineering-after-the-wonderful-company,engr.ku.edu
Is a coursework-only Master of Science degree available in bioengineering at KU?,"No, the MS in Bioengineering requires a thesis; however, a coursework-only Master of Engineering (MEng) degree is available.","Is a “coursework only” MS degree in bioengineering available? Click to expand No. The MS in Bioengineering requires a thesis. However, students can earn a coursework only Master of Engineering (MEng) degree.",https://bioengr.ku.edu/faqs,bioengr.ku.edu
Which director is also responsible for the Advancement in Kansas Program?,"Ken Fischer, Ph.D.","Ken Fischer, Ph.D. -Director, Bioengineering -Director, Biomechanical Rehabilitation Engineering Advancement in Kansas Program.",https://bioengr.ku.edu/leadership,bioengr.ku.edu
What type of award did the KU ACM student chapter receive in 2005?,They received the 2005 Outstanding Chapter Activities Award.,The KU Association for Computing Machinery (ACM) student chapter garnered the 2005 Outstanding Chapter Activities Award.,https://eecs.ku.edu/news?page=14,eecs.ku.edu
How can undergraduate students get involved in research at KU?,Students can get involved in research through a specific faculty member or through the KU Center for Undergraduate Research.,Undergraduate students interested in research or graduate study are encouraged to get involved in a research lab in their focus area. This may be developed through a specific faculty member or through the KU Center for Undergraduate Research.,https://engr.ku.edu/undergraduate-research,engr.ku.edu
"Which student has a hometown listed as 'Mons, BE'?","Sydney Kindsvater has a hometown listed as Mons, BE.","Sydney Kindsvater Mechanical Engineering, 2025 Hometown: Mons, BE",https://engr.ku.edu/self-class-2025,engr.ku.edu
What additional coverage may J-2 dependents need if their policy does not include specific services?,They may need to purchase a standalone Emergency Evacuation and Repatriation policy.,"If the health insurance policy does not provide coverage of Emergency Evacuation and Repatriation, you may purchase a standalone Emergency Evacuation and Repatriation policy.",https://iss.ku.edu/proof-insurance-j-2-dependents,iss.ku.edu
What engineering disciplines are included in the list of departments for the SELF Fellows?,"The disciplines include Aerospace Engineering, Applied Computing, Architectural Engineering, Chemical Engineering, Civil Engineering, Computer Engineering, Computer Science, Electrical Engineering, and Mechanical Engineering.",By Department Aerospace Engineering Applied Computing Architectural Engineering Chemical Engineering Civil Engineering Computer Engineering Computer Science Electrical Engineering Mechanical Engineering,https://engr.ku.edu/self-fellows,engr.ku.edu
What type of preceptorship is required for students in the Biomedical Product Design and Development Track?,A clinical or industrial preceptorship is required to give students practical exposure to applied biomedical research and development.,A clinical or industrial preceptorship is required to give students practical exposure to applied biomedical research and development.,https://bioengr.ku.edu/biomedical-product-design-development,bioengr.ku.edu
Can a person hold multiple visas at the same time while in the U.S.?,"You may have more than one visa in your passport, but can only hold one status while in the United States.","If you have visited the U.S. for different purposes, you may have more than one visa in your passport. However, you can have only one status while you are in the United States.",https://iss.ku.edu/about-your-visa-scholar,iss.ku.edu
What documentation do J-1 students need to submit along with their SSN application?,"J-1 students must submit their original immigration documents, ISS work authorization letter, and application reference number along with their SSN application.","Take all original immigration documents, ISS work authorization letter, and application reference number to the Social Security Administration.",https://iss.ku.edu/social-security-number-application,iss.ku.edu
Which laboratory conducts research related to human motion control?,The Human Motion Control Laboratory.,Human Motion Control Laboratory - Wilson...,https://bioengr.ku.edu/research,bioengr.ku.edu
What specific personal attributes are SELF Fellows expected to demonstrate?,"SELF Fellows are expected to demonstrate integrity, humility, curiosity, creativity, academic excellence, perseverance, and diligence.","Those who receive the fellowship shall be accountable to themselves, their peers, and the program to continuously seek to demonstrate to the highest extent possible: integrity, humility, curiosity, creativity, academic excellence, perseverance and diligence while deepening their skills as represented by the seven pillars of the SELF Program.",https://engr.ku.edu/self-engineering-leadership-fellows-program,engr.ku.edu
What are the key areas of research for graduate students in the Chemical & Petroleum Engineering department?,"Graduate students work on cutting-edge research in bioengineering, catalysis, renewable energy, sustainability, separations, enhanced oil and gas recovery, unconventional reservoirs, data mining and reservoir characterization, flow in porous media, and reservoir simulation.","Work on cutting-edge research with nationally and internationally recognized faculty in areas including bioengineering, catalysis, renewable energy, sustainability, separations, enhanced oil and gas recovery, unconventional reservoirs, data mining and reservoir characterization, flow in porous media, and reservoir simulation.",http://cpe.engr.ku.edu/staff-profiles,cpe.engr.ku.edu
What is the purpose of the secondary inspection by CBP?,The secondary inspection may be conducted for additional time to look at your documents and perform more inspections.,"The CBP officer’s decision to send a person to secondary inspection is sometimes random, or it may be because they decided they needed more time to look at your documents and perform additional inspections.",https://iss.ku.edu/entry-newly-admitted,iss.ku.edu
What is a fun fact about Kabir Panahi?,A fun fact is that he can eat 4 pounds of lamb by himself.,Fun fact is I can eat 4 pounds of lamb by myself.,https://engr.ku.edu/people/kabir-panahi,engr.ku.edu
What educational approach does the Department of Chemical & Petroleum Engineering emphasize?,The department emphasizes hands-on education based on industrial problems and real-world examples.,Learn more about how hands-on education based on industrial problems and real-world examples taught by expert faculty can start your path to a successful career.,http://cpe.engr.ku.edu/resources-undergraduate,cpe.engr.ku.edu
"What educational approach did the winning app, Simulearn, utilize?",Simulearn presents users with engaging Python coding exercises tied to real-world home automation tasks.,"They developed Simulearn, a webapp that presents users with a series of engaging Python coding exercises that tie beginner programming concepts to real-world home automation tasks.",https://eecs.ku.edu/news/article/2023/04/18/ku-eecs-team-winner-regional-code-thon-competition,eecs.ku.edu
What resources are available for students regarding tuition and fees?,The Office of the University Registrar provides a comprehensive tuition and fee schedule to help students calculate their costs.,A KU degree is a valuable investment. We’re here to inform and advise you as you prepare for and pursue a successful career as a Jayhawk. Calculate Your Costs Tuition and Fees Residency.,https://registrar.ku.edu/,registrar.ku.edu
How does bioimaging contribute to the field of bioinformatics?,Gene-array imaging and analysis provide data for mining with the techniques used in bioinformatics.,"For example, as part of bioimaging, gene-array imaging and analysis provide data for mining with the techniques used in bioinformatics.",http://bioengr.ku.edu/bioimaging,bioengr.ku.edu
What should students do if they receive a grade of 'C' in their classes?,"A grade of 'C' can be counted towards the degree, but it may bring the GPA below 3.0, causing academic probation or potential dismissal.","A grade of 'C' can be counted toward your degree, but may cause your graduate GPA to go below the required 3.0 to remain in good academic standing. This may require that you be placed on academic probation and could lead to dismissal from the graduate program.",https://engr.ku.edu/current-graduate-students,engr.ku.edu
What unique opportunities does KU Bioengineering provide for student achievements?,"Students can achieve patents, start-ups, and work with nationally ranked companies.","Student achievements include patents, start-ups, and nationally ranked companies.",http://bio.engr.ku.edu/,bio.engr.ku.edu
Where is the KU Engineering Complex located?,The KU Engineering Complex is located at 1536 W. 15th St.,"The public is invited to Expo events from noon-3 p.m. Feb. 23 at the KU Engineering Complex, 1536 W. 15th St.",https://engr.ku.edu/desa-nomination,engr.ku.edu
What is required for a student under 18 years of age when signing the I-20?,A parent or guardian must also sign the I-20 in the section beneath the student's signature.,"Then sign and date the I-20 in the STUDENT ATTESTATION box on your original paper I-20. If you are under 18 years of age, your parent or guardian must also sign your I-20 in the section beneath your signature.",https://iss.ku.edu/applying-your-i-20ds-2019-form,iss.ku.edu
What should users do if the methods to save a transcript as an independent document do not work?,Users may need to consult the maker of their computer/administrative software to identify available methods to convert a PDF into a word file/unprotected file.,"If the options below do not work, you may need to consult the maker of your own computer/administrative software to identify available methods to convert a PDF into a word file/unprotected file.",https://registrar.ku.edu/electronic-transcript-faq,registrar.ku.edu
What resource does the U.S. Department of State offer related to B-2 tourist visas?,The U.S. Department of State provides an excellent overview on B-2 Tourist Visas.,The U.S. Department of State provides an excellent overview on B-2 Tourist Visas.,https://iss.ku.edu/invitation-letter-family,iss.ku.edu
What are the four design options available for undergraduate students in the Engineering Physics program at KU?,"The four design options are Aerospace Systems, Chemical Systems, Digital Electronic Systems, and Electromechanical Control Systems.","The program offers a B.S. degree in engineering physics with opportunities to pursue one of four design options: Aerospace Systems, Chemical Systems, Digital Electronic Systems, and Electromechanical Control Systems.",http://ephx.engr.ku.edu/admissions,ephx.engr.ku.edu
How will the transition to the KU Core 34 impact students who have already completed courses under the previous KU Core model?,They will have one calendar year to opt-out of the KU Core 34 if they started at KU in the specified semesters.,"Transfer students starting in Fall 2024, Spring 2025, or Summer 2025 will have one calendar year to opt-out of the KU Core 34.",https://registrar.ku.edu/systemwide-gen-ed,registrar.ku.edu
How many distinct tracks are mentioned for the Master's degree programs?,There are six distinct tracks mentioned for the Master's degree programs.,"Bioimaging Track, Biomaterials & Tissue Engineering Track, Biomechanics & Neural Engineering Track, Biomedical Product Design & Development Track, Biomolecular Engineering Track, Computational Bioengineering Track.",http://bioengr.ku.edu/degree-requirements,bioengr.ku.edu
Which Engineering Physics concentrations allow for specialization in aerospace systems?,The Engineering Physics with Aerospace Systems concentration allows for specialization in aerospace systems.,Engineering Physics with Aerospace Systems concentration,https://engr.ku.edu/advising/degree-plans,engr.ku.edu
What innovative approaches does the Chemical & Petroleum Engineering department utilize in teaching?,The department utilizes hands-on education based on industrial problems and real-world examples.,Learn more about how hands-on education based on industrial problems and real-world examples taught by expert faculty can start your path to a successful career.,http://cpe.engr.ku.edu/staff-profiles,cpe.engr.ku.edu
What characterizes an 'Independent Study' course component?,An Independent Study course is designed to meet the needs of an individual student and may include individualized instruction or directed readings.,Independent Study IND Individualized instruction Course designed to meet the needs of an individual student. May include individualized instruction or directed readings.,https://registrar.ku.edu/definitions-course-components,registrar.ku.edu
Which professional societies is Carlton Leuschen a member of?,He is a member of the Institute of Electrical and Electronics Engineers and the IEEE Geoscience and Remote Sensing Society.,Memberships — Institute of Electrical and Electronics Engineers IEEE Geoscience and Remote Sensing Society.,https://eecs.ku.edu/people/carlton-leuschen,eecs.ku.edu
What educational approach does the petroleum engineering program emphasize?,The program emphasizes hands-on education based on industrial problems and real-world examples.,Learn more about how hands-on education based on industrial problems and real-world examples taught by expert faculty can start your path to a successful career.,http://cpe.engr.ku.edu/research-and-job-opportunities,cpe.engr.ku.edu
What types of documents must be included when applying for reinstatement to legal F-1 status?,"Supporting documents can include the student's transcript, medical records, a letter from an academic advisor, proof of finances, and a personal letter explaining the circumstances of their status violation.",Supporting documents. Include documents that support what you claim in your personal letter. This might include such things as your transcript (or printout of Degree Progress Report from MyKU) to show your academic record or medical records/letters from a doctor to confirm a medical condition.,https://iss.ku.edu/f-1-regaining-legal-status,iss.ku.edu
What types of laboratories are included in the facilities of I2S?,"I2S facilities include the Kansas Applied Research Laboratory, RF Measurement Laboratory, Optical and Photonics Systems Laboratories, a High-Performance Computing Cluster & File Storage, the Cyber-physical Laboratory, Cybersecurity Laboratory, and the Blockchain Laboratory.","I2S facilities include: the Kansas Applied Research Laboratory, RF Measurement Laboratory, Optical and Photonics Systems Laboratories, a High-Performance Computing Cluster & File Storage, the Cyber-physical Laboratory, Cybersecurity Laboratory and the Blockchain Laboratory.",https://eecs.ku.edu/research-facilities,eecs.ku.edu
What notable achievement is highlighted among KU Aerospace Engineering alumni?,"Four NASA astronauts earned degrees at KU, including one in the 2017 astronaut class.","KU Aerospace Engineering is one of the top programs in the world in aircraft and engine design education. Four NASA astronauts earned degrees at KU, including one in the 2017 astronaut class.",https://engr.ku.edu,engr.ku.edu
How many categories of scholarships are mentioned in the passage?,Four categories of scholarships are mentioned.,"The School of Engineering has a wide variety of scholarship offerings available for undergraduate, graduate and underrepresented students. See a complete listing at one of the sections below. Research Undergraduate Scholarships Graduate Scholarships IHAWKe Scholarships SELF.",https://engr.ku.edu/scholarships,engr.ku.edu
Where can completed prints be picked up after using printing services?,Completed prints can be picked up in front of Room 1001 in Eaton Hall.,Completed prints can be picked up in front of Room 1001 in Eaton Hall.,https://engr.ku.edu/technology-service-center,engr.ku.edu
What specific financial documentation is recommended for evidence of support for J-1 and J-2 visa applicants?,"USCIS Form I-134 is recommended as evidence of financial support, along with past four months of bank statements.",Evidence of financial support. USCIS Form I-134 is recommended. Other evidence that may be sufficient: Past 4 months of bank statements (a letter from the bank is insufficient).,https://iss.ku.edu/cos-travel-and-re-entry,iss.ku.edu
What academic prerequisites are necessary for admission to the Master of Engineering in Bioengineering program?,"Applicants are expected to have completed calculus I and II, differential equations, linear algebra, general physics I and II, chemistry, and biology, along with relevant track prerequisites.","General prerequisites include calculus I and II, differential equations, linear algebra, general physics I and II, chemistry, and biology. Track prerequisites depend on the student’s track of study.",https://bioengr.ku.edu/master-engineering,bioengr.ku.edu
What unique funding statistic is mentioned regarding graduate students in EECS?,75% of EECS graduate students receive funding from assistantships or fellowships.,75% Of EECS Graduate Students Receive Funding from Assistantships or Fellowships,https://eecs.ku.edu/,eecs.ku.edu
Which two students in the Mechanical Engineering program share the same hometown?,"Maleena Baha and Glory Gladden both hail from Overland Park, KS.","Maleena Baha Mechanical Engineering, 2027 Hometown: Overland Park, KS; Glory Gladden Mechanical Engineering, 2027 Hometown: Overland Park, KS.",https://engr.ku.edu/self-mechanical-engineering,engr.ku.edu
Is a travel signature required for J-1 scholars when leaving the U.S.?,"No, a travel signature is not required to leave the U.S.",A travel signature is relevant only to J-1 scholars (and their dependents) who are planning to travel abroad and return to the U.S. in J status. You do not need a travel signature to leave the U.S.,https://iss.ku.edu/travel-signatures-and-ds-2019-reprint-j-scholar,iss.ku.edu
Where is Elaina Sutley's office located?,"Her office is located in Eaton Hall, room 1, suite 1B2, 1520 W. 15th Street, Lawrence, KS 66045.","Eaton Hall, room 1, suite 1B2 1520 W. 15th Street Lawrence, KS 66045",https://engr.ku.edu/people/elaina-sutley,engr.ku.edu
Which professor at the University of Kansas has a distinguished chair in Biomedical Sciences?,"Andrew Godwin, Ph.D., holds the Chancellor's Distinguished Chair in Biomedical Sciences.","Andrew Godwin, Ph.D. -Chancellors Distinguished Chair in Biomedical Sciences and Endowed Professor -Professor and Director of Molecular Oncology, Pathology and Laboratory Medicine...",http://bio.engr.ku.edu/academic-affiliates,bio.engr.ku.edu
What are the four design options available for students pursuing a B.S. in Engineering Physics at KU?,"The four design options are Aerospace Systems, Chemical Systems, Digital Electronic Systems, and Electromechanical Control Systems.","The program offers a B.S. degree in engineering physics with opportunities to pursue one of four design options: Aerospace Systems, Chemical Systems, Digital Electronic Systems, and Electromechanical Control Systems.",http://ephx.engr.ku.edu/electromechanical-control-systems,ephx.engr.ku.edu
How can engineering faculty submit requests for software for the upcoming academic year?,Faculty should use the software request form and submit requests no later than August 1st of the upcoming academic year.,Please use the software request form to submit requests for the upcoming academic year. Please submit no later than August 1st of the upcoming academic year.,https://engr.ku.edu/technology-service-center,engr.ku.edu
Is there a specific engineering track focused on product design?,"Yes, there is a Biomedical Product Design & Development Track.",Masters of Engineering Requirements Click to expand... Biomedical Product Design & Development Track...,http://bio.engr.ku.edu/degree-requirements,bio.engr.ku.edu
What is required for international applicants regarding financial support when applying to the Master of Engineering program?,"International applicants must provide proof of financial resources to obtain an I-20 and student visa, such as an official bank statement, but this documentation is not required for admission decisions.","Although the financial statement is not required for making admission decisions, the U.S. Department of State mandates that evidence of financial resources, such as an official bank statement, be provided in order to issue an I-20 and student visa.",https://bioengr.ku.edu/master-engineering,bioengr.ku.edu
What is one of Derek Zomer's responsibilities related to student support?,He works closely with Jayhawk Academic Advising to ensure students are on the right track for graduation.,"In this role, he works closely with Jayhawk Academic Advising to ensure students are on the right track for graduation.",https://eecs.ku.edu/people/derek-zomer,eecs.ku.edu
Who led the EECS faculty at the University of Kansas that received a nomination at the SC23 conference?,Associate Professor Esam El-Araby led the EECS faculty.,"In a commendable recognition, the EECS faculty at the University of Kansas, led by Associate Professor Esam El-Araby, was nominated for the prestigious Best Research Poster Award at the 2023 International Conference for High-Performance Computing, Networking, Storage, and Analysis (SC23).",https://eecs.ku.edu/news/article/2023/11/16/quantum-brilliance-takes-center-stage-sc23-conference,eecs.ku.edu
What is one of the key focuses in Ward Thompson's research?,"Ward Thompson focuses on understanding chemical dynamics in liquids, specifically how and how fast molecules move and react.","His work focuses on understanding chemical dynamics in liquids, namely how, and how fast, molecules move and react.",https://engr.ku.edu/news/article/engineering-professor-named-aaas-fellow,engr.ku.edu
What is required of a senior citizen student regarding class grading if they apply for the Senior Citizen Rate?,They agree to receive a grade of NE (not evaluated) for all classes for any semester in which they are applying the senior citizen waiver.,They agree to receive a grade of NE (not evaluated) for all classes for any semester in which they are applying the senior citizen waiver.,https://registrar.ku.edu/senior-citizen-students,registrar.ku.edu
Which professor focuses on both software security and performance within the EECS research team?,Prasad Kulkarni focuses on software security and software performance.,Primary Research Interests Software security Software performance Compiler optimizations Virtual Machines and Runtime Systems.,https://eecs.ku.edu/computer-systems-design,eecs.ku.edu
What are the specific requirements a student must meet regarding their course enrollment to qualify for the Field Work waiver?,Students must be enrolled only in course work taught by appointment and must not be employed on campus.,"Eligibility: Students must be enrolled only in course work taught by appointment and must reside and complete all academic work outside the area served by the Lawrence, KS postal service for the semester that they are applying for the Field Work waiver. A student must not be employed on campus or applying for staff reduction rates.",https://registrar.ku.edu/field-work-waiver,registrar.ku.edu
"How many faculty members are affiliated with KU's Bioengineering Program, and what is their collaborative focus?","More than 80 faculty from more than 30 multidisciplinary departments and centers across KU and the KU Medical Center are affiliated with KU’s Bioengineering Program, focusing on establishing productive collaborations of translational research.","More than 80 faculty from more than 30 multidisciplinary departments and centers across KU and the KU Medical Center are affiliated with KU’s Bioengineering Program. The faculty are highly collaborative and strive to cultivate strong relationships with professionals, businesses, and government agencies, with the goal of establishing productive collaborations of translational research that truly makes a difference.",https://engr.ku.edu/bioengineering-brochure-2023,engr.ku.edu
What emphases are offered within the chemical engineering program at the University of Kansas?,"Emphases offered include Biomedical, Data Science, Environmental, Material Science, Premedical, and Petroleum Engineering.","Discover chemical engineering and the emphases we offer in Biomedical, Data Science, Environmental, Material Science, Premedical, and Petroleum Engineering.",http://cpe.engr.ku.edu/chemical-engineering,cpe.engr.ku.edu
What is the purpose of the comprehensive examination in the Ph.D. bioengineering program?,The comprehensive examination is intended to assure that the student has the potential to become an independent investigator.,The major examination in a doctoral student's career is the comprehensive examination. It is intended to assure that the student has potential to become an independent investigator.,http://bio.engr.ku.edu/phd,bio.engr.ku.edu
What should students do if they want to attend an orientation session?,"Students are encouraged to register early for an Orientation session, as many sessions fill to capacity.","Students are encouraged to register early for an Orientation session, as many sessions fill to capacity.",https://engr.ku.edu/after-admission,engr.ku.edu
What specific information must be included in the documents submitted for the Out of Country Waiver?,"The documents must include your name, the name of the airline company, flight numbers, and dates of flights including day, month, and year.","If you are submitting airline ticket or flight itinerary, documents must include your name, name of airline company, flight numbers, date of flights which includes day, month, year.",https://iss.ku.edu/out-country-waiver,iss.ku.edu
Which areas of cutting-edge research are highlighted in the graduate programs for chemical and petroleum engineering?,"Graduate programs focus on bioengineering, catalysis, renewable energy, sustainability, separations, enhanced oil and gas recovery, unconventional reservoirs, data mining, and more.","Work on cutting-edge research with nationally and internationally recognized faculty in areas including bioengineering, catalysis, renewable energy, sustainability, separations, enhanced oil and gas recovery, unconventional reservoirs, data mining and reservoir characterization, flow in porous media, and reservoir simulation.",http://cpe.engr.ku.edu/,cpe.engr.ku.edu
What educational objectives are outlined for understanding software systems?,"Understand mathematical concepts of formal languages, techniques for analyzing time and space complexity of software systems, and specifying mathematical structures for software artifacts.",Program Objectives Understand mathematical concepts of formal languages. Understand techniques for analyzing time and space complexity of software systems. Understand basic techniques for specifying mathematical structures for describing software artifacts.,https://eecs.ku.edu/theory-computing,eecs.ku.edu
What is the monetary threshold to become a member of the Deans Club at KU School of Engineering?,"To become a member of the Deans Club, donors must make an annual gift of $1,000 or more to the School of Engineering.","Deans Club donors make an annual gift of $1,000 or more to the School of Engineering.",https://engr.ku.edu/alumni-friends,engr.ku.edu
What degree backgrounds are encouraged for applicants to the KU BioE Graduate Program?,"Applicants normally have a Bachelors of Science degree or a Masters of Science degree in an engineering discipline, physical sciences, the life sciences, or a closely related field.","Applicants normally have a Bachelors of Science degree or a Masters of Science degree in an engineering discipline, physical sciences (e.g. Chemistry, Physics, etc.), the life sciences (e.g. Biology, Biochemistry, etc.), or a closely related field.",http://bioengr.ku.edu/entrance-requirements-track,bioengr.ku.edu
What achievements did Icorium Engineering Company accomplish at the Rice Business Plan Competition?,"Icorium Engineering Company, a sustainable engineering startup and spin-out from KU, placed fifth and won more than $180,000 in investments and nondilutive cash and in-kind prizes.","Icorium Engineering Company earns top-5 finish at 2024 Rice Business Plan Competition Icorium Engineering Company, a sustainable engineering startup and spin-out company from KU, recently placed fifth overall and won more than $180,000 in investments and nondilutive cash and in-kind prizes at the prestigious Rice Business Plan Competition at Rice University in Houston.",https://engr.ku.edu/news,engr.ku.edu
Can students who are currently enrolled in the Undergraduate Bioengineering Certificate still complete it?,"Yes, students who have the Undergraduate Bioengineering Certificate as part of their program can complete the certificate along with their degree.","However, students who have the Undergraduate Bioengineering Certificate as part of their program currently, may complete the certificate along with their degree.",http://bioengr.ku.edu/undergraduate-certificate,bioengr.ku.edu
When was the information about Fall 2025 short courses last updated?,"The information was last updated on April 1, 2025.","Last updated on April 1, 2025.",https://registrar.ku.edu/fall-2025-short-courses,registrar.ku.edu
"What is Ted Peltier, Ph.D.'s role within the Civil, Environmental and Architectural Engineering department?",He is the Professor and Dean R. and Florence W. Frisbie Associate Chair for Undergraduate Studies.,"Ted Peltier, Ph.D. -Professor, Civil, Environmental and Architectural Engineering -Dean R. and Florence W. Frisbie Associate Chair for Undergraduate Studies",https://bioengr.ku.edu/academic-affiliates,bioengr.ku.edu
How does the Mechanical Engineering program at the University of Kansas view continuous learning for its graduates?,The program encourages graduates to actively engage in continuous learning and professional growth throughout their careers.,Actively engaged in continuous learning and professional growth throughout their careers while productively contributing to their organizations and communities.,http://me.engr.ku.edu/faculty-research,me.engr.ku.edu
What accreditation does the Engineering Physics Bachelor of Science program hold?,The program is accredited by the Engineering Accreditation Commission of ABET.,The Engineering Physics Bachelor of Science program is accredited by the Engineering Accreditation Commission of ABET.,http://ephx.engr.ku.edu/digital-electronic-systems,ephx.engr.ku.edu
How can high school counselors schedule a visit for their students to the School of Engineering?,"They can reach out to the Student recruiter, Brian Murakami, at brian.murakami@ku.edu.","If you are a high school counselor or a teacher looking to bring a group of your students to visit, please reach out to our Student recruiter, Brian Murakami, at brian.murakami@ku.edu.",https://engr.ku.edu/explore,engr.ku.edu
What are Scott Lanigan's educational qualifications?,"He holds a B.A. in Mathematics, a B.A. in Philosophy, and an M.A. in Mathematics from Eastern Illinois University.","Education — B.A. in Mathematics, Eastern Illinois University, 1994 B.A. in Philosophy, Eastern Illinois University, 1994 M.A. in Mathematics, Eastern Illinois University, 1996",https://registrar.ku.edu/people/scott-lanigan,registrar.ku.edu
In what specific areas are students trained to apply their engineering principles?,"Students are trained to apply basic sciences to medical and biological problems, using engineering principles.","Train students to: Apply basic sciences to medical and biological problems, using engineering principles.",https://bioengr.ku.edu/overview,bioengr.ku.edu
Which emphasis areas are available in the Chemical Engineering program at the University of Kansas?,"The emphasis areas offered include Biomedical, Data Science, Environmental, Material Science, Premedical, and Petroleum Engineering.","Discover chemical engineering and the emphases we offer in Biomedical, Data Science, Environmental, Material Science, Premedical, and Petroleum Engineering.",http://cpe.engr.ku.edu/degrees-and-curriculum,cpe.engr.ku.edu
What should students do if they plan to transfer a class during their last semester at KU?,Students must submit a 30-Hour Requirement Exception Form before planning to take the class outside of KU.,"Though, students may petition their dean for a waiver of this rule. If you are planning to transfer a course into KU during your last 30 hours, please submit a 30-Hour Requirement Exception Form before you plan to take the class outside of KU.",https://engr.ku.edu/advising,engr.ku.edu
What document is created when a person is admitted into the U.S. with a visa?,An electronic I-94 Arrival Record is generated when you are admitted.,The status in which you are admitted by a Customs and Border Protection (CBP) Officer is stamped in your passport and generates an electronic I-94 Arrival Record.,https://iss.ku.edu/about-your-visa-scholar,iss.ku.edu
Which emphases does the Chemical Engineering program at KU offer?,"The program offers emphases in Biomedical, Data Science, Environmental, Material Science, Premedical, and Petroleum Engineering.","Discover chemical engineering and the emphases we offer in Biomedical, Data Science, Environmental, Material Science, Premedical, and Petroleum Engineering.",http://cpe.engr.ku.edu/staff-profiles,cpe.engr.ku.edu
What is the minimum grade required for transfer credits to count towards degree requirements?,The minimum grade required for transfer credit to count towards degree requirements is a C- or higher; grades of D+ and below are not applied.,Transfer credit with grades of D+ and below are not applied towards degree requirements.,https://registrar.ku.edu/credittransfer,registrar.ku.edu
What information can students find in the Graduate Program Handbook?,Students can find the Plan of Study Requirements and information regarding the timeline for their respective degrees.,Documents Click to expand Breadth Course Master List Comprehensive Exam Information Masters Timeline Ph.D. Timeline Plan of Study Tutorial Graduate Program Handbook Qualifying Exam Information Steps to Graduation Student Advisor Expectations Plan of Study Requirements.,http://bioengr.ku.edu/forms-documents,bioengr.ku.edu
How did Professor Erik Perrins contribute to the 2024 EECS Graduation Dinner and Awards Ceremony?,"Professor Erik Perrins opened the ceremony with words of congratulations and encouragement for the new graduates, emphasizing the significance of community.","Professor Erik Perrins, Chair of the EECS department, opened the ceremony with words of congratulations and encouragement for the new graduates. He commended them for their remarkable achievements and invited them to reflect on their journey within the department.",https://eecs.ku.edu/news/article/2024/04/26/eecs-honors-excellence-highlights-2024-graduation-dinner-and-awards-ceremony,eecs.ku.edu
What is the charge for late payments of tuition and fees?,A late payment fee of $100.00 for fall/spring and $50.00 for summer is assessed each month for any unpaid balance.,"Late Payment Fee Assessed each month for any unpaid tuition and fee balance for two consecutive months. If unpaid balance remains after two months, the late payment fee will default to 1.5% of the total unpaid 'tuition and related fees' balance owed beginning with the third month. Fall/Spring - $100.00 Summer - $50.00",https://registrar.ku.edu/fy-2024-specialized-tuition-fees,registrar.ku.edu
Which individual's research focus includes Bioimaging?,"Xinmai Yang, Ph.D.","Xinmai Yang, Ph.D. -Graduate Studies Director, Bioengineering -Track Director, Bioimaging -Professor, Mechanical Engineering.",https://bioengr.ku.edu/leadership,bioengr.ku.edu
Who should be contacted for more information about investing in KU Bioengineering endowments?,"Caleb Regan, the School of Engineering Development Director and Team Leader, should be contacted for more information about investing in KU Bioengineering.","To discuss opportunities to invest in KU Bioengineering... please contact the School of Engineering Development Director and Team Leader, Caleb Regan...",http://bio.engr.ku.edu/donate,bio.engr.ku.edu
What types of academic calendars are available for different semesters in 2025?,"The academic calendars available for 2025 include Spring 2025, Summer 2025, and Fall 2025.",Spring 2025 Academic Calendar Select to follow link Summer 2025 Academic Calendar Select to follow link Fall 2025 Academic Calendar Select to follow link,https://registrar.ku.edu/academic-calendar,registrar.ku.edu
What is the purpose of the GEA Travel Grant?,The GEA Travel Grant supports graduate students in their academic and research endeavors by providing funding for travel related to their studies.,GEA Travel Grant GEA Research Showcase ... Graduate Engineering Ambassadors,https://engr.ku.edu/navigator,engr.ku.edu
What is the role of the Building Emergency Liaison during evacuation drills?,The Building Emergency Liaison is expected to perform the assigned duties as if in an actual emergency situation.,"In the conduct of drills, emphasis shall be placed upon orderly evacuation under proper discipline rather than upon speed. The Building Emergency Liaison is expected to perform the assigned duties as if in an actual emergency situation.",https://engr.ku.edu/easton-hall-emergency-evacuation-plan,engr.ku.edu
What exemptions exist for readmitted students regarding the International Student Orientation?,Readmitted students are exempt from the International Student Orientation but still required to complete check-ins with ISS and Watkins Health Services.,"*Readmitted students are exempt from ISO. However, they are still required to complete check-ins with ISS and Watkins Health Services.",https://iss.ku.edu/register-international-student-orientation,iss.ku.edu
What features contribute to the reputation of the Chemical Engineering faculty at the University of Kansas?,The faculty are described as world-renowned and are equipped to prepare students to solve problems and positively impact the world.,"Chemical Engineering World renowned faculty, state-of-the-art facilities, innovative teaching and research prepare students to solve problems and positively impact the world.",http://cpe.engr.ku.edu/accreditation,cpe.engr.ku.edu
What additional step must a student take if someone else will pick up their diploma on their behalf?,They must submit the Authorization for 3rd Party Pick-Up to give the university permission to release the diploma to that person.,"If a student needs another person to pick up their diploma, they must submit the Authorization for 3rd Party Pick-Up to give the university permission to release it to them.",https://registrar.ku.edu/diplomas,registrar.ku.edu
What are some specific types of unmanned aerial vehicles (UAVs) that Ron Barrett-Gonzalez's lab has worked on?,The lab supports the design and flight testing of a variety of UAVs including an unmanned hypersonic spy plane and a disaster-relief medical quadcopter.,"Barrett-Gonzalez also guides winning teams of KU engineering students whose designs have included an unmanned hypersonic spy plane, a disaster-relief medical quadcopter, a flying motorcycle and a family of fast, eco-friendly jets dubbed Skyblazers.",https://engr.ku.edu/news/article/aerospace-engineer-ron-barrett-gonzalez-named-national-academy-of-inventors-fellow,engr.ku.edu
What unique interdisciplinary efforts are emphasized at the University of Kansas?,"Students and faculty members develop close ties with colleagues across disciplines and campuses, indicating a strong interdisciplinary approach.","At The University of Kansas, students and faculty members develop close ties with their colleagues across disciplines and campuses, embracing an interdisciplinary approach.",http://bio.engr.ku.edu/vision-mission,bio.engr.ku.edu
Which student from the list is pursuing a Petroleum Engineering degree?,Zion Bradsher is pursuing a Petroleum Engineering degree.,"Zion Bradsher Petroleum Engineering, 2026 Hometown: Bridgeton, MO.",https://engr.ku.edu/self-chemical,engr.ku.edu
What identity groups do the student organizations primarily support?,"The student organizations support women, Black individuals, American Indian individuals, Asian individuals, and Hispanic individuals in engineering.","Within the School of Engineering, we help students connect to these student organizations: Women in Computing (WIC), Society of Women Engineers (SWE), National Society of Black Engineers (NSBE), American Indian Science & Engineering Society (AISES), Society of Asian Scientists & Engineers (SASE), Society of Hispanic Professionals Engineers (SHPE), and Out in Science, Technology, Engineering, and Mathematics (OSTEM).",https://engr.ku.edu/impact-and-belonging-student-organizations,engr.ku.edu
How are the funds for scholarships structured for engineering students?,"The specific funds that comprise an engineering student's package, and the proportion of funds provided by the University and Engineering, may change, but the total award will not.","The specific funds that comprise an engineering student's package, and the proportion of funds provided by the University and Engineering, may change, but the total award will not, provided the student meets renewal criteria.",https://engr.ku.edu/undergraduate-scholarships,engr.ku.edu
What role does Travis Passman hold within the Engineering Technology Service Center?,Engineering TSC Manager,Travis Passman Engineering TSC Manager travispassman@ku.edu 785-864-0309,https://engr.ku.edu/people,engr.ku.edu
What primary research interests does Professor Shima Fardad focus on?,"Light-matter interactions in soft-matter systems, nanophotonics, plasmonics, metamaterials, imaging microscopy, and spectroscopy techniques.","Primary Research Interests: Light-matter interactions in soft-matter systems, Nanophotonics, Plasmonics and Metamaterials, Imaging Microscopy and Spectroscopy Techniques.",https://eecs.ku.edu/applied-electromagnetics,eecs.ku.edu
What benefits do admitted students receive from participating in BIOE Sneak Peek?,"Admitted students are likely to receive reimbursement for a portion of their travel, accommodations, and meals.","A portion of the costs for your travel, accommodations and meals will be reimbursed to you if you participate in Visitation Days.",https://bioengr.ku.edu/contact,bioengr.ku.edu
What is the role of the Engineering Advising Hold (EAH)?,The Engineering Advising Hold ensures that students meet with their academic advisor every semester to stay on track for graduation.,The School of Engineering requires advising each semester to ensure you stay on track for graduation.,https://engr.ku.edu/advising/advising-enrollment-policies,engr.ku.edu
Who is welcome to participate in the International Student Association?,All KU students are welcome to participate in ISA.,ISA welcomes all KU students to participate.,https://iss.ku.edu/international-student-clubs-and-organizations,iss.ku.edu
What does the conclusion of 'Basic Human-Robot Interaction' cover?,The conclusion explores current trends and future outlooks within the field of HRI.,"Basic Human-Robot Interaction concludes by exploring current trends and future outlooks within the field, ensuring readers stay informed about the latest advancements.",https://eecs.ku.edu/news/article/2024/02/25/professor-david-johnson-publishes-new-book-human-robot-interaction,eecs.ku.edu
Are there different tracks available for Master's of Science and Doctor of Philosophy degrees?,"Yes, there are multiple tracks available for both Master's of Science and Doctor of Philosophy degrees including Bioimaging, Biomaterials & Tissue Engineering, and others.",Masters of Science Requirements Click to expand Bioimaging Track Biomaterials & Tissue Engineering Track... Doctor of Philosophy Requirements Click to expand Bioimaging Track Biomaterials & Tissue Engineering Track...,http://bio.engr.ku.edu/degree-requirements,bio.engr.ku.edu
How do grades from transfer courses affect KU GPA calculations?,Grades from transfer courses are not included in the calculation of the KU Overall GPA.,"Grades from transfer courses are considered in making decisions for admission to the university, entry into specific program, and for satisfying degree requirements. However, grades from transfer courses are not used in the calculation of the KU Overall GPA.",https://registrar.ku.edu/transfer-credit-faq,registrar.ku.edu
What documentation is required for students whose source of funding has changed when applying for an I-20 extension?,They must provide the name and email address of the departmental staff person who can verify salary and benefit information or upload current evidence of financial support.,If your financial source has changed (ex. previously a GRA and now supported by family funds):...you must provide the name and email address of the departmental staff person who can verify the salary and benefit information.,https://iss.ku.edu/i-20-extension,iss.ku.edu
What type of engineering concentration is represented among the Chemical Engineering ambassadors?,The Chemical Engineering ambassadors include a student with a Data Science concentration.,"Chemical Engineering, Data Science concentration Zion Bradsher.",https://engr.ku.edu/engineering-ambassadors,engr.ku.edu
What committee sets the times for final examinations?,Times for examinations are set by KU Policy and by the University Governance Calendar Committee.,Times for examinations are set by KU Policy and by the University Governance Calendar Committee.,https://registrar.ku.edu/course-and-room-scheduling,registrar.ku.edu
What financial proof is required for the issuance of an I-20 or DS-2019 form?,You will be required to submit proof of financial support before an I-20 form (for F-1 status) or a DS-2019 form (for J-1 status) can be issued.,"If you are requesting F-1 or J-1 non-immigrant status for your upcoming program admission, you will be required to submit proof of financial support before an I-20 form (for F-1 status) or a DS-2019 form (for J-1 status) can be issued.",https://iss.ku.edu/estimated-cost-attendance,iss.ku.edu
What unique skills do mechanical engineering students at KU gain through their program?,"Mechanical engineering students gain skills in advanced materials, biomechanics, and developing energy-efficient vehicles.","From award winning race cars and energy efficient vehicle development to advanced spinal implants and an easier path to recovery from knee surgery, mechanical engineering at KU offers a wide variety of opportunities.",https://engr.ku.edu,engr.ku.edu
What role did the Jayhackers assume during the RMCCDC competition?,The Jayhackers took on the role of cybersecurity analysts of a hypothetical company under active cyberattack.,"Jayhackers competed in the 2023 RMCCDC in Denver, CO after qualifying in February and took on the role of cybersecurity analysts of a hypothetical company under active cyberattack.",https://eecs.ku.edu/news/article/2023/02/16/jayhackers-compete-2023-cyber-defense-competition,eecs.ku.edu
Can prospective students secure Graduate Research Assistantships (GRAs) prior to admission?,It is NOT required for prospective students to have KU faculty pledge a GRA position prior to your admission.,It is NOT required for prospective students to have KU faculty pledge a GRA position prior to your admission.,http://bio.engr.ku.edu/funding,bio.engr.ku.edu
What role does Jeffrey Burns hold at the University of Kansas Health System?,He is the Director of the Clinical and Translational Science Unit and the Memory Care Clinic.,"Director, Clinical And Translational Science Unit -Director, Memory Care Clinic, University of Kansas Health System",https://bioengr.ku.edu/clinical-affiliates,bioengr.ku.edu
What should students do before electing to take a course for CR/NC that counts towards their degree?,Students should consult with their academic advisor and the department corresponding to their major or minor to confirm if they can take a specific course CR/NC.,"Your academic advisor... Your major, minor, or future major department when considering electing CR/NC for a class that will count towards degree requirements.",https://registrar.ku.edu/creditno-credit,registrar.ku.edu
What is the office room number for Robert Lee Parsons?,His office room number is 2160E in Learned Hall.,"Learned Hall, room #2160E",https://engr.ku.edu/people/robert-parsons-phd,engr.ku.edu
What is the timeline for notifying students of an academic misconduct charge?,Alleged students will be notified of the charge of academic misconduct within 30 days of the instructor’s filing of charges.,Alleged students will be notified of the charge of academic misconduct within 30 days of the instructor’s filing of charges.,https://engr.ku.edu/engineering-student-resources/academic-misconduct,engr.ku.edu
What teaching approach is emphasized in the petroleum engineering program at the University of Kansas?,Hands-on education based on industrial problems and real-world examples is emphasized.,Learn more about how hands-on education based on industrial problems and real-world examples taught by expert faculty can start your path to a successful career.,http://cpe.engr.ku.edu/seminar,cpe.engr.ku.edu
What organization does the University of Kansas use to send electronic transcripts?,"The University of Kansas uses the National Student Clearinghouse (NSC) located in Herndon, VA, to send electronic transcripts.","The University of Kansas uses the National Student Clearinghouse (NSC) located in Herndon, VA, to send electronic transcripts.",https://registrar.ku.edu/electronic-transcript-faq,registrar.ku.edu
What extra step do students need to take before registering for the Graduate Student Orientation?,Students need to use their KU online ID to register for the orientation.,"You will need to use your KU online ID to register. If you have not setup your online ID yet, please do so at MyIdentity Account Setup.",https://engr.ku.edu/graduate-student-orientation,engr.ku.edu
What is the priority for room reservations in the School of Engineering?,Preference is given to Engineering sponsored events.,"Preference is giving to Engineering sponsored events, therefore non-engineering related organizations can reserve rooms no more than two weeks in advance.",https://engr.ku.edu/room-reservation-request,engr.ku.edu
How should self-employed individuals report their work if they have contracts that are close together?,They do not have to report multiple contract work unless they are more than 10 days apart.,"If self-employed on contract, write 'Self-employed work for hire' in Company Name and include the start date of the contract in 'Employment Start Date.' You do not have to report multiple contract work unless they are more than 10 days apart.",https://iss.ku.edu/f-1-opt-reporting,iss.ku.edu
What eligibility criteria must be met for J-1 students to pursue off-campus employment due to economic hardship?,"Students must be in good academic standing, continue to engage in a full course of study while school is in session, and be sponsored by KU.","Off-campus employment may be possible because of serious, urgent and unforeseen economic circumstances arising since acquiring exchange visitor status. Student must be in good academic standing, continue to engage in a full course of study while school in session, and sponsored by KU.",https://iss.ku.edu/j-1-employment-options,iss.ku.edu
What personal interest does Ibilola Ogundare have that helps her relax outside of academic pursuits?,Ibilola finds relaxation in watching movies.,"Beyond her academic endeavors, Lola finds relaxation in watching movies, enjoying the captivating stories and moments of inspiration they bring.",https://engr.ku.edu/people/ibilola-ogundare,engr.ku.edu
How many computers are available in the Eaton Room 1014/1018?,There are 60 computers available in Eaton Room 1014/1018.,Eaton Rooms Room Capacity Media Type Seating Type Entrances 1014/1018 60 Computer Lab 60 Computers 2.,https://engr.ku.edu/eaton-learned-and-leep2-spaces,engr.ku.edu
Who is responsible for overseeing the Clinical Rehabilitation Research Program?,"Neil Segal, MD, MS is the Director of the Clinical Rehabilitation Research Program.","Neil Segal, MD, MS -Professor, Rehabilitation Medicine -Director, Clinical Rehabilitation Research Program , Rehabilitation Medicine",http://bio.engr.ku.edu/clinical-affiliates,bio.engr.ku.edu
What innovative feature does the object detection model developed by Tianxiao Zhang leverage to improve performance across different domains?,"It employs generative adversarial networks (GANs) to generate images from different domains, enhancing model performance through a 6-channel representation.","To address the domain shift problem in object detection, we employ generative adversarial networks (GANs) to generate images from different domains.",https://eecs.ku.edu/defense-notices?page=%2C0,eecs.ku.edu
What restrictions apply to someone who is subject to INA 212(e)?,They cannot apply for any type of change of status from within the U.S. and must reside in their home country for two years before applying for permanent residence or certain visas.,"If you are subject to 212(e), the following restrictions apply: Cannot apply for any type of change of status from within the U.S. Must return home and 'reside and be physically present' in your 'home' country for an aggregate of two years before you can apply for permanent residence, an H visa, or an L visa.",https://iss.ku.edu/J-1-two-year-home-residency-requirement,iss.ku.edu
Which professor at the colloquium is associated with the Department of Physics & Astronomy?,Chris Fischer is associated with the Department of Physics & Astronomy.,Monday: 02/17/2025 Chris Fischer Professor and Chair Department of Physics & Astronomy University of Kansas,http://bio.engr.ku.edu/colloquium,bio.engr.ku.edu
What is the office phone number for Suzanne Shontz?,785-864-8816,Office Phone: 785-864-8816,https://engr.ku.edu/people/suzanne-shontz-0,engr.ku.edu
Where is Teresa Fry's office located?,"Her office is located in LEEP2, room 1415.","LEEP2, room 1415 1536 W 15th St Lawrence, KS 66045",https://engr.ku.edu/people/teresa-fry,engr.ku.edu
What is the primary objective of the Web-Armour approach proposed by Yousif Dafalla?,Its main goal is to increase the cost for attackers to perform automated reconnaissance and vulnerability scanning.,"Web-Armour has two goals: First, increase the cost for attackers to perform automated reconnaissance and vulnerability scanning; Second, introduce minimal to negligible performance overhead to benign users of the deployment.",https://eecs.ku.edu/defense-notices?page=%2C2,eecs.ku.edu
What are the mathematics preparedness options for freshmen applicants to the EECS Department?,"Freshmen must demonstrate mathematics preparedness by obtaining a mathematics ACT score of 22+ (or math SAT score of 540+), achieving a 'B' or better in 'college algebra' or a more advanced mathematics course, or various other qualifications including a high school calculus course.","Demonstrate mathematics preparedness by: Obtaining a mathematics ACT score of 22+ (or math SAT score of 540+), OR Achieving a ‘B’ or better in ‘college algebra’ or a more advanced mathematics course, OR... Achieving at minimum a qualifying score for MATH 104 on the ALEKS mathematics placement exam.",https://eecs.ku.edu/admissions-undergraduate,eecs.ku.edu
What is the deadline for students to add short courses online for Spring 2025?,Students may add short courses online through the second calendar day of the class.,Students may add short courses online through the second calendar day of the class.,https://registrar.ku.edu/spring-2025-short-courses,registrar.ku.edu
Does owning property in Kansas automatically qualify someone for resident tuition rates?,"No, residence is based on where one physically resides, and no provision is made for where one is employed or owns property.","By statute, residence is based upon where one physically resides and criteria associated with that residence. No provision is made for where one is employed or owns property.",https://registrar.ku.edu/residency-faqs,registrar.ku.edu
In what ways do Engineering Ambassadors contribute to recruitment efforts beyond leading tours?,"They participate in on-campus events like Open House and Junior Days, serve on student panels, and communicate through semester campaigns.","These opportunities include, but are not limited to: On-campus events and tours for the School of Engineering such as Open House and Engineering Scholars Day On-campus events for the Office of Admissions such as Junior Days and Senior Days Serve on a variety of student panels for visiting high school groups to events with industry partners Communicate with prospective students through semester campaigns (emails, letters, postcards, etc.).",https://engr.ku.edu/undergraduate-engineering-ambassadors,engr.ku.edu
What is the significance of green hydrogen in the context of energy storage?,Green hydrogen can be used to store excess energy generated during peak production times for later use during high demand periods.,"Clean hydrogen is also gaining interest for renewable energy storage. 'During winter days, the solar panels on the grid can produce much more energy than is needed... However, using green hydrogen to store that energy, then converting it back to electricity later, may prove effective for grid energy balancing.'",https://engr.ku.edu/news/article/new-5-million-doe-award-supports-ku-startups-green-hydrogen-energy-research,engr.ku.edu
What type of signals are being considered for cohabitation in the proposed study?,The study considers cohabitation between radar signals and communication signals.,"For this work, we will consider cohabitation between radar signals and communication signals, with the former being the desired signal and the latter being the noncooperative agent.",https://eecs.ku.edu/source-separation-using-sparse-bayesian-learning,eecs.ku.edu
What role does Elaina Sutley serve in relation to engineering leadership at her institution?,She is the Director of the Self Engineering Leadership Fellows Program.,Self Engineering Leadership Fellows Program Director,https://engr.ku.edu/people/elaina-sutley,engr.ku.edu
How is graduation with distinction determined for students?,Graduation with distinction is awarded to students in the upper 10 percent of their graduating class based on GPA determined by KU residence credit hours.,Students who rank in the upper 10 percent of their graduating class graduate with distinction.,https://engr.ku.edu/undergraduate-graduation-info,engr.ku.edu
What is the requirement for general admission and institutional scholarships at KU regarding standardized test scores?,"KU only requires a GPA for general admission and institutional scholarships, not SAT or ACT scores.",We only require GPA — not SAT or ACT scores — for general admission and institutional scholarships.,https://registrar.ku.edu/transfer-credit,registrar.ku.edu
What role does the academic advisor play in the Engineering Undergraduate Advising process?,The academic advisor serves as a liaison to the EECS department and is responsible for removing the Engineering Advising Hold each semester.,Your dedicated engineering academic advisor is part of Jayhawk Academic Advising (JAA) and serves as your liaison to the EECS department.,https://eecs.ku.edu/undergraduate,eecs.ku.edu
"What role did Tim Johnson hold at The IDEA Center, Inc.?",He was the Vice President of Innovation and Technology.,"He is past Vice President of Innovation and Technology for The IDEA Center, Inc.",https://eecs.ku.edu/people/tim-johnson,eecs.ku.edu
How can computational molecular models contribute to drug design?,Computational molecular models can be used to inform rational drug design.,Computational molecular models can be used to inform rational drug design.,http://bioengr.ku.edu/computational-bioengineering,bioengr.ku.edu
What unique program does the University of Kansas host in the field of engineering?,The only petroleum engineering program in the State of Kansas.,The University of Kansas hosts the only petroleum engineering program in the State of Kansas and is home to the Tertiary Oil Recovery Program.,http://cpe.engr.ku.edu/petroleum-engineering-graduate-programs-2024-25,cpe.engr.ku.edu
During which years does Valentine Baumann facilitate students?,Valentine Baumann facilitates students in their third and fourth years.,Third and Fourth Year Facilitator,https://engr.ku.edu/people/valentine-baumann,engr.ku.edu
What unique equipment is mentioned for use in mechanical engineering laboratories?,The laboratories feature unique equipment such as a 3D printer and advanced computer-aided design software.,Students gain hands-on experience with unique equipment including 3D printers and advanced computer-aided design software.,https://engr.ku.edu/mechanical-engineering-facilities,engr.ku.edu
What must students do before submitting a Change of Catalog Year form?,Students must schedule a meeting with their academic advisor(s) to discuss the impact of this change on their current degree plan.,"Before submitting a change of catalog year form, students must do the following: Schedule a meeting with their academic advisor(s) to discuss the impact of this change on their current degree plan.",https://registrar.ku.edu/catalog-year,registrar.ku.edu
What novel method is introduced in the report to enhance privacy-preserving inference in deep learning?,"The report introduces PrivDNN, which selectively encrypts the most critical model parameters to significantly reduce encrypted operations.","To enable privacy-preserving inference while accelerating homomorphic encryption, we propose PrivDNN, which selectively encrypts the most critical model parameters, significantly reducing encrypted operations.",https://eecs.ku.edu/understanding-and-mitigating-security-risks-towards-trustworthy-deep-learning-systems,eecs.ku.edu
What are some of the potential applications of green hydrogen beyond traditional uses?,Green hydrogen is being considered for sustainable aviation fuels and renewable energy storage solutions.,"“People are interested in green hydrogen for traditional applications ... but also for emerging ones,” he said. “One example is sustainable aviation fuels. Green hydrogen will be critical in creating sustainable, petroleum-free fuels, specifically for aviation.”",https://engr.ku.edu/news/article/new-5-million-doe-award-supports-ku-startups-green-hydrogen-energy-research,engr.ku.edu
When is information regarding applications for the travel funding posted?,Information regarding applications for graduate student travel funding are posted each fall semester.,Information regarding applications for graduate student travel funding are posted each fall semester.,https://engr.ku.edu/graduate-scholarly-presentation-travel-award,engr.ku.edu
What banking facilities are available to new employees at KU?,"The University of Kansas is not affiliated with any bank, and there are several banks in Lawrence where new employees can open accounts.",The University of Kansas is not affiliated with any bank in the United States. There are several banks in Lawrence.,https://iss.ku.edu/checklist-new-faculty-and-staff,iss.ku.edu
What unique challenge does the KU EECS research project aim to tackle?,It aims to send 40 megabytes of data every second over a distance of 100 miles using a wireless transmitter.,"Imagine this engineering headache: Using a wireless transmitter, you need to send 40 megabytes of data every single second over a distance of 100 miles.",https://eecs.ku.edu/news?page=5,eecs.ku.edu
What prior experience did Brian McClendon have before joining Google?,He spent eight years at Silicon Graphics developing high-end workstation 3D graphics.,He spent eight years at Silicon Graphics developing high-end workstation 3D graphics.,https://engr.ku.edu/news/article/2023/12/12/google-earth-creator-brian-mcclendon-kus-newest-national-academy-inventors-fellow,engr.ku.edu
What is required before a student can appeal a denied fee petition?,A student must submit an initial fee petition to the Office of the University Registrar prior to submitting an appeal.,You must submit an initial fee petition for the Office of the University Registrar prior to submitting an appeal.,https://registrar.ku.edu/fee-petition,registrar.ku.edu
"What position does Stephen Waller, M.D. have in the Infectious Diseases department?",He is an Associate Professor and the Interim Co-Director of Infectious Diseases.,"Stephen Waller, M.D. -Associate Professor, Infectious Diseases -Interim Co-Director, Infectious Diseases",http://bioengr.ku.edu/clinical-affiliates,bioengr.ku.edu
What emphases are available within the Chemical Engineering program at KU?,"The emphases offered include Biomedical, Data Science, Environmental, Material Science, Premedical, and Petroleum Engineering.","Discover chemical engineering and the emphases we offer in Biomedical, Data Science, Environmental, Material Science, Premedical, and Petroleum Engineering.",http://cpe.engr.ku.edu/about-undergraduate,cpe.engr.ku.edu
Who is the Director of the Computational Bioengineering program at KU?,"The Director of the Computational Bioengineering program at KU is Suzanne Shontz, Ph.D.","Computational Bioengineering Director: Suzanne Shontz, Ph.D.",https://bioengr.ku.edu/computational-bioengineering,bioengr.ku.edu
What resources are available for faculty and staff to support students?,KU resources to support students are available for faculty and staff to utilize.,Student Support Resources for Faculty and Staff KU resources to support students are available for faculty and staff to utilize.,https://engr.ku.edu/resources,engr.ku.edu
Can you continue using an unexpired F-1 or J-1 visa after obtaining a new passport?,"Yes, if your expired passport has an unexpired F-1 or J-1 visa in it, you can continue to use the unexpired visa along with your new passport.","If your expired passport has an unexpired F-1 or J-1 visa in it, you can continue to use the unexpired visa along with your new passport.",https://iss.ku.edu/renewing-your-passport-united-states,iss.ku.edu
What collaboration effort is highlighted in the context of graduate programs at the University of Kansas?,KU's Offices of Graduate Studies and Institutional Research and Planning collaborate to provide Program Profiles for all graduate programs.,KU’s Offices of Graduate Studies and Institutional Research and Planning collaborate to provide Program Profiles for all graduate programs offered by the university.,https://bioengr.ku.edu/vision-mission,bioengr.ku.edu
What does the polarization-sensitive OFDR system measure and how?,It measures birefringence vectors along the fiber by employing three mutually orthogonal states of polarization of the launched optical signal.,"By employing three mutually orthogonal SOPs of the launched optical signal, we can measure birefringence vectors along the fiber, providing not only the magnitude of birefringence but also the direction of any external pressure applied to the fiber.",https://eecs.ku.edu/optical-fiber-measurements-leveraging-coherent-fmcw-techniques,eecs.ku.edu
How does the Engineering Student Council contribute to the student community?,"The ESC serves as a collective voice for the engineering student community, promoting engineering education and involvement within the school.",...and serving as a collective voice for the engineering student community.,https://engr.ku.edu/engineering-student-council,engr.ku.edu
What types of funding options are available for graduate students in the Bioengineering program at KU?,"The passage mentions that there are funding opportunities available, although specific types of funding are not detailed.",Funding Graduate Degree Program,http://bioengr.ku.edu/navigator,bioengr.ku.edu
Which field of study is represented by the most students in the Class of 2028?,Mechanical Engineering is represented by four students.,"Alexis Dominic Mechanical Engineering, 2028 Hometown: Overland Park, KS Charlie Erker Mechanical Engineering, 2028 Hometown: Chesterfield, MO AJ Lauer Mechanical Engineering, 2028 Hometown: Shawnee, KS",https://engr.ku.edu/self-class-2028,engr.ku.edu
What must graduate students do if their leave of absence extends beyond three semesters?,"If the total time for the leave extends more than three semesters, you may lose your place in the program and have to re-apply for admission.","However, if the total time for the leave extends more than three semesters, you may lose your place in the program and have to re-apply for admission.",https://engr.ku.edu/progress-toward-degree,engr.ku.edu
"What specialized tool will KU launch to assist students in course planning, and when is it expected to be available?","The KU Planner, powered by Stellic, will be launched for undergraduate students in phases over the Spring 2025 term.","KU is launching a new tool to students in phases over the Spring 2025 term. The KU Planner (powered by Stellic), will allow undergraduate students with a Fall 2024 and future catalog and requirement term to plan their courses and build a schedule.",https://registrar.ku.edu/enrollment-planning,registrar.ku.edu
What project was funded by a $5 million award from the Department of Energy for KU?,"The project aims to make clean hydrogen more affordable in collaboration with Avium, a startup firm founded by researchers from KU’s School of Engineering.","New $5 million DoE award supports KU startup’s green hydrogen energy research With $5 million in support from U.S. Department of Energy, the University of Kansas and Avium, a startup firm founded by researchers from KU’s School of Engineering, aim to make clean hydrogen more affordable.",https://engr.ku.edu/news,engr.ku.edu
In which building does Amy Wierman work?,Amy Wierman works in Eaton Hall.,Eaton Hall Biography,https://engr.ku.edu/people/amy-wierman,engr.ku.edu
What key technologies are Dr. El-Araby's research focused on unlocking?,The potential of quantum computing and quantum communications.,"Dr. El-Araby and his research group have focused on fully unlocking the potential of quantum computing and quantum communications, cutting-edge technologies with the power to revolutionize our world.",https://eecs.ku.edu/news/article/2023/07/20/eecs-faculty-research-group-wins-best-poster-award-doe-quantum-computing-event,eecs.ku.edu
What is the maximum duration a student can continue their health insurance after graduation?,Students can pay for continuing coverage for a maximum of up to 3 months after their coverage end date.,"Students graduating from KU who were enrolled in the KU UHCSR GTA/GRA/GA health insurance their last semester at KU, may pay for continuing coverage for a maximum of up to 3 months after their coverage end date of their GTA/GRA/GA health insurance plan.",https://iss.ku.edu/health-insurance-gta-gra-ga,iss.ku.edu
What role does Max Jiang play in relation to the School of Engineering's website?,He maintains the School of Engineering Website content.,maintains the School of Engineering Website content and social networking sites,https://engr.ku.edu/people/max-jiang-0,engr.ku.edu
Which states are involved in Tamzidul Hoque's initiative to train high school students?,"Kansas, Florida, and Texas.","...in partnership with Shawnee Mission West High School and other schools across Kansas, Florida, and Texas...",https://eecs.ku.edu/news/article/training-the-next-generation-of-ai-and-microelectronics-innovators,eecs.ku.edu
What resources are available to support student organizations in the School of Engineering?,The passage mentions that there are Student Organization Resources available.,The School of Engineering is home to many amazing student groups... Student Organization Resources.,https://engr.ku.edu/orgs,engr.ku.edu
Who is the current director of the Biomaterials & Tissue Engineering track at KU?,"Candan Tamerler, Ph.D. is the current director of the Biomaterials & Tissue Engineering track.","Biomaterials & Tissue Engineering Director: Candan Tamerler, Ph.D.",https://bioengr.ku.edu/biomaterials-tissue-engineering,bioengr.ku.edu
What opportunities does the GEA provide for graduate students?,"The GEA provides professional development, research/outreach, and travel opportunities for all graduate students in the school.","In addition, the GEA provides professional development, research/outreach, and travel opportunities for all graduate students in the school.",https://engr.ku.edu/graduate-engineering-association,engr.ku.edu
What can users expect during the transition to the new Technical Support Center?,Users can expect to finalize details of the new support model in the coming weeks.,We appreciate your patience as we finalize the details of our new support model in the coming weeks.,https://eecs.ku.edu/tech-help,eecs.ku.edu
How should students taking part-time AEC and part-time regular KU academic courses seek advising?,Students taking part-time AEC and part-time regular KU academic courses should be advised by Jayhawk Academic Advising.,Students taking part-time AEC and part-time regular KU academic courses should be advised by Jayhawk Academic Advising.,https://iss.ku.edu/enrollment-tuition,iss.ku.edu
Since when has Jordan been a student at the University of Kansas?,Jordan has been a Jayhawk since 2015.,Jordan has been a Jayhawk since 2015 when she came to KU to pursue a B.S. in Architectural Engineering.,https://engr.ku.edu/people/jordan-nutter,engr.ku.edu
What age limit exists for students to continue receiving benefits under the Kansas Foster Child Education Assistance Act?,Eligible applicants may receive benefits until they attain the age of 23.,This program provides for undergraduate enrollment of eligible applicant through the semester applicant attains 23 years of age.,https://registrar.ku.edu/kansas-foster-child-education-assistance-act,registrar.ku.edu
"What organization did Promise O. Longe join, and what are his motives for joining it?","He joined GEA to share his experiences, contribute to meeting GEA's vision, and connect with students from different backgrounds and cultures.","More so, he joined GEA to share his experiences, contribute to meeting GEA's vision and connect with students from different backgrounds and cultures.",https://engr.ku.edu/people/promise-o-longe,engr.ku.edu
How can J-1 visiting scholars request an accessible version of the documents related to health insurance?,They can contact International Support Services at iss@ku.edu to request the document be made available in an accessible format.,"An accessible version of the documents on this site will be made available upon request. Please contact the International Support Services, at iss@ku.edu to request the document be made available in an accessible format.",https://iss.ku.edu/visiting-scholar-health-insurance,iss.ku.edu
What distinction did Faculty Members Dave Petr and Lorin Maletsky receive at the start of the academic year?,They were among the first faculty members visited by the 'Surprise Patrol' for their excellent teaching.,Electrical Engineering and Computer Science Professor Dave Petr and Assistant Professor of Mechanical Engineering Lorin Maletsky were among the first faculty members to be visited by the 'Surprise Patrol' during the first two days of class at the University of Kansas.,https://engr.ku.edu/news?page=20,engr.ku.edu
How can consulting Consumer Reports assist in the car buying process?,"Consulting Consumer Reports can provide information on average prices and reliability, aiding in making informed purchasing decisions.",You can do some research first to learn about average prices and reliability by consulting the Kelley Blue Book and Consumer Reports.,https://iss.ku.edu/cars,iss.ku.edu
What specific application must J-1 research scholars complete related to taxation?,"They must apply for a social security number, which is used for tax purposes.","The J-1 research scholar, J-1 short-term scholar, and J-1 professor categories are all eligible to apply for a social security number. A social security number is used for tax purposes.",https://iss.ku.edu/checklist-new-visiting-scholars,iss.ku.edu
"Which conference did KU Engineering attend on October 26-28, 2023?","KU Engineering attended the Society of Women Engineers conference in Los Angeles, California.","2023 Conferences KU Engineering attended these conferences in Fall 2023. - Society of Women Engineers, Los Angeles , California (October 26-28)",https://engr.ku.edu/graduate-recruitment-schedule,engr.ku.edu
What courses are associated with the School of Engineering's Mechanical Engineering department?,The Mechanical Engineering department is represented by Genesis Buckhalton.,School of Engineering Mechanical Engineering Genesis Buckhalton kume@ku.edu ME,https://registrar.ku.edu/scheduling-officer-contact-information,registrar.ku.edu
What educational institution is associated with Gary Handy?,Gary Handy is associated with the University of Kansas.,Source: https://engr.ku.edu/people/gary-handy,https://engr.ku.edu/people/gary-handy,engr.ku.edu
What kind of educational pathways does the Biomaterials and Tissue Engineering track offer for students?,"Graduates are prepared to enter industry, government, or academics.","Graduates are prepared to enter into industry, government, or academics, where they will be able to assist in research programs in biomaterials.",https://bioengr.ku.edu/biomaterials-tissue-engineering,bioengr.ku.edu
What types of techniques are used in the biomechanics research program at KU?,"The program uses experimental measurement, mathematical modeling, and computer simulations to analyze the mechanics of the human body.","Our mission is to provide a quality graduate research and educational experience with emphasis on understanding and analyzing the mechanics of the human body through experimental measurement, mathematical modeling and computer simulations.",http://bio.engr.ku.edu/biomechanics-neural-engineering,bio.engr.ku.edu
Which significant national award did two KU professors receive for their early-career research?,Anthony Fehr and Gibum Kwon received the PECASE Award.,"Two KU professors — Anthony Fehr, associate professor of molecular biosciences, and Gibum Kwon, associate professor of mechanical engineering — were recently chosen for the PECASE Award, the highest honor given by the U.S. government to early-career researchers who show great potential for leading scientific advancements in the 21st century.",https://engr.ku.edu/news?page=1,engr.ku.edu
What role does Julia Espinoza Mejia serve in addition to her doctoral studies?,She serves as a Graduate Engineering Ambassador and adviser for the Peruvian Student Association at KU.,Julia serves as a Graduate Engineering Ambassador and adviser for the Peruvian Student Association at KU.,https://engr.ku.edu/people/julia-emilia-espinoza-mejia,engr.ku.edu
What leisure activities does Yousif Dafalla enjoy in his free time?,"Playing tennis, soccer, and watching movies and TV series","In his free time Yousif enjoys playing tennis, soccer and watching movies and TV series.",https://engr.ku.edu/people/yousif-dafalla,engr.ku.edu
What attributes are important for a candidate to demonstrate in their application for the SELF Program?,"Candidates should demonstrate key attributes such as recognition and interest in developing leadership and entrepreneurial skills, practical intelligence, motivation, self-sufficiency, perseverance, and creative problem-solving skills.","Students chosen for the program should demonstrate key attributes that relate to successful leadership, such as: Recognition and a strong interest in developing strong leadership and entrepreneurial knowledge and skills, Practical intelligence, Motivation and goal oriented, and more.",https://engr.ku.edu/self-program-apply,engr.ku.edu
What are the specific conditions under which a B-1 visitor may receive an honorarium?,A B-1 visitor may be paid an honorarium for usual academic activities lasting no longer than nine days at any institution and cannot have accepted such payments from more than five institutions in the previous six months.,A B-1 visitor may be paid an honorarium for 'usual academic activities' as long as the academic activity does not last longer than nine days at any institution and the visitor may not have accepted similar payments from more than five institutions during the previous six months.,https://iss.ku.edu/visitor-visa,iss.ku.edu
What is the funding source for the SafeRide and SafeBus programs?,The programs are funded by the SafeRide student fee and by the State of Kansas.,"The SafeRide and SafeBus programs are run by KU on Wheels. It is funded by the SafeRide student fee, by the State of Kansas.",https://iss.ku.edu/saferide-and-safebus,iss.ku.edu
When is it necessary to resubmit an auditorium request during the update period?,Requests received during advanced placement are not reviewed and must be resubmitted during the update period.,Requests received during advanced placement are not reviewed and must be resubmitted during the update period.,https://registrar.ku.edu/auditoriums,registrar.ku.edu
What specific achievement did the KU Jayhackers accomplish in their competition apart from their overall ranking?,They secured 1st place in the Universities category.,The KU Jayhackers secured 1st place in the Universities category and an impressive 9th place overall.,https://eecs.ku.edu/news/article/ku-jayhackers-triumph-in-international-best-cyber-warrior-competition,eecs.ku.edu
"What is the academic focus of Nathan Phillips from Shawnee, KS?",Nathan Phillips is focused on Computer Engineering.,"Nathan Phillips Computer Engineering, 2028 Hometown: Shawnee, KS",https://engr.ku.edu/self-class-2028,engr.ku.edu
Do applicants need to have a faculty advisor to apply for a Graduate Research Assistantship?,"No, you do not need to have a faculty advisor pledge to provide you a GRA before you submit your application.",You do not need to have a faculty advisor pledge to provide you a GRA before you submit your application.,https://engr.ku.edu/graduate-student-funding,engr.ku.edu
What is the email address provided for Laila Kakar?,The email address for Laila Kakar is laila-zm-kakar@ku.edu.,Contact Info laila-zm-kakar@ku.edu,https://iss.ku.edu/people/laila-kakar,iss.ku.edu
What can be said about Joyce Shinn's perspective on giving back to education?,"Joyce Shinn expressed gratitude for the opportunity and means to support young people and education, hoping that students will be inspired to help others in the future.","Joyce Shinn said that she and her husband were grateful to have both the opportunity and the means to support young people and education. 'Using our God-given talents we’ve been able to give back exponentially, and I pray the students who have graced the halls of KU... will do likewise and be inspired to reach back to help others.'",https://engr.ku.edu/news/article/new-ku-engineering-ihawke-student-lounge-named-for-joyce-and-mike-shinn,engr.ku.edu
What is the focus of this year’s J.A. Tiberti Family Lecture at KU?,The lecture will focus on forging a rewarding engineering career.,A pioneer in workforce development in the field of civil engineering will give this year’s J.A. Tiberti Family Lecture at the University of Kansas School of Engineering.,https://engr.ku.edu/news?page=3,engr.ku.edu
Who is the Director of the Hoglund Brain Imaging Center?,"William Brooks, Ph.D. is the Director of the Hoglund Brain Imaging Center.","William Brooks, Ph.D. -Director, Hoglund Brain Imaging Center -Professor, Neurology...",http://bio.engr.ku.edu/academic-affiliates,bio.engr.ku.edu
"What challenges might faculty face when submitting grade changes, according to the passage?",Faculty need to submit a grade change form for grades more than one year old or specific circumstances like if the student has graduated or has a P grade.,"Faculty will submit this form for grade changes that are more than one year old and for changes within one year that cannot be done in Enroll & Pay for the following reasons: Student has graduated, The current grade is a P (Progress).",https://registrar.ku.edu/grades,registrar.ku.edu
"What steps must F-1, F-2, or J-1 international students take to activate their health insurance if they enroll in Summer 2025 KU classes?","They must click on the 'Opt-in' tab in the initial insurance waiver email, log into their ECI Services account, and click on 'Enroll Now'.","F-1, F-2 or J-1 international students enrolled in Summer 2025 KU classes can activate their KU United Healthcare Student Resources (UHCSR) International Basic health insurance plan by taking the following steps: Click on the 'Opt-in' tab in the initial insurance waiver email from ECI Services. Log into your ECI Services account and click on the 'Enroll Now' icon.",https://iss.ku.edu/optional-insurnace-summer,iss.ku.edu
What aspect of activism does the recognized paper explore?,"The paper explores the needs, practices, risks, and challenges of political activists.","Their work investigates the needs, practices, risks, and challenges of activists during the Sudanese revolution in 2018–2019.",https://eecs.ku.edu/news/article/2023/01/05/eecs-faculty-research-receives-honorable-mention-nsa,eecs.ku.edu
What kind of proposals can faculty submit for research funding?,Faculty can submit SOE proposals for research funding.,Faculty Funding SOE Proposals.,https://engr.ku.edu/research-funding,engr.ku.edu
Are there specific scholarships available for underrepresented students?,"Yes, there are scholarships available specifically for underrepresented students.","The School of Engineering has a wide variety of scholarship offerings available for undergraduate, graduate and underrepresented students.",https://engr.ku.edu/scholarships,engr.ku.edu
What is one of the suggested early steps for Ph.D. students in Electrical Engineering at KU?,Electrical Engineering students are encouraged to choose a research cluster and dissertation topic as early in the graduate program as possible.,Electrical Engineering students are encouraged to choose a research cluster and dissertation topic as early in the graduate program as possible and identify a faculty adviser who is interested in supervising their work.,https://eecs.ku.edu/ph-d-programs,eecs.ku.edu
What benefits do participants receive for attending the conference?,Participants will receive an honorarium and travel award for their participation.,They will receive an honorarium and travel award for participation.,http://bioengr.ku.edu/rising-bme-scholars-conference,bioengr.ku.edu
Are there specific eligibility criteria mentioned for the funding options?,The passage does not specify detailed eligibility criteria for the funding options.,The text does not provide specific eligibility criteria for those seeking funding.,https://engr.ku.edu/school-engineering-proposals,engr.ku.edu
What is the total budget allocated for the initiative led by Tamzidul Hoque?,"$1.4 million, with $350,000 allocated to KU.","Through a $1.4 million National Science Foundation grant, with $350,000 allocated to KU...",https://eecs.ku.edu/news/article/training-the-next-generation-of-ai-and-microelectronics-innovators,eecs.ku.edu
What email address can be contacted to request an accessible version of the degree requirements content?,The email address to contact is bioe@ku.edu.,An accessible version of the content below will be made available upon request. Please contact bioe@ku.edu to request the content be made available in an accessible format.,http://bioengr.ku.edu/degree-requirements,bioengr.ku.edu
What is the first day of classes for the Fall Semester 2025?,"August 18, 2025.",First Day of Classes *Aug 18 M,https://registrar.ku.edu/kbor-approved-academic-calendars,registrar.ku.edu
What skills do UGR Fellows develop that aid in their career preparation?,"As UGRF students learn these skills, they likely encounter many obstacles impeding the progress of their projects, but through the mentoring provided, they also learn better problem-solving skills.",This experience makes the UGR Fellows more resilient and better scientists and engineers.,https://engr.ku.edu/undergraduate-research-fellows,engr.ku.edu
What expectations are set regarding the adaptability of graduates in the Mechanical Engineering program?,"Graduates are expected to demonstrate the attitudes, abilities, and personal leadership to effectively adapt to a changing global society.","2. Successful in their chosen career paths, demonstrating the attitudes, abilities, and personal leadership to effectively adapt to our changing global society while maintaining and promoting the highest engineering, professional, and ethical standards.",http://me.engr.ku.edu/,me.engr.ku.edu
What types of roles are available for undergraduate researchers at KU?,Undergraduate researchers may take on voluntary roles with minimal responsibilities or paid positions with defined expectations.,Undergraduate researchers may be voluntary (minimal responsibilities) or paid positions (with expectations and responsibilities defined).,https://engr.ku.edu/undergraduate-research,engr.ku.edu
What is the role of ISS in the J-1 on-campus employment process?,ISS provides approval for on-campus work and requires that students submit a request for an On-Campus Work Permit.,You are eligible as soon as you obtain J status and receive approval from ISS in advance of work. Permission from ISS J-1 exchange visitor regulations require sponsor authorization for on-campus employment.,https://iss.ku.edu/campus-employment-j-students,iss.ku.edu
Is it possible for students to take deficiency courses at institutions other than KU?,"Yes, students can take deficiency courses at other accredited colleges or universities, but prior approval from the graduate committee is required.",You can decide if the deficiency courses are taken at KU or at another accredited college or university. Prior approval by the graduate committee is required if taken elsewhere.,https://eecs.ku.edu/deficiency-courses,eecs.ku.edu
"In addition to his academic pursuits, what activities is Willy Lee passionate about?",Engaging in diverse sports games and embarking on travel adventures.,"With a strong and energetic characteristic, Willy holds a deep passion for engaging in diverse sports games and embarking on travel adventures.",https://engr.ku.edu/people/willy-lee,engr.ku.edu
How long is a typical class hour at the University of Kansas?,A typical class hour at the University of Kansas is 50 minutes long.,A class hour at the University of Kansas is typically 50 minutes to allow students and faculty time to transition between classes and buildings.,https://registrar.ku.edu/standard-meeting-times,registrar.ku.edu
What options are available to submit an attachment when ordering a paper transcript?,"Students can upload the attachment online, drop it off in person, or mail it to the Office of the University Registrar.",When ordering a paper transcript (not a PDF) that has an attachment that needs to be included you have the following options to submit those to us: Upload your attachment to the order online when placing your order. Drop the attachment off in office at the 1502 Building before placing your order. Mail your attachment.,https://registrar.ku.edu/order-transcript,registrar.ku.edu
What notable achievements have KU Bioengineering students accomplished?,"Student achievements include patents, start-ups, and nationally ranked companies.","Student achievements include patents, start-ups, and nationally ranked companies",http://bioengr.ku.edu/,bioengr.ku.edu
How does the Engineering Physics program at KU prepare students for the future?,"The program prepares students for life in the 21st century by providing an interdisciplinary education that combines science, math, and engineering.","If you love science, math and engineering, this is the place for you. In our interdisciplinary program students prepare themselves for life in the 21st century.",http://ephx.engr.ku.edu/courses,ephx.engr.ku.edu
What is the new student arrival date for summer 2025?,"All summer admit students must arrive by May 28, 2025.","Summer 2025 - New Student Arrival Dates All summer admit students must arrive by - May 28, 2025.",https://iss.ku.edu/arrival-date-newly-admitted,iss.ku.edu
Which types of companies typically employ KU Bioengineering graduates?,"Employers of KU Bioengineering graduates include companies from various sectors such as biomedical device firms, biotechnology, health care, and pharmaceutical firms.",Who Hires KU Bioengineering Students? Click to expand Abbott Labs Amgen Beckman Coulter Diagnostics Becton Dickinson Boehringer Ingelheim Boston Scientific Bristol Myers Squibb Catalent Pharma Solutions CritiTech Particle Engineering Solutions Epic Systems Evoke Medical Merck MRIGlobal National Institutes of Health PSC Biotech Pfizer Where do they Work? Click to expand Athletics companies Biomedical device firms Biotechnology Environmental companies Health care Manufacturing companies Pharmaceutical firms State/federal government.,https://engr.ku.edu/bioengineering-brochure-2023,engr.ku.edu
From which city does Josh Dwoskin hail?,"Josh Dwoskin's hometown is Atlanta, GA.","Josh Dwoskin Applied Computing, 2026 Hometown: Atlanta, GA",https://engr.ku.edu/self-applied-computing,engr.ku.edu
What is the hometown of the student named Alana Schmalzried-Lugo?,"Alana Schmalzried-Lugo's hometown is Olathe, KS.","Alana Schmalzried-Lugo Electrical Engineering, 2027 Hometown: Olathe, KS",https://engr.ku.edu/self-electrical-engineering,engr.ku.edu
What is the legal requirement regarding your I-94 once you arrive in the U.S.?,"Legally, you are required to carry your I-94 with you at all times.","Legally, you are required to carry your I-94 with you at all-times.",https://iss.ku.edu/i94-newly-admitted,iss.ku.edu
What is the minimum GPA requirement for completing the BME minor courses?,Students must complete the courses required with a cumulative GPA of 2.0 or better.,The BME minor requires a minimum of 18 credit hours. Students must complete the courses required with a cumulative GPA of 2.0 or better.,http://bioengr.ku.edu/minor-biomedical-engineering,bioengr.ku.edu
What role did Zack Holland play in the advisory board for the Department of Chemical & Petroleum Engineering?,"Holland served on the advisory board for the Department of Chemical & Petroleum Engineering from 2006 to 2010, contributing insights during a period of growth for the department.","Holland shared his insight on the needs and direction of the petroleum engineering profession through his service on the advisory board for Department of Chemical & Petroleum Engineering from 2006 to 2010, coinciding with a period of growth for the department.",https://engr.ku.edu/news/article/ku-engineering-to-honor-2-alumni-with-distinguished-engineering-service-award,engr.ku.edu
What is the premium amount students with GTA/GRA/GA appointments need to pay for their health insurance?,The students need to pay a 25% portion of the insurance fee amounting to $118.00.,Students with a qualifying GTA/GRA/GA appointment for the semester should pay their 25% portion of the insurance fee ($118.00) when paying tuition and fees.,https://iss.ku.edu/optional-insurnace-summer,iss.ku.edu
Which institute is associated with patient-centered outcomes research funding?,Patient-Centered Outcomes Research Institute,Patient-Centered Outcomes Research Institute,https://engr.ku.edu/external-funding-faculty,engr.ku.edu
What are some specific areas of research highlighted within the graduate programs?,"Cutting-edge research includes bioengineering, catalysis, renewable energy, sustainability, and reservoir simulation.","Work on cutting-edge research with nationally and internationally recognized faculty in areas including bioengineering, catalysis, renewable energy, sustainability, separations, enhanced oil and gas recovery, unconventional reservoirs, data mining and reservoir characterization, flow in porous media, and reservoir simulation.",http://cpe.engr.ku.edu/advisory-board,cpe.engr.ku.edu
What areas of research can graduate students engage in according to the passage?,"Graduate students can work on research in bioengineering, catalysis, renewable energy, sustainability, separations, enhanced oil and gas recovery, unconventional reservoirs, data mining and reservoir characterization, flow in porous media, and reservoir simulation.","Work on cutting-edge research with nationally and internationally recognized faculty in areas including bioengineering, catalysis, renewable energy, sustainability, separations, enhanced oil and gas recovery, unconventional reservoirs, data mining and reservoir characterization, flow in porous media, and reservoir simulation.",http://cpe.engr.ku.edu/teaching-labs,cpe.engr.ku.edu
What research areas are highlighted in the graduate programs of the Chemical and Petroleum Engineering department?,"Research areas include bioengineering, catalysis, renewable energy, sustainability, separations, enhanced oil and gas recovery, unconventional reservoirs, data mining and reservoir characterization, flow in porous media, and reservoir simulation.","Work on cutting-edge research with nationally and internationally recognized faculty in areas including bioengineering, catalysis, renewable energy, sustainability, separations, enhanced oil and gas recovery, unconventional reservoirs, data mining and reservoir characterization, flow in porous media, and reservoir simulation.",http://cpe.engr.ku.edu/cpe-images,cpe.engr.ku.edu
What notable awards has Derek Zomer received?,He received the 2019 Melissa Beall Award from the Central States Communication Association and the 2024 Larry Draper Campus Liaison Award from the University of Kansas.,"2019 Melissa Beall Award, Central States Communication Association 2024 Larry Draper Campus Liaison Award, University of Kansas",https://eecs.ku.edu/people/derek-zomer,eecs.ku.edu
What academic title does David Johnson hold?,He holds the title of Associate Teaching Professor.,David Johnson Associate Teaching Professor,https://eecs.ku.edu/people/david-johnson,eecs.ku.edu
What are international students required to do before arriving on campus?,"They must secure their housing, book transportation from the airport, and complete a pre-arrival checklist within the Canvas course.",Secure your housing on or off-campus. Book your transportation from the airport to the campus. (KU will not be providing shuttle service from the airport.) Pre-Arrival Checklist After Arrival.,https://iss.ku.edu/international-student-orientation,iss.ku.edu
Why is it advised to secure funding prior to arriving in the United States for international students?,"U.S. immigration regulations greatly restrict employment opportunities for international students, making it risky to rely on finding a job or scholarships after arriving.",Secure funding prior to your arrival in the United States. Do not assume you will be able to find a job or get a scholarship in the U.S. to cover your expenses. U.S. immigration regulations greatly restrict employment opportunities for international students.,https://iss.ku.edu/applying-your-i-20ds-2019-form,iss.ku.edu
What joint administrative departments are involved in the Engineering Physics program at KU?,The program is jointly administered through the School of Engineering and the Department of Physics and Astronomy.,KU's Engineering Physics program is jointly administered through the School of Engineering and the Department of Physics and Astronomy in the College of Liberal Arts and Sciences.,http://ephx.engr.ku.edu/,ephx.engr.ku.edu
What is the timeline of Sankha Narayan Guria's academic journey prior to joining EECS?,"He earned his Ph.D. in Computer Science from the University of Maryland, College Park in summer 2023.","Sankha Narayan Guria joined the department in fall 2023. He earned his Ph.D. in Computer Science from the University of Maryland, College Park in summer 2023.",https://eecs.ku.edu/news/article/2023/08/18/new-eecs-faculty-members-bring-expertise-data-security-privacy-and-programming-languages,eecs.ku.edu
What types of research collaborations exist within the KU bioengineering program?,"The program features collaborations across KU’s main campus in Lawrence and at the KU Medical Center in Kansas City, Kansas.","Bioengineering collaborations across KU’s main campus in Lawrence and at the KU Medical Center in Kansas City, Kansas, ensure that graduate students in the bioengineering program receive a fundamentally strong and comprehensive research and education experience.",https://bioengr.ku.edu/bioengineering-graduate-programs-2024-25,bioengr.ku.edu
What impact does the recognition at SC24 signify for Dr. El-Araby's research?,It highlights the significant impact their research is having on the field of HPC.,This recognition at SC24 highlights the significant impact their research is having on the field of HPC.,https://eecs.ku.edu/news/article/eecs-faculty-research-group-makes-waves-at-international-high-performance-computing-conference-for-second-consecutive-year,eecs.ku.edu
What types of teaching subjects does Carlton Leuschen cover?,"He teaches courses on Electronic Circuits, Signals and Systems, Digital Signal Processing, and Radar Systems.",Teaching — Electronic Circuits Signals and Systems Digital Signal Processing using Field Programmable Gate Arrays Radar Systems.,https://eecs.ku.edu/people/carlton-leuschen,eecs.ku.edu
Who is the Track Co-Director of the Biomedical Product Design and Development program?,"Sara Wilson, Ph.D., is the Track Co-Director of the Biomedical Product Design & Development program.","Sara Wilson, Ph.D. - Track Co-Director, Biomedical Product Design & Dev. - Associate Professor, Mechanical Engineering.",https://bioengr.ku.edu/biomedical-product-design-development,bioengr.ku.edu
"What was the enrollment number for the BS in Mechanical Engineering program in the 2020-2021 academic year, and how did it compare to the previous year?","The enrollment was 503 in the 2020-2021 academic year, a slight increase from 492 in 2019-2020.",BS in Mechanical Engineering School Year Enrolled 2019-2020 508; 2020-2021 503.,https://engr.ku.edu/enrollment-and-graduation-data,engr.ku.edu
What types of research areas are emphasized in the graduate programs of the Department of Chemical & Petroleum Engineering?,"Research areas include bioengineering, catalysis, renewable energy, sustainability, separations, enhanced oil and gas recovery, unconventional reservoirs, data mining and reservoir characterization, flow in porous media, and reservoir simulation.","Work on cutting-edge research with nationally and internationally recognized faculty in areas including bioengineering, catalysis, renewable energy, sustainability, separations, enhanced oil and gas recovery, unconventional reservoirs, data mining and reservoir characterization, flow in porous media, and reservoir simulation.",http://cpe.engr.ku.edu/opportunities,cpe.engr.ku.edu
What type of coursework can undergraduate students complete to receive credit for the accelerated Master's in Bioengineering program?,Students admitted to the accelerated program receive a 6 credit hour reduction upon admission for 700 level or above course work completed as part of the BS curriculum.,"Students who are admitted to this program receive academic credit for their exceptional preparation, reducing the time necessary to complete the MS degree. Normally, the MS plan of study requires 24 hours of graduate course credit plus 6 hours of thesis work. Students admitted to the accelerated program receive a 6 credit hour reduction upon admission for 700 level or above course work completed as part of the BS curriculum.",http://bio.engr.ku.edu/accelerated-ms,bio.engr.ku.edu
What specific types of labs are available for undergraduate mechanical engineering students?,"Undergraduate mechanical engineering students at KU have access to laboratories such as the Design and Manufacturing Lab, the Fluid Mechanics Lab, and the Dynamics and Controls Lab.","The undergraduate mechanical engineering students use laboratories such as the Design and Manufacturing Lab, the Fluid Mechanics Lab, and the Dynamics and Controls Lab.",https://engr.ku.edu/mechanical-engineering-facilities,engr.ku.edu
What types of degrees does the Electrical Engineering and Computer Science Department offer?,"The department offers Bachelor of Science (B.S.) degree programs in Computer Science, Computer Engineering, Electrical Engineering, and Interdisciplinary Computing.","The Electrical Engineering and Computer Science Department offers Bachelor of Science (B.S.) degree programs in the following disciplines: Computer Science, Computer Engineering, Electrical Engineering, Interdisciplinary Computing.",https://eecs.ku.edu/undergraduate-programs,eecs.ku.edu
Which department is noted for having research grants focused on environmental issues?,Environmental Protection Agency (EPA),Environmental Protection Agency EPA Grants EPA Research Grants,https://engr.ku.edu/external-funding-faculty,engr.ku.edu
Where is Marisa Ross originally from?,"Sabetha, Kansas.","Originally from Sabetha, Kansas, Marisa Ross has been a Lawrence resident since 2008.",https://registrar.ku.edu/people/marisa-ross,registrar.ku.edu
What range of starting salaries can graduates expect for various engineering disciplines from KU?,"The starting salary range for graduates varies; Computer Engineering: $72,500 - $85,000, Computer Science: $70,500 - $97,650, Electrical Engineering: $70,000 - $80,000.","Bachelor's degree candidates national average starting salary range: Computer Engineering: $72,500 - $85,000; Computer Science: $70,500 - $97,650; Electrical Engineering: $70,000 - $80,000.",https://engr.ku.edu/node/2792,engr.ku.edu
Which professors are collaborating with Dr. Morteza Hashemi on this project?,Dr. Victor Frost and Dr. Shawn Keshmiri are collaborating with Dr. Morteza Hashemi.,"Collaborating closely with Dr. Victor Frost, a professor in EECS and an expert in wireless communication, and Dr. Shawn Keshmiri, a professor in aerospace engineering and an expert in guidance, navigation, and control of multi-agent unmanned aerial systems.",https://eecs.ku.edu/news/article/2023/08/22/eecs-professor-secures-600k-nsf-award-rural-cellular-network-performance-study,eecs.ku.edu
What unique program related to petroleum engineering does the University of Kansas offer?,The University of Kansas hosts the only petroleum engineering program in the State of Kansas.,The University of Kansas hosts the only petroleum engineering program in the State of Kansas and is home to the Tertiary Oil Recovery Program.,http://cpe.engr.ku.edu/about-undergraduate,cpe.engr.ku.edu
What service does the Office of the University Registrar provide to support students transferring to the university?,It supports students in the transfer credit evaluation process to guide their transition to the university.,Supporting students in the transfer credit evaluation process to guide their transition to the university.,https://registrar.ku.edu/node/66,registrar.ku.edu
What does McCormick hope the results of his project will achieve?,He hopes the results will be a seed for a research portfolio that continues to expand in the future.,I hope the results from this project will be a seed for a research portfolio that continues to expand in the future.,https://engr.ku.edu/news/article/2024/01/08/engineering-professor-receives-darpa-grant-research-radar-signal-processing,engr.ku.edu
What unique opportunity does the University of Kansas provide in terms of its petroleum engineering program?,It hosts the only petroleum engineering program in the State of Kansas.,The University of Kansas hosts the only petroleum engineering program in the State of Kansas and is home to the Tertiary Oil Recovery Program.,http://cpe.engr.ku.edu/videos,cpe.engr.ku.edu
What are the implications for students who fail to comply with immunization and tuberculosis testing requirements?,Failure to comply with the immunization policy will result in not being allowed to enroll in classes.,Failure to comply with this policy will result in not being allowed to enroll in classes.,https://iss.ku.edu/jayhawk-semester-students,iss.ku.edu
Can students from schools without an engineering program participate in the competition?,"Yes, teams are encouraged to compete regardless of having an engineering program.",Absolutely. Teams are encouraged to compete to the best of their ability and go as far in each competition as possible.,https://engr.ku.edu/hsd-faq,engr.ku.edu
What is the focus of William Powers' research project and who is supervising it?,"William Powers' research project, entitled BackTrader V2, focuses on creating a cloud platform for investors to build automated computer trading systems without programming, supervised by Professor Hossein Saiedian.","Powers' research and creative work is entitled BackTrader V2, a cloud platform that will allow investors to build automated computer trading systems without programming; his work will be supervised by Professor Hossein Saiedian.",https://eecs.ku.edu/news/article/2022/12/17/two-eecs-undergraduate-students-earn-research-awards,eecs.ku.edu
Can you name some specific start-up companies founded by KU students?,"A sampling of our student start-up companies include Dynamic Athletic Research Institute, LLC, Evoke Medical, Glyscend, and Likarda.","A sampling of our student start-up companies include: Dynamic Athletic Research Institute, LLC, Lenexa, KS; Evoke Medical, Lawrence, KS; Glyscend, Baltimore, MD; Likarda, Kansas City, KS.",http://bioengr.ku.edu/beyond-ku,bioengr.ku.edu
What is the purpose of the fee structure implemented by KU for immigration services?,The fee structure is necessary to ensure KU retains the internal capacity to perform immigration work and hold costs to the unit to a minimum.,The implementation of a fee structure is necessary to ensure KU retains the internal capacity to perform this work and hold costs to the unit to a minimum.,https://iss.ku.edu/immigration-service-fees,iss.ku.edu
What unique program does the University of Kansas offer in the field of Petroleum Engineering?,The University of Kansas hosts the only petroleum engineering program in the State of Kansas.,The University of Kansas hosts the only petroleum engineering program in the State of Kansas and is home to the Tertiary Oil Recovery Program.,http://cpe.engr.ku.edu/staff-profiles,cpe.engr.ku.edu
What policies govern the disclosure of student information?,The disclosure of student information is processed according to the Student Records Policy as administered by the Office of the University Registrar and General Counsel.,Student Privacy: Disclosure of student information is processed according to the Student Records Policy as administered by the Office of the University Registrar and General Counsel.,https://registrar.ku.edu/course-and-room-scheduling,registrar.ku.edu
What specific project did Promise O. Longe work on related to CO2 and enhanced oil recovery?,He worked on a field-scale reservoir simulation project of CO2-WAG injection for EOR and CO2 sequestration in Kansas.,"Previously, he has worked on a field—scale reservoir simulation project of CO2-WAG injection for EOR and CO2 sequestration in Kansas.",https://engr.ku.edu/people/promise-o-longe,engr.ku.edu
What unique faculty position is open at the University of Minnesota in the field of Biomedical Engineering?,BME Faculty Position - Open Rank (Assistant/Associate/Professor),BME Faculty Position - Open Rank (Assistant/Associate/Professor) University of Minnesota Apply/MoreInfo,https://bioengr.ku.edu/opportunities,bioengr.ku.edu
What unique program does the University of Kansas offer in petroleum engineering?,The University of Kansas hosts the only petroleum engineering program in the State of Kansas.,The University of Kansas hosts the only petroleum engineering program in the State of Kansas and is home to the Tertiary Oil Recovery Program.,http://cpe.engr.ku.edu/research-and-job-opportunities,cpe.engr.ku.edu
What are the scheduled timings for the public open house at the KU Engineering Expo?,The public open house is set for noon to 3 p.m. on February 23.,Expo will host an open house for the public from noon to 3 p.m. Feb. 23.,https://engr.ku.edu/news/article/expo-showcases-the-wonders-of-ku-engineering,engr.ku.edu
What was the original relationship between the School of Architecture and the School of Engineering?,"Originally, KU's architecture degree program was administered through the School of Engineering.","Originally, KU's architecture degree program was administered through the School of Engineering.",https://engr.ku.edu/history,engr.ku.edu
Which department does Dave Glauner work in at the university?,Engineering Technology Service Center,"Dave Glauner IT Support Technician Senior, Engineering Technology Service Center",https://engr.ku.edu/people/dave-glauner,engr.ku.edu
What types of research areas do faculty engage in within the graduate programs?,"Research areas include bioengineering, catalysis, renewable energy, sustainability, and reservoir simulation, among others.","Work on cutting-edge research with nationally and internationally recognized faculty in areas including bioengineering, catalysis, renewable energy, sustainability, separations, enhanced oil and gas recovery, unconventional reservoirs, data mining and reservoir characterization, flow in porous media, and reservoir simulation.",http://cpe.engr.ku.edu/resources-undergraduate,cpe.engr.ku.edu
Where is Tracy Rockers' office located?,"Tracy Rockers' office is located in Eaton Hall, room 1H.","Eaton Hall, room 1H 1520 W. 15th Street Lawrence, KS 66045",https://engr.ku.edu/people/tracy-rockers,engr.ku.edu
How are the undergraduate degree plans categorized on the advising page?,Undergraduate degree plans are categorized by department or program for easier navigation.,Majors are broken down by department or program.,https://engr.ku.edu/advising/degree-plans,engr.ku.edu
What actions must an F-1 student take if they have not completed their educational program by the I-20 completion date?,They must apply for a Program Extension before their current I-20 expires.,"An F-1 student who will not complete their educational program by the completion date noted in Section 5 on their most current, valid I-20 must apply for a Program Extension.",https://iss.ku.edu/i-20-extension,iss.ku.edu
What happens if a student completes the graduate certificate in RF Systems Engineering with a grade of B or better within a certain timeframe?,"Completion of the graduate certificate within five years, with a grade of B or better, is recognized as exceptional preparation, warranting a waiver of course work from the certificate not transferred.","For the purposes of the MSEE program, completion of the graduate certificate in RF Systems Engineering within five years, with a grade of B or better, shall also be recognized as exceptional preparation which warrants the waiver of course work completed during the certificate program and not transferred.",https://eecs.ku.edu/current/rf-systems-engineering-graduate-certificate,eecs.ku.edu
Who is the founding director of the Bachelor of Science in Interdisciplinary Computing Program?,"Suzanne Shontz, Ph.D.","Founding Director, Bachelor of Science in Interdisciplinary Computing Program, Department of Electrical Engineering and Computer Science.",https://bioengr.ku.edu/leadership,bioengr.ku.edu
What must students do to verify completion of their Research/Design Requirement for the Bioengineering Certificate?,Students must submit a Bioengineering Research or Design Course Approval Petition after completing their pre-approved project.,"When you have completed your pre-approved project, then follow these steps for verification of completion of your Research/Design Requirement.",http://bioengr.ku.edu/undergraduate-certificate,bioengr.ku.edu
What is the GPA requirement for students to maintain after applying for the accelerated Master's in Bioengineering program?,Students must maintain at least a 3.50 for all remaining undergraduate courses in their B.S. program.,"If accepted, the students must maintain at least a 3.50 for all remaining undergraduate courses in their B.S. program.",https://bioengr.ku.edu/accelerated-ms,bioengr.ku.edu
What teaching methods are emphasized in the KU Chemical & Petroleum Engineering program?,The program emphasizes hands-on education based on industrial problems and real-world examples.,Learn more about how hands-on education based on industrial problems and real-world examples taught by expert faculty can start your path to a successful career.,http://cpe.engr.ku.edu/reu,cpe.engr.ku.edu
What guidelines should students and faculty follow regarding graduate travel?,Bioengineering Travel Guidelines.,Travel Click to expand ... Bioengineering Travel Guidelines,https://bioengr.ku.edu/forms-documents,bioengr.ku.edu
What is the eligibility requirement for accessing the insurance ID cards?,Students must wait for an email from ISS Insurance notifying them that their insurance has been activated before they can print the ID card.,You CANNOT print out a card before you receive an email from ISS Insurance notifying you that your insurance has been activated.,https://iss.ku.edu/plan-details-id-cards,iss.ku.edu
In what ways does ISS encourage community engagement among international students?,ISS encourages community engagement through volunteer opportunities and by partnering with local cultural and ethnic organizations.,Give back to your community. Promote cross-cultural exchange. Volunteer with ISS Local Cultural and Ethnic Organizations...,https://iss.ku.edu/events-programs,iss.ku.edu
What role does Rachel Jarvis hold at the university?,Assistant Professor.,Rachel Jarvis Assistant Professor,https://eecs.ku.edu/people/rachel-jarvis,eecs.ku.edu
What happens if a student's STEM OPT application is filed late?,"If the STEM application is not receipted before the current OPT expiration date, the student will not be able to continue working pending the decision on their application.","Applications for the STEM OPT extension can be filed up to 90 days prior to the end of the regular period of post-completion OPT, but USCIS must receive and receipt the application before the current OPT expires.",https://iss.ku.edu/f-1-opt-stem-extension,iss.ku.edu
Which programming language tools and environments are associated with the computer systems design research at EECS?,"Associated facilities include the Rosetta specification language, Raskell evaluation environment, and various analysis software like PVS, SPIN, Isabelle, HOL, and SAT.","Associated Facilities Click to expand Smart GDB debugging environment C, C++, and GDB and associated support tools Rosetta specification language Raskell evaluation environment PVS, SPIN, Isabelle, HOL, and SAT analysis software.",https://eecs.ku.edu/computer-systems-design,eecs.ku.edu
What is the role of Jeff Roberts at the university?,He is the Assistant University Registrar.,Jeff Roberts Assistant University Registrar,https://registrar.ku.edu/people/jeff-roberts,registrar.ku.edu
What is the role of Keeli Nelson in the hiring process for tenure-track positions?,Keeli Nelson works as the Immigration Employment Coordinator in Human Resources and should be contacted by departments planning to hire tenure/tenure-track faculty.,"Departments that are planning to hire a tenure/tenure-track faculty should reach out directly to Immigration Employment Coordinator, Keeli Nelson. Keeli works in Human Resources.",https://iss.ku.edu/hire-foreign-national,iss.ku.edu
What is the enrollment requirement for students in J immigration status regarding health insurance?,Students in J immigration status are required to stay continually enrolled in health insurance for themselves and their dependents for the entirety of their stay in the United States.,Please be advised that students in J immigration status are required to stay continually enrolled in health insurance for themselves and their dependents for the entirety of their stay in the United States.,https://iss.ku.edu/health-insurance-OPT-AT,iss.ku.edu
How many years did Mary Rezac serve at Washington State University before joining KU?,Seven years,Rezac joined KU as Dean of Engineering in March 2024 after seven years as dean of Washington State University's Voiland College of Engineering and Architecture.,https://engr.ku.edu/people/mary-rezac-phd,engr.ku.edu
Are there any final exams scheduled for classes listed under 'No finals scheduled'?,"No, there are no finals scheduled for the classes listed under 'No finals scheduled'.",No finals scheduled.,https://registrar.ku.edu/fall-2025-final-exam-schedule,registrar.ku.edu
What steps must applicants for the SELF Program be prepared to undertake during the application process?,Applicants must be willing to participate in interviews and other assessment methods employed as part of the selection process.,Applicants must be willing to participate in interviews and other assessment methods employed as part of the selection process.,https://engr.ku.edu/apply-self-program,engr.ku.edu
Who should faculty members contact to schedule a meeting for ASCEND funding application support?,Nikki Hammond,Reach out to Nikki Hammond ( nikkihammond@ku.edu ) to schedule a meeting with Suzanne.,https://engr.ku.edu/ascend-funding-program,engr.ku.edu
What specific training plan form must be completed for the STEM OPT extension?,Students must complete the Training Plan on form I-983 along with their employer.,"Complete, along with your employer, a Training Plan on form I-983.",https://iss.ku.edu/f-1-opt-stem-extension,iss.ku.edu
What special considerations are made for guests with limited mobility during the Engineering recognition ceremonies?,"Special seating is available for guests with limited mobility, and it is requested that parties limit their use of reserved seating to those who need it and one additional companion.","Special seating is available for guests with limited mobility. For the spring ceremony, to ensure all guests with mobility concerns are accommodated, we ask that parties limit their use of reserved seating to those who need it and one additional companion.",https://engr.ku.edu/graduate-graduation,engr.ku.edu
How long has the International Student Association (ISA) been active at KU?,ISA has been active for more than 50 years.,ISA has been active for more than 50 years and provides a platform for KU international students to share their unique backgrounds with the wider KU community.,https://iss.ku.edu/international-student-clubs-and-organizations,iss.ku.edu
How does the PrivDNN method proposed by Liangqin Ren enhance privacy-preserving inference in deep learning?,"PrivDNN reduces encrypted operations by 85%-98% through selective encryption of the most critical model parameters, significantly enhancing efficiency.","We propose PrivDNN, which selectively encrypts the most critical model parameters, significantly reducing encrypted operations.",https://eecs.ku.edu/defense-notices?page=%2C0,eecs.ku.edu
What accreditation does the Engineering Physics Bachelor of Science program hold?,The program is accredited by the Engineering Accreditation Commission of ABET.,"The Engineering Physics Bachelor of Science program is accredited by the Engineering Accreditation Commission of ABET, under the commission’s General Criteria and Program Criteria for Engineering, General Engineering, Engineering Physics, Engineering Science, and Similarly Named Engineering Programs.",http://ephx.engr.ku.edu/degree-concentrations,ephx.engr.ku.edu
How does the Engineering Physics program at KU prepare students for future careers?,"Students engage in interdisciplinary education and cutting-edge research experiences that integrate science, math, and engineering.",In our interdisciplinary program students prepare themselves for life in the 21st century. Students work with faculty from both the Department of Physics and Astronomy and the School of Engineering.,http://ephx.engr.ku.edu/people/list/staff,ephx.engr.ku.edu
How has the University of Kansas responded to the growing need for public health strategies in relation to infectious diseases?,The University of Kansas received an $11.35 million NIH COBRE award to continue fighting against infectious diseases.,"With new $11.35M NIH COBRE award, KU center continues fight against infectious diseases...",https://engr.ku.edu/news?page=4,engr.ku.edu
What application areas are included under the umbrella of molecular modeling?,"Molecular modeling includes biological sequence analysis, the structure and function of proteins and nucleic acids, genetic networks and gene expression, and molecular evolution.","Molecular modeling can include biological sequence analysis, the structure and function of proteins and nucleic acids, genetic networks and gene expression, molecular evolution, and hypothesis generation from large-scale data sources.",https://bioengr.ku.edu/computational-bioengineering,bioengr.ku.edu
How does the Office of the University Registrar assist in class scheduling?,"The Office of the University Registrar helps faculty and staff schedule classes, final exams, update the catalog, and reserve centrally scheduled classrooms.","Helping faculty and staff schedule classes, final exams, update the catalog, schedule, and reserve centrally scheduled classrooms.",https://registrar.ku.edu/node/66,registrar.ku.edu
What innovative technique is introduced for measuring birefringence in optical fibers?,"A polarization-sensitive Optical Frequency Domain Reflectometer (OFDR) system is introduced, utilizing a coherent optical transceiver to generate a linear frequency chirp for precise birefringence measurements.",We also demonstrate a polarization-sensitive OFDR system utilizing a commercially available digital coherent optical transceiver to generate a linear frequency chirp.,https://eecs.ku.edu/defense-notices?page=%2C80,eecs.ku.edu
What are the preferred pronouns of Elaina Sutley?,Her preferred pronouns are she/her/hers.,She/her/hers,https://engr.ku.edu/people/elaina-sutley,engr.ku.edu
What indicates that a website is secure when providing personal information?,A secure website will have 'https://' at the beginning of the web address and show a padlock symbol at the bottom right of the screen.,You may determine if a website is secure by looking at the beginning of the web address in your browser's address bar. It should read 'https://' instead of 'http://'. You may also look to the bottom right of your screen for a padlock symbol.,https://iss.ku.edu/identity-theft,iss.ku.edu
Is there a specific platform or method to request a room in the School of Engineering?,"Yes, there is a 'Request a Room' option available.",View rooms and resources Request a Room,https://engr.ku.edu/room-reservation-request,engr.ku.edu
What feedback did Baca and Harders receive from the judges during the competition?,They received a lot of excellent and valuable feedback from the judges during and after the competition.,"Some of the Q&A sessions were intense, but we received a lot of excellent and valuable feedback from the judges during and after the competition...",https://engr.ku.edu/news/article/icorium-engineering-company-earns-top-5-finish-at-2024-rice-business-plan-competition,engr.ku.edu
What is the phone number to reach Aaron McIntyre?,The phone number to reach Aaron McIntyre is 785-864-3617.,Contact Info 785-864-3617,https://iss.ku.edu/people/aaron-mcintyre,iss.ku.edu
Which honoree has the title 'Rear Adm.'?,Rear Adm. Wayne E. Meyer is recognized.,Rear Adm. Wayne E. Meyer View full profile,https://engr.ku.edu/desa,engr.ku.edu
What aspect of licensure regulations do the KU’s programs strive to maintain?,KU’s licensure programs strive to maintain accurate and up-to-date information about the educational requirements for licensure in U.S. states and territories.,KU’s licensure programs strive to maintain accurate and up-to-date information about the educational requirements for licensure in U.S. states and territories.,https://engr.ku.edu/public-disclosure-requirements-licensure-programs,engr.ku.edu
What must be included in the syllabus of an online course where a proctored or online exam is given?,The due date for the proctored or online exam must be noted in the course syllabus.,"except that if a proctored or online exam is given for an online course, the due date shall be noted in the course syllabus.",https://registrar.ku.edu/final-exams-online-and-non-regular-courses,registrar.ku.edu
Who can be contacted for more information about industry partnerships at KU Engineering?,"For more information about industry partnerships, contact Jane New, the director of industry partnerships.","Please contact Jane New, director of industry partnerships, for more information.",https://engr.ku.edu/industry-research-partners,engr.ku.edu
What is the average GPA for applicants to the Ph.D. programs in the EECS Department?,The mean GPA for applicants is 3.6.,GPA: at or above 3.5 on a 4 point scale (mean GPA: 3.6).,https://eecs.ku.edu/ph-d-programs,eecs.ku.edu
How does the department approach education in the petroleum engineering program?,The department uses hands-on education based on industrial problems and real-world examples.,Learn more about how hands-on education based on industrial problems and real-world examples taught by expert faculty can start your path to a successful career.,http://cpe.engr.ku.edu/forms,cpe.engr.ku.edu
What type of seating is available in the Spahr Classroom 216?,The Spahr Classroom 216 has tiered tables.,2 - Spahr Classroom 216 Full Media Auditorium Tiered Tables 2.,https://engr.ku.edu/eaton-learned-and-leep2-spaces,engr.ku.edu
What is the significance of the funding received by Assistant Professor Morteza Hashemi?,The funding from Sony Corporation aims to develop novel multi-hop routing protocols for millimeter wave communication systems.,Sony Corporation of America is supporting Assistant Professor Morteza Hashemi to develop novel multi-hop routing protocols for millimeter wave (mmWave) communication systems.,https://eecs.ku.edu/news?page=3,eecs.ku.edu
How can Lindsey McCaig be contacted via email?,Lindsey McCaig can be contacted via email at lmccaig@ku.edu.,lmccaig@ku.edu,https://engr.ku.edu/people/lindsey-mccaig,engr.ku.edu
What notable awards did Michael Branicky receive in honor of his contributions to teaching?,"He received several teaching awards including the EECS Department Teaching Award at CWRU in 2004 and 2007, and the Teaching Leader Award from the Case School of Engineering in 2004.","Teaching Award , EECS Department, CWRU, 2007. Teaching Award , EECS Department, CWRU, 2004. Teaching Leader Award , Case School of Engineering, 2004.",https://eecs.ku.edu/people/michael-branicky,eecs.ku.edu
What key events occur during the first few weeks for students starting in August?,They can attend events and activities during Hawk Week with thousands of other Jayhawks.,"For students beginning in August, kick off your KU career by attending events and activities during Hawk week with thousands of other Jayhawks.",https://iss.ku.edu/international-student-orientation,iss.ku.edu
What specific democratic aim does Brian McClendon's research focus on?,His research aims to democratize machine learning.,"My focus is on democratizing machine learning, computer vision, autonomous vehicles, and next-generation mapping technology.",https://eecs.ku.edu/people/brian-mcclendon,eecs.ku.edu
How much has been spent on laboratory equipment upgrades over the past six years in the EECS department?,More than $1.7 million has been spent on laboratory equipment in the past six years.,Upgrades to the eight computer labs and nine hardware labs are included in the more than $1.7 million spent on laboratory equipment in the past six years.,https://eecs.ku.edu/undergraduate-programs,eecs.ku.edu
Are tips expected when using Uber or Lyft services?,Tips are not currently expected when using Uber or Lyft services.,Uber/Lyft is generally a cheaper option than taxis and tips are not currently expected.,https://iss.ku.edu/taxisuber,iss.ku.edu
What type of education approach is emphasized in the petroleum engineering program at the University of Kansas?,The program emphasizes hands-on education based on industrial problems and real-world examples.,Learn more about how hands-on education based on industrial problems and real-world examples taught by expert faculty can start your path to a successful career.,http://cpe.engr.ku.edu/chemical-engineering,cpe.engr.ku.edu
When is the colloquium scheduled for Antonis P. Stylianou?,The colloquium for Antonis P. Stylianou is scheduled for 03/03/2025.,"Monday: 03/03/2025 Antonis P. Stylianou Associate Professor, Mechanical Engineering Program Chair Division of Energy, Matter, and Systems School of Science and Engineering University of Missouri - Kansas City",http://bioengr.ku.edu/colloquium,bioengr.ku.edu
What is the target audience for the Rising BME Scholars Conference?,"The target audience is early to mid-stage doctoral students, at least one year prior to graduation.","Rising BME Scholars will be early to mid-stage doctoral students, at least one year prior to graduation.",https://bioengr.ku.edu/rising-bme-scholars-conference,bioengr.ku.edu
What could a university employee include in their request for student information?,A university employee might complete the Request for Student Information.,University employees requesting student information for internal use may complete the Request for Student Information.,https://registrar.ku.edu/requests-student-information,registrar.ku.edu
What type of employment does the authorization with an international organization allow an F-1 student to pursue?,The position does not have to be related to the student’s field of study.,"The position does not have to be related to the student’s field of study, but the authorization cannot extend beyond the end of the student’s academic program.",https://iss.ku.edu/f-1-internship-international-organization,iss.ku.edu
What types of support are offered to catalyze innovative discoveries in KU Engineering?,"The support includes collaborative research visioning, faculty mentoring, and seed funding programs.","Through collaborative research visioning, faculty mentoring, and seed funding programs, we catalyze innovative and unique discoveries...",https://engr.ku.edu/news-faculty-leaders-and-research-support,engr.ku.edu
What significant achievement did the Undergraduate Certificate in Cybersecurity Program receive in 2022?,It was validated by the NSA National CAE Program as a new Program of Study in Cybersecurity.,"The Undergraduate Certificate in Cybersecurity Program has been validated by NSA National CAE Program in 2022, as a new Program of Study in Cybersecurity under KU’s CAE-CD designation.",https://eecs.ku.edu/news?page=2,eecs.ku.edu
What happens after a CBP officer decides to admit you to the U.S.?,"You will be photographed, fingerprinted, and receive an admission stamp in your passport indicating your status.","Once the CBP officer has made the decision to admit you to the U.S., you will be photographed, fingerprinted and an admission stamp will be put in your passport. The stamp will indicate the status you are being given (F-1, J-1 etc).",https://iss.ku.edu/entry-newly-admitted,iss.ku.edu
What prize did the winning team receive for their accomplishment?,They received an Arduino kit as their prize.,"Congratulations to these talented students for their outstanding success, and for bringing home an Arduino kit as their prize.",https://eecs.ku.edu/news/article/eecs-students-achieve-success-at-hack-k-state-2024,eecs.ku.edu
What GPA must bioengineering students maintain to meet program expectations?,Students are expected to maintain a 3.0 GPA in their coursework.,Students are expected to: Maintain a 3.0 GPA in their coursework.,https://bioengr.ku.edu/overview,bioengr.ku.edu
What is the expiration date for health insurance for the summer semester?,July 31 is the expiration date for health insurance for the summer semester.,"Expiration dates are December 31 (for the fall semester), May 31 (for the spring) or July 31 (summer semester).",https://iss.ku.edu/health-insurance-frequently-asked-questions,iss.ku.edu
What error message is mentioned in the passage?,The passage states 'This page has moved!',This page has moved! This page has moved!,https://app.eecs.ku.edu/mill/emailform.php,app.eecs.ku.edu
What is the maximum credit limit for BIOE 860 towards any degree without written waiver?,The maximum credit toward any degree for BIOE 860 is three hours unless waived in writing by the academic director.,Maximum credit toward any degree is three hours unless waived in writing by the academic director.,https://bioengr.ku.edu/bioengineering-courses,bioengr.ku.edu
How much total funding did Icorium Engineering Company win at the Rice Business Plan Competition?,"Icorium won more than $180,000 in investments and nondilutive cash and in-kind prizes.","Icorium Engineering Company... placed fifth overall and won more than $180,000 in investments and nondilutive cash and in-kind prizes.",https://engr.ku.edu/news/article/icorium-engineering-company-earns-top-5-finish-at-2024-rice-business-plan-competition,engr.ku.edu
In which building is David Petr's office located?,His office is located in 2001C Eaton Hall.,2001C Eaton Hall,https://eecs.ku.edu/people/david-petr,eecs.ku.edu
What approach does the KU School of Engineering take in its research initiatives?,The School of Engineering focuses on integrating research and innovation to address key challenging problems on a global scale.,The School of Engineering focuses on integrating research and innovation to address key challenging problems on a global scale.,https://engr.ku.edu/research,engr.ku.edu
What is Palvih Bhana's role at the university?,Palvih Bhana is the Impact and Belonging Coordinator.,Palvih Bhana Impact and Belonging Coordinator,https://engr.ku.edu/people/palvih-bhana,engr.ku.edu
"Which student from the Architectural Engineering program comes from Tulsa, OK?","Avery Hellen comes from Tulsa, OK.","Avery Hellen Architectural Engineering, 2028 Hometown: Tulsa, OK",https://engr.ku.edu/self-architectural,engr.ku.edu
What specific subjects does Dr. Stiles teach in the Electrical Engineering and Computer Science department?,He teaches various courses including Electromagnetics I and Microwave Engineering.,Teaching — EECS 220 - Electromagnetics I EECS 722 - Microwave Engineering 723 lecture material.,https://eecs.ku.edu/people/james-stiles,eecs.ku.edu
What skills are emphasized in the Engineering Physics program at KU?,"The program emphasizes skills in science, math, and engineering.","If you love science, math and engineering, this is the place for you.",http://ephx.engr.ku.edu/program-statements,ephx.engr.ku.edu
What focus does the new National Science Foundation Gen-4 Engineering Research Center at KU have?,The center focuses on developing sustainable refrigerants to address climate change.,KU is the lead institution for a new National Science Foundation Gen-4 Engineering Research Center — Environmentally Applied Refrigerant Technology Hub (EARTH) — that will focus on developing sustainable refrigerants to address climate change.,https://engr.ku.edu/news?page=1,engr.ku.edu
What components must be included in a Ph.D. student’s Plan of Study?,"The Plan of Study must consist of CORE, RESEARCH, DEPTH, BREADTH, and ELECTIVES.","The Plan of Study must consist of the following components: CORE, RESEARCH, DEPTH, BREADTH and ELECTIVES.",http://bioengr.ku.edu/phd,bioengr.ku.edu
What is Malcolm L Snead's role at the University of Southern California?,He is a Professor at the Herman Ostrow School of Dentistry.,"Malcolm L Snead, D.D.S., Ph.D. -Professor, Herman Ostrow School of Dentistry of University of Southern California",http://bio.engr.ku.edu/clinical-affiliates,bio.engr.ku.edu
What is the minimum number of credit hours required for the Research or Design requirement of the Bioengineering Certificate?,A minimum of 2 credit hours is required for the Research or Design activity.,"Research and design activity topics that are not pre-approved may not count towards the Bioengineering Certificate. Research or Design, 2 credit hours minimum.",http://bio.engr.ku.edu/undergraduate-certificate,bio.engr.ku.edu
What offices have ownership and usage rights to emboss the University Seal?,"The offices of the Chancellor, Executive Vice Chancellor at the KU Medical Center, University Registrar, and the Registrar’s Office at the KU Medical Center have ownership rights to emboss the seal.","The offices of the Chancellor, Executive Vice Chancellor at the KU Medical Center, University Registrar, and the Registrar’s Office at the KU Medical Center have ownership and usage rights to devices that can emboss or impress the university seal on a document.",https://registrar.ku.edu/university-seal,registrar.ku.edu
What is the main role of Dave Glauner at the Engineering Technology Service Center?,IT Support Technician Senior,"Dave Glauner IT Support Technician Senior, Engineering Technology Service Center",https://engr.ku.edu/people/dave-glauner,engr.ku.edu
What additional training does the Certificate provide for professionals lacking a Bioengineering degree?,The Certificate in Biomedical Product Design offers additional training in Bioengineering to better prepare professionals for a career in industry.,"the Certificate in Biomedical Product Design offers additional training in Bioengineering, that will better prepare them for a career in industry.",https://bioengr.ku.edu/biomedical-product-design-certificate,bioengr.ku.edu
What are the four design options available for students in the Engineering Physics program?,"The four design options are Aerospace Systems, Chemical Systems, Digital Electronic Systems, and Electromechanical Control Systems.","The program offers a B.S. degree in engineering physics with opportunities to pursue one of four design options: Aerospace Systems, Chemical Systems, Digital Electronic Systems, and Electromechanical Control Systems.",http://ephx.engr.ku.edu/people/list/faculty,ephx.engr.ku.edu
Which department's staff does Sam Klecan belong to?,Sam Klecan belongs to the engineering department.,http://bio.engr.ku.edu/staff,http://bio.engr.ku.edu/staff,bio.engr.ku.edu
What institutions are collaborating with the University of Kansas on this project?,Kansas State University and the University of Tennessee Space Institute are collaborating with the University of Kansas on the project.,A research team from the University of Kansas School of Engineering will collaborate with partner institutions Kansas State University and the University of Tennessee Space Institute on a $4 million Department of Defense-sponsored project.,https://engr.ku.edu/news/article/2023/11/13/ku-engineering-partner-4-million-department-defense-grant,engr.ku.edu
What collaborative opportunities are available for graduate students in the radar systems and remote sensing program?,Students can engage in coursework that includes either EECS 720 or EECS 861 to fulfill their core coursework requirement.,Note: Students must take either EECS 720 or EECS 861 to fulfill their core coursework requirement.,https://eecs.ku.edu/radar-systems-and-remote-sensing,eecs.ku.edu
What type of official records does the University of Kansas maintain?,"The University of Kansas maintains official records of personal, financial, and academic records.","The University of Kansas and the Office of the University Registrar maintains official records of personal, financial, and academic records.",https://registrar.ku.edu/student-records,registrar.ku.edu
What does the success of the KU EECS team reflect about the department's commitment to its students?,"It reflects the department's commitment to providing students with the knowledge, skills, and opportunities needed to excel in their future professional careers.","Their success is a reflection of the department's commitment to providing students with the knowledge, skills, and opportunities needed to excel in their future professional careers.",https://eecs.ku.edu/news/article/ku-eecs-students-achieve-major-success-at-hack-midwest-2024,eecs.ku.edu
What is the recommended time frame for submitting a DS-2019 extension request?,"Extensions should be processed before the completion date on your current DS-2019, and it's recommended to submit your extension paperwork within the semester that your DS-2019 expires.","When to Apply for an Extension If you need more time to complete your degree or program beyond the date in item #3, please submit the DS-2019 Extension Request. Extensions should be processed before the completion date on your current DS-2019. We recommend that you submit your extension paperwork within the semester that your DS-2019 expires.",https://iss.ku.edu/ds-2019-extension,iss.ku.edu
What should new faculty do regarding their arrival in Lawrence?,"New faculty should inform their supervisor at KU about their arrival date, as arrangements for pickup and orientation can be made.",Tell your new supervisor at KU when you will arrive in Lawrence. Your supervisor or department may wish to arrange to pick you up at the airport...,https://iss.ku.edu/checklist-new-faculty-and-staff,iss.ku.edu
What is the core coursework requirement for the Master's program in Communications Systems?,Students must take either EECS 865 or EECS 728 to fulfill their core coursework requirement.,Core Coursework (MS) Courses Note: Students must take either EECS 865 or EECS 728 to fulfill their core coursework requirement.,https://eecs.ku.edu/communications-systems,eecs.ku.edu
Which team from St. Thomas Aquinas tied in the bioengineering category?,Jam Angels.,"Bio Engineering Jam Angels - St. Joseph Academy (Melanie Beers, Ashley Calais, Joise Duke) Gangatron - Olathe North High School (Subira Opande, Adeline Qin, Riya Mazumdar, Elliot Zolton) Tied for 3rd Magneticists - Olathe South High School (Wesley Tillotson, Smaran Giri, Colten Barnes, Katie Fears) Astonishing Kidneys - Olathe North High School (Abu Bakhautdinov, Adam Ahmad, Ghokul Kariyandal Murugan, Xanthe Combs)",https://engr.ku.edu/hsd-2023-winners,engr.ku.edu
What unique financial benefits are available for out-of-state students participating in KU study abroad programs?,Out-of-state students pay in-state tuition rates on many KU study abroad programs.,Out-of-state students pay in-state tuition rates on many KU study abroad programs.,https://engr.ku.edu/engineering-study-abroad,engr.ku.edu
What should a student do if their lender sends a collection letter despite being eligible for deferment?,"The student should contact their lender or loan servicer to verify their deferment status and if unresolved, reach out to the National Student Clearinghouse.","If you are eligible for deferment, but received a collection letter you should: Contact your lender or loan servicer to verify your deferment status.",https://registrar.ku.edu/request-enrollment-certification,registrar.ku.edu
What aspect of radar systems does Jonathan Paden specialize in?,He specializes in SAR signal processing and related technologies.,"Primary Research Interests SAR signal processing and related technologies Signal and image processing Sensor design and development, and system engineering",https://eecs.ku.edu/faculty,eecs.ku.edu
What specific areas does Amanda Chesbrough specialize in at the university?,She specializes in Tuition & Fees and Student Records.,"Amanda Chesbrough Student Records Specialist: Tuition & Fees, Student Records.",https://registrar.ku.edu/people/amanda-chesbrough,registrar.ku.edu
What strategies are suggested for graduate students to decide on their advising needs before contacting potential faculty advisors?,Students should determine their area of interest and understand how they work best in an advising situation before approaching faculty.,Student’s should determine their area of interest and understand how they work best in an advising situation before approaching faculty to inquire/interview for a position within a lab or research center.,https://engr.ku.edu/student-advisor-expectations,engr.ku.edu
What type of teaching space does the Engineering Physics program utilize for hands-on learning?,The program utilizes specialized teaching labs for hands-on learning.,Specialized teaching labs are available for hands-on learning.,https://engr.ku.edu/engineering-physics-facilities,engr.ku.edu
What types of student records does the Office of the University Registrar maintain?,"The Office of the University Registrar maintains official academic student records including grades, transcripts, enrollment certifications, degrees and diplomas, and personal information.","The Office of the University Registrar maintains official academic student records. This includes grades, transcripts, enrollment certifications, degrees and diplomas, a student’s personal information and more.",https://registrar.ku.edu,registrar.ku.edu
What are some of the emphasis areas offered in the Chemical Engineering program?,"The emphasis areas offered include Biomedical, Data Science, Environmental, Material Science, Premedical, and Petroleum Engineering.","Discover chemical engineering and the emphases we offer in Biomedical, Data Science, Environmental, Material Science, Premedical, and Petroleum Engineering.",http://cpe.engr.ku.edu/cpe-newsletters,cpe.engr.ku.edu
Where can users find instructions for setting up and using Splashtop?,Users can find instructions for setting up and using Splashtop at howto.ku.edu/splashtop-setup-instructions.,Instructions for setting up and using Splashtop can be found here: howto.ku.edu/splashtop-setup-instructions.,https://engr.ku.edu/remote-lab-access,engr.ku.edu
How can new graduate students not in F-1 or J-1 status opt out of the ISO requirement?,New graduate students not in F-1 or J-1 status may request to be waived from the ISO requirement by emailing issorientation@ku.edu.,New graduate students not in F-1 or J-1 status may request to be waived from the ISO requirement by emailing issorientation@ku.edu.,https://iss.ku.edu/register-international-student-orientation,iss.ku.edu
What must F-1 students do if they change their residential address?,Students must report any change of residential address to ISS within 10 days of the change.,Students must report any change of residential address to ISS within 10 days of the change.,https://iss.ku.edu/F-1-staying-legal,iss.ku.edu
What is one consequence of dropping below full-time status without ISS permission?,Dropping below full time without ISS permission is a deportable offense.,Important: Dropping below full time without ISS permission is a deportable offense.,https://iss.ku.edu/f-1-reduced-course-load,iss.ku.edu
What is the process for submitting important university-wide forms?,"Important university-wide forms are routed to the School of Engineering for approval, and students should work with their advisor when submitting these.","Important university-wide forms are routed to the School of Engineering for approval. Please work with your advisor when submitting any of these, or if you have questions about the forms.",https://engr.ku.edu/forms,engr.ku.edu
What is required of the H-1B petition for a student to qualify for the cap gap extension?,"The petition must be timely filed, nonfrivolous, and request a change of status instead of consular notification.",To Qualify for the H-1B Cap Gap Extension: The student must be the beneficiary of an H-1B petition that is subject to the annual H-1B cap; is timely filed (before your F-1 status expires and within the H-1B filing deadline from selection); requests a change of status (instead of consular notification); AND is nonfrivolous.,https://iss.ku.edu/f-1-cap-gap,iss.ku.edu
What specific communication responsibilities does Max Jiang hold?,"He communicates news of School of Engineering achievements, research, and events.","communicates news of School of Engineering achievements, research and events",https://engr.ku.edu/people/max-jiang-0,engr.ku.edu
What unique feature does KU’s Structural Testing Facility have for testing structures?,"It has a 40-foot-high, l-shaped strong wall capable of supporting 880,000 pounds simultaneously in two directions.","KU’s world-class Structural Testing Facility is equipped with a 40-foot-high, l-shaped strong wall capable of supporting 880,000 pounds simultaneously in two directions.",https://engr.ku.edu/node/2791,engr.ku.edu
What type of research opportunities are available for graduate students in the KU Chemical & Petroleum Engineering Department?,"Graduate students can work on cutting-edge research in areas including bioengineering, catalysis, renewable energy, sustainability, separations, and enhanced oil and gas recovery.","Work on cutting-edge research with nationally and internationally recognized faculty in areas including bioengineering, catalysis, renewable energy, sustainability, separations, enhanced oil and gas recovery, unconventional reservoirs, data mining and reservoir characterization, flow in porous media, and reservoir simulation.",http://cpe.engr.ku.edu/reu,cpe.engr.ku.edu
What does the section on 'Impact & Belonging' address concerning university policy?,It addresses the university policy on Impact & Belonging.,Impact & Belonging University policy on Impact & Belonging,https://engr.ku.edu/resources,engr.ku.edu
What is a key requirement for faculty meetings with the Associate Dean for Research and Graduate Programs?,The meeting must take place by November 30.,The meeting with the Associate Dean for Research and Graduate Programs must take place by November 30.,https://engr.ku.edu/ascend-funding-program,engr.ku.edu
"Who is Brian McClendon, and what relevance does he have to the EECS Department?",Brian McClendon is an EECS graduate who created Google Earth and is the Vice President of Google.,"Brian McClendon EECS Graduate, Creator of Google Earth and Vice President of Google.",https://eecs.ku.edu/admissions-undergraduate,eecs.ku.edu
What are the names and academic standings of the EECS students who received research awards at the University of Kansas?,"The EECS students who received research awards are Junyi Zhao, a senior, and William Powers, a junior.","EECS students, Junyi Zhao (senior) and William Powers (junior) were among the recipients.",https://eecs.ku.edu/news/article/2022/12/17/two-eecs-undergraduate-students-earn-research-awards,eecs.ku.edu
Which faculty member serves as a subject matter expert for the Office of the Under Secretary of Defense for Research & Engineering?,Shannon Blunt serves as a subject matter expert for the Office of the Under Secretary of Defense for Research & Engineering.,Subject matter expert on spectrum R&D for the Office of the Under Secretary of Defense for Research & Engineering,https://eecs.ku.edu/faculty,eecs.ku.edu
What specialized faculty group related to project management is mentioned in the list?,Project Management Faculty and Staff.,Project Management Faculty and Staff Links,https://engr.ku.edu/departmental-faculty-and-staff,engr.ku.edu
"How many scientists, engineers, and researchers were included in the 2024 cohort of AAAS fellows?","The 2024 cohort includes 471 distinguished scientists, engineers, and researchers.","The 2024 cohort includes 471 distinguished scientists, engineers, and researchers who represent the pinnacle of their respective fields.",https://eecs.ku.edu/news/article/eecs-faculty-honored-as-aaas-fellow,eecs.ku.edu
How does the passage describe the faculty in the Chemical Engineering department?,The faculty is described as world-renowned and consisting of experts in their fields.,"Chemical Engineering World renowned faculty, state-of-the-art facilities, innovative teaching and research prepare students to solve problems and positively impact the world.",http://cpe.engr.ku.edu/emeriti-professors,cpe.engr.ku.edu
What steps must a J-1 student take to obtain authorization for on-campus employment?,The student should go to iHawk and complete an On-Campus Work Permit Request (J-1) under J-1 Student Services.,"Once an on campus job is obtained, the student (with a DS-2019 issued by KU) should go to iHawk and complete an On-Campus Work Permit Request (J-1) , under J-1 Student Services.",https://iss.ku.edu/j-1-employment-options,iss.ku.edu
What is one notable tradition associated with KU's University Commencement?,The 'walk down the Hill' is a fun tradition where students often bring balloons or decorate caps and gowns.,The 'walk down the Hill' is a fun tradition where students often bring balloons or decorate caps and gowns.,https://engr.ku.edu/recognition-ceremonies,engr.ku.edu
What kind of research opportunities are available to students in the Engineering Physics program?,Students can have cutting-edge research experiences that run the gamut from A (Automobiles) to Z (Z bosons).,They can have cutting edge research experiences that run the gamut from A (Automobiles) to Z (Z bosons).,http://ephx.engr.ku.edu/faqs,ephx.engr.ku.edu
What is Joanna Thomas's official title?,Assistant Director,Joanna Thomas Assistant Director Contact Info joannathomas@ku.edu 785-864-3617,https://iss.ku.edu/people/joanna-thomas,iss.ku.edu
Is completing the Yellow Ribbon form sufficient for accessing VA education benefits?,"No, the Yellow Ribbon form is NOT a substitute for requesting to use your VA education benefits.",The Yellow Ribbon form is NOT a substitute for requesting to use your VA education benefits.,https://registrar.ku.edu/yellow-ribbon-program-application-0,registrar.ku.edu
How does the partnership between Panasonic Energy and the University of Kansas aim to contribute to the local economy?,"The partnership aims to generate employment in the De Soto area and the surrounding economic zones of Kansas, contributing to the revitalization of the U.S. manufacturing sector and the overall economy.","The project is a significant step in realizing the commitment to reduce CO2 emissions through the widespread adoption of electric vehicles, generating employment in the De Soto area and the surrounding economic zones of Kansas, thereby contributing to the revitalization of the U.S. manufacturing sector and the overall economy.",https://engr.ku.edu/news/article/panasonic-energy-and-university-of-kansas-to-collaborate-on-ev-battery-technology-and-talent-development,engr.ku.edu
What is the typical allocation period for awards given to eligible graduate students in the School of Engineering?,Awards are generally allocated in March.,Awards are generally allocated in March.,https://engr.ku.edu/graduate-student-funding,engr.ku.edu
What is the procedure for using elevators during an emergency evacuation?,Elevators may only be used if they are designated as 'Emergency Exit Elevators' approved for use by the University Fire Marshal.,Elevators designated as 'Emergency Exit Elevators' approved for use by the University Fire Marshal can be used by people with disabilities or other conditions needing assistance to evacuate.,https://engr.ku.edu/m2sec-emergency-evacuation-plan,engr.ku.edu
What interdisciplinary approaches are incorporated in the biomolecular engineering research program?,"The program involves collaborations among engineers, biological scientists, chemists, physicians, and pharmaceutical scientists.","Research in this area involves collaborations among engineers, biological scientists, chemists, physicians and pharmaceutical scientists in industry, academia, surgery and clinical settings.",http://bio.engr.ku.edu/biomolecular-engineering,bio.engr.ku.edu
Which professor holds the position of Director for the Hoglund Brain Imaging Center?,"William Brooks, Ph.D.","William Brooks, Ph.D. -Director, Hoglund Brain Imaging Center -Professor, Neurology",http://bio.engr.ku.edu/people/search,bio.engr.ku.edu
Who is a speaker at the Rising BME Scholars Conference and what is their talk about?,"One of the speakers is Jayant Anand, who will present 'Building Your Support'.",Jayant Anand: 'Building Your Support'...,https://bioengr.ku.edu/rising-bme-scholars-conference,bioengr.ku.edu
What type of environment does the KU Bioengineering program promote?,The program promotes a highly interdisciplinary collaborative environment.,Highly Interdisciplinary Collaborative environment,http://bioengr.ku.edu/,bioengr.ku.edu
What recent innovation has been developed by EECS researchers to enhance energy efficiency in networks?,An innovative exchange using interconnected sensor nodes that provide simple summaries to the network to minimize power and costs.,"EECS Professor Arvin Agah, left, and EECS doctoral student Christopher Redford have developed an innovative exchange in which interconnected sensor nodes provide simple summaries to the network in order to minimize power and costs.",https://eecs.ku.edu/theory-computing,eecs.ku.edu
Who is responsible for room scheduling at the university?,Renganayagi Shyam is the Room Scheduling Specialist.,Renganayagi Shyam Room Scheduling Specialist She/her View full profile,https://registrar.ku.edu/people,registrar.ku.edu
What resource is available for managing exam scheduling and policies?,The passage provides an Exam Calendar & Policies for managing exam scheduling.,Final Exams Exam Calendar & Policies Select to follow link,https://registrar.ku.edu/calendar,registrar.ku.edu
What are some of the emphases offered within the Chemical Engineering program?,"The emphases offered include Biomedical, Data Science, Environmental, Material Science, Premedical, and Petroleum Engineering.","Discover chemical engineering and the emphases we offer in Biomedical, Data Science, Environmental, Material Science, Premedical, and Petroleum Engineering.",http://cpe.engr.ku.edu/reu-alumni,cpe.engr.ku.edu
Who was recognized with the Kemper Fellowship Award in the EECS department?,Professor Dave Petr was presented with the Kemper Fellowship Award.,"Professor Dave Petr, Associate Chair for Undergraduate Studies, was presented the Kemper Fellowship Award by the 'Suprise Patrol'.",https://eecs.ku.edu/news?page=14,eecs.ku.edu
What computational capabilities does the associated facility provide?,"The associated facility includes a computational cluster with over 1,000 processors connected to 37 TB of on-line storage.","Associated Facilities... Computational cluster with over 1,000 processors connected to 37 TB of on-line storage.",https://eecs.ku.edu/cyber-security,eecs.ku.edu
What is the primary purpose of the Faculty Development Fund?,"The Faculty Development Fund primarily supports faculty activities such as recruiting, travel, retention, and acquisition of specialized research equipment.","The Faculty Development Fund supports faculty activities such as recruiting, travel, retention, and acquisition of specialized research equipment.",https://eecs.ku.edu/giving,eecs.ku.edu
What is required for a student to appeal a transfer credit decision at KU?,"To appeal a transfer credit decision, a student may submit a transfer credit petition.","To appeal a transfer credit decision, you may submit a transfer credit petition.",https://registrar.ku.edu/determining-transferability,registrar.ku.edu
What types of events does KU Engineering provide as part of its research support initiatives?,KU Engineering provides various research events as part of its support initiatives.,Research Events,https://engr.ku.edu/research-support-0,engr.ku.edu
What is required for a student to gain early access to select a room in the Self Engineered Learning Community?,Students must sign their Housing Contract early and pay their Enrollment Deposit by April 1.,1. Sign your Housing Contract early! This will ensure you are one of the first students to be able to choose your room during the room selection process. ... 2. Pay your Enrollment Deposit! Students must pay their enrollment deposit to receive a room selection number.,https://engr.ku.edu/engineering-learning-community,engr.ku.edu
What unique collaborative facility does KU offer to petroleum engineering students?,"The new Earth, Energy and Environment Center is a multidisciplinary facility where petroleum engineers work alongside geologists, physicists, and researchers from other disciplines.","The new Earth, Energy and Environment Center (pictured at left) is a multidisciplinary facility where petroleum engineers work alongside geologists, physicists, and researchers from other disciplines.",https://engr.ku.edu/petroleum-engineering-brochure-2023,engr.ku.edu
What should the Conclusions section of the project report summary include?,The Conclusions section should include a summary of results.,Conclusions: Summary of Results,https://eecs.ku.edu/project-outline,eecs.ku.edu
What unique business and engineering practices will students encounter in the SELF & BLP program in Slovenia?,"Students will learn about Slovenia’s most important business, engineering, and governmental practices through guided tours, site visits, and guest lectures.","Students will experience the local culture and learn about Slovenia’s most important business, engineering, and governmental practices through guided tours, site visits, and guest lectures.",https://engr.ku.edu/international-experiences-ku-school-engineering,engr.ku.edu
Can F-2 dependents seek employment in the US?,"No, F-2 dependents are not eligible for any employment in the US.",F-2 dependents are not eligible for any employment in the US.,https://iss.ku.edu/f-2-dependents,iss.ku.edu
What steps should a student take to set up or modify delegate access?,"Students should log into Enroll & Pay, select the 'Share My Information' tile, and follow the prompts to either grant, modify, or revoke delegate access.","Log into Enroll & Pay. Select the Share My Information tile on the homepage. For new access, select the Delegate Access To a New Contact box... This access can be granted and revoked as needed by adjusting the checkboxes or by deleting the entire Delegate account following the above instructions.",https://registrar.ku.edu/delegate,registrar.ku.edu
What opportunities does the KU Information Security Club provide for students?,"The KU Information Security Club provides hands-on experience in offensive and defensive security concepts through competitions and lab workshops, and invites industry professionals to give talks.",The Information Security Club is a competition based group that focuses on learning security concepts through Collegiate Cyber Defense Competitions. KUISC provides students with hands-on experience in offensive and defensive security concepts in competitions and lab workshops.,https://eecs.ku.edu/academic-experience,eecs.ku.edu
What type of faculty position is being offered at the University of Oregon?,The University of Oregon is offering an Assistant/Associate/Full Professor position in Bioengineering.,Assistant/Associate/Full Professor Bioengineering University of Oregon Apply/MoreInfo,http://bio.engr.ku.edu/opportunities,bio.engr.ku.edu
What is the schedule for the KUEST Bridge program?,"The program runs Monday through Friday from 8 AM to 5 PM, with evening activities included.","This program runs from M-F from 8-5, with evening activities, and is designed to help students transition from high school to the academic rigors of engineering.",https://engr.ku.edu/pre-college-programs,engr.ku.edu
What specific grades must applicants maintain in their undergraduate courses to remain eligible for the accelerated Master's program?,Applicants must maintain at least a 3.50 for all remaining undergraduate courses in their B.S. program.,"If accepted, the students must maintain at least a 3.50 for all remaining undergraduate courses in their B.S. program.",http://bio.engr.ku.edu/accelerated-ms,bio.engr.ku.edu
What is the consequence of making changes to the Plan of Study after it has been submitted for approval?,Making changes prior to final approval will disrupt the automatic email system and may delay the approval process.,It is important that you do not make changes to your plan after submitting the plan prior to final approval. Doing so will disrupt the automatic email system and may delay approval.,https://engr.ku.edu/plan-study,engr.ku.edu
What overarching goal does Dr. Tamzidul Hoque's NSF-funded project strive to achieve?,To develop robust security measures that adapt to evolving threats.,The goal is to develop robust security measures that adapt to evolving threats.,https://eecs.ku.edu/news/article/eecs-professor-wins-400k-nsf-grant-for-cutting-edge-hardware-security-research,eecs.ku.edu
What position does Tyrone Duncan hold at the university?,Tyrone Duncan is a Courtesy Professor.,Tyrone Duncan Courtesy Professor,https://eecs.ku.edu/people/tyrone-duncan,eecs.ku.edu
What should a student do if they need a course substitution or pre-requisite waiver?,"Students should contact their advisor to discuss transfer courses, course substitutions, or pre-requisite waivers.","Please contact your advisor if you need to discuss transfer courses, course substitutions, or pre-requisite waivers.",https://engr.ku.edu/forms,engr.ku.edu
What service does the Office of the University Registrar provide to assist students transferring to the university?,The office supports students in the transfer credit evaluation process to guide their transition to the university.,Supporting students in the transfer credit evaluation process to guide their transition to the university.,https://registrar.ku.edu/,registrar.ku.edu
What requirements must financial documents meet regarding their issuance?,"Documents must be issued on the official stationery of the financial, sponsoring or lending institution and must be dated and less than six months old.","Documents must be issued on the official stationery of the financial, sponsoring or lending institution. Documents must be dated and less than six months old.",https://iss.ku.edu/proof-finances,iss.ku.edu
What specific information should be included in the invitation letter for a visiting scholar?,"The invitation letter should include the general field of research, a brief description of the research, exact start and end dates at KU, details of funding (or lack thereof), and additional benefits offered to the scholar.","Letters should include: General field of research, Brief description of research, Exact start and end date they will be at KU, Either KU funding (include exact dollar amount) or no funding from KU, Additional benefits department is offering scholar (office space, staff assistance, department facilities, etc.).",https://iss.ku.edu/invite-visiting-scholar,iss.ku.edu
How are KU chemical engineering students recognized for their achievements?,"Students have received national and international recognition, including prestigious Goldwater Scholarships, graduate fellowships, and prizes for innovative technology commercialization strategies.","KU students consistently receive national and international recognition and have been awarded prestigious Goldwater Scholarships, graduate fellowships, and prizes for innovative technology commercialization strategies.",https://engr.ku.edu/chemical-engineering-brochure-2023,engr.ku.edu
Which mathematics courses are required as prerequisites for the KU BioE Graduate Program?,"The required mathematics courses include Calculus I, Calculus II, Applied Differential Equations, and Elementary Linear Algebra.","Mathematics: all courses below must be taken Calculus I, MATH 121 (4 credits) or equivalent AND Calculus II, MATH 126 (4 credits) or equivalent AND Applied Differential Equations, MATH 220 (3 credits) or equivalent AND Elementary Linear Algebra, MATH 290 (2 credits) or equivalent.",http://bioengr.ku.edu/entrance-requirements-track,bioengr.ku.edu
What is the contact method for inquiries about becoming a corporate partner for the 2025 Competition?,Inquiries about becoming a corporate partner can be made via email at highschooldesign@ku.edu.,"For more information, contact us at highschooldesign@ku.edu.",https://engr.ku.edu/hsd-partnerships,engr.ku.edu
What specific areas of research is Kabir Panahi focused on?,"His research is focused on cyber security, usable security, and IoT security.","My research is focused on cyber security, usable security and IoT security.",https://engr.ku.edu/people/kabir-panahi,engr.ku.edu
In what ways are Bioengineering graduate students involved in program development and improvement?,"Bioengineering graduate students play an important role in new course development, grant writing efforts of faculty, and recruitment of new students.",Bioengineering graduate students often play an important role in: New course development Grant writing efforts of faculty Recruitment of new students Bioengineering Program development and improvement,http://bioengr.ku.edu/overview,bioengr.ku.edu
Is there a non-thesis option for the master's program in bioengineering?,"No, the MS in Bioengineering requires a thesis, but a coursework-only Master of Engineering (MEng) degree is available.","No. The MS in Bioengineering requires a thesis. However, students can earn a coursework only Master of Engineering (MEng) degree.",http://bio.engr.ku.edu/faqs,bio.engr.ku.edu
What are Adam G Rouse's research interests?,"His research interests include neural encoding of hand and finger movements, brain-machine interfaces, and data science/machine learning for neurotechnologies.",Research — Research interests: Neural encoding of hand and finger movements Brain-machine interfaces Data science/machine learning for neurotechnologies,https://eecs.ku.edu/people/adam-rouse-md-phd,eecs.ku.edu
What should a user do if they are experiencing login issues despite entering the correct credentials?,They should clear all cookies/cache/history/saved iHawk passwords in their browser and ensure the browser is configured to accept cookies.,"To resolve this issue, please try the following: Clear all the cookies/cache/history/saved iHawk passwords in the browser you are using to access iHawk...",https://iss.ku.edu/troubleshooting-ihawk-login-issues,iss.ku.edu
What languages does Amanda Chesbrough enjoy learning in her free time?,The passage does not specify which languages she enjoys learning.,"In her free time Amanda loves spending time with her family, reading and learning languages.",https://registrar.ku.edu/people/amanda-chesbrough,registrar.ku.edu
What is the specific focus of the university's mission in the field of bioengineering?,"The mission focuses on being a national leader in bioengineering research, educational activities, and technology transfers.","Our mission is to be a national leader in bioengineering research, educational activities, and technology transfers...",https://bioengr.ku.edu/vision-mission,bioengr.ku.edu
What eligibility requirement is necessary for Graduate Research Assistantships (GRA) regarding faculty advisors?,You do not need to have a faculty advisor pledge to provide you a GRA before you submit your application.,Graduate Research Assistantships: Research Assistantships are available to graduate students through grants from state-appropriated research funds and from federal and private agencies. ... You do not need to have a faculty advisor pledge to provide you a GRA before you submit your application.,https://engr.ku.edu/grad-funding,engr.ku.edu
What is the earliest date a J-1 Scholar may enter the U.S. before their program start date?,30 days before the program start date.,The earliest date you may enter the U.S. is 30 days before the program start date in item 3 on your DS-2019.,https://iss.ku.edu/entering-us-scholars,iss.ku.edu
What notable product did Dr. Phil Anderson design that connected computers to amateur radios?,Dr. Anderson's most notable contribution is his design of products that enable the connection of computers to amateur radios.,"His work at IBM, teaching at the University of Kansas, and founding Kantronics in 1972 have all contributed to the advancement of the field of electrical engineering. Dr. Anderson's most notable contribution is his design of products that enable the connection of computers to amateur radios, making the hobby more accessible to a wider range of people...",https://eecs.ku.edu/news/article/2023/04/21/2023-ku-eecs-keds-award-presented,eecs.ku.edu
"How many speakers are scheduled for the colloquium in April 2025, and who are they?","Three speakers are scheduled for April 2025: Jonathan Brumberg on April 7, Justin Hutchison on April 14, and Sara Wilson on April 28.","Monday: 04/07/2025 Jonathan Brumberg Assocaite Professor, Chairperson Department of Psychology University of Kansas Monday: 04/14/2025 Justin Hutchison Associate Professor Department of Civil, Environmental, and Architecture Engineering University of Kansas Monday: 04/28/2025 Sara Wilson Associate Professor Department of Mechanical Engineering University of Kansas",https://bioengr.ku.edu/colloquium,bioengr.ku.edu
Where should students first direct their questions regarding health insurance?,The business office at Watkins Health Center should be one of the first places you ask questions about your health insurance.,The business office at Watkins Health Center should be one of the first places you asks questions about your health insurance.,https://iss.ku.edu/understanding-health-insurance,iss.ku.edu
What significant breakthrough related to imaging did Salandrino co-author in Nature Communications?,"He co-authored a paper on 'Adiabatic Far Field Sub-Diffraction Imaging', which highlights advancements in imaging techniques.","Cang, H., Salandrino, A., Wang, Y., & Zhang, X. (2015). Adiabatic Far Field Sub-Diffraction Imaging. Nature Communications, 6 , 8942.",https://eecs.ku.edu/people/alessandro-salandrino,eecs.ku.edu
What is the role of Travis Passman at the university?,Travis Passman is the Engineering TSC Manager.,Travis Passman Engineering TSC Manager,https://engr.ku.edu/people/travis-passman,engr.ku.edu
"How did the Measurement, Materials and Sustainable Environment Center (M2SEC) secure funding for its construction?",M2SEC was funded in part through a $12.3 million award from the Department of Commerce’s National Institute of Standards and Technology Construction Grant Program.,The $24 million research building is funded in part through a $12.3 million award from the Department of Commerce’s National Institute of Standards and Technology Construction Grant Program.,https://engr.ku.edu/facilities-maps,engr.ku.edu
What is a crucial step to take when in need of emergency care according to the passage?,You should find out which hospitals in your area are in your new insurance plan's network in case you need emergency care.,"Be sure to find out which hospitals in your area are in your new insurance plan’s network so that if you need emergency care, you know which hospitals to go to.",https://iss.ku.edu/how-find-doctor,iss.ku.edu
How does KU's Architectural Engineering Program stand out in terms of accreditation?,It is one of only two nationwide with continuous accreditation since 1936.,KU’s Architectural Engineering Program is one of only two nationwide with continuous accreditation since 1936.,https://engr.ku.edu/civil-environmental-architectural-engineering-brochure-2023,engr.ku.edu
What overarching goal does Admin Husic aim to achieve with his research?,"Husic aims to develop predictive tools that indicate where, when, and how water quality is deteriorated, addressing the management of dynamic landscape connectivity.","This work will provide us with a set of predictive tools that will indicate where, when and how water quality is deteriorated.",https://engr.ku.edu/news/article/2024/04/01/two-ku-engineering-professors-recognized-early-career-research-success,engr.ku.edu
What is the unique service offered by Better Alternative Transportation Services (BATS) for passengers arriving at MCI?,BATS offers an exclusive personalized service for up to 5 people with door-to-door delivery to any location in Lawrence.,Better Alternative Transportation Services (BATS) An exclusive personalized service for up to 5 people with door-to-door delivery to any location in Lawrence.,https://iss.ku.edu/airport-lawrence,iss.ku.edu
What unique opportunity does the High School Design Competition provide for students?,It allows high school students to participate in a hands-on engineering challenge.,KU Engineering's High School Design Competition is set for 8 a.m. to 3 p.m. Oct. 23 at the engineering complex on KU’s campus.,https://engr.ku.edu/news?page=1,engr.ku.edu
How does the Hawk Link program support students' educational journeys?,Hawk Link supports the development of students by providing custom support and guidance for each individual’s educational journey.,Hawk Link supports the development of students by providing custom support and guidance for each individual’s educational journey.,https://engr.ku.edu/campus-student-resources,engr.ku.edu
What should travelers do to ensure their arrival record is correct after entering the U.S.?,Check the electronic record of your arrival a day or two later.,CBP also creates an electronic record of your arrival. Check it a day or two later to make sure it is correct.,https://iss.ku.edu/entering-us-scholars,iss.ku.edu
What is Tyler Smith's role within the Engineering Technology Service Center?,Tyler Smith is an IT Support Technician.,"Tyler Smith IT Support Technician, Engineering Technology Service Center",https://engr.ku.edu/people/tyler-smith,engr.ku.edu
What should one do to obtain the content in an accessible format?,Contact bioe@ku.edu to request the content be made available in an accessible format.,An accessible version of the content below will be made available upon request. Please contact bioe@ku.edu to request the content be made available in an accessible format.,http://bio.engr.ku.edu/research,bio.engr.ku.edu
What type of bank account should your ATM card be tied to?,"ATM cards should be tied to a checking account, not a savings account.",ATM cards should be tied to a checking (not savings) account.,https://iss.ku.edu/finances-newly-admitted,iss.ku.edu
What is the intended outcome of students participating in undergraduate research prior to applying for the accelerated Master’s program?,Students are highly encouraged to participate in undergraduate research to identify their research topic and advisor.,Students are highly encouraged to participate in undergraduate research prior to their application in order to identify their research topic and advisor.,http://bio.engr.ku.edu/accelerated-ms,bio.engr.ku.edu
Are there financial aid options available for non-degree seeking students at KU?,"Generally, Financial Aid and Scholarships are not available for non-degree seeking students.",Generally Financial Aid and Scholarships are not available for non-degree seeking students.,https://registrar.ku.edu/senior-citizen-students,registrar.ku.edu
What are the implications of taking AEC classes on counting online course credits for J-1 students?,Students taking any AEC classes cannot count any online class towards the full-time enrollment requirement.,"Limitation on counting ONLINE course credits towards minimum requirement: Generally, only one online class (up to 3 credit hours) can count towards the full-time enrollment requirement. Note: students taking any AEC classes cannot count any online class towards the full-time enrollment requirement.",https://iss.ku.edu/j-1-staying-legal,iss.ku.edu
What is the processing time for room reservation requests?,Please allow two business days for requests to be processed.,Please allow two business days for requests to be processed.,https://engr.ku.edu/room-reservation-form,engr.ku.edu
What is the specific office number of Sankha Guria?,2034,Contact Info 2034 Eaton Hall,https://eecs.ku.edu/people/sankha-guria,eecs.ku.edu
What motivated João Poli to pursue a higher education in Chemical Engineering?,"As a first-generation student from Brazil, João Poli graduated with a Bachelor of Science in Chemical Engineering before pursuing his PhD.","My name is João Victor Poli, I am a first-generation student from Brazil. I graduated with a Bachelor of Science degree in Chemical Engineering and now I am pursuing a PhD in Chemical Engineering at the University of Kansas.",https://engr.ku.edu/people/joao-victor-poli,engr.ku.edu
How does the KU Chemical & Petroleum Engineering program prepare students for their careers?,The program provides hands-on education based on industrial problems and real-world examples taught by expert faculty.,Learn more about how hands-on education based on industrial problems and real-world examples taught by expert faculty can start your path to a successful career.,http://cpe.engr.ku.edu/hall-fame,cpe.engr.ku.edu
What methods are utilized in KU's biomechanics program to study biological systems?,"Experimental measurement, mathematical modeling, and computer simulations are utilized.","Our mission is to provide a quality graduate research and educational experience with emphasis on understanding and analyzing the mechanics of the human body through experimental measurement, mathematical modeling and computer simulations.",http://bioengr.ku.edu/biomechanics-neural-engineering,bioengr.ku.edu
When was KU named a member of the National Academy of Inventors?,KU was named a member of the National Academy of Inventors in 2013.,KU was named a member of the National Academy of Inventors in 2013.,https://engr.ku.edu/news/article/2023/12/12/google-earth-creator-brian-mcclendon-kus-newest-national-academy-inventors-fellow,engr.ku.edu
Where can one find contact information for James McNaughton?,Contact information for James McNaughton can be found on the EECS website.,Contact Info: Available on the EECS website.,https://eecs.ku.edu/people/james-mcnaughton,eecs.ku.edu
What is the significance of the insurance billing process for J-2 dependents who enroll in classes at KU?,J-2 dependents who enroll in KU classes are not automatically billed for the insurance.,"NOTE: Because all J-1 Visitors are required to have health insurance for themselves and their J-2 dependents for the duration of their stay, regardless of enrollment, J-2’s who enroll in KU classes are not automatically billed for the insurance.",https://iss.ku.edu/student-health-insurance,iss.ku.edu
What are the overarching goals of the Mechanical Engineering program's mission at the University of Kansas?,"The program aims to provide a high-quality education, generate and apply knowledge, and serve society and the engineering profession.","Our mission is to provide our students with a high quality education, to generate and apply knowledge, and to serve both society and the engineering profession.",http://me.engr.ku.edu/,me.engr.ku.edu
Is the content about the degree requirements available in a format other than the regular text?,"Yes, an accessible version can be requested.",An accessible version of the content below will be made available upon request.,http://bioengr.ku.edu/degree-requirements,bioengr.ku.edu
Which prestigious universities have KU alumni continued their education at?,"KU alumni have continued their education at universities such as Harvard University, Stanford University, and Massachusetts Institute of Technology.","Our alumni have also gone on to continue their education and careers at universities such as Harvard University, John’s Hopkins, and Massachusetts Institute of Technology.",http://bioengr.ku.edu/beyond-ku,bioengr.ku.edu
What accomplishment does Chancellor Douglas A. Girod highlight about the four researchers from the university?,He highlights that they have demonstrated excellence in their fields that reflects well on the entire university.,These four researchers have demonstrated excellence in their fields and have done so in a way that reflects well on our entire university.,https://engr.ku.edu/desa-nomination,engr.ku.edu
What is the potential outcome of a KU Core Petition?,The KU Core Petition allows for a determination of whether a transfer course should fulfill a General Education Requirement in the KU Core.,Petition the University Core Curriculum Committee to determine if your transfer course should fulfill a General Education Requirement in the KU Core 34 (Fall 2024+) or the KU Core (Pre-Fall 2024).,https://registrar.ku.edu/transfer-credit-petitions,registrar.ku.edu
Which catalog should a student refer to for determining their graduation requirements and regulations?,Students should use the catalog of the year they entered KU to determine their requirements.,"In most cases, you will use the catalog of the year you entered KU to determine your requirements.",https://registrar.ku.edu/enrollment-planning,registrar.ku.edu
What distinguishes KU's petroleum engineering program in Kansas?,KU is the only institution in Kansas that offers a degree in petroleum engineering.,KU is the only institution in Kansas that offers a degree in petroleum engineering.,https://engr.ku.edu,engr.ku.edu
When should students pay the SEVIS fee?,Students must pay the SEVIS fee after receiving their initial F-1 I-20 or initial J-1 DS-2019.,Pay the SEVIS fee after you have received your initial F-1 I-20 or initial J-1 DS-2019.,https://iss.ku.edu/sevis-fee-newly-admitted,iss.ku.edu
How can someone contact Adam G Rouse?,He can be contacted via email at arouse@kumc.edu or by phone at 913-588-5129.,Contact Info arouse@kumc.edu 913-588-5129,https://eecs.ku.edu/people/adam-rouse-md-phd,eecs.ku.edu
What hometown is shared by two students in the Class of 2028?,"Lenexa, KS is shared by two students, Elizabeth Aberle and Blake Pennel.","Elizabeth Aberle Chemical Engineering, 2028 Hometown: Lenexa, KS Blake Pennel Computer Science, 2028 Hometown: Lenexa, KS",https://engr.ku.edu/self-class-2028,engr.ku.edu
What primarily happens in the state-of-the-art laboratories provided by the EECS department?,"Students gain experience in building, programming, testing, and debugging digital circuits, processors, and FPGA-based systems.","Nine state-of-the-art laboratories provide students with experience in building, programming, testing, and debugging digital circuits, processors, and FPGA-based systems.",https://eecs.ku.edu/facilities,eecs.ku.edu
What unique program does the University of Kansas offer in relation to petroleum engineering?,The University of Kansas hosts the only petroleum engineering program in the State of Kansas.,The University of Kansas hosts the only petroleum engineering program in the State of Kansas and is home to the Tertiary Oil Recovery Program.,http://cpe.engr.ku.edu/reu-alumni,cpe.engr.ku.edu
What kind of professional development is emphasized alongside academic skills in the program?,Students develop ethics and leadership skills through service to the Bioengineering Program.,"Develop ethics and leadership skills through service to the Bioengineering Program, Academic Departments of Advisors, or the School of Engineering.",https://bioengr.ku.edu/overview,bioengr.ku.edu
Which award did Man C. Kong receive in 2004 for his teaching?,"Excellence in Teaching Award, Center for Teaching Excellence.","Excellence in Teaching Award, Center for Teaching Excellence, University of Kansas, 2004.",https://eecs.ku.edu/people/man-kong,eecs.ku.edu
How can someone contact Tanner Willbanks?,Tanner Willbanks can be contacted via email at tjwills0@ku.edu or by phone at 785-864-1203.,Contact Info tjwills0@ku.edu 785-864-1203,https://eecs.ku.edu/people/tanner-willbanks,eecs.ku.edu
What significant experience does Mary Rezac have in overseeing research and academic programs?,"As dean of Washington State’s Voiland College of Engineering and Architecture, she oversaw seven academic schools and multiple research centers.","As dean of Washington State’s Voiland College of Engineering and Architecture, Rezac oversees seven academic schools and multiple research centers.",https://engr.ku.edu/news/article/2023/12/07/mary-rezac-named-new-dean-ku-school-engineering,engr.ku.edu
What role did Glenn Prescott serve in NASA's Earth Science Enterprise?,Associate Director for Technology (Information Systems) from 1999 to 2000.,"Service — Associate Director for Technology (Information Systems), NASA Earth Science Enterprise, 1999-2000...",https://eecs.ku.edu/people/glenn-prescott,eecs.ku.edu
What should graduate students or those under prior catalog years continue to use instead of the KU Planner?,"They should continue to use the DPR, the Schedule of Classes, and consult with their school and advisor for course planning and scheduling.","For graduate students and undergraduate students with a catalog year prior to Fall 2024, please continue to use the DPR...",https://registrar.ku.edu/ku-planner,registrar.ku.edu
Can a student apply for the STEM OPT extension based on a prior STEM degree?,"Yes, students can apply for the STEM extension based on a prior STEM degree obtained within the last 10 years from a US, SEVP-approved, accredited school.","The degree used for the current post-completion OPT does NOT have to be in a STEM field. You can apply for the STEM extension based on a prior STEM degree obtained within the last 10 years from a US, SEVP-approved, accredited school.",https://iss.ku.edu/f-1-opt-stem-extension,iss.ku.edu
What position does Tim Miller hold at the Engineering Technology Service Center?,Tim Miller is an IT Support Technician Senior (Tier II) at the Engineering Technology Service Center.,"Tim Miller IT Support Technician Senior (Tier II), Engineering Technology Service Center",https://engr.ku.edu/people/tim-miller,engr.ku.edu
What is the preferred option for prospective students wanting to visit the KU Bioengineering program?,"The preferred option is to apply for Fall admission to the program, which may lead to an invitation to participate in BIOE Sneak Peek.","The first, and most preferred, option entails simply applying for Fall admission to the program. If you are admitted, it is highly likely that you will be invited to participate in BIOE Sneak Peek in late February prior to the Fall semester of your intended matriculation.",http://bioengr.ku.edu/contact,bioengr.ku.edu
Name three programming languages supported on the EECS Linux workstations.,"The supported programming languages include C, Python, and Ruby.",Programming Click to expand Android SDK C C++ C# (Mono) CUDA Fortran Git Haskell HDL Java LaTex OpenAL OpenGL (mesa) Perl PHP Python R Ruby Scheme x86 Assembly Clips Cmucl Cvs DDD Ghc Ghdl Gtkwave Isabelle Mplayer nam Ns Pine Proofgeneral Pvs SDL Smlnj Vim Xine,https://eecs.ku.edu/eecs-workstation-software,eecs.ku.edu
What must a student do for delegates to access their 1098-T forms?,Students must grant consent to receive the 1098-T online and provide delegates access to view the 1098-T.,"In order for the delegates to see the 1098-T, two things must occur. Students must grant consent to receive the 1098-T online through their Enroll & Pay account. Students must grant their delegates access to view the 1098-T.",https://registrar.ku.edu/delegate,registrar.ku.edu
What is the minimum GPA required to maintain eligibility as a Fellow?,Fellows are required to maintain at least a 3.0 cumulative KU GPA.,Fellows are required to maintain at least a 3.0 cumulative KU GPA.,https://engr.ku.edu/self-program-faq,engr.ku.edu
What is the importance of having a friend assist in the car purchasing process?,"An American friend may be more familiar with buying practices in the United States, which can be helpful.","It can be helpful to ask an American friend to assist you in buying a car, because they might be more familiar with buying practices in the United States.",https://iss.ku.edu/cars,iss.ku.edu
What specific final exam scheduling rule applies to classes that meet daily?,Classes that meet daily will follow the Monday-Wednesday-Friday schedule.,Classes that meet daily will follow the Monday-Wednesday-Friday schedule.,https://registrar.ku.edu/fall-2025-final-exam-schedule,registrar.ku.edu
What opportunities are available for graduate students in the Bioengineering program?,Graduate students have access to research events and opportunities such as the Colloquium Events and the Rising BME Scholars Conference.,Research Events and Opportunities Colloquium Events Opportunities Rising BME Scholars Conference,http://bio.engr.ku.edu/navigator,bio.engr.ku.edu
What is the category code to be used on USCIS Form I-765 for severe economic hardship work authorization?,The category code to be used is (c)(3)(iii).,Use the category code (c)(3)(iii) in section number 16 of the form.,https://iss.ku.edu/f-1-economic-hardship,iss.ku.edu
What is the validity period of a travel signature on a DS-2019 form?,"A travel signature is valid for 12 months or until the end date on your DS-2019, whichever is earlier.","A travel signature on page one on your DS-2019 is valid for 12 months or until the end date on your DS-2019, whichever is earlier.",https://iss.ku.edu/travel-signatures-and-ds-2019-reprint-j-scholar,iss.ku.edu
How does ISS keep international students informed about recent events and immigration news?,"ISS sends out a weekly newsletter to all international students, focusing on upcoming events and important immigration news.",The ISS newsletter is sent to all international students every week. We focus on on upcoming events as well as important immigration news and student resources across campus.,https://iss.ku.edu/events-programs,iss.ku.edu
How can students view a database of transfer courses that have already been evaluated?,Students may refer to CredTran to see a database of transfer courses that have already gone through the evaluation process.,Students may refer to CredTran to see a database of transfer courses that have already gone through the evaluation process.,https://registrar.ku.edu/transfer-credit-codes,registrar.ku.edu
What initiatives does KU Engineering implement to support innovative research development?,"KU Engineering emboldens student and faculty research development through collaborative research visioning, faculty mentoring, and seed funding programs.","KU Engineering's Research and Graduate Programs emboldens student and faculty research development. Through collaborative research visioning, faculty mentoring, and seed funding programs, we catalyze innovative and unique discoveries and grow our research enterprise.",https://engr.ku.edu/news-honors-initiatives,engr.ku.edu
What are the academic qualifications of Steven D. Schrock?,Steven D. Schrock holds a Ph.D. and is a Professional Engineer (P.E.) and a Fellow of the Institute of Transportation Engineers (F.ITE).,"Steven D. Schrock Interim Associate Dean for Academic Affairs, School of Engineering Professor Director of the University of Kansas Transportation Center Glenn L. Parker Faculty Fellow Ph.D., P.E., F.ITE",https://engr.ku.edu/undergraduate-program-staff,engr.ku.edu
Which advisory board member was involved with a well-known automotive company?,Alan Mulally was involved with Ford Motor Co.,"Alan Mulally Retired, Ford Motor Co.",https://engr.ku.edu/school-engineering-advisory-board,engr.ku.edu
What are the four design options available for students in the Engineering Physics program?,"The design options include Aerospace Systems, Chemical Systems, Digital Electronic Systems, and Electromechanical Control Systems.","The program offers a B.S. degree in engineering physics with opportunities to pursue one of four design options: Aerospace Systems, Chemical Systems, Digital Electronic Systems, and Electromechanical Control Systems.",http://ephx.engr.ku.edu/research,ephx.engr.ku.edu
What role did Andrew Williams recently accept after serving at KU Engineering?,He accepted the role as Dean of Engineering at The Citadel.,"Andrew Williams, KU Engineering Associate Dean for Diversity, Equity & Inclusion and Charles E. and Mary Jane Spahr Professor in Electrical Engineering and Computer Science, has accepted the role as Dean of Engineering at The Citadel, in Charleston, South Carolina.",https://engr.ku.edu/news?page=5,engr.ku.edu
What constitutes a 'compelling reason' for an F-1 student to apply for an I-20 extension?,"Compelling reasons may include a change of major, unexpected research problems, or a documented illness interfering with full-time study.","A 'compelling reason' may include such things as a change of major or research topic, unexpected research problems, or a documented illness, which has interfered with full-time study.",https://iss.ku.edu/i-20-extension,iss.ku.edu
What must be done 2-3 business days in advance if media equipment training is needed for an auditorium reservation?,KU IT Classroom Technology Support must be notified.,KU IT Classroom Technology Support must be notified 2-3 business days in advance of your event if media equipment training is needed or if anything beyond lights is required for an auditorium reservation.,https://registrar.ku.edu/room-reservations,registrar.ku.edu
What is the purpose of the Motivation section in the project report outline?,The purpose of the Motivation section is to describe who will be interested in the solution.,Motivation: Describe the motivation; who will be interested in the solution,https://eecs.ku.edu/project-outline,eecs.ku.edu
"Which university offers a position specifically focused on circuits, design, and instrumentation within Biomedical Engineering?","Washington University (WashU) offers a Teaching Faculty Position in Biomedical Engineering with a focus on Circuits, Design, and Instrumentation.","Teaching Faculty Position in Biomedical Engineering: Circuits, Design, Instrumentation WashU Apply/MoreInfo",http://bioengr.ku.edu/opportunities,bioengr.ku.edu
Which student has the same hometown as Kelsey Schnettgoecke and what is their expected graduation year?,"Hannah Poe is from Overland Park, KS and is expected to graduate in 2026.","Hannah Poe Civil Engineering, 2026 Hometown: Overland Park, KS Kelsey Schnettgoecke Civil Engineering, 2026 Hometown: Overland Park, KS",https://engr.ku.edu/self-civil,engr.ku.edu
What specific responsibilities does Nathan Fortner have regarding access control in the Engineering complex?,"He is in charge of card access for doors in the Engineering complex, setting them to lock and unlock at specific times and scheduling them for specific events.",In charge of card access for doors in Engineering complex on main campus... Sets the doors to lock and unlock at specific times and can schedule them to be open for specific events in Engineering buildings.,https://engr.ku.edu/people/nathan-fortner,engr.ku.edu
Which organization chairs the Global Opportunities Expo?,The Global Opportunities Expo is chaired by Latin American and Caribbean Studies and Donnelly College.,The Global Opportunities Expo is sponsored by units across campus but is chaired by Latin American and Caribbean Studies and Donnelly College.,https://iss.ku.edu/festivals-and-fairs,iss.ku.edu
What are the specific research interests of David Johnson?,"His research interests include Robotics, Human Robot Interaction, Natural Language Understanding, Applied Linguistics, and Artificial Intelligence.",Research — Research interests: Robotics Human Robot Interaction Natural Language Understanding Applied Linguistics Artificial Intelligence,https://eecs.ku.edu/people/david-johnson,eecs.ku.edu
What are some modern applications of bioimaging mentioned in the passage?,"Modern applications include multi-photon imaging, image-guided interventional procedures, surgical planning, and oncology treatment planning.","Modern applications of bioimaging include multi-photon imaging, image-guided interventional procedures, surgical planning, oncology treatment planning, endoscopic and laparoscopic surgeries and virtual telemedicine.",http://bio.engr.ku.edu/bioimaging,bio.engr.ku.edu
What services are included under the Office of the University Registrar's responsibilities?,"The Office of the University Registrar oversees enrollment services, academic records, diploma production, tuition and fee assessment, course and room scheduling, athletic certification, and veterans services.","About The Office of the University Registrar oversees enrollment services, academic records, diploma production, tuition and fee assessment, course and room scheduling, athletic certification and veterans services.",https://registrar.ku.edu/about,registrar.ku.edu
What is the last day to update information for the Spring 2025 Schedule of Classes before room optimization?,"August 30, 2024.","August 30, 2024 Spring 2025 Schedule of Classes last day to update all information before room optimization",https://registrar.ku.edu/schedule-classes-deadlines,registrar.ku.edu
Who is the Associate Chair for Graduate Studies in the EECS department?,Prasad Kulkarni,Prasad Kulkarni Professor Associate Chair for Graduate Studies View full profile,https://eecs.ku.edu/graduate-students,eecs.ku.edu
Can the University monitor the use of its systems?,"Yes, the University may monitor the use of this system for security management, system operations, and intellectual property compliance.","The University may monitor the use of this system for purposes related to security management, system operations, and intellectual property compliance.",https://shopkeeper.eecs.ku.edu/,shopkeeper.eecs.ku.edu
What is the responsibility of the individual in regard to DS-2019 document retention?,It is the individual's responsibility to retain all of their DS-2019s; ISS does not archive official copies of all documents.,Keep in mind it is your responsibility to retain all of your DS-2019s and it is not the responsibility of ISS to archive official copies of all documents.,https://iss.ku.edu/j-1-request-copies-ds-2019-form,iss.ku.edu
"What is required to change, release, or withhold certain information aside from contact details?","A form must be submitted to the office to change, release, or withhold other information.","...the change, release, or withholding of other information requires a form be submitted to our office.",https://registrar.ku.edu/student-records,registrar.ku.edu
What unique program is offered by the University of Kansas in the field of Petroleum Engineering?,The University of Kansas is home to the only petroleum engineering program in the State of Kansas.,The University of Kansas hosts the only petroleum engineering program in the State of Kansas and is home to the Tertiary Oil Recovery Program.,http://cpe.engr.ku.edu/news,cpe.engr.ku.edu
What resources are available for students seeking housing in Lawrence?,"Students can find housing options through Craigslist, Apartments Lawrence.com, and Realtor.com.",Craigs List Apartments Craigs List Apartments Apartments Lawrence.com Apartments Lawrence.com Realtor.com Realtor.com,http://bio.engr.ku.edu/community,bio.engr.ku.edu
What pronouns does Connor Ahlquist use?,Connor Ahlquist uses the pronouns he/him.,Pronouns: he/him,https://engr.ku.edu/people/connor-ahlquist,engr.ku.edu
What documents are needed to apply for a Kansas Driver's License?,You will need to bring documents that establish your legal presence in the U.S. and documents that establish your residency in the state of Kansas.,"When you go to apply, you will need to take your relevant immigration documents (for example your passport, I-94 record, H-1B I-797 Approval Notice or DS-2019), and proof of Lawrence residency.",https://iss.ku.edu/drivers-license,iss.ku.edu
What should students do if they have three or more finals scheduled on the same day?,Students are not obligated to take more than two exams on that day and must notify the instructors of the highest numbered courses at least two weeks before Stop Day.,"However, in the event that a student has (3) three or more final examinations scheduled on the same day, no student shall be obligated to take more than two exams on that day. No later than two weeks before Stop Day, the student shall notify the instructor(s) from the highest numbered course(s) not having a common final exam of the need to provide a make-up examination.",https://registrar.ku.edu/final-exam-policies-guidelines,registrar.ku.edu
What is the requirement for the composition of a doctoral committee in the Ph.D. programs?,"The doctoral committee must consist of a minimum of five Graduate Faculty members, including at least two tenured or tenure-track EECS Graduate Faculty, and one committee member must be a regular KU faculty member from outside of EECS.","The advisor and at least two other members of the committee must be tenured or tenure-track EECS Graduate Faculty. One committee member must be the Graduate Studies Representative, a regular KU faculty member from outside of EECS.",https://eecs.ku.edu/phd-programs,eecs.ku.edu
What is the protocol for F-1/J-1 students concerning their entry into the U.S.?,"F-1/J-1 students can enter the U.S. up to 30 days before their program start date, as indicated on their I-20 or DS-2019, but not later than that program start date.","IMPORTANT: For F-1/J-1 students, check the program start date on your I-20 ('Program of Study' section) / DS-2019 (item 3). You can enter the U.S. up to 30 days prior to this date, but no later than this program start date.",https://iss.ku.edu/readmitted_students,iss.ku.edu
What are some examples of elective courses available in the Certificate in Biomedical Product Design program?,"Elective courses include Bioengineering Internship, Mechatronics, and Tissue Engineering, among others.",Elective Courses (6 credit hours) Code Title Hours BIOE 802 Bioengineering Internship 3 ME 708 Mechatronics 3 C&PE 752 Tissue Engineering 3...,https://bioengr.ku.edu/biomedical-product-design-certificate,bioengr.ku.edu
Which specific areas of research are highlighted in the graduate programs mentioned in the passage?,"Highlighted areas include bioengineering, catalysis, renewable energy, sustainability, separations, enhanced oil and gas recovery, and reservoir simulation.","Graduate Programs Work on cutting-edge research with nationally and internationally recognized faculty in areas including bioengineering, catalysis, renewable energy, sustainability, separations, enhanced oil and gas recovery...",http://cpe.engr.ku.edu/navigator,cpe.engr.ku.edu
What is the primary purpose of the EECS Department Wiki?,"The primary purpose is to provide EECS users with answers to common problems, details on the services offered by the department, and information on departmental policies and procedures.","The purpose of this wiki is to provide EECS users with answers to common problems, details on the services offered by the department, and information on departmental policies and procedures.",http://wiki.eecs.ku.edu/,wiki.eecs.ku.edu
What are the enrollment requirements for GTA or GRA positions during the summer semester?,"Students working as a GTA or GRA are required to enroll in 6 credit hours each fall and spring, and 1-3 credit hours each summer to be eligible for employment.","Students working as a GTA or GRA are required to enroll in 6 credit hours each fall and spring, and 1-3 credit hours each summer to be eligible for employment.",https://engr.ku.edu/graduate-enrollment-info,engr.ku.edu
What leadership development opportunities are available for engineering students at this university?,The Engineering Leadership Development Program is an opportunity available for engineering students.,Engineering Leadership Development Program,https://engr.ku.edu/student-involvement,engr.ku.edu
What significant role did EECS Professor Suzanne Shontz take on in 2017?,She was elected Secretary of the SIAM Activity Group on Computational Science and Engineering.,"EECS Professor Suzanne Shontz has been elected Secretary of the SIAM Activity Group on Computational Science and Engineering for January 1, 2017 – December 31, 2018.",https://eecs.ku.edu/news?page=5,eecs.ku.edu
Which software providers collaborate with KU faculty to enhance student training in petroleum engineering?,"KU faculty collaborate with major software providers such as IHS Markit, CMG, Schlumberger, and NSI Technology to provide students with access to multimillion dollar software and on-campus training opportunities.","KU faculty collaborate with major software providers such as IHS Markit, CMG, Schlumberger and NSI Technology to provide students with access to multimillion dollar software and on-campus training opportunities.",https://engr.ku.edu/node/2786,engr.ku.edu
What specific area of research does Rachel Jarvis focus on besides radar systems design?,Applied Electromagnetics.,Research interests: Radar Systems Design Applied Electromagnetics Biomedical Imaging,https://eecs.ku.edu/people/rachel-jarvis,eecs.ku.edu
What was the amount of the Phase 1 grant that preceded the recent $5 million award?,"$750,000.","This Phase 2 award follows a successful Phase 1 grant of $750,000, revealing a significant step towards securing the future of 5G technology.",https://eecs.ku.edu/news/article/2023/09/18/eecs-professor-secures-5m-nsf-grant-enhance-5g-network-security-defense,eecs.ku.edu
In what year did the KU Jayhackers participate in the Best Cyber Warrior Competition for the first time?,This victory marks their first time competing in this prestigious competition.,This victory marks the KU's second year with a dedicated Capture The Flag team and their first time competing in this prestigious competition.,https://eecs.ku.edu/news/article/ku-jayhackers-triumph-in-international-best-cyber-warrior-competition,eecs.ku.edu
What types of funding options are available for graduate students?,"Graduate student funding can include research assistantships, teaching assistantships, and grants.",Funding Options Graduate Student Funding.,https://engr.ku.edu/research-funding,engr.ku.edu
What analytical aspect is part of Jilu Li's research focus?,Radar data analysis and interpretation.,Research interests: Radar data analysis and interpretation.,https://eecs.ku.edu/people/jilu-li,eecs.ku.edu
What type of graduate programs do KU Bioengineers commonly attend after completing their undergraduate degree?,"KU Bioengineers commonly attend graduate programs at institutions such as Columbia University, Duke University, and MIT.","What Graduate Programs do KU Bioengineers attend? Click to expand: Columbia University, Duke University, MIT, and more.",https://engr.ku.edu/node/2787,engr.ku.edu
What kind of internship opportunity is available through Kansas State University?,Kansas State University offers a Pollution Prevention Internship.,Pollution Prevention Internship Kansas State University Apply/MoreInfo,http://bioengr.ku.edu/opportunities,bioengr.ku.edu
What are some of the emphases offered in the KU Chemical Engineering program?,"Emphases offered include Biomedical, Data Science, Environmental, Material Science, Premedical, and Petroleum Engineering.","Discover chemical engineering and the emphases we offer in Biomedical, Data Science, Environmental, Material Science, Premedical, and Petroleum Engineering.",http://cpe.engr.ku.edu/cpe-events,cpe.engr.ku.edu
What is the phone number to contact Valentine Baumann?,The phone number to contact Valentine Baumann is 785-864-2945.,Office: 785-864-2945,https://engr.ku.edu/people/valentine-baumann,engr.ku.edu
"What funding amount did Admin Husic receive for his CAREER award, and what is the focus of his research?","Admin Husic received a five-year, $609,000 grant, focusing on documenting dynamic connectivity in water systems affected by human activity.","He was awarded a five-year, $609,000 grant from the National Science Foundation Early Career Development (CAREER) award for his efforts to document and share what he describes as 'dynamic connectivity: a research and educational frontier for sustainable environmental management under climate and land use uncertainty.'",https://engr.ku.edu/news/article/2024/04/01/two-ku-engineering-professors-recognized-early-career-research-success,engr.ku.edu
How does KU's Bioengineering Program utilize interdisciplinary collaboration?,More than 80 faculty from more than 30 multidisciplinary departments and centers across KU and the KU Medical Center are affiliated with KU’s Bioengineering Program.,More than 80 faculty from more than 30 multidisciplinary departments and centers across KU and the KU Medical Center are affiliated with KU’s Bioengineering Program.,https://engr.ku.edu/node/2787,engr.ku.edu
What specific area of expertise does Carley Stowers focus on relating to residency?,Carley Stowers specializes in residency matters for student athletes.,Athletics & Residency Specialist,https://registrar.ku.edu/people/carley-stowers,registrar.ku.edu
What action should a traveler take if their passport expires before their I-797 approval notice?,Contact ISS if your I-94 record end date is different than your I-797 approval notice.,"If your passport expires before your I-797 approval notice, your I-94 record will be shortened to your passport expiration date. Please contact ISS if your I-94 record end date is different than your I-797 approval notice.",https://iss.ku.edu/entering-us-scholars,iss.ku.edu
What innovative feature do the transient photonic devices researched by Dr. Fardad possess?,They can self-assemble and disassemble in response to light.,"These devices are remarkable for their ability to self-assemble and disassemble in response to light, making them both stable and reconfigurable under illumination.",https://eecs.ku.edu/news/article/ku-eecs-faculty-secures-nsf-funding-for-groundbreaking-research-in-transient-photonics,eecs.ku.edu
How do the bioengineering facilities support student engagement in research?,"The facilities provide students with access to cutting-edge tools and equipment, fostering hands-on research experience.",The bioengineering facilities encourage student involvement by offering access to advanced technologies and equipment that facilitate hands-on experience in research.,https://engr.ku.edu/bioengineering-facilities,engr.ku.edu
Name one publication by Glenn Prescott related to polar communications.,"A High-Speed, Long Range Mobile Communications Link for Use in Polar Regions.","A. J. Mohammad, G. Prescott, D. Braaten, ""A High-Speed, Long Range Mobile Communications Link for Use in Polar Regions"" 2003 American Geophysical Union (AGU), San Francisco, 2003.",https://eecs.ku.edu/people/glenn-prescott,eecs.ku.edu
What should a J-1 student do if their Form DS-2019 is issued by a different program sponsor?,They need to contact their program sponsor for the work permit.,Students with a Form DS-2019 issued by a program sponsor other than KU... need to contact their program sponsor for the work permit.,https://iss.ku.edu/campus-employment-j-students,iss.ku.edu
Can temporary visa holders qualify for resident tuition rates?,"Usually, no, as students on a temporary visa must leave the country once the purpose of the visa has been met.",Students who are here on a temporary visa must leave the country once the purpose for the visa has been met. The evidence of a temporary visa shows the student does not have permission to reside in the state of Kansas indefinitely.,https://registrar.ku.edu/residency-faqs,registrar.ku.edu
What is the minimum credit hours required to complete the certificate program?,"To receive the graduate Certificate in Biomedical Product Design, students must complete a minimum of 12 credit hours of coursework.","To receive the graduate Certificate in Biomedical Product Design, students must complete a minimum of 12 credit hours of coursework with the following requirements.",http://bioengr.ku.edu/biomedical-product-design-certificate,bioengr.ku.edu
What is McCormick's proposed solution to limit signal interference?,He proposes a framework that allows radar to operate within a certain band and monitor the band to separate desired signals from unwanted ones.,"I’m proposing a framework that allows radar to operate within a certain band, monitor the band and separate out the desired signals from the ones I don’t care about.",https://engr.ku.edu/news/article/2024/01/08/engineering-professor-receives-darpa-grant-research-radar-signal-processing,engr.ku.edu
When was the final round of the competition held?,The final round was held on March 10th at the Kansas City Federal Reserve.,"The final round was held on March 10th at the Kansas City Federal Reserve, where the top three teams presented their app to KC Fed employees.",https://eecs.ku.edu/news/article/2023/04/18/ku-eecs-team-winner-regional-code-thon-competition,eecs.ku.edu
Why might someone contact bioe@ku.edu based on the passage?,Someone might contact bioe@ku.edu to request the content be made available in an accessible format.,An accessible version of the content below will be made available upon request. Please contact bioe@ku.edu to request the content be made available in an accessible format.,http://bioengr.ku.edu/biomolecular-engineering,bioengr.ku.edu
What are the consequences if a graduate student is on academic probation regarding GTA/GRA funding?,Students placed on academic probation may not be eligible for GTA/GRA funding.,Students placed on academic probation are required to complete those expectations (set by their degree program) to gain regular status and may not be eligible for GTA/GRA funding.,https://engr.ku.edu/progress-toward-degree,engr.ku.edu
What unique educational opportunity does the University of Kansas offer in the field of petroleum engineering?,The University of Kansas hosts the only petroleum engineering program in the State of Kansas.,The University of Kansas hosts the only petroleum engineering program in the State of Kansas and is home to the Tertiary Oil Recovery Program.,http://cpe.engr.ku.edu/navigator,cpe.engr.ku.edu
What distinguishes BIOE 899 from BIOE 999 courses in terms of degree requirements?,"BIOE 899 is for a Master of Science degree, while BIOE 999 is for a Doctor of Philosophy degree.","An original and independent research or design investigation involving analytical, experimental and/or modeling methodology applied to solve a bioengineering problem as a part of the degree requirements for the Master of Science. ... for the Doctor of Philosophy.",http://bioengr.ku.edu/bioengineering-courses,bioengr.ku.edu
What year did the SELF Program graduate its first class of Fellows?,2011,The Program graduated its first class of Fellows in the spring of 2011.,https://engr.ku.edu/self-program-history,engr.ku.edu
In which city are both Nichols Hall and Eaton Hall located?,Both Nichols Hall and Eaton Hall are located in Lawrence.,"Facilities Locations Nichols Hall Lawrence, Kansas Eaton Hall Lawrence, Kansas",https://eecs.ku.edu/facilities-locations,eecs.ku.edu
What academic department is Samyoga Bhattarai part of?,She is part of the Department of Electrical Engineering and Computer Science.,Department: Electrical Engineering and Computer Science,https://engr.ku.edu/people/samyoga-bhattarai,engr.ku.edu
What GPA must a student maintain in all certificate courses to successfully complete the program?,Students must maintain a GPA of 3.0 or better in all certificate courses.,The completion requirements of the cybersecurity certificate include: Students must have a GPA of 3.0 or better in all certificate courses...,https://eecs.ku.edu/undergraduate-certificate-cybersecurity,eecs.ku.edu
Is there any funding available for student organizations in the School of Engineering?,"Yes, the passage mentions Student Organization Funding as a resource.",Student Organization Funding,https://engr.ku.edu/orgs,engr.ku.edu
What happens to original diplomas held by the University of Kansas after one year from graduation?,"After one year, diplomas are destroyed and students must request and pay for a replacement diploma.","Original diplomas are held for one year after graduation. After one-year, diplomas are destroyed and students must request and pay for a replacement diploma.",https://registrar.ku.edu/diplomas,registrar.ku.edu
What is Lindsey McCaig's phone number for inquiries?,Lindsey McCaig's phone number is 785-864-2989.,785-864-2989,https://engr.ku.edu/people/lindsey-mccaig,engr.ku.edu
Which specializations are included in the Bioengineering graduate program courses?,"Specializations include Bioimaging, Biomaterials & Tissue Engineering, Biomechanics & Neural Engineering, Biomedical Product Design & Development, and Biomolecular Engineering.",BIOE Courses Bioimaging Biomaterials & Tissue Engineering Biomechanics & Neural Engineering Biomedical Product Design & Development Biomolecular Engineering,http://bio.engr.ku.edu/navigator,bio.engr.ku.edu
What types of funding options are available for proposals in the School of Engineering?,"The passage mentions multiple funding options, which include internal seed funding and external grant opportunities.",Funding options include internal seed funding as well as various external grant opportunities.,https://engr.ku.edu/school-engineering-proposals,engr.ku.edu
What type of awards are the Graduate Scholarly Presentation Travel Awards?,They are travel awards intended for graduate scholarly presentations.,Graduate Scholarly Presentation Travel Award KU's Office of Graduate Studies manages the Graduate Scholarly Presentation Travel Awards.,https://engr.ku.edu/graduate-scholarly-presentation-travel-award,engr.ku.edu
What must international students in F-1 or J-1 status do before dropping below full-time enrollment?,They must get permission from International Support Services.,"If you are an international student in F-1 or J-1 status, you MUST get permission from International Support Services BEFORE dropping below full-time to maintain legal status.",https://registrar.ku.edu/dropping-and-withdrawing,registrar.ku.edu
What are the four design options available in the Engineering Physics program?,"The program offers opportunities to pursue one of four design options: Aerospace Systems, Chemical Systems, Digital Electronic Systems, and Electromechanical Control Systems.","Students work with faculty from both the Department of Physics and Astronomy and the School of Engineering. They can have cutting edge research experiences that run the gamut from A (Automobiles) to Z (Z bosons). The program offers a B.S. degree in engineering physics with opportunities to pursue one of four design options: Aerospace Systems, Chemical Systems, Digital Electronic Systems, and Electromechanical Control Systems.",http://ephx.engr.ku.edu/welcome-and-mission,ephx.engr.ku.edu
Who should be contacted for official requests for data related to Facts & Figures or external reporting?,"Requests for Facts & Figures, information on official and external reporting, and other official request for data need to be submitted to Analytics, Institutional Research, & Effectiveness.","Requests for Facts & Figures, information on official and external reporting, and other official request for data need to be submitted to Analytics, Institutional Research, & Effectiveness.",https://registrar.ku.edu/requests-student-information,registrar.ku.edu
What resources are related to course and room scheduling mentioned in the passage?,"Resources related to course and room scheduling include 25 Live Room Scheduling, Auditoriums, Classrooms, and CourseLeaf FAQ.",Course and Room Scheduling Resources 25 Live Room Scheduling Auditoriums Classrooms CourseLeaf FAQ Definitions for Course Components Exams Room Reservations Scheduling Officer Resources,https://registrar.ku.edu/final-exams-online-and-non-regular-courses,registrar.ku.edu
What type of information can a student access using the Personal Directory (FERPA) Information Access Forms?,Students can access their personal directory information as protected under FERPA.,Personal Directory (FERPA) Information Access Forms Select to follow link,https://registrar.ku.edu/forms,registrar.ku.edu
What innovative methods will Professor Kim's team utilize to enhance 5G network security?,They will employ an Open-RAN approach for network security monitoring and a device-centric method using machine learning techniques.,"Their mission: to fortify the security of 5G networks for the defense users. This project aims to combine two innovative strategies: an Open-RAN approach for monitoring and mitigating threats at the network level, and a device-centric method that employs machine learning techniques to enhance security at the device level.",https://eecs.ku.edu/news/article/2023/09/18/eecs-professor-secures-5m-nsf-grant-enhance-5g-network-security-defense,eecs.ku.edu
What kind of financial documentation is required from international applicants?,"International applicants must provide evidence of financial resources such as an official bank statement, which must have the student's name on the account.","Obtain the proper Financial Documentation. Scan the document and save it as a pdf file. Although the financial statement is not required for making admission decisions, the U.S. Department of State mandates that evidence of financial resources... be provided in order to issue an I-20.",http://bio.engr.ku.edu/application,bio.engr.ku.edu
What is the role of the sponsored program coordinator at the University of Kansas?,"The sponsored program coordinator works with each sponsored student to promote a successful, smooth and fulfilling experience at KU.","The sponsored program coordinator works with each sponsored student to promote a successful, smooth and fulfilling experience at KU.",https://iss.ku.edu/sponsored-students,iss.ku.edu
Are both facilities mentioned in the passage located in the same postal code zone?,"Yes, both Nichols Hall and Eaton Hall are located in the same postal code zone, 66045.","Nichols Hall Lawrence, Kansas 66045 Eaton Hall Lawrence, Kansas 66045",https://eecs.ku.edu/facilities-locations,eecs.ku.edu
What financial support will participants of the Rising BME Scholars Conference receive?,Participants will receive an honorarium and travel award for participation.,They will receive an honorarium and travel award for participation.,https://bioengr.ku.edu/rising-bme-scholars-conference,bioengr.ku.edu
What are the support hours for the software request assistance?,Support hours are 7:30 a.m. - 4:30 p.m. Monday-Thursday and 7 a.m - 4 p.m. Friday.,Support Hours: 7:30 a.m. - 4:30 p.m. Monday-Thursday; 7 a.m - 4 p.m. Friday,https://engr.ku.edu/software-request,engr.ku.edu
What is one key requirement for educators to be nominated for the Outstanding Educator award?,Nominated educators must demonstrate availability to students.,Outstanding Educators are evaluated based on: Availability to students How prepared is the professor for class everyday...,https://engr.ku.edu/locke-and-gould-awards,engr.ku.edu
What steps need to be taken for J-1 students who have a DS-2019 issued by a program sponsor other than KU?,Students with a Form DS-2019 issued by a program sponsor other than KU need to contact their program sponsor for the work permit.,"Students with a Form DS-2019 issued by a program sponsor other than KU (i.e. IIE, LASPAU, Department of State) need to contact their program sponsor for the work permit.",https://iss.ku.edu/campus-employment-f-and-j-students,iss.ku.edu
What distinguishes the faculty in KU Engineering in terms of research and education?,They are world-class researchers and excel in educating the next generation of engineers.,KU Engineering is home to a host of world-class faculty who are leading researchers in their fields and excel in the classroom in educating the next generation of engineers.,https://engr.ku.edu/faculty-leaders,engr.ku.edu
What is the process for determining the additional deficiency courses a student must take?,The set of 'extra' courses required for each student is determined by the EECS Graduate Studies Committee and must be completed before enrolling in graduate courses.,The set of 'extra' courses which a particular student must take is determined for each student by the EECS Graduate Studies Committee and must be taken before enrolling in graduate courses at KU.,https://eecs.ku.edu/deficiency-courses,eecs.ku.edu
How does the KU Chemical & Petroleum Engineering department emphasize hands-on education?,They utilize hands-on education based on industrial problems and real-world examples.,Learn more about how hands-on education based on industrial problems and real-world examples taught by expert faculty can start your path to a successful career.,http://cpe.engr.ku.edu/resources-students-graduate,cpe.engr.ku.edu
What is the primary mission of the KU EECS Distinguished Service Award?,The primary mission is to recognize distinguished alumni and dedicated associates of the Department of Electrical Engineering and Computer Science.,To recognize distinguished alumni and dedicated associates of the University of Kansas Department of Electrical Engineering and Computer Science.,https://eecs.ku.edu/ku-eecs-distinguished-service-award,eecs.ku.edu
What must students do to maintain their eligibility after receiving a tuition waiver?,Students must remain in good academic standing and make satisfactory progress toward completion of their educational program.,Students who have been granted tuition waiver shall remain in good academic standing at the Kansas educational institution where the eligible applicant is enrolled and shall make satisfactory progress toward completion of the requirements of the educational program in which the eligible applicant is enrolled.,https://registrar.ku.edu/kansas-foster-child-education-assistance-act,registrar.ku.edu
What specific programs are included in the engineering graduate offerings at KU?,"Programs include Aerospace Engineering, Bioengineering, Chemical Engineering, and more.","KU Engineering offers 27 graduate degrees and 10 graduate certificates in the following areas: Architectural Engineering, Aerospace Engineering, Bioengineering, Chemical Engineering, Civil Engineering, Computer Engineering, Computer Science, Construction Management, Electrical Engineering, Environmental and Water Resources, Mechanical Engineering, Petroleum Engineering.",https://engr.ku.edu/graduate-programs,engr.ku.edu
What are some primary research interests of Professor Suzanne Shontz?,"Professor Suzanne Shontz's primary research interests include High Performance Scientific Computing, Algorithms, Parallel Unstructured Mesh and Optimization Algorithms, and Image Processing.",Primary Research Interests High Performance Scientific Computing Algorithms Parallel Unstructured Mesh and Optimization Algorithms Model Order Reduction Computational Medicine Image Processing,https://eecs.ku.edu/computational-science-and-engineering,eecs.ku.edu
What is required for an F-1 student to maintain legal status regarding course load?,F-1 students must adhere to the guidelines for 'Reduced Course Load' to maintain their legal status.,F-1 Students Enrollment Staying Legal Reduced Course Load,https://iss.ku.edu/navigator,iss.ku.edu
How does KU convert credits from quarter system schools?,"KU awards the standard .67 semester credits per quarter credit hour of study. For example, a 3 credit course from a quarter school will be awarded 2 credits at KU.",KU awards the standard .67 semester credits per quarter credit hour of study. A 3 credit course from a quarter school will be awarded 2 credits at KU.,https://registrar.ku.edu/transfer-credit-faq,registrar.ku.edu
By when must incoming students submit an application to be considered for freshman scholarships?,Incoming students must submit an Undergraduate Application for Freshmen Admissions and Scholarships by November 1st.,Incoming students are considered for scholarships if they submit an Undergraduate Application for Freshmen Admissions and Scholarships by November 1st.,https://eecs.ku.edu/scholarship-tuition,eecs.ku.edu
What is the distinction between graduate-level and undergraduate-level coursework for degree credit at KU?,Only courses numbered 500 or above can be counted toward the minimum hours of graduate credit required for the degree.,Please keep in mind that only courses numbered 500 or above can be counted toward the minimum hours of graduate credit required for the degree.,http://bioengr.ku.edu/entrance-requirements-track,bioengr.ku.edu
What are the two departments mentioned that relate to agriculture and transportation?,U.S. Department of Agriculture and U.S. Department of Transportation,U.S. Department of Agriculture U.S. Department of Transportation,https://engr.ku.edu/external-funding-faculty,engr.ku.edu
What does the nomination for the Best Research Poster Award signify for the EECS faculty's work?,It signifies their commitment to advancing technology and points to a promising trajectory toward the future of computing.,"Their nomination is a testament to their commitment to advancing technology, signaling a promising trajectory toward the future of computing.",https://eecs.ku.edu/news/article/2023/11/16/quantum-brilliance-takes-center-stage-sc23-conference,eecs.ku.edu
"What is the significance of attending orientation for readmitted students, even if it is not required?","Attending orientation, while not mandatory, is strongly encouraged as it is the best way to complete check-ins and learn about new resources available since the student last attended.",Orientation is the best way to complete the various check-ins and learn about any new resources available to you since you last attended.,https://iss.ku.edu/readmitted_students,iss.ku.edu
"Who is Eaton Hall named after, and what does it house?","Eaton Hall is named for Robert Eaton, a 1963 mechanical engineering alumnus, and it houses the administrative offices of the School of Engineering and the Department of Electrical Engineering and Computer Science.","Eaton Hall... houses the administrative offices of the School of Engineering, as well as the Department of Electrical Engineering and Computer Science and the Engineering Career Center.",http://bio.engr.ku.edu/contact,bio.engr.ku.edu
What are some specific topics included in the Bioengineering Graduate Program's curriculum?,"Students receive in-depth understanding of mathematics, engineering principles, physics, chemistry, anatomy and physiology, computation, and modern biology.","Provide students with an in-depth understanding of mathematics, engineering principles, physics, chemistry, anatomy and physiology, computation, and modern biology.",http://bioengr.ku.edu/overview,bioengr.ku.edu
What services does Counseling and Psychological Services offer to the KU community?,"Counseling and Psychological Services provides individual and group therapy, psychiatry services, outreach and peer support, training for students in mental health, and consultation through multidisciplinary professionals.","Counseling and Psychological Services provides individual and group therapy, psychiatry services, outreach and peer support, training for students in mental health, and consultation through multidisciplinary professionals to the KU community.",https://engr.ku.edu/campus-student-resources-deib,engr.ku.edu
